recommendationid,author,language,review,timestamp_created,timestamp_updated,voted_up,votes_up,votes_funny,weighted_vote_score,comment_count,steam_purchase,received_for_free,written_during_early_access,hidden_in_steam_china,steam_china_location,timestamp_dev_responded,developer_response
63939852,"{'steamid': '76561198053246648', 'num_games_owned': 1732, 'num_reviews': 139, 'playtime_forever': 1046, 'playtime_last_two_weeks': 0, 'playtime_at_review': 1028, 'last_played': 1603801866}",polish,"Book 3, koniec trylogii, która dostarczyła mi w sumie kilkadziesiąt godzin solidnej rozgrywki. Mimo archaicznej (specjalnie) oprawy i kilku wad w mechanice. Trzecia część jest znacznie krótsza od poprzednich odsłon, co niektórym może się nie spodobać. Zakończenie przychodzi nagle, kiedy ma się ochotę jeszcze trochę pograć. Zmian w mechanice prawie nie ma. Zauważalną zmianą jest inaczej potraktowana umiejętność przeszukiwania. Od teraz składniki alchemiczne otrzymujemy w czasie przemierzania świata gry, a nie podczas odpoczynku, jak to miało miejsce w 2 części. Zasobów tych otrzymujemy teraz znacznie mniej, a to w połączeniu z mniejszą dostępnością składników u sprzedawców sprawia, że mamy również mniej mikstur. Czy wpływa to na trudność gry? Chyba tak, ale mimo to gra nie jest zbyt trudna.
Ogólnie, mimo krótszego czasu rozgrywki oceniam tę część podobnie jak poprzednie. Ma na to wpływ ciekawsza moim zdaniem fabuła, której finał, mimo że przychodzi zbyt szybko, jest satysfakcjonujący. Twórcy obronili swoje dziwne pomysły z końcówki 2 części - ich rozwiązanie spodobało mi się. W zakończeniu zabrakło ukazania dalszych losów świata, ale może twórcy powrócą jeszcze kiedyś do tego uniwersum i przedstawią jego przyszłość, na co liczę. Oprócz dobrej fabuły spodobały mi się projekty lokacji, których jest niestety mniej... ale liczy się jakość, a nie ilość. ;)
Moja ocena: 7/10.",1582386254,1582386254,True,0,0,0,0,False,False,False,False,,,
63184494,"{'steamid': '76561198005488054', 'num_games_owned': 0, 'num_reviews': 6, 'playtime_forever': 7117, 'playtime_last_two_weeks': 0, 'playtime_at_review': 7117, 'last_played': 1581199915}",english,meh.,1581200100,1581200100,False,0,0,0.381043285131454468,0,True,False,False,False,,,
56729595,"{'steamid': '76561198067105778', 'num_games_owned': 0, 'num_reviews': 19, 'playtime_forever': 1127, 'playtime_last_two_weeks': 0, 'playtime_at_review': 1027, 'last_played': 1662926446}",english,"A bit shorter, but more polished game than Eschalon II.

I loved my time spent with the series! If you're a fan of this type of games, the Eschalon trilogy is a solid buy. The atmosphere is great, the soundtrack is fitting, mages are OP, having a minimap is a skill (so, no skill, no minimap)...

11/10 based on a unarmed/divine magick build.",1573176069,1573176069,True,0,0,0,0,True,False,False,False,,,
55893573,"{'steamid': '76561198093378763', 'num_games_owned': 0, 'num_reviews': 56, 'playtime_forever': 2477, 'playtime_last_two_weeks': 0, 'playtime_at_review': 2477, 'last_played': 1564854187}",english,"Should have been the amazing cap stone. Between never overhauling the skill distribution/level up system and not bothering to create a good coherent story that stands out, the final straw in how crappy it is compared to the previous games lies in just how little exploration is done and how small the area you adventure in is.",1572401698,1572401698,False,1,0,0.505907654762268066,0,True,False,False,False,,,
50746938,"{'steamid': '76561198074897031', 'num_games_owned': 0, 'num_reviews': 4, 'playtime_forever': 2734, 'playtime_last_two_weeks': 0, 'playtime_at_review': 2261, 'last_played': 1558507105}",schinese,我找不到第四个特殊物品：螺栓。而且，那个需要输入文字的谜语我也解不出。,1558422012,1558422012,True,3,0,0.5625,0,True,False,False,False,,,
47159374,"{'steamid': '76561198067418609', 'num_games_owned': 0, 'num_reviews': 16, 'playtime_forever': 770, 'playtime_last_two_weeks': 0, 'playtime_at_review': 770, 'last_played': 1543381245}",english,"Recommended with caveats:

Eschalon: Book III is the worst of the series. It's the shortest, and doesn't innovate or improve in any way upon the second installment. 

However, most of its weaknesses are common to the series as a whole: Questlines require that you fetch numerous items before proceeding, strewn about opposite ends of the world to such an annoying extent that you'll want to follow a walkthrough. Although there is a fast travel mechanic, backtracking is a dreadful experience since the enemies don't appear to respawn (by design, I imagine, since if they did you'd become too powerful).

Nevertheless the series was charming enough that I felt compelled to finish Book III, and I enjoyed it for much the same reasons I enjoyed Books I and II, as a sort of respite between denser RPGs.

If you've enjoyed the previous two games, you'll enjoy this one. If you're looking to play just one in the series, go with Book II.",1543381799,1543383084,True,3,0,0.558414816856384277,0,True,False,False,False,,,
40339579,"{'steamid': '76561198110840672', 'num_games_owned': 0, 'num_reviews': 3, 'playtime_forever': 2904, 'playtime_last_two_weeks': 0, 'playtime_at_review': 2634, 'last_played': 1510772146}",russian,"Не играла в предыдущие части, потому оценивать эту игру буду как отдельную. 
За 48 часов наиграных в неё, и пару прохождений разными классами, на разных сложностях, могу сказать одно: [b]очень жаль что её так мало[/b]. Игра просто [b]шикарна[/b] и единственный её минус - она очень короткая, даже если брать в расчет побочные квесты(хотя их не так много) и секреты. Да, в ней есть мелкие баги и фичи, которые могут понравиться нечестным игрокам, но при этом они совершенно не влияют на гемплей, позволяя игнорировать их тем, кто не хочет их использовать. Сюжет затягивает со старта, интерестно узнать что же будет дальше(и в правду как буд-то залипаешь в интересную книгу). Система развития персонажей так же очень продумана: то какого персонажа ты создаешь, какие особые абилки ему выбираешь в начале, кардинально меняет стиль игры, и если проходить без руководств, впервые, выбрав не очень хорошие статы/навыки - прийдеться ой как не сладко, но до жути интерестно. Всем любителям хардкорных олдскульных пошаговых RPG однозначно рекомендую! Игра стоит своих денег и познакомсь я с ней не получив её бесплатно, с удовольствием купила бы. [b]10/10[/b]",1519423890,1519423890,True,5,0,0.577737629413604736,0,False,True,False,False,,,
39740180,"{'steamid': '76561197992776583', 'num_games_owned': 0, 'num_reviews': 334, 'playtime_forever': 1363, 'playtime_last_two_weeks': 0, 'playtime_at_review': 1363, 'last_played': 1517371772}",english,Game has a bigger obsession with powder kegs than Majora's Mask.,1517370884,1517370884,True,2,2,0.445306390523910522,0,False,False,False,False,,,
39211560,"{'steamid': '76561198020935870', 'num_games_owned': 0, 'num_reviews': 136, 'playtime_forever': 1017, 'playtime_last_two_weeks': 0, 'playtime_at_review': 1017, 'last_played': 1515501985}",english,"The feeling this game provides differs significantly from Eschalon II, even though the gameplay is very similar. The structure was completely reshaped, to the point of making it even surprising. The writing of the main plot is still an issue (though not as much as in the previous games) and the slow, turn-based combat with awkward survival elements still may ruin this game for some, but it's crucial to understand that Eschalon III takes some new directions and tries to change some of the trilogy's shortcomings.

First of all, it's no more an open-world game. You won't find here two-hour dungeons that you can, but don't have to play through or vast fields of empty nothingness to ""explore"". Instead, you basically need to follow the game's story to achieve major parts of the map and even though you have some freedom in your progression, every area is connected with the main story and you basically have to go everywhere to find some keys or other essential items.

Various maps are also connected with each other much better and you spend much less time on pointless walking or grinding XP on roaming mobs. Instead, there's a lot of fun related to getting to some hidden areas, looking for treasures or getting to know some interesting places which either have nice, even creative backstories or are just fun eye-candies that allow you to use your imagination. For some reason, developer really likes his ""black powder kegs"" and you have dozens of moments when you can or have to blow up some walls, palisades or fences. It can be pretty fun.

Also, for the first time I actually found the battles challenging. In Eschalon I I was a ranger, in Eschalon II a sorcerer, and now, playing as a melee warrior, I struggled a lot getting through some areas. Maybe melees are below the power curve, or maybe the game is way easier if you focus on keeping your distance from the mostly-melee enemies. 

The money matters much more, while the items became more rare and the equipment management is now more convenient and not pointless. A big plus.

Generally speaking - the game is different enough to stay fresh, while it's also much better structured, you could even say ""orchestrated"", what could scare some people away. Fans of first two games are most likely open-world lovers and this game was clearly missing its fanbase.",1515516842,1535840073,True,2,0,0.536178112030029297,0,False,False,False,False,,,
38441827,"{'steamid': '76561197976266976', 'num_games_owned': 0, 'num_reviews': 26, 'playtime_forever': 1693, 'playtime_last_two_weeks': 0, 'playtime_at_review': 1693, 'last_played': 1392757899}",english,"Last in the series of the Eschalon games from Basilisk games, sadly, also the worst. If you were like me and loved its predecessor, you'll most likely be disappointed by this one.

Still, an Eschalon game is still an eschalon game, so it's a rump at the least, just remember,

Go in with low expectations.",1513729089,1513729089,True,1,0,0.505907654762268066,0,True,False,False,False,,,
36248348,"{'steamid': '76561198006210523', 'num_games_owned': 393, 'num_reviews': 177, 'playtime_forever': 726, 'playtime_last_two_weeks': 0, 'playtime_at_review': 726, 'last_played': 1509560385}",italian,"Tra la fine degli anni 80 e i primissimi 90, a chi avesse voluto cimentarsi con un CRPG erano richieste pazienza, capacità di ragionare e voglia di esplorare tutto l'esplorabile. All'epoca infatti era raro che venissero fornite più di poche e generiche indicazioni sul come  procedere e il giocatore doveva sostanzialmente reperire le informazioni/indicazioni necessarie da solo, usando l'inventiva, i dialoghi, l'esplorazione e una bella dose di fortuna. I giochi della serie Eschalon ci  riportano a quei bei tempi andati in cui  l'obiettivo di una quest non compariva da solo sulla mappa ma era necessario andarselo a cercare, spesso sudando le proverbiali sette camice.

Eschalon: Book 3 (E:B3) e' il terzo ed ultimo capitolo di una serie di CRPG creati a partire dal 2007 da Basilisk Games, una piccola software house Indie americana e che ha riscosso un ottimo successo sia di critica che di pubblico. Per descrivere la Trama di Eschalon devo necessariamente partire dall'inizio del primo capitolo, dove il nostro eroe si risveglia in un piccolo cottage privo di qualsiasi ricordo della sua vita. Una misteriosa nota lo informerà che questa amnesia e' stata indotta magicamente per proteggerlo da un pericolo mortale legato al suo passato e gli indicherà il primo passo per recuperare la sua memoria. La storia di E:B3 riparte la dove era stata lasciata alla fine del secondo capitolo, con il nostro eroe che dopo essere stato colpito da un incantesimo durante lo scontro con il cattivo del gioco si risveglia con la Crux of Fire (una potente gemma magica) e il compito di scoprirne i poteri.

Come tutti i capitoli della serie E:B3 e' fortemente ispirato a titoli come Ultima 6 e Ultima 7 ed in generale i titoli della stessa epoca dei due capolavori di Origin Systems. Tutto il sistema di gioco e' gestito a turni, non solo il combattimento: per rendersene conto basta non fare nulla ed osservare che il mondo attorno a noi (NPC, mostri etc) rimane perfettamente immobile, per ritornare ad animarsi ogni volta che noi compiamo una azione. Il Ruleset e' custom, ma molto simile al buon vecchio D20: In Eschalon le capacità del nostro alter ego virtuale hanno un ruolo fondamentale: ad esempio, la quantità di dettagli mostrati nella mini-mappa della interfaccia di gioco dipende da quanti punti avremo investito nella skill Cartografia e nel caso che non ne sia stato assegnato nessuno la mappa rimarrà vuota. Allo stesso modo, la nostra capacità di colpire qualcosa a distanza con un arco dipenderà dai punti skill assegnati all'uso di tale arma. Come standard, il gioco richiederà al nostro eroe di mangiare e bere, inoltre il nostro equipaggiamento si deteriorerà con l'uso e avrà quindi bisogno di riparazioni.

Il mondo di gioco e' composto da macro aree collegate tra di loro, con ciclo notte e giorno e condizioni atmosferiche variabili. L'esplorazione del territorio circostante, sia esso una landa selvaggia o l'interno di un dungeon, e' una delle componenti fondamentali del gioco. che nel corso della partita ci costringerà a lunghe scarpinate per raggiungere le varie località sulla mappa. Esiste anche un sistema di viaggio veloce, ma per attivare le destinazioni dovremo prima scoprirle ed attivare il Geo-Marker relativo. Il viaggio veloce semplifica un poco la vita, ma il gioco farà in modo di farci camminare parecchio, anche perché alcuni degli oggetti necessari al completamento di alcune quest (specie quelle del finale) si trovano solo esplorando a fondo luoghi che non sempre sono toccati da quest precedenti.

Gli scontri con i nemici sono abbastanza ostici, specie nelle prime ore di gioco, quando il nostro equipaggiamento e le nostre capacità sono scarsi. Inoltre gli avversari che si incontrano non sono ""livellati"" in base al nostro personaggio e fare l'incontro sbagliato può portare al Game-Over molto velocemente. Va anche detto che la durata non e' lunghissima: le quest, tra principali e secondarie sono meno di 30 e ciò, unito al fatto che non c'è respawn dei nemici, pone un limite al numero di livelli che potremo salire. Ne consegue che E:B3, come i suoi due predecessori, non e' un gioco facile e può risultare molto frustrante.

La realizzazione tecnica del gioco e' estremamente semplice e spartana, a partire dal fatto che la risoluzione video e' fissa ed inalterabile a 1024x768x32bpp sia in modalità a finestra che a schermo intero, con l'interfaccia grafica che prende una buona parte di questa area. L'engine di gioco e' sostanzialmente 2D Tile based con visuale isometrica. Non quindi aspettatevi animazioni super fluide e mirabolanti effetti speciali: come ho già detto, la resa grafica del gioco e' molto semplice ma tutto sommato molto gradevole.

Eschalon: Book 3 e' un gioco per molti, ma non per tutti: pur non essendo un gioco difficile, il suo gameplay dal gusto retro' può mettere in seria difficoltà chi non e' abituato a dover fare praticamente tutto da solo senza grossi aiuti da parte del gioco stesso. Detto questo pero' e' uno splendido CRPG che sa dare grandissime soddisfazioni a tutti coloro che amano applicarsi a fondo. Per chi non conoscesse ancora la serie, il primo episodio e' stato reso gratuito nel decennale dell'uscita (lo potete trovare su Steam o sul sito di Basilisk), mentre secondo e terzo episodio vengono via per l'equivalente di un Cinema + popcorn per una persona.
",1509732309,1509732309,True,4,0,0.58242952823638916,0,True,False,False,False,,,
36042832,"{'steamid': '76561198402521885', 'num_games_owned': 623, 'num_reviews': 136, 'playtime_forever': 867, 'playtime_last_two_weeks': 0, 'playtime_at_review': 21, 'last_played': 1535480355}",english,"it took me years to get Book III after I finished Book 1 and 2. I enjoyed it greatly, no less than previous Books. Maybe the story line is a bit shorter than in previous games, but there's great replayability value (with different class or different roleplay style) so it's not that bad.

highly recommended! flawless real Linux game. 10/10",1509108656,1509108656,True,1,0,0.477971792221069336,0,True,False,False,False,,,
34605094,"{'steamid': '76561198007179147', 'num_games_owned': 0, 'num_reviews': 748, 'playtime_forever': 27, 'playtime_last_two_weeks': 0, 'playtime_at_review': 27, 'last_played': 1504092878}",english,Rogue Like + RPG + Isometric + Loot = Eschalon,1504093028,1504093028,True,0,0,0.190316721796989441,0,False,False,False,False,,,
30707054,"{'steamid': '76561197996518633', 'num_games_owned': 1898, 'num_reviews': 182, 'playtime_forever': 1047, 'playtime_last_two_weeks': 0, 'playtime_at_review': 1047, 'last_played': 1490369836}",french,"Typiquement le jeu pour lequel le système steam ne rime à rien et mériterait d'être remplacé par une notation (et ça vaudrait un 5/10, ni bon ni mauvais donc). 

Fin de la trilogie Eschalon, la série médiocre qui n'aura jamais décollé et sera resté embourbé dans des défauts de game design facilement corrigeables/évitables nonobstant une incontestable envie de proposer un jeu rétro riche en possibilités.

Le jeu reste du mini-maxage, donc toujours autant déséquilibré.
Le jeu reste sur des ennemis qui ne respawnent pas, donc toujours censé être importants ... mais ils ne le sont toujours pas.
Le jeu garde son écriture terriblement plate, donc toujours sans surprise la majeure partie du temps et consternante dans son final. 
Le jeu a toujours sa mécanique de trainers, donc le fric est toujours la ressource la plus importante du jeu.
Le loot est toujours aléatoire dans les coffres, donc c'est toujours de la merde.

Et je peux continuer comme ça pour tous les défauts du jeu ...

Et pourtant il y'a encore eu des petites améliorations:
-le foraging ne se fait plus avec le camping mais pendant la marche
-on peut ENFIN s'entrainer sur les armures/boucliers
-il est indiqué d'entrée de jeu que les bidons explosifs peuvent être portés 
-l'expérience coule à flot

C'est tout le problème de cette série: il y'a une envie de bien faire, il y'a des idées, il y'a un doux parfum rétro, il est très choupi ... et en même temps il y'a pléthore aberrations, une pauvreté d'imagination, un archaïsme ignorant. 

Bref, c'est une toute petite série, sans grand intérêt, que t'as envie d'aimer mais que tu ne peux objectivement pas qualifier de bonne tant les défauts te sautent à la gueule. :/",1490370826,1490370826,False,5,0,0.596192836761474609,0,False,False,False,False,,,
30585711,"{'steamid': '76561197995749658', 'num_games_owned': 1958, 'num_reviews': 1565, 'playtime_forever': 31, 'playtime_last_two_weeks': 0, 'playtime_at_review': 31, 'last_played': 1489600650}",german,"Old School RPG.
So zwischen Ultima 6 und 7.
Keine Controller Unterstützung.
Ich fand die Steuerung pingelig und nervig.
Ansonsten Rumlaufen, Monster töten, mit Leuten sprechen und denen nen Kasten Bier besorgen.
Bin nicht geduldig genug dafür und es gibt imho z.Zt. wieder bessere Vertreter des Genres.",1489822864,1489822864,False,0,1,0.458039700984954834,0,False,False,False,False,,,
28421397,"{'steamid': '76561198336546434', 'num_games_owned': 0, 'num_reviews': 12, 'playtime_forever': 209, 'playtime_last_two_weeks': 0, 'playtime_at_review': 103, 'last_played': 1493374432}",tchinese,好好好，没得说。,1481967172,1481967172,True,0,0,0,0,True,False,False,False,,,
28350010,"{'steamid': '76561198084707018', 'num_games_owned': 0, 'num_reviews': 33, 'playtime_forever': 1407, 'playtime_last_two_weeks': 0, 'playtime_at_review': 1193, 'last_played': 1483373035}",english,"So far, 2/10. Dreadful, don't know where to go or what to do half the time. The people who say that I'm just stupid and don't know how to play are probably the same butthurt hardcore eschalon fans that have put 4-5x the hours the average person puts in them. Play the first game, and the second, so far this one is indescribably awful.",1481662988,1481662988,False,2,2,0.337684392929077148,0,True,False,False,False,,,
27319771,"{'steamid': '76561198025967839', 'num_games_owned': 238, 'num_reviews': 12, 'playtime_forever': 2219, 'playtime_last_two_weeks': 0, 'playtime_at_review': 955, 'last_played': 1534437233}",russian,Отличная игра для любителей такой классики в жанре РПГ как Baldur's Gate и Fallout,1480021975,1480021975,True,3,0,0.540426671504974365,0,True,False,False,False,,,
25155146,"{'steamid': '76561198084019881', 'num_games_owned': 0, 'num_reviews': 480, 'playtime_forever': 1222, 'playtime_last_two_weeks': 0, 'playtime_at_review': 1222, 'last_played': 1407266413}",russian,"Заключительная часть великолепной [url=http://steamcommunity.com/profiles/76561198084019881/recommended/25600]трилогии[/url]. 

Коротковата по сравнению со второй частью, зато даёт ответы на все загадки. Уровень «хардкорности» был унаследован из предыдущих частей, так что довольно легко «запороть» персонажа если развивать его не думая. 

К вопросу о смертоубийстве: обычно гадов приходится уничтожать сотнями, но в этой Книге появилось достижение Пацифист, которое формулируется примерно как «завалил меньше двадцати тушек», что намекает на «стелс». Ещё одно нововведение заключается в том, что тут появились физические загородки между локациями, что немного подкашивает концепцию «открытого мира». С другой стороны именно тут были раскрыты все загадки и найдены [i]все[/i] ответы, так что «читать» эту книгу настоятельно рекомендуется.

[h1]GNU/Linux[/h1]
GNU/Linux порт отработал без претензий. Ubuntu LTS

[h1]Обзор входит в список [url=https://steamcommunity.com/sharedfiles/filedetails/?id=1103944566]Игры, Linux, Steam, обзоры[/url].[/h1]",1472185279,1515168243,True,11,0,0.611536622047424316,1,True,False,False,False,,,
24753028,"{'steamid': '76561198041796034', 'num_games_owned': 0, 'num_reviews': 14, 'playtime_forever': 2210, 'playtime_last_two_weeks': 0, 'playtime_at_review': 1827, 'last_played': 1393138820}",english,Enjoyd the game,1470540320,1470540320,True,0,0,0.341393202543258667,0,True,False,False,False,,,
24456047,"{'steamid': '76561198035532559', 'num_games_owned': 0, 'num_reviews': 64, 'playtime_forever': 1300, 'playtime_last_two_weeks': 0, 'playtime_at_review': 1300, 'last_played': 1392741047}",english,"Although I played it till the end and more or less enjoyed it, I have to give a thumb down here, simply because this was much less polished than the previous two Eschalon books and I felt a bit ripped off> The games starts well, but the later maps are very empty and devout of any life or meaning and you can't stop the feeling that this part was rushed for release much sooner than it should, and so the end remained partly unfinished.",1469177533,1469177533,False,7,0,0.586137712001800537,0,True,False,False,False,,,
24076450,"{'steamid': '76561198118816458', 'num_games_owned': 0, 'num_reviews': 8, 'playtime_forever': 220, 'playtime_last_two_weeks': 0, 'playtime_at_review': 130, 'last_played': 1672077553}",turkish,oyun güzel ama ingilizceyi orta seviyede olsa bilmek oyunu daha zevkli hale getire bilir,1467627894,1467627894,True,0,0,0,0,False,False,False,False,,,
23671845,"{'steamid': '76561198126980726', 'num_games_owned': 0, 'num_reviews': 3, 'playtime_forever': 1833, 'playtime_last_two_weeks': 0, 'playtime_at_review': 1771, 'last_played': 1432609555}",finnish,"contains Little spoiler: it wasnt climatic ending.

""Eschalon: Book III brings the trilogy to a climactic end""

Can you help me? i tried to find the ""climatic ending"" but i just cant find it, i guess im stuck with the game, or i did something wrong because all i got was anticlimatic and disappointing ending. i tried both endings but oh wait, it didnt even matter which side you choose! Holy fuck i was angry when i finished the game.

I was huge fan of the game serie, waited the 3rd one so long...
If you are fan like me, sure you must buy it, but its far from satisfying ending.

""Look what you did basilisk, now you broke it!""",1466442922,1466442922,False,0,0,0,0,True,False,False,False,,,
