recommendationid,author,language,review,timestamp_created,timestamp_updated,voted_up,votes_up,votes_funny,weighted_vote_score,comment_count,steam_purchase,received_for_free,written_during_early_access,hidden_in_steam_china,steam_china_location,timestamp_dev_responded,developer_response
153468832,"{'steamid': '76561198042317098', 'num_games_owned': 0, 'num_reviews': 852, 'playtime_forever': 11, 'playtime_last_two_weeks': 0, 'playtime_at_review': 11, 'last_played': 1702415454}",polish,2/10,1702415482,1702415482,False,0,0,0,0,False,False,False,True,,,
149581040,"{'steamid': '76561198096668357', 'num_games_owned': 0, 'num_reviews': 2, 'playtime_forever': 23306, 'playtime_last_two_weeks': 0, 'playtime_at_review': 21938, 'last_played': 1699716768}",english,easy to play,1699184332,1699184332,True,0,0,0,0,True,False,False,True,,,
149568719,"{'steamid': '76561198149396436', 'num_games_owned': 981, 'num_reviews': 408, 'playtime_forever': 1232, 'playtime_last_two_weeks': 0, 'playtime_at_review': 1232, 'last_played': 1699165938}",russian,"Наверное лучшая часть из трилогии, наконец-то добавили и продумали секреты которые интересно искать и подземелья которые не бесят. Визуально игра не стала лучше или хуже, но внутри её механики смазали и кое где подкрутили. Сюжет всё такой же накуренный, концовки воспринимаются без эмоций, ну и в целом вся трилогия это игры которые можно пропустить. Читая обзоры на эту игру на других ресурсах например на stopgame складывается впечатление, что они играют в совершенно другую игру, а ты получил классическую компоновку ролевой игры, герой-инвентарь для бесполезного барахла-20 квестов-город из 10 человек иди спасай мир, больше делать в принципе нечего и смотреть не на что. 70% навыков бесполезны,  алхимия не нужна, магия за исключением пятёрки заклинаний, тоже не нужна, в игре есть хай лвл вещи но из-за рандома и тупейшей системы лута ты их не найдёшь. 
Если выбирать - 2 полторашки пивосодержащей мочи или трилогия эшалон - выбирай ничего.",1699166961,1699167175,True,0,0,0.274162441492080688,0,True,False,False,True,,,
145309230,"{'steamid': '76561198406627335', 'num_games_owned': 0, 'num_reviews': 29, 'playtime_forever': 2357, 'playtime_last_two_weeks': 0, 'playtime_at_review': 1690, 'last_played': 1693486982}",german,"[b]Fazit:[/b]

Mein Eindruck wurde ergebnisoptimiert durch Erwartungsreduktion. Dazu rate ich.
War dann doch besser und länger als befürchtet, jedoch nicht so gut wie Teil 2, obwohl teilweise dann wieder doch.
Für Fans auf jeden Fall ein Muss.

[b]Was ist neu zum Vorgänger?[/b]

Es gibt rote Vasen die nur aufsprengbar sind.
Gefundene Secrets werden also solche angezeigt (und gezählt) und geben neben extra Erfahrung gelegentlich einen zusätzlichen Skill- oder Statpunkt.
Foraging funktioniert nun durch Laufen, nicht mehr durch Schlafen.
Es gibt sehr viele Skillbücher und Trainer, mehr als bisher.
Sehr rätsellastig. Achtung, hütet eure Questitems, auch wenn sie nicht als solche gekennzeichnet sind. Ich musste 2x welche suchen und dachte schon ich bin Game Over. Packt besser alles in Kisten und schreibt euch auf wo diese sind.

[b]Gleich und doch anders[/b]

Die Karte ist sehr interessant. Sehr verschlungen und geheimnisschwanger, mehr noch als bisher. Sie sorgt für fast schon Dark Soulsige Aha- und Oho-Erlebnisse.
Die Entwickler haben sich eindeutig bemüht mit dem Level- und Rätseldesign nochmal alles rauszuholen. Das spielt sich ein wenig anders und hat einige coole Lösungen parat. Allerdings irrt man auch oft irgendwo durch die Gegend ohne richtiges Ziel vor Augen. Viel Aufmerksamkeit haben die Pulverfässer in diesem Teil bekommen.

[b]Auffälliges und Nerviges[/b]

Der Schwierigkeitsgrad scheint gestiegen zu sein. Bald schon treffe ich auf, für mich, unverwundbare Gegner, die ganze Karte ist voll davon und ich kann nur vor ihnen weglaufen. Wird langsam zur Tradition, aber na gut.
Mein Bogen zerbricht nach ungefähr 20 Schuss. Für einen Dungeon muss ich 3x rausgehen, in die Stadt schnellreisen, reparieren (wofür ich nur mit Mühe das Geld zamkratzen kann, indem ich Zeug verkaufe das ich eigentlich selbst brauche), und wieder zurück.
Auch ein bisschen übertrieben. Das nächste Mal nehm ich also Reparieren auf 3 vom Start weg. Ist ja ohne kaum spielbar. Auch die Schuhe latschen durch's (schnell)reisen viel zu schnell aus. Ich ziehe sie deshalb fast immer aus. Nervt dezent.

[b]Schlechter als Book 2?[/b]

Aber es stimmt leider auch was viele Rezensenten sagen. Ich hatte so im ersten Drittel auch nicht immer das beste Gefühl. Der Spielfluß war nicht so gut wie in Book 2. Manche spielens gar in 14 Stunden durch und müssen sich so vor einem abrupten Ende wappnen. Bei mir selbst hats aber 22 gedauert. Das Ende der Story hat mir hingegen ganz gut gefallen.

[b]Erste Gedanken [i](aus dem Tagebuch meines Helden Rick Ranger)[/i][/b]

Kann nicht nach links auf die nächste Karte laufen obwohl da alles frei ist. Magische Barriere? Ich denke eher an einen Bug. Ich laufe zurück und will nach Norden, aber da wo der schwarze Rand des Ungewissen beginnt ist plötzlich jeder Meter mit Slimes gefüllt die da nicht hingehören und nicht angreifbar sind. Na das ist aber eindeutig ein Fehler in der Matrix! Nach dem Zeit zurückdehen gehts wieder. Die Angst vor Bugs sitzt ab jetzt im Nacken (kamen aber keine mehr).

Eine Bekannte hat mir eben erzählt sie weiß von meinem Schicksal und der Aufgabe der Crux. Sie weiß ich halte das Schicksal von Eschalon in den Händen und gibt mir diesbezüglich wichtige Informationen. Kurz darauf ist sie pissed weil ich eine Perle aus einer Muschel vom Strand genommen habe, die ihr zwar nicht mal gehört, aber so ein schlimmes Verbrechen kann sie nicht ertragen, dass ihr Held sich einfach Perlen luchst. Als ich sie wieder sehe haut sie mir eine ins Maul und will mich umbringen! Come on, really?
",1693385876,1693386202,True,0,0,0,0,True,False,False,True,,,
142267915,"{'steamid': '76561198004314979', 'num_games_owned': 0, 'num_reviews': 14, 'playtime_forever': 1008, 'playtime_last_two_weeks': 0, 'playtime_at_review': 1008, 'last_played': 1689602095}",english,Good,1689602171,1689602171,True,0,0,0,0,True,False,False,True,,,
136822512,"{'steamid': '76561198070062595', 'num_games_owned': 21, 'num_reviews': 12, 'playtime_forever': 8743, 'playtime_last_two_weeks': 806, 'playtime_at_review': 5235, 'last_played': 1710794088}",english,"The series is fantastic. Much thought has gone into a series that love a challenge
and is not as hard as it first plays out. I have yet to finish any series but 3 is the best Battle-mage
I have done so far. Seems many games especially rogue-like are too hard....think this one out and save
before taking on more than one NPC. Beautiful Isometric Art.... would love to see it up close with zoom ;-O
",1681673398,1681673398,True,0,0,0,0,True,False,False,True,,,
131678699,"{'steamid': '76561197963607018', 'num_games_owned': 776, 'num_reviews': 26, 'playtime_forever': 2246, 'playtime_last_two_weeks': 1, 'playtime_at_review': 1005, 'last_played': 1710430171}",english,People over 40 will know / understand,1674854316,1674854316,True,0,0,0,0,True,False,False,True,,,
130468957,"{'steamid': '76561198841109873', 'num_games_owned': 0, 'num_reviews': 1, 'playtime_forever': 1383, 'playtime_last_two_weeks': 0, 'playtime_at_review': 1376, 'last_played': 1702406379}",english,"If you're a fan of the series you'll probably enjoy the final installment. However, it's definitely the least of the trilogy with less interesting everything. Less interesting dungeons, quests, environments, etc. That said, everything that made the first two games good is still here and I'd recommend this game if you're a fan. Just... try to lower your expectations.",1673221888,1673221888,True,2,0,0.549549520015716553,0,True,False,False,True,,,
130423376,"{'steamid': '76561199013664211', 'num_games_owned': 74, 'num_reviews': 6, 'playtime_forever': 1416, 'playtime_last_two_weeks': 0, 'playtime_at_review': 1416, 'last_played': 1673126112}",english,"[h1]Compared to the two predecessors this one falls a bit flat but it's still good.[/h1]

While I loved Eschalon Book I and II in every respect, Book III felt a bit rushed and I found the ending to be anticlimatic and very sudden.
Nevertheless it's still Eschalon and I enjoyed playing it very much to the point that I neglected household chores for 2 days.. 
If you liked Book I and II you cannot go wrong in buying Book III just for the sake of completing the series but I recommend to buy it on sale.

The cons:
- much much more walking than in Book I and II, however it becomes doable with more short-travel markers activated, but hey, sometimes you circle an area for 3 screens just to get to a tiny point in e.g. the north of the area :-/
- rushed anticlimatic ending
- it took me a bit to figure out which area to clear first or which quests to do first because ALL enemies were too strong in the beginning
- I sold an important item I found twice but you need it to progress the story(that wasn't clear at first), thank God I found another one or I had to start a new game D-: That should have been made more clear in the game that one mustn't sell the [spoiler] Sigil of Fire ring[/spoiler] e.g. by letting all merchants say that they are not interested in buying it. 

The pros:
- cute monsters and great lore like in all Eschalon games
- the music (my cat liked the calming music very much)
- the battles were fun as in Book I and II, I simply like the battle system
- although the ending was rushed I enjoyed the final battle very much, I saved all my gold for this nice super strong mauling hammer and crushing my enemies with it was so much fun and very effective!!
- the landscapes and dungeons were interesting
- an interesting point:  in Book 1 I remember the noximanders to be a huge pain and quite a challenge for me because I got poisoned or sick like every three seconds, in this part however beware of the swampy areas, save everytime before you want to walk through a swamp, the swamps are this game's noximanders :-D

Well yeah buy it!! But buy it on a sale!!",1673177400,1673177400,True,0,0,0,0,True,False,False,True,,,
123403675,"{'steamid': '76561198007392741', 'num_games_owned': 690, 'num_reviews': 107, 'playtime_forever': 450, 'playtime_last_two_weeks': 0, 'playtime_at_review': 447, 'last_played': 1665069361}",english,"You catch a disease every five minutes. Not trivial diseases, but for example one that leaves the warrior at half strength and endurance and another that triples food consumption. That thing about food seems silly, but it's not when after consuming all the food in the region where you start and you're still hungry. And when the food bar runs out you start losing life.
I can't buy new equipment because I'm spending all my money on curing diseases.",1664993086,1664993086,False,0,0,0,0,True,False,False,True,,,
122835856,"{'steamid': '76561198043234884', 'num_games_owned': 0, 'num_reviews': 1, 'playtime_forever': 1004, 'playtime_last_two_weeks': 0, 'playtime_at_review': 1004, 'last_played': 1664140771}",english,"Just finished the trilogy. Remembered playing it a long time ago, it's nostalgic. The game is what you'd expect from an old turn-based RPG game. Story really evolves a lot and changes your POV. Writing of it seems kinda ""on the go"" all books combined considered. Starts can be difficult depending on your build. Jack of all trades, master of none applies well here in char creation.",1664141201,1664141201,True,0,0,0,0,True,False,False,True,,,
121940137,"{'steamid': '76561198016246523', 'num_games_owned': 805, 'num_reviews': 31, 'playtime_forever': 1614, 'playtime_last_two_weeks': 0, 'playtime_at_review': 1614, 'last_played': 1402427452}",english,"end of the series. pity that nothing followed it in this ""classic"" style
",1662660209,1662660209,True,0,0,0,0,False,False,False,True,,,
116445966,"{'steamid': '76561198045118691', 'num_games_owned': 0, 'num_reviews': 75, 'playtime_forever': 1097, 'playtime_last_two_weeks': 0, 'playtime_at_review': 1097, 'last_played': 1654295569}",english,"Much of the same if you liked the first two, but this one definitely feels a bit more rushed and the world a lot less inspired. 

I didn't mind the ending [spoiler]if you stayed with Erubor[/spoiler]. On the other hand, if you decided to [spoiler]switch sides and fight with Malkur, I felt like the swapped text was pretty lazy. Even though I can accept that Malkur might have been telling the truth, the fact he is a mind reader and working solo can also argue a strong point that he is just manipulating your character for his own gains. It would have been nice if this was focused on more if you decided to help Malkur instead of the ambiguous similar Erubor ending.[/spoiler]

The game never had a truly in depth story, but neither do games like Baldur's Gate (more characters than story in my opinion), Avernum, Diablo, etc. I think this games strong point was the character building system (even if it was far more simple then it lends you to believe), and the art/assets/sprites. I've played bigger games (looking at you Wasteland), where the character portraits were obvious palette swaps, which does not happen with this game. I also appreciated that pieces of armor actually changed your sprite. I really did like the overall look of it, and even though some skills seemed pretty useless or like they had minimal impact, I had fun roleplaying my self inflicted amnesiac that could colour in a very basic map.

You can't go wrong playing through this trilogy, it definitely is unique in its own way.",1654298019,1654298027,True,0,0,0,0,True,False,False,False,,,
113662055,"{'steamid': '76561198841317169', 'num_games_owned': 0, 'num_reviews': 3, 'playtime_forever': 12543, 'playtime_last_two_weeks': 0, 'playtime_at_review': 2442, 'last_played': 1678049627}",english,"First played  Eschalon 1 then 2 then 3 around 2010-11  and enjoyed them at the time. I played them again  between then and now.  I had to repurchase this time around  because I could not find the Registration numbers..  I am enjoying them all over again.  Seems a bit more challenging this time around but there is a lot to do.   Hours of play, good puzzles, as challenging as you want. Very re-playable..  I recommend .
",1649630355,1649630355,True,0,0,0,0,True,False,False,False,,,
110775242,"{'steamid': '76561198311849353', 'num_games_owned': 92, 'num_reviews': 8, 'playtime_forever': 411, 'playtime_last_two_weeks': 0, 'playtime_at_review': 411, 'last_played': 1645450649}",english,"after all these years, still worth it",1645545632,1645545632,True,0,0,0,0,True,False,False,False,,,
108246486,"{'steamid': '76561198007444309', 'num_games_owned': 0, 'num_reviews': 39, 'playtime_forever': 1010, 'playtime_last_two_weeks': 0, 'playtime_at_review': 371, 'last_played': 1672525089}",english,"A classic turn-based adventure, no rogue-likes here, just pure adventure. Every thing you want has a skill attached, so if you wanna do magic, melee, or ranged there are trade-offs. Even mapping has its own skill points, called ""Cartography."" This is by far my favorite skill since it paints in the map as you explore with more detail. If you like this type of old school adventuring, in the vein of Ultima, Baldur's Gates, and other isometric old school RPGs, this will be your jam.",1642478420,1642478420,True,0,0,0,0,True,False,False,False,,,
107332771,"{'steamid': '76561198331079000', 'num_games_owned': 184, 'num_reviews': 53, 'playtime_forever': 1227, 'playtime_last_two_weeks': 0, 'playtime_at_review': 1227, 'last_played': 1641262597}",english,"A very nice conclusion to the series. As good as Book II IMO, even though people say it's inferior.",1641334225,1641334225,True,0,0,0,0,True,False,False,False,,,
107142226,"{'steamid': '76561197973249829', 'num_games_owned': 586, 'num_reviews': 26, 'playtime_forever': 3296, 'playtime_last_two_weeks': 0, 'playtime_at_review': 3246, 'last_played': 1641174977}",english,"I like this game and I like this series, but the epilogue at the end of this game is one of the most frustrating endings ever conceived. You get two choices at the end of the game, and regardless of which choice you make neither one tells you what actually happens as a result of your choice. You're left to assume that what was told to you is what will come to pass. There's never any indication that you made the right or wrong choice. Frustrating!

I'd love it if the creator would make more games, but it's been almost eight years now since this released and their website is devoid of any additional information. This is a sad note for a developer to go out on. I still recommend it because I really like the gameplay (lots of skills, grind is entertaining enough) but the story makes it feel like they got tired of making the series by this point and were just trying to get it over with by leaving you with just enough game to be called passable.",1641134833,1641134833,True,0,0,0,0,True,False,False,False,,,
86836619,"{'steamid': '76561198040581863', 'num_games_owned': 0, 'num_reviews': 165, 'playtime_forever': 1169, 'playtime_last_two_weeks': 0, 'playtime_at_review': 233, 'last_played': 1613857792}",english,"Most will say it was not as good as Book 2, they are right

That it was too short, that the story was rushed, the map was smaller than book 2 , etc.

However I want to focus on the aspect that game mechanics wise this was very refined, loot was plentiful and varried, a lot more store clerks to trade with, while we didn't get a lot of varriation in biomes it was a fun Island adventure.

Only gripe with Book 3 is how ramped up the difficulty was and how it was never really a sure way to know where you were supposed to go and what to do.

But nonetheless I am happy to have finished something that started with a demo in 2008

Thank you Basilisk Games.

-----------------------------------------------------------------------------------------------------

Perfection

Goblin soldier attacks [99% chance to hit]
You attack [20% chance to hit]

Perfection in pain",1613515798,1613857226,True,2,0,0.54367983341217041,0,True,False,False,False,,,
81804128,"{'steamid': '76561197976761085', 'num_games_owned': 1207, 'num_reviews': 76, 'playtime_forever': 918, 'playtime_last_two_weeks': 0, 'playtime_at_review': 918, 'last_played': 1607376948}",english,"A wonderful conclusion to the Trilogy in my opinion.  It's kind of hard to review this game itself because it's clearly the final part of a Trilogy and you really should play the first two prior to this and if you like the other two well enough, I don't see why you wouldn't enjoy this one (it's my personal favorite of the three).  The first game is free (I think) and gives a good idea what the games are like (though 2 and 3 have some balance changes and are more fleshed out) so you would really know by now if you would like this game or not.",1607377222,1607377222,True,2,0,0.541778981685638428,0,True,False,False,False,,,
78962530,"{'steamid': '76561197970707099', 'num_games_owned': 502, 'num_reviews': 62, 'playtime_forever': 7, 'playtime_last_two_weeks': 0, 'playtime_at_review': 7, 'last_played': 1604866246}",english,"While I love the first game and I'd love to play this one, the complete utter inability to adjust screen resolution (I mean literal upscaling, drawing window in 2x pixel size) in windowed mode makes this and the first one nearly unplayable for people who have less than perfect vision.

Only options you have is fullscreen stretched (ratio is kept), or ant sized window. I hope their next game is even slightly modernized for monitors instead of hey hou get a 17"" CRT to play this game :<",1604866638,1604866638,False,0,0,0.46092185378074646,0,True,False,False,False,,,
77642562,"{'steamid': '76561198124738753', 'num_games_owned': 3678, 'num_reviews': 75, 'playtime_forever': 4428, 'playtime_last_two_weeks': 0, 'playtime_at_review': 4428, 'last_played': 1602846161}",english,"""Premium gruel is marginally better than standard gruel but still tastes like fungus and bugs.""

Ah, Eschalon, I see your denizens have grown wise to my formerly lucrative paladin schemes of ""turning mana into cold hard cash"" in Book II by creating stacks of delicious food and selling it all. Not to say that my mercantile skills went to waste this time. Or that surviving primarily on what I envision as cricket oatmeal was a bad idea. In fact, trivializing finding food and water via spellcasting made everything run smoother and I preferred it to relying on foraging. (Which also wasn't nearly ""the-camp-in-the-rain-for-4-days-collect-weeds-overcharge-the-innkeeper-rinse-repeat"" cashgrab it was in II.) Foiled again! Looks like I can only rake in gold now by being a genuinely on the level paladin this time and do what I was born to do — risk life and limb (and possibly contracting diseases and curses) as I dive into dark catecombs and bash skeletons into dust.

On more ""serious"" topics like saving the world, I didn't find the open ended nature of the conclusion disappointing like some other players did. I thought it was sad in both branches but made sense.

As far as the content goes, I will say Book II is the highest point but I still enjoyed III a lot and am glad I played the whole trilogy. I will say I added some player created extra content for III (Rockhammer mini dungeons, Mirkland expanded and the Alchemist's Tower) and I'm sure that made for a more well rounded experience. I'd recommend hunting those down if you play. It probably would have felt a bit short without them.",1602848088,1602860673,True,1,0,0.51530611515045166,0,False,False,False,False,,,
76228789,"{'steamid': '76561198030784015', 'num_games_owned': 0, 'num_reviews': 11095, 'playtime_forever': 15, 'playtime_last_two_weeks': 0, 'playtime_at_review': 15, 'last_played': 1600528019}",english,"This is an old school classic retro RPG released in 2010, the third in the Eschalon series.  Featuring retro pixel ISO graphics, build your character and hack and slash through RPG combat, inventory management, collecting magic items and so on.

It's hard to recommend this because despite being released in 2014, the graphics are incredibly dated, it's hard to say if that was a deliberate attempt at making a retro looking game or the developer was just really bad at art.   Also, being fixed at a 4:3 aspect ratio and SVGA resolution is really unacceptable for 2014.   Such shortcomings are not worth paying $10 USD for, whatever the developers excuses might be.",1600528070,1600528092,False,1,4,0.205829128623008728,0,False,False,False,False,,,
73295448,"{'steamid': '76561198132667085', 'num_games_owned': 0, 'num_reviews': 10, 'playtime_forever': 1776, 'playtime_last_two_weeks': 0, 'playtime_at_review': 1776, 'last_played': 1595741253}",english,"I was excited for the finale after playing books I and II, but the ending is rushed and unsatisfactory, solving the tension of three games in five minutes with a poorly designed Inception ending.",1595743449,1595743449,True,2,0,0.541666686534881592,0,True,False,False,False,,,
67781235,"{'steamid': '76561197980613851', 'num_games_owned': 0, 'num_reviews': 50, 'playtime_forever': 426, 'playtime_last_two_weeks': 0, 'playtime_at_review': 351, 'last_played': 1587592081}",english,Fun Game,1587505621,1587505621,True,0,0,0.406957745552062988,0,True,False,False,False,,,
65286183,"{'steamid': '76561198077170607', 'num_games_owned': 0, 'num_reviews': 49, 'playtime_forever': 441, 'playtime_last_two_weeks': 0, 'playtime_at_review': 441, 'last_played': 1584557965}",english,"Feels like a worse-written, lower-effort mod of the second game without a single actual improvement apart from how Foraging works.",1584559956,1584559956,False,0,0,0,0,True,False,False,False,,,
64745571,"{'steamid': '76561198278756303', 'num_games_owned': 91, 'num_reviews': 17, 'playtime_forever': 4430, 'playtime_last_two_weeks': 0, 'playtime_at_review': 4430, 'last_played': 1571470744}",english,if you love rpg isometric with a UO feel.. this is it.,1583730857,1583730857,True,0,0,0.485924959182739258,0,False,False,False,False,,,
