recommendationid,author,language,review,timestamp_created,timestamp_updated,voted_up,votes_up,votes_funny,weighted_vote_score,comment_count,steam_purchase,received_for_free,written_during_early_access,hidden_in_steam_china,steam_china_location,timestamp_dev_responded,developer_response
8225850,"{'steamid': '76561197970721201', 'num_games_owned': 0, 'num_reviews': 4, 'playtime_forever': 15, 'playtime_last_two_weeks': 0, 'playtime_at_review': 11, 'last_played': 1667016144}",english,"This game is really for hardcore movie buffs. I've watched probably close to 3000 movies in 3 decades but this particular YDKJ game is still quite hard. I wouldn't recommend it to a casual player, more for the super hardcore quiz / movie buffs.

On a note to the game itself, I'm pretty disappointed. There is no option to play full screen, no choice of screen resolution or similar. Looks crappy, it's a old game and to be expected. The commentator is funny for the most part but sometimes I'd rather just play than to listen to him.

Hate the fact that you always have to watch the intro which takes like a minute until you can actually play. There should be an option to skip the intro.

Verdict: Good value game for hardcore quiz (movie) buffs. Terrible integration on steam as in no achievements, no nothing, no option for screen resolution etc. The ""Millionaire"" games may be better suited for the casual player.",1387811318,1387811318,True,1,0,0.486204773187637329,0,True,False,False,False,,,
8219013,"{'steamid': '76561198044851583', 'num_games_owned': 0, 'num_reviews': 7, 'playtime_forever': 10, 'playtime_last_two_weeks': 0, 'playtime_at_review': 10, 'last_played': 1387787530}",english,"Old, but hilarious.",1387787588,1387787588,True,0,0,0.471698105335235596,0,True,False,False,False,,,
7903998,"{'steamid': '76561198110440078', 'num_games_owned': 0, 'num_reviews': 24, 'playtime_forever': 110, 'playtime_last_two_weeks': 0, 'playtime_at_review': 12, 'last_played': 1387725964}",english,Incorrect. School of Rock - Jack Black. I do know Jack movies.,1386120348,1386120348,True,5,2,0.421256542205810547,0,True,False,False,False,,,
7775522,"{'steamid': '76561198038479815', 'num_games_owned': 0, 'num_reviews': 11, 'playtime_forever': 83, 'playtime_last_two_weeks': 0, 'playtime_at_review': 62, 'last_played': 1684175295}",german,"Deutsche YOU DON'T KNOW JACK Fans fragen sich vielleicht, ob sich der Kauf dieses Ablegers lohnt. Während es in den 90ern einige Teile mit liebevoller Synchronisation zu uns geschafft haben, blieben und dieses Filmquiz und einige andere leider verwehrt. Dank Steam kann man sie nun für kleines Geld nachholen, und das hat mich persönlich sehr gefreut, weil ich sogar schon mit dem Gedanken gespielt hatte, sie zu importieren. So ist es natürlich bequemer.

Nur wie spielt sich YDKJ ohne deutsche Synchro? Normalerweise ist das tatsächlich ein Problem, denn es geht nicht nur um das bloße Verständnis, sondern auch um das Hintergrundwissen. Die Spiele beziehen sich gerne auf amerikanische Eigenarten, wer sich also nicht mit Footballteams, TV Sternchen und typischen Speisen auskennt, wird bestimmte Fragen trotz besten Sprachkenntnissen nicht beantworten können. Hier punktet das Filmquiz, denn Hollywoodfilme sind ein internationales Thema. In meinen bisherigen Runden gab es keine Frage, die mich frustriert denken ließ: ""Das kann man aber nur als Amerikaner wissen!"". Man kann dieses Spiel also guten Gewissens auch deutschen Spielern empfehlen, die sich Sorgen machen, ob die Fragen zu schwer sind.

Allerdings gibt es auch einen kleinen Nachteil: Da es sich tatsächlich um reine Filmfragen handelt, fühlt sich das Spiel weniger chaotisch an als die YDKJ Titel mit gemischten Inhalten. Wer aber einfach nur auf der Suche nach einem lustig präsentiertem Filmquiz ist, bei dem man ein wenig um die Ecke denken muss, der wird seinen Spaß haben. Das typische Jack-Feeling kommt auch hierbei auf.",1385504647,1385504647,True,1,0,0.484717339277267456,0,False,False,False,False,,,
