recommendationid,author,language,review,timestamp_created,timestamp_updated,voted_up,votes_up,votes_funny,weighted_vote_score,comment_count,steam_purchase,received_for_free,written_during_early_access,hidden_in_steam_china,steam_china_location,timestamp_dev_responded,developer_response
54499972,"{'steamid': '76561198043109558', 'num_games_owned': 2065, 'num_reviews': 508, 'playtime_forever': 62, 'playtime_last_two_weeks': 0, 'playtime_at_review': 62, 'last_played': 1565100319}",russian,"Я бы сказал, что YDNJ Movies плохо состарилась, но, судя по всему, она всегда была такой: местные вопросы регулярно ставят в тупик современных игроков, однако даже в конце 90-х ответить на них мог бы далеко не каждый американец. ""Какой из четырех актеров играл самого немногословного Тарзана?"" ""Если преемник Шона Коннери - Тимоти Далтон, то кто из четырех актеров является преемником Питера Селлерса""? ""По произведениям какого из четырех писателей снято больше всего фильмов?"" В оригинальной YDNJ Vol.1 было много вопросов, ответить на которые правильно большинство игроков могло лишь случайно, но в Movies их стало еще больше из-за нагромождения незнакомых современным игрокам фамилий и названий.

Итого, в 2019-м геймплей YDNJ Movies больше напоминает игру в угадывание чисел: если вариантов всего четыре, периодически вам будет везти, но количество ошибочных ответов все равно будет больше. Сегодня специалисты по американским кинофильмам и телесериалам 50-80-х гг. встречаются редко, но, кажется, именно в расчете на них создавалась эта игра (вопросов про более близкие сегодняшним игрокам кинематографические 90-е здесь крайне мало).

Я не жалею, что сыграл в Movies - прикоснуться к классике quiz-игр все еще было приятно (и на некоторые вопросы я, к своему удивлению, даже знал правильные ответы - спасибо ретро-обзорам триллеров и хорроров от AVGN), однако большинство игроков при контакте с ней, скорее, испытают раздражение.

P.S.: Забавная вещь: как в 1998-м все обожали Киану Ривза (и по YDNJ Movies это заметно), так и в 2019-м все обожают Киану Ривза.",1565179171,1565179368,False,5,0,0.506771624088287354,0,True,False,False,False,,,
52257531,"{'steamid': '76561198044730496', 'num_games_owned': 0, 'num_reviews': 1, 'playtime_forever': 881, 'playtime_last_two_weeks': 0, 'playtime_at_review': 827, 'last_played': 1566818061}",english,"It's not the best of the YDKJ classic games.
The questions are harder and dated. And some require  details from some rather obscure films. 

It still has the awesome faux game show presentation, but so do the other YDKJ games.  Go with those first.",1561856539,1561856539,False,3,0,0.547494649887084961,0,True,False,False,False,,,
49997814,"{'steamid': '76561197973738565', 'num_games_owned': 3042, 'num_reviews': 429, 'playtime_forever': 35, 'playtime_last_two_weeks': 0, 'playtime_at_review': 35, 'last_played': 1554581957}",french,"+ L'humour est toujours aussi réussi
+/- Questions réservé au fin connaisseurs
- Les références des années 1990 sont très poussiéreuses

6/10 À essayer",1554582095,1554582095,True,0,0,0,0,True,False,False,False,,,
47298666,"{'steamid': '76561197988931399', 'num_games_owned': 681, 'num_reviews': 83, 'playtime_forever': 462, 'playtime_last_two_weeks': 0, 'playtime_at_review': 198, 'last_played': 1693780192}",english,"My personal favorite of the classic YDKJ games, the Movies edition has an excellent variety of questions, great voice work, and for its age plays pretty well on modern systems. However, it's important to note that this was released in 1997 with no content updates made, so to really enjoy this you need some familiarity with American movies and performers of that era and then going back to roughly 1940. There's good humor and lame humor, easy questions and ones out of left field, but on the whole it's still quite fun and I play this at least a couple times each year.

4/5",1543961269,1543961269,True,5,0,0.564977288246154785,0,False,False,False,False,,,
43952897,"{'steamid': '76561198050307392', 'num_games_owned': 0, 'num_reviews': 2, 'playtime_forever': 16, 'playtime_last_two_weeks': 0, 'playtime_at_review': 16, 'last_played': 1533497514}",english,"The interface is fine, the graphics are fine, its the questions that were terrible. I would have liked to see questions centered on classic films, or blockbusters, or important films. Instead you would have to know two out of three of the following: who was the star of a Doctor Pepper add from the mid seventies, what his line was, and another movie that he was in. 
Quite dissappointed. Second round was played with older people  ( they did just as poorly as I did)",1533497831,1533497831,False,2,0,0.465608477592468262,0,True,False,False,False,,,
41742745,"{'steamid': '76561198045600661', 'num_games_owned': 0, 'num_reviews': 101, 'playtime_forever': 11, 'playtime_last_two_weeks': 0, 'playtime_at_review': 11, 'last_played': 1524948734}",english,Great questions if you were born 1940,1524948797,1524948797,False,6,5,0.473125636577606201,0,False,False,False,False,,,
36838986,"{'steamid': '76561198054926015', 'num_games_owned': 0, 'num_reviews': 7, 'playtime_forever': 474, 'playtime_last_two_weeks': 0, 'playtime_at_review': 361, 'last_played': 1633119164}",english,"If you love trivia, a huge movie fan and love quirky and funny dialogue, then this is the game  for you. Brilliant!",1511390033,1511390033,True,0,0,0,0,True,False,False,False,,,
35460245,"{'steamid': '76561198149993698', 'num_games_owned': 0, 'num_reviews': 5, 'playtime_forever': 162, 'playtime_last_two_weeks': 0, 'playtime_at_review': 135, 'last_played': 1561718719}",english,"[System used - Win 10; 1070GTX, Gaming rig and Win10 HP 8mb ram laptop with 2GB dedicated graphics]
I have always liked the ""You don't know Jack"" games - having played them since their first incarnation many window platforms ago.  They can lose their magic a little because they follow the same formula, but it's bit like having different trivial pursuit games, enough different topics and a bit of fun to play with someone else, or by yourself.  

As I am from Australia the only downside is that there is a lot of content that is not relevant or is specific to US (eg: some comedy and tv shows that may not be shown here), although if you have a good general kinowledge of movies then this is only a very minor criticism.  I would like to see some Oz movies included of course.  Note that I have played this game a lot more than the 2 hours it says on my steam account.

Recommended for those who have a good knowledge of movies, enjoy other ""Jack"" games and get on sale.
My rating is 6/10 overall for gameplay.  
(note I use ratings where anything above 5 is ok to excellent)",1507080824,1507085399,True,0,0,0,0,True,False,False,False,,,
34404204,"{'steamid': '76561198027267313', 'num_games_owned': 1838, 'num_reviews': 4460, 'playtime_forever': 5, 'playtime_last_two_weeks': 0, 'playtime_at_review': 5, 'last_played': 1503355522}",english,"Tags: Casual - Quizz
Additional Tags: Delete Local Content & Remove from Library

TLDR: Couch party game where people have to share a keyboard?

Nice tongue in cheek humor and good concept. But made completely obsolete by the Jackbox 2015 remasters that offer proper controller support. More modern pop culture references and a better engine. Removing all DOS-ERA YDKJ for their dated clunkyness",1503355527,1509662727,False,0,0,0,0,False,False,False,False,,,
33402102,"{'steamid': '76561197970615671', 'num_games_owned': 0, 'num_reviews': 128, 'playtime_forever': 9, 'playtime_last_two_weeks': 0, 'playtime_at_review': 9, 'last_played': 1499601277}",english,"Still has all the cool stuff of the original game, still locked to 800x600.  1997, so no movies after then - only movies that are >20 years old :)  at least a game can be played in under 10 minutes, though.",1499601325,1499601325,True,0,0,0.476965993642807007,0,True,False,False,False,,,
29223152,"{'steamid': '76561198137201199', 'num_games_owned': 0, 'num_reviews': 81, 'playtime_forever': 14, 'playtime_last_two_weeks': 0, 'playtime_at_review': 14, 'last_played': 1482684877}",english,This version was better than the original. At least most of us have seen some of the movies it asks questions about.,1484312747,1484312747,True,0,0,0,0,True,False,False,False,,,
28878942,"{'steamid': '76561198077900189', 'num_games_owned': 0, 'num_reviews': 10, 'playtime_forever': 216, 'playtime_last_two_weeks': 0, 'playtime_at_review': 29, 'last_played': 1617571244}",english,"Similar to You Don't Know Jack Sports, this iteration of the franchise deals exclusively with Film trivia.  Most of what I said in my YDKJ Sports review can be applied here, just change ""sports"" to ""movies.""  Movie buffs will get the most out of this; comedy will be the saving grace for everyone else.  Again, I think it would be prudent to purchase this in the bundle, and that's where my recommendation falls.",1483211172,1483211172,True,0,0,0,0,True,False,False,False,,,
26670474,"{'steamid': '76561197991367479', 'num_games_owned': 0, 'num_reviews': 66, 'playtime_forever': 102, 'playtime_last_two_weeks': 0, 'playtime_at_review': 102, 'last_played': 1479470443}",english,"Hm, how should I put this? I hate it. 
So, I liked the first few You Don't Know Jack games in my youth, and always felt that they posed interesting questions paired with good humor, even when I was younger. 
I also love movies and have watched several thousand, so this should be good for me, right?
Uh, no. I've read some people's complaints on here about the interface, and they are plain wrong. It's fine, aside from not adjusting to resolutions above 1024x768, doesn't really matter. 
The real problem is the obscurity of the questions. 
As an example, I played a random 21 questions game, and in order to finish the game with a score above ZERO, the winning player would have to be intimately familiar with:
Our Man Flint
Reality Bites
Song of the South
She Wore a Yellow Ribbon
Myra Breckenridge
all of the seven dwarf's names
most titles of Jerry Lewis' filmography
and NO ONE I was playing with got a score over ZERO. So, yeah, fun game, maybe, if you're Leonard Maltin, and you're playing with Gene Shalit and Ken Jennings. But even for the average movie buff, let alone the average person, this is just silly.",1479470920,1479470920,False,53,13,0.687014400959014893,0,True,False,False,False,,,
25134361,"{'steamid': '76561198040884867', 'num_games_owned': 2433, 'num_reviews': 901, 'playtime_forever': 93, 'playtime_last_two_weeks': 0, 'playtime_at_review': 49, 'last_played': 1387423553}",english,"[b]Until recently (ie. [i]Quiplash[/i], and the party box 2), [i]JackBox[/i] had a great formula and unique party-game style BUT there were [i]terrible[/i] control options and they all felt like a bad port.[/b]

I'd pass on all of the older [i]You Don't Know Jack[/i] titles and go for the more modern [i]JackBox[/i] games that let people use mobile devices as the controllers. 

Bottom line: great ideas and fun here, but terrible interface, controls, and overal wasted potential.",1472139658,1472139658,False,17,2,0.497233033180236816,0,True,False,False,False,,,
25046009,"{'steamid': '76561197967201791', 'num_games_owned': 322, 'num_reviews': 23, 'playtime_forever': 12, 'playtime_last_two_weeks': 0, 'playtime_at_review': 12, 'last_played': 1471747638}",english,Terrible.,1471753151,1471753151,False,1,0,0.383686572313308716,0,True,False,False,False,,,
23655236,"{'steamid': '76561197969749884', 'num_games_owned': 2459, 'num_reviews': 1422, 'playtime_forever': 1916, 'playtime_last_two_weeks': 0, 'playtime_at_review': 181, 'last_played': 1529814117}",english,"If you don't know You Don't Know Jack, you don't know jacks***.",1466356958,1466356958,True,0,0,0,0,False,False,False,False,,,
23558595,"{'steamid': '76561198299339400', 'num_games_owned': 0, 'num_reviews': 3, 'playtime_forever': 9208, 'playtime_last_two_weeks': 0, 'playtime_at_review': 1203, 'last_played': 1546309061}",english,"I love this game!! I remember playing it when it first came out and I am so excited to see that Steam has it.

#bringonthetrivia",1465936300,1465936300,True,0,0,0,0,True,False,False,False,,,
18270909,"{'steamid': '76561198030125439', 'num_games_owned': 1850, 'num_reviews': 265, 'playtime_forever': 66, 'playtime_last_two_weeks': 0, 'playtime_at_review': 66, 'last_played': 1443665274}",english,very nice,1443665283,1443665283,True,0,0,0,0,False,False,False,False,,,
18191616,"{'steamid': '76561197986012702', 'num_games_owned': 386, 'num_reviews': 3, 'playtime_forever': 15, 'playtime_last_two_weeks': 0, 'playtime_at_review': 15, 'last_played': 1443214981}",english,THIS GAME IS BULLSHIT. DO NOT WASTE YOUR TIME,1443215056,1443215056,False,1,0,0.411072731018066406,0,True,False,False,False,,,
18148140,"{'steamid': '76561197970602587', 'num_games_owned': 6364, 'num_reviews': 3660, 'playtime_forever': 30, 'playtime_last_two_weeks': 0, 'last_played': 1440866769}",english,"https://youtu.be/Yx0wTD_Dt9o

As good as it was at the time of release, this game has not aged well, I'd go with their newer products.",1442943421,1442943421,False,1,0,0.449940234422683716,0,True,False,False,False,,,
17871917,"{'steamid': '76561198109641005', 'num_games_owned': 951, 'num_reviews': 33, 'playtime_forever': 675, 'playtime_last_two_weeks': 0, 'playtime_at_review': 336, 'last_played': 1490637821}",english,"Simple fun from the 90s. I'm a trivia buff, so this was right up my ally. Not to mention, the stupid humor (I use stupid in a positive way here) is quite refreshing and enjoyable.",1441338655,1441338655,True,0,0,0,0,False,False,False,False,,,
17510727,"{'steamid': '76561198119765006', 'num_games_owned': 0, 'num_reviews': 68, 'playtime_forever': 59, 'playtime_last_two_weeks': 0, 'playtime_at_review': 59, 'last_played': 1439412363}",english,"The game is fun, and definitely follows the YDKJ pattern, but the movie trivia does become only more dated and obscure with time, as even what were newer movies when the game was made are now decades old. Even if you're really into movies, you will still be lucky to get more than a handful of correct answers in a full game, despite the impression caused by the screenshots. This is especially true if you don't watch and rewatch classic films and the popular movies from the 70s, 80s, and 90s on a regular basis. It's still very good, and I definitely look forward to playing the multiplayer and hopefully letting others narrow down the answers a bit for me sometimes, but it seems fair to warn everyone that this is not the type of trivia game where one can reasonably expect to be really ""good"" at it. If you cannot have fun while being utterly clueless and guessing the wrong answers to silly questions, you will despise the game very quickly.",1439413654,1439413654,True,7,0,0.588182389736175537,0,False,False,False,False,,,
17345884,"{'steamid': '76561198043346855', 'num_games_owned': 425, 'num_reviews': 630, 'playtime_forever': 13, 'playtime_last_two_weeks': 0, 'playtime_at_review': 13, 'last_played': 1504932297}",english,Hosted by Cookie - and you can never have too much Cookie.  Based on the YDKJ 2 engine with some very inspired new assets.,1438500459,1504932344,True,0,0,0,0,False,False,False,False,,,
16111757,"{'steamid': '76561198162051946', 'num_games_owned': 1241, 'num_reviews': 4, 'playtime_forever': 22, 'playtime_last_two_weeks': 0, 'playtime_at_review': 22, 'last_played': 1433139346}",english,"I would have to say that im  disappointed in this game. I usually enjoy trivia games. But never played a You Don't know Jack Games. The main problem i have with the game is the way the questions are asked. Instead of simply asking you who directed this and who was in that or what scene is this from. It has to ask you question in some nonsensical way. like ""In the movie Airplane, Jimmy is asked if he has seen a grown man naked. Who would he see naked in the directors other movies"". Its actually a trick question since that movie had 3 directors.  Also i got really annoyed by the narrator constant sarcasm. That alone gives me a reason not to play this again.",1433141063,1433141771,False,1,0,0.431783050298690796,1,False,False,False,False,,,
15752799,"{'steamid': '76561198066830407', 'num_games_owned': 0, 'num_reviews': 2, 'playtime_forever': 895, 'playtime_last_two_weeks': 0, 'playtime_at_review': 186, 'last_played': 1680989042}",english,"Embarrassing admission: when I was in middle school, I had a crush on Cookie.

I've still got the game disk (and instruction manual!) for this kicking around somewhere, though I haven't been able to actually run it on a computer since about 2005. I bought the bundle pretty much the instant I saw that, at long last, the YDKJ games were available on Steam (well, some of them).

YDKJ Movies was tough when I played it when it first came out, because I was pretty young and hadn't seen that many movies. Now it's still really tough, because the majority of movies I've seen came out since 1997 (or at least are fresher in my memory). I'm pretty good at trivia, so I never found any of the other YDKJ games difficult, but this one's still rough. Still, the humor and nostalgia more than make up for it, and getting questions wrong just means more opportunities for Cookie to hilariously insult me. I don't even mind.",1431164745,1431164745,True,0,1,0,0,True,False,False,False,,,
15695002,"{'steamid': '76561198035643084', 'num_games_owned': 0, 'num_reviews': 265, 'playtime_forever': 237, 'playtime_last_two_weeks': 0, 'playtime_at_review': 90, 'last_played': 1576881548}",english,"From MST3K to the Big Silver Screen at AMC or any other Movie Theater, YDKJ Movies is a pretty good CD-ROM Cinema Triva/Digital Download Game. Don't forget the Popcorn, Candy & Snacks before you take your seat in your Local Movie Theaters, New Releases or Classic Movies.

YDKJ Movies is also one of the first YDKJ games to be published by Sierra On-Line as well, following Sierra On-Line's purchase of Berkeley Systems in 1997 until Berkeley Systems' final published game: YDKJ Louder Faster Funnier in 2000 before Berkeley Systems' closure in 2001.",1430802747,1574681429,True,1,0,0.380930691957473755,0,True,False,False,False,,,
15694634,"{'steamid': '76561198010313742', 'num_games_owned': 0, 'num_reviews': 6, 'playtime_forever': 20, 'playtime_last_two_weeks': 0, 'playtime_at_review': 11, 'last_played': 1442806247}",english,"I've loved this game and the original one since it came out back in 1997, so it is awesome that Steam has it available.  I could play my original disc version, but Win 7 doesn't like Windows 3.1/95 games.  This have never been an easy game series to master.  The questions are often time quite difficult, and crazy (but that's the fun of it all).  It would have been nice it the host, Cookie, had continued through into the rest of the games, but he stepped down for another actor after this outting.  Everything about the first three Jack games are great.  The humor, the setting, the difficulty (which can piss you off at times since you come away saying to yourself, ""Crap!  I knew that!  Why didn't I choose that answer!?""  Even the credits are hilarious with the fake commercials.  If you love quirky, fun and challenging trivia games, don't miss this or Volumes 1 (the Xtra Larged Edition) and 2, the Volume 4 - The Ride.  Skip Volume 3.  It got bad reviews back when it was first released.",1430799206,1430799206,True,0,0,0,0,True,False,False,False,,,
15150646,"{'steamid': '76561198013817268', 'num_games_owned': 0, 'num_reviews': 23, 'playtime_forever': 40, 'playtime_last_two_weeks': 0, 'playtime_at_review': 40, 'last_played': 1424982964}",english,Power,1427864355,1427864355,True,1,0,0.455138742923736572,0,True,False,False,False,,,
12843103,"{'steamid': '76561198004315495', 'num_games_owned': 123, 'num_reviews': 13, 'playtime_forever': 21, 'playtime_last_two_weeks': 0, 'playtime_at_review': 21, 'last_played': 1404752962}",english,"I really disliked this game for so many reasons I can't even begin to pick out the most prevalent. 

Crass, random, irrelevant and obscure. I'm pretty sure I'd rather stab myself in the foot than play this again.

Dreadful and poorly executed",1415449744,1415449744,False,1,0,0.336166977882385254,1,True,False,False,False,,,
10902274,"{'steamid': '76561198078672954', 'num_games_owned': 0, 'num_reviews': 18, 'playtime_forever': 27, 'playtime_last_two_weeks': 0, 'playtime_at_review': 27, 'last_played': 1403759491}",english,"This YDKJ is for the hard core movie goer. Wow, it is hard... And I watch/watched a lot of movies in my 40 years on this planet.  A challenge for sure. 

I would recommend only for HARD CORE MOVIE TRIVIA crazyness!",1403953129,1403953129,True,13,0,0.681926071643829346,0,True,False,False,False,,,
10699760,"{'steamid': '76561197993568205', 'num_games_owned': 0, 'num_reviews': 1, 'playtime_forever': 300, 'playtime_last_two_weeks': 0, 'playtime_at_review': 115, 'last_played': 1607741323}",english,"As someone who is a film maker and have a degree in film, this game is semi hard and really gets you thinking. if you love movies pick this up!",1403508454,1403508454,True,11,1,0.543571770191192627,0,True,False,False,False,,,
10693353,"{'steamid': '76561198043635362', 'num_games_owned': 0, 'num_reviews': 1, 'playtime_forever': 63, 'playtime_last_two_weeks': 0, 'playtime_at_review': 63, 'last_played': 1403492072}",english,The YDNJ trivia series is great. I love them.,1403492089,1403492089,True,1,0,0.434251576662063599,0,True,False,False,False,,,
10611056,"{'steamid': '76561198009372168', 'num_games_owned': 0, 'num_reviews': 2, 'playtime_forever': 29, 'playtime_last_two_weeks': 0, 'playtime_at_review': 29, 'last_played': 1387812417}",english,Rather annoying game after 2 minutes in..,1403352291,1403352291,False,4,0,0.349047869443893433,0,True,False,False,False,,,
10158514,"{'steamid': '76561198008675448', 'num_games_owned': 517, 'num_reviews': 51, 'playtime_forever': 20, 'playtime_last_two_weeks': 0, 'playtime_at_review': 20, 'last_played': 1400413890}",french,"Je pensais que cela allait etre plus simple avec un episode consacré aux films. Et bien non, c'est pire ! Le titre est toujours en anglais haut niveau avec des références purement américaine. Bref, déconseillé si ce n'est si vous souhaitez vous faire humilier par Jack :)",1400414073,1400414073,False,2,0,0.541284441947937012,0,False,False,False,False,,,
9234488,"{'steamid': '76561197993624971', 'num_games_owned': 0, 'num_reviews': 29, 'playtime_forever': 177, 'playtime_last_two_weeks': 0, 'playtime_at_review': 67, 'last_played': 1709864455}",english,"Frankly my dear... This game is classic YDKJ! I mean hell, one of the answers is ""Taun-Taun gut lined gloves""",1393169281,1393169281,True,9,0,0.580086946487426758,0,True,False,False,False,,,
8424463,"{'steamid': '76561197985209709', 'num_games_owned': 495, 'num_reviews': 155, 'playtime_forever': 22, 'playtime_last_two_weeks': 0, 'playtime_at_review': 22, 'last_played': 1387508863}",english,"This is one of the best video game franchises in history, just because it actually requires you to know things. As in, really know them. You can't just be all ""oh, I like movies"" and expect to get by in this game. You have to activate your brain and fork out hard facts about really tough Hollywood jive. 

Get this game if you want to both be intellectually stimulated and humiliated.

",1388401933,1388401933,True,1,0,0.464932680130004883,0,True,False,False,False,,,
8395655,"{'steamid': '76561198047489380', 'num_games_owned': 318, 'num_reviews': 7, 'playtime_forever': 14, 'playtime_last_two_weeks': 0, 'playtime_at_review': 14, 'last_played': 1387775617}",english,"The title says it all, when you play you really do find out you don't know jack about movies. The game was obviously made quite a while ago without HD resolutions in mind and it's definitely not a game for kids with all the adult humor which was definitely a good thing in my situation. This has made a great addition to my party game line-up.",1388322099,1388322099,True,1,0,0.455142229795455933,0,True,False,False,False,,,
