recommendationid,author,language,review,timestamp_created,timestamp_updated,voted_up,votes_up,votes_funny,weighted_vote_score,comment_count,steam_purchase,received_for_free,written_during_early_access,hidden_in_steam_china,steam_china_location,timestamp_dev_responded,developer_response
160990335,"{'steamid': '76561199254661596', 'num_games_owned': 81, 'num_reviews': 3, 'playtime_forever': 27, 'playtime_last_two_weeks': 14, 'playtime_at_review': 12, 'last_played': 1711128816}",russian,прЭкольно. СОВЕТУЮ. ЕСЛИ ТЫ ИНГЛИШ.,1710940268,1710940268,True,0,0,0,0,True,False,False,True,,,
159199121,"{'steamid': '76561198137349289', 'num_games_owned': 2329, 'num_reviews': 1364, 'playtime_forever': 1010, 'playtime_last_two_weeks': 0, 'playtime_at_review': 1010, 'last_played': 1708819725}",english,👍,1708822407,1708822407,True,1,0,0.528985500335693359,0,False,False,False,True,,,
147397050,"{'steamid': '76561198003919468', 'num_games_owned': 0, 'num_reviews': 165, 'playtime_forever': 61, 'playtime_last_two_weeks': 0, 'playtime_at_review': 48, 'last_played': 1696121409}",english,"nearly a good quiz game.
like the idea. great voice over but with out much funny material. the timers combined with A high level of voice over skill that lack joke content soon becomes abrasive and annoying! the way the questions are written combined with the all out emphasis narration mean that its not so much the question your figuring out but what the hell he trying to say in the 1st place. so if i dont want to hear the 'right' answer where is the skip button? also the films didnt seem that relevant to me, for eg you know what my good friend jack burton always says about the eye of the storm?? open yr eyes and watch some GOOD movies, gone with the wind SUCKS and i am happy not  to know shit about it or its boring friends.SKIP BUTTON!. Over all i found my answers to be, dont care or shut the hell up already!
pretty glad i dont know about alot of these film tbh.

couldve been good if they..
watched some better movies.
wrote some gags and stuff
it wasnt a bitchy nag (like 25% less)
S-K-I-P   B-U-T-T-O-N!!
And why the hell put A timer on category selection? (this ended the fun for me!) 

it would be good to see these more inventive selections, it seems that they are mostly what the jibberish vs fact premise derives from, why limit the introduction to the subject matter, let us take it on before you slag us out the door with a gob barrage of pebble dash shrapnel! iam not having problems jumping out of a plane here, IAM JUST SELECTING!",1696120643,1696760643,False,0,0,0,0,True,False,False,True,,,
145566665,"{'steamid': '76561198012807843', 'num_games_owned': 0, 'num_reviews': 1, 'playtime_forever': 236, 'playtime_last_two_weeks': 0, 'playtime_at_review': 236, 'last_played': 1693711605}",english,Challenging for movie buffs but players must be on the same keel,1693711867,1693711867,True,0,0,0,0,True,False,False,True,,,
140926416,"{'steamid': '76561198199331935', 'num_games_owned': 1371, 'num_reviews': 1096, 'playtime_forever': 5, 'playtime_last_two_weeks': 0, 'playtime_at_review': 5, 'last_played': 1688069829}",russian,"Как викторина норм, но много вопросов на которые не знаешь ответа. Так же цена чуток высокая как по мне.
Но тут уже вкусовщина, и каждому свое.",1688069892,1688069892,True,6,0,0.595608115196228027,0,False,False,False,True,,,
139378138,"{'steamid': '76561198010812017', 'num_games_owned': 351, 'num_reviews': 13, 'playtime_forever': 42, 'playtime_last_two_weeks': 0, 'playtime_at_review': 32, 'last_played': 1686154860}",english,If you don't know what movie you should watch - this game can give you some options lol.,1685636059,1685636059,True,2,0,0.548872172832489014,0,True,False,False,True,,,
137019112,"{'steamid': '76561198990643352', 'num_games_owned': 61, 'num_reviews': 16, 'playtime_forever': 10, 'playtime_last_two_weeks': 0, 'playtime_at_review': 10, 'last_played': 1682018251}",english,"Despite me not being familiar with american film culture, i still love the sounds and graphics of this game",1682018328,1682018328,True,0,0,0,0,False,False,False,True,,,
130895440,"{'steamid': '76561198042406453', 'num_games_owned': 1063, 'num_reviews': 752, 'playtime_forever': 590, 'playtime_last_two_weeks': 0, 'playtime_at_review': 148, 'last_played': 1676236485}",english,"[quote]For more puzzle game reviews, news and everything puzzle-related, follow [url=https://store.steampowered.com/curator/25928931-Puzzle-Lovers/]Puzzle Lovers[/url] and check out our [url=http://steamcommunity.com/groups/puzzlelovers]Steam group[/url].[/quote]

[b]you don't know jack[/b] is the best trivia game series of all time. this one is from 1997, so it's pretty outdated by now and [b]it's always been us-centric[/b] (though with movies both are less of an issue than in other entries), so you'll either find it very challenging or very frustrating if you're from somewhere else. or a piece of cake because you know all the answers.

it's your typical multiple choice deal, but there are [b]a ton of other question types over the series[/b], like dis or dat (or sometimes both) or gibberish question. you can play a game of [b]7 or 21 questions[/b], some question types only appear in the full run, but they both end with the [b]jack attack[/b]. there's a clue and you have to match things accordingly.

[b]local multiplayer is available for up to 3 players[/b], you can even screw each other by buzzing in and forcing another player to answer. save for a few occasions way back when, I've always played it alone and always had a blast.

it's all [b]presented as a tv show[/b] (there was an actual short-lived tv show as well, should be on youtube), there's some behind-the-scenes chatter at the beginning, fake commercials at the end (don't you dare skip them!), fake money to win and all that, and [b]the writing is fantastic[/b]. if it was a simple text-based thing, it'd still be excellent stuff, so much creativity, but [b]the voiceovers take it to a whole new level[/b]. lots of characters, one-off or recurring, great hosts, also one-off or recurring, and again, the whole thing is just great.

[b]the attention to detail and variety elevates it even further.[/b] sure, if you play long enough, you'll see repeated questions (though I don't think the game will show them again until you've seen most of them), but there are a lot of different ways to introduce questions, a lot of remarks if you chose the wrong answer or hesitate to enter your name (in which case the host will give you one) or pick a category or answer, a relevant joke for most choices, right or wrong, and of course the commercials, man... the game also starts differently based on the time and date, so on certain holidays, early in the morning, late at night, on friday evening, and so on. and for answers that need typing, you can try some profanities, see what good they do.

[b]there was nothing done to modernize the game[/b] for the steam release, so it runs in 640x480 (a very tiny window with a black background, you can set the .exe to run in that resolution or something closer and fill the screen more with the actual game), there's no steam overlay, there's only a single volume setting (it's fine in this case, though lowering it completely didn't let me raise it again until a restart) and controls aren't rebindable. each player gets a buzz hotkey scattered on the keyboard, the screw is the same for everybody, and if you play alone, no need to buzz and space works just fine for that too.

I literally don't know jack and I've been having fun with the series since it first came out, most of it played alone. if you don't mind questions about older stuff (or that's your specialty) and can handle a lower resolution, definitely pick these up.",1673781760,1673781760,True,11,0,0.583069264888763428,1,True,False,False,True,,,
130127423,"{'steamid': '76561198031313794', 'num_games_owned': 8531, 'num_reviews': 3393, 'playtime_forever': 16, 'playtime_last_two_weeks': 0, 'playtime_at_review': 16, 'last_played': 1672856216}",russian,"Серия викторин родом из 90х. Вопросы сложные даже для носителя языка. В плане оформления игры классные - озвучка вопросов, всякие вставки. Для 99.99% игроков это игра - пройти мимо.",1672856517,1672856517,False,5,0,0.487861335277557373,0,False,False,False,True,,,
127712984,"{'steamid': '76561198140622478', 'num_games_owned': 0, 'num_reviews': 41, 'playtime_forever': 1485, 'playtime_last_two_weeks': 0, 'playtime_at_review': 1232, 'last_played': 1709930033}",english,This is another fun entry in the YDKJ series although the themed entries such as this one along with SPORTS and TELEVISION is pretty difficult so you do have to be pretty knowledgeable in movies to be consistently good in this. It is outdated but still enjoyable.,1669922909,1669922909,True,0,0,0,0,True,False,False,True,,,
127685562,"{'steamid': '76561198169235574', 'num_games_owned': 41, 'num_reviews': 2, 'playtime_forever': 57, 'playtime_last_two_weeks': 0, 'playtime_at_review': 26, 'last_played': 1704058584}",german,"First things first: this game came out in 1997 so don't expect any Avengers or Harry Potter related questions. But also with that in mind, some of the questions seem out of date as most of them referenced movies from the 70ies and 80ies with only a very few 90ies mixed in. As usual the gameplay is fun and the prompts are wonderfully silly, just be prepared to be frustrated if your movie knowledge doesn't include qa vast knowledge of the classics and their personnel.",1669889639,1669889639,True,0,0,0,0,False,False,False,True,,,
122737312,"{'steamid': '76561199368377112', 'num_games_owned': 0, 'num_reviews': 19, 'playtime_forever': 1636, 'playtime_last_two_weeks': 26, 'playtime_at_review': 421, 'last_played': 1712139634}",english,good for movie buffs.,1664018309,1664018309,True,0,0,0,0,True,False,False,True,,,
122239136,"{'steamid': '76561198801843218', 'num_games_owned': 0, 'num_reviews': 22, 'playtime_forever': 89, 'playtime_last_two_weeks': 0, 'playtime_at_review': 89, 'last_played': 1663164829}",english,"I worked at a video store for almost a decade and like movie trivia.  The difficulty level on this game is ""Well above average"" to ""Well that's obscure"".",1663177257,1663177257,False,0,0,0,0,True,False,False,True,,,
121993692,"{'steamid': '76561198384121504', 'num_games_owned': 0, 'num_reviews': 2, 'playtime_forever': 475, 'playtime_last_two_weeks': 0, 'playtime_at_review': 438, 'last_played': 1684528626}",english,Awsome game to play,1662751613,1662751613,True,0,0,0,0,True,False,False,True,,,
121582783,"{'steamid': '76561199173770892', 'num_games_owned': 428, 'num_reviews': 182, 'playtime_forever': 6704, 'playtime_last_two_weeks': 0, 'playtime_at_review': 177, 'last_played': 1664872350}",russian,я ваще не eбу что это,1662053376,1662053376,False,0,0,0,0,False,False,False,True,,,
120243521,"{'steamid': '76561199084879910', 'num_games_owned': 0, 'num_reviews': 21, 'playtime_forever': 136, 'playtime_last_two_weeks': 0, 'playtime_at_review': 122, 'last_played': 1699389608}",english,"Mechanically, this is a fine game, but this is definitely the hardest You Don't Know Jack game. So hard, I can't even really recommend this to someone if they aren't a die-hard movie fan who loves every classic movie ever.

[I did get this as part of a humble bundle, along with many other Jackbox games, but that didn't affect my review in any way.]",1659907884,1659908997,False,0,0,0,0,False,False,False,False,,,
118387867,"{'steamid': '76561199121539127', 'num_games_owned': 231, 'num_reviews': 122, 'playtime_forever': 62, 'playtime_last_two_weeks': 0, 'playtime_at_review': 11, 'last_played': 1681029773}",english,movies,1657201109,1657201109,True,0,0,0,0,True,False,False,False,,,
108140399,"{'steamid': '76561198060731577', 'num_games_owned': 2394, 'num_reviews': 120, 'playtime_forever': 17, 'playtime_last_two_weeks': 0, 'playtime_at_review': 17, 'last_played': 1641915675}",english,"The controls are meh, the movies are far too old for me, but if you know your stuff than maybe you will have a better time with this game than me. Also, it's better with more people.",1642344074,1642344074,False,0,1,0,0,False,False,False,False,,,
106038436,"{'steamid': '76561198048038590', 'num_games_owned': 0, 'num_reviews': 367, 'playtime_forever': 12, 'playtime_last_two_weeks': 0, 'playtime_at_review': 12, 'last_played': 1639834750}",german,"Eine nette Idee YDKJ nur mit Fragen zu Filmen zu machen, funktioniert auch ganz gut soweit, aber leider wieder einmal keine deutsche Syncro. Das macht das Spiel nicht schlecht, keineswegs, jedoch ist es ungeeignet für Spieler die der englischen Sprache nicht so sehr mächtig sind, alle die englisch gut können, können auch getrost zugreifen.",1639834869,1639834869,False,0,0,0,0,False,False,False,False,,,
102180015,"{'steamid': '76561198077242222', 'num_games_owned': 2468, 'num_reviews': 444, 'playtime_forever': 101, 'playtime_last_two_weeks': 0, 'playtime_at_review': 36, 'last_played': 1654441837}",english,"I am a cinephile and this game is amazing for me and playing with friends!

The questions can be pretty hardcore at times, they require you to have seen and remember quite a lot of details about not so famous movies or to use your imagination. It's fun to score above 0 though when everyone else is below 0.",1635986956,1635987183,True,6,0,0.600784838199615479,0,False,False,False,False,,,
100880165,"{'steamid': '76561198063159693', 'num_games_owned': 1560, 'num_reviews': 334, 'playtime_forever': 32, 'playtime_last_two_weeks': 0, 'playtime_at_review': 32, 'last_played': 1633930720}",english,better than sports but still boomer,1633930747,1633930747,False,0,0,0,0,False,False,False,False,,,
99467653,"{'steamid': '76561198059361840', 'num_games_owned': 1182, 'num_reviews': 1030, 'playtime_forever': 64, 'playtime_last_two_weeks': 0, 'playtime_at_review': 64, 'last_played': 1631826812}",english,"I really love all the Jackbox games, but this quiz is way too old and to specific. It is almost impossible to answer the questions, if you aren’t 50 years old and up. Therefore, I unfortunately don’t recommend it.",1631826851,1631826851,False,0,0,0,0,False,False,False,False,,,
98941646,"{'steamid': '76561198172925593', 'num_games_owned': 14021, 'num_reviews': 4532, 'playtime_forever': 21, 'playtime_last_two_weeks': 0, 'playtime_at_review': 21, 'last_played': 1631028948}",schinese,"毫无乐趣的系列智力答题游戏
非常丑的配色，约等于没有的UI
有几代还有文字bug，单引号显示乱码",1631028972,1631028972,False,4,0,0.381110280752182007,0,False,False,False,False,,,
98856333,"{'steamid': '76561198800965012', 'num_games_owned': 0, 'num_reviews': 189, 'playtime_forever': 23, 'playtime_last_two_weeks': 0, 'playtime_at_review': 11, 'last_played': 1630885600}",english,"Do I recommend this game? No. 
However, I think the page is honest about what type of game this is, so if it seems appealing, by all means go ahead and get this.

Like lots of others, I got this as part of a bundle, and perhaps never would have played it otherwise.

The most important point to note is that this game is from 1997. So all of the trivia is from movies from before this date. Some of the questions just seemed ridiculous, I'd be surprised if anyone knew the answer (again, it's labelled as a challenging game, the developers are up-front about this).

However, when compared to the Jackbox games, this one pales in comparison. It's basic quiz game with very specific movie references that hasn't aged well.",1630884883,1630884990,False,0,0,0,0,False,False,False,False,,,
94782287,"{'steamid': '76561198122173956', 'num_games_owned': 0, 'num_reviews': 9, 'playtime_forever': 29, 'playtime_last_two_weeks': 0, 'playtime_at_review': 18, 'last_played': 1693446392}",english,More of a game for the generation born before 1990.  The questions are all based on movies from before 1990 era.  A little disappointed.,1625112135,1625112135,False,0,1,0,0,True,False,False,False,,,
89964383,"{'steamid': '76561197997398155', 'num_games_owned': 165, 'num_reviews': 43, 'playtime_forever': 29, 'playtime_last_two_weeks': 0, 'playtime_at_review': 29, 'last_played': 1617908952}",german,Ich hätte gedacht ein (Hollywood) Filmquiz könnte von sich aus gut funktionieren. Auch hier merkt man wie wichtig bei dem Titel eine anständige Lokalisierung ist. Diese fehlt hier komplett.,1617910947,1617910947,False,0,0,0,0,False,False,False,False,,,
88338921,"{'steamid': '76561198004772835', 'num_games_owned': 0, 'num_reviews': 6, 'playtime_forever': 8, 'playtime_last_two_weeks': 0, 'playtime_at_review': 8, 'last_played': 1615602184}",english,"It's terrible and dated, don't get the any of the set.",1615609020,1615609020,False,0,0,0.458553820848464966,0,True,False,False,False,,,
86166612,"{'steamid': '76561198035394965', 'num_games_owned': 0, 'num_reviews': 54, 'playtime_forever': 6, 'playtime_last_two_weeks': 0, 'playtime_at_review': 6, 'last_played': 1612729746}",english,Really not very good. The questions are incredibly dumb and just not fun,1612733976,1612733976,False,0,0,0,0,False,False,False,False,,,
82493480,"{'steamid': '76561197983612330', 'num_games_owned': 2735, 'num_reviews': 427, 'playtime_forever': 51, 'playtime_last_two_weeks': 0, 'playtime_at_review': 21, 'last_played': 1608123670}",english,"bom jogo para quem é hardcore em filmes, como o jogo é antigo (97), as perguntas são bem difíceis.
precisa ter uma nova versão.
gostei da apresentação do jogo, bem original.",1608121856,1608121856,True,0,0,0.458553820848464966,0,False,False,False,False,,,
81438135,"{'steamid': '76561198259831834', 'num_games_owned': 84, 'num_reviews': 5, 'playtime_forever': 19, 'playtime_last_two_weeks': 0, 'playtime_at_review': 19, 'last_played': 1606878216}",english,"I bought this game for 1$ on sale so I really don't mind it.
However, this game does not hold up well at all, questions are pretty much blind guesses 3/4 times because of how old and random the movies are. The game doesn't even have a settings page, so your stuck watching it on a tiny little box in the middle of your screen, which there is a workaround but its not even worth the effort. 
I personally think this game is dead and doesn't need to be played, it had its run when it was released but now it just doesn't compare to any of the other amazing Jackbox games. 
(NOTE: You can not play this with people who aren't watching the game in person, there is no jackbox.tv compatibility.)",1606879108,1606879108,False,2,0,0.542855978012084961,0,True,False,False,False,,,
71698050,"{'steamid': '76561198985491715', 'num_games_owned': 0, 'num_reviews': 6, 'playtime_forever': 52, 'playtime_last_two_weeks': 0, 'playtime_at_review': 13, 'last_played': 1595591871}",english,Its true...I guess I really didnt know Jack....,1593483368,1593483368,False,0,5,0.452122539281845093,0,False,False,False,False,,,
67800107,"{'steamid': '76561197997934524', 'num_games_owned': 3413, 'num_reviews': 356, 'playtime_forever': 20, 'playtime_last_two_weeks': 0, 'playtime_at_review': 20, 'last_played': 1587538024}",english,"Yes, the references top out at 1997, yes it runs in a tiny resolution, and yes, there's no online and you have to share a keyboard, but this is the only YDKJ where I have a chance at getting most of the questions right and I'll take it. Would love if they did a movie exclusive version in a future Jackbox game.",1587538107,1587538149,True,3,0,0.568084537982940674,0,True,False,False,False,,,
67520036,"{'steamid': '76561198111773484', 'num_games_owned': 0, 'num_reviews': 15, 'playtime_forever': 36, 'playtime_last_two_weeks': 0, 'playtime_at_review': 28, 'last_played': 1587195595}",english,I wish to play this game with Quentin Tarantino.,1587158506,1587158506,True,2,5,0.540996432304382324,0,True,False,False,False,,,
66552435,"{'steamid': '76561199042668291', 'num_games_owned': 0, 'num_reviews': 1, 'playtime_forever': 27, 'playtime_last_two_weeks': 0, 'playtime_at_review': 27, 'last_played': 1585969829}",english,I'm bummed. I thought this was ajackbox tv game that could be played via Zoom- my mistake- such a waste of money,1585970927,1585970927,False,1,5,0.358998894691467285,0,True,False,False,False,,,
63300687,"{'steamid': '76561197996919908', 'num_games_owned': 1532, 'num_reviews': 875, 'playtime_forever': 17, 'playtime_last_two_weeks': 0, 'playtime_at_review': 17, 'last_played': 1579128688}",german,"[h1]YOU DON`T KNOW ENGLISCH MOVIES![/h1]

Die Spielreihe kam ursprünglich für die Playstation 1 raus und wurde nun, Jahre später, auf Steam veröffentlicht. Der Daumen geht nach oben, aber bitte das ganze Review lesen, welches stellvertretend für die gesamte Spielereihe steht!

[b]Gameplay[/b]
Die gesamte “YOU DON`T KNOW JACK” – Reihe ist ein Quizspiel, die sich durch abstrakte Fragen und viel Humor auszeichnet. Man kann auswählen, ob man alleine oder im Partymodus spielen will und bekommt anschließend 7 oder 21 Fragen gestellt, wobei man aus einer von drei fragwürdigen Kategorien auswählen darf. Wer den „Buzzer“ drückt, darf antworten: Ist es Richtig, gibt es die Summe aufs Konto, ansonsten wird sie abgezogen.  Gelegentlich gibt es dann noch Zusatzspiele, wo man Begriffe assoziieren muss und Ähnliches. 

[b]Story[/b]
Klar, das Spiel ist eine Quizshow und hat damit keine Geschichte. Allerdings sind die vertonten Stimmen einfach der Hammer und reißen ständig sehr geile Witze. Am Ende gibt es auch verstörende und lustige Werbeclips zum Anhören. Auch die Kategorien sind ziemlich durchgeknallt und die Fragen werden manchmal so merkwürdig und verzweigt gestellt, dass man erstmal überhaupt die Frage herausarbeiten muss. Zudem beinhaltet das Spiel oft Fremdwörter oder ältere politische Themen. Hier liegt aber das große Problem: Das Spiel ist nur auf Englisch verfügbar! Normalerweise keine große Sache, jedoch werden wie bereits erwähnt, viele Fremdwörter benutzt, die man sich auch schon schwer ins Deutsche übersetzen kann und dann noch selten weiß, was eigentlich gemeint ist. Zudem zielen geschichtliche, gesellschaftliche und politische Fragen auf die USA ab und nicht wie in meiner Playstationfassung, auf die Deutsche.

[b]Grafik/Sound[/b]
Die Auflösung ist leider nicht einfach so skalierbar, wodurch das Spiel nur in einem kleinen Fenster geöffnet wird. Ansonsten ist das Spiel grafisch nicht aufwendig, da es zum Einen sehr alt und zum Anderen eben ein Quizspiel ist.
Die Musik klingt sehr flockig nach einer typischen Quizshow und die Vertonung ist in der englischen Version und damals auch in der Deutschen einfach super gewesen.

[b]Fazit[/b]
„YOU DON`T KNOW JACK“ ist ein super Spiel, was mich früher auf der Playstation ständig zum Lachen gebracht hat. Leider wurde die Steamversion nur auf Englisch veröffentlicht und ich habe wirklich fast alles versucht. Ich habe die deutsche Vertonung im Internet gesucht und habe die Entwickler angeschrieben, jedoch ohne Erfolg. Den ersten Teil kann man allerdings nachgebaut im Browser spielen, den Link werde ich aber hier logischerweise nicht veröffentlichen.  Auf jeden Fall Danke an diesem Typen, dass er ein super Spiel nachgebaut hat. Wer wirklich gut im Englischen ist, kann sich die Spielreihe gerne anschaffen, ansonsten würde ich stark davon abraten.


Hat dir das Review gefallen? Dann folge mir doch in meiner [url=http://steamcommunity.com/groups/Drakeschool]Steamgruppe[/url], wo ich meine Reviews als Kurator verfasse.
",1581372457,1581372457,True,3,0,0.544037878513336182,1,False,False,False,False,,,
58023326,"{'steamid': '76561197978997366', 'num_games_owned': 1469, 'num_reviews': 67, 'playtime_forever': 876, 'playtime_last_two_weeks': 0, 'playtime_at_review': 729, 'last_played': 1694032567}",english,"Cookie Masterson's first outing as host. A bunch of classic movie trivia for movie nerds, it's one of the tougher ones, but it's a good game. You can't go wrong with YDKJ Movies.",1574815243,1574815243,True,2,0,0.532564640045166016,0,False,False,False,False,,,
55425403,"{'steamid': '76561198875567731', 'num_games_owned': 0, 'num_reviews': 145, 'playtime_forever': 5, 'playtime_last_two_weeks': 0, 'playtime_at_review': 5, 'last_played': 1568327125}",english,"I made the mistake of buying this game and playing it.

I don't want to talk about it any more than that.

Please listen to my warning and save yourself, do not buy any of these Jack games.",1570110736,1570110736,False,0,0,0.275129795074462891,0,False,False,False,False,,,
55117145,"{'steamid': '76561198009687811', 'num_games_owned': 727, 'num_reviews': 68, 'playtime_forever': 9, 'playtime_last_two_weeks': 0, 'playtime_at_review': 9, 'last_played': 1568517237}",english,"Old, awful looking, annoying, can't use phones, MAX 3 players? Pass.",1568517839,1568517839,False,1,3,0.389485746622085571,0,False,False,False,False,,,
54666250,"{'steamid': '76561198094803808', 'num_games_owned': 4070, 'num_reviews': 5378, 'playtime_forever': 10, 'playtime_last_two_weeks': 0, 'playtime_at_review': 10, 'last_played': 1566057460}",english,"-cant use your phones
-shit port
-didnt age well
got as part of the humble bundle, the jack box party games are WAY more fun",1566057490,1566057490,False,5,1,0.261443227529525757,0,False,False,False,False,,,
