recommendationid,author,language,review,timestamp_created,timestamp_updated,voted_up,votes_up,votes_funny,weighted_vote_score,comment_count,steam_purchase,received_for_free,written_during_early_access,hidden_in_steam_china,steam_china_location,timestamp_dev_responded,developer_response
23715707,"{'steamid': '76561197970739339', 'num_games_owned': 676, 'num_reviews': 564, 'playtime_forever': 213, 'playtime_last_two_weeks': 0, 'playtime_at_review': 213, 'last_played': 1466634319}",english,"I picked up this game at a considerable discount, thanks to the developer's decision to ""celebrate"" the release of Mighty No. 9. I played the original version of this game some years ago, but didn't get around to playing this version until today.

At the end of my run as ARES, I was ready to give Extinction Agenda EX a thumbs down, and maybe I still should: It's one of the jankiest run-and-gun games I have ever played. Asthetically, it's fine: The music is excellent and the sprite work fairly appealing. Aiming and shooting is just fine thanks to the mouse, but the jumping controls are uniquely unresponsive and occasionally just fail to work at all. ARES' air dash move is especially difficult to use properly. I must have wasted an hour of the two hours it took to finish the game just falling into pits. It's also rather difficult to avoid damage, and if not for the in-built repair ability, I probably would not have gotten anywhere. I imagine I had a similar experience playing the first version of this game, but that was back in 2011 so I don't remember for sure. Nostalgia makes every game seem better I guess, because I gave that game a positive review just yesterday. But playing it again was not nearly as fun.

Then, I played Tarus, the new playable character to this version of the game. And let me tell you, playing Tarus is like playing a different game entirely, and a better one at that. ARES' unwieldy air-dash is replaced with a much simpler to use mid-air hover move, which allows you to fly around for a short duration. At least once jump segment that gave me no end of trouble with ARES can be bypassed using Tarus entirely: Though Tarus' cutscenes differ from ARES, the levels do not. His ""limit break""-type move, instead of a smart bomb like ARES, is a invulnerability shield. His weapons, while shorter-ranged and slower then ARES', do considerably more damage. All this meant that my run as Tarus took about half the time, give or take a few minutes. I've never seen a disparity between two characters in the same game this huge before. If you get this game, get it on sale like I did, and don't even bother playing as ARES- Tarus is your bot.",1466636071,1466636071,True,7,0,0.569275856018066406,1,True,False,False,False,,,
23707742,"{'steamid': '76561197985777126', 'num_games_owned': 637, 'num_reviews': 14, 'playtime_forever': 7, 'playtime_last_two_weeks': 0, 'playtime_at_review': 7, 'last_played': 1466608928}",english,"Character takes too long to respond to inputs.  For a game of this sort, this kind of input lag is absolutely fatal.  Do not reccommend, getting refund.",1466609037,1466609037,False,2,0,0.488580614328384399,0,True,False,False,False,,,
23703357,"{'steamid': '76561198105083312', 'num_games_owned': 0, 'num_reviews': 10, 'playtime_forever': 57, 'playtime_last_two_weeks': 0, 'playtime_at_review': 57, 'last_played': 1466592016}",thai,"เนื่องจากได้ยินกิตติศัพท์ของเกมส์นี้มานานมาก...ว่าสนุก ผมรอจังหวะดีๆ ลด 77% เหลือ 50 บาท เลยสอยทันที ครั้งแรกที่ลองเล่น

*** มันสนุกมาก สนุกกว่า Rockman ที่ผมเคยเล่นซะอีก*** คือ เกมส์นี้เหมาะกับใช้คีย์บอร์ดกับเม้าส์ในการเล่นมากกว่า ใช้จอย เพราะสามารถบังคับยิงได้ทุกทิศทางเลย และความแม่นยำสูงมาก รวมถึงการหลบลีกโดยการแดชก็ทำได้ค่อนข้างดี

ด้านบวก
1.การยิงทำได้ 180 องศา และความแม่นยำสูงมาก ถ้าใช้เม้าส์และคีย์บอร์ดดีๆ ลืม Rockman ไปได้เลย
2.ปืน มีความหลากหลายน้อยไปหน่อย แต่ได้การอัพเกรด มาแทน
3.มีการอัพเกรดเกราะและความสามารถช่วยเหลือ ที่ต้องไปเก็บกับบอสหรือตามส่วนลับต่างๆ  
4.ภาค EX สามารถอัพภาพได้ 1080p ขนาดจอ Full Screen 1980x1080 ของผมไม่มีปัญหา เต็มจอสวยงาม

ด้านลบ
1.เป็นเกมส์คนไทยทำ ประสบการณ์ Disign ตัวละครและศัตรูไม่สวย (บอสนี่รูปร่างค่อนข้างแย่เลย) ตัวละครอาจซ้ำซากไปหน่อย ฉากค่อนข้างมีแต่ในที่มืด ไม่ค่อยหลากหลาย
2.ถึงเป็นเกมส์ที่เหมาะกับใช้เม้าส์และคีย์บอร์ด แต่บางฉากเช่นกระโดดเยอะๆ  กลับเหมาะที่จะใช้จอยมากกว่า และเปลี่ยนการบังคับทันทีไม่ได้ต้องกดเข้า Option 
3.เสียงเพลงมันส์ก็จริงแต่ค่อนข้างซ้ำซาก 
4.การโจมตีของบอสหลบค่อนข้างยาก และเจ็บหนัก


ผมให้ 7.5 เต็ม 10 คะแนนแล้วกันครับ",1466592766,1466592766,True,3,0,0.523809552192687988,0,True,False,False,False,,,
23700532,"{'steamid': '76561198182194298', 'num_games_owned': 0, 'num_reviews': 12, 'playtime_forever': 273, 'playtime_last_two_weeks': 0, 'playtime_at_review': 273, 'last_played': 1466575382}",thai,Better than Mighty No. 9,1466578863,1466578863,True,4,3,0.541960239410400391,0,True,False,False,False,,,
23699103,"{'steamid': '76561198014639482', 'num_games_owned': 254, 'num_reviews': 10, 'playtime_forever': 1497, 'playtime_last_two_weeks': 0, 'playtime_at_review': 727, 'last_played': 1664652138}",english,"Having played through the first ARES, this does seem a bit superfluous, but I'll accept it, as it has some new content.

+ Two new levels
+ A new playable character and story
+ Slight improvements to original
+ As usual, rockin' soundtrack
- If you're using a keyboard like the plebe I am, it may be difficult.
 
+ Not a disappointment like Mighty No. 9.",1466571001,1466571001,True,18,2,0.63771897554397583,1,True,False,False,False,,,
23691835,"{'steamid': '76561198010021791', 'num_games_owned': 123, 'num_reviews': 6, 'playtime_forever': 377, 'playtime_last_two_weeks': 0, 'playtime_at_review': 301, 'last_played': 1501133902}",english,"Yes, it's better than Mighty No. 9.",1466538748,1466538748,True,52,42,0.601344168186187744,1,False,False,False,False,,,
23012646,"{'steamid': '76561198042668112', 'num_games_owned': 0, 'num_reviews': 4, 'playtime_forever': 544, 'playtime_last_two_weeks': 0, 'playtime_at_review': 450, 'last_played': 1609796815}",english,"Extinction Agenda EX a fun game that doesn't take too long to play. It feels a lot more fleshed out than the original, and they've improved a lot of mechanics. There's some new music and some old music, and although it's a small gripe, I was disappointed to find that they did away with one of my favorite tracks from the original (Stage 5's theme).

I'd definitely recommend the game to platformer fans. The art style is nice, the story is very similar to the original game's, and the music is great.",1463363799,1463363799,True,2,0,0.4648093581199646,0,True,False,False,False,,,
22462525,"{'steamid': '76561198054902790', 'num_games_owned': 864, 'num_reviews': 105, 'playtime_forever': 152, 'playtime_last_two_weeks': 0, 'playtime_at_review': 142, 'last_played': 1412716535}",french,"Cette version EX du jeu A.R.E.S. Extinction Agenda s'avère être un sympathique hommage aux sagas Megaman et Metroid. Cependant quitte à jouer là dessus je pense que le jeu aurait gagné à ne pas être découpé en niveaux mais à proposer un monde ouvert tant les systèmes de notation et d'expérience en fin de niveaux sont sous-exploités. On regrettera la répétitivité du jeu et son bestiaire assez limité néanmoins grâce à un Gameplay accrocheur, des Boss impressionnants et des graphismes tape à l'oeil il peut valoir le coup.

Test complet : http://aquab0n.fr/2014/11/test-a-r-e-s-extinction-agenda-ex.html",1460840824,1460840824,True,0,0,0,0,False,False,False,False,,,
22241359,"{'steamid': '76561198169605976', 'num_games_owned': 0, 'num_reviews': 2, 'playtime_forever': 1637, 'playtime_last_two_weeks': 0, 'playtime_at_review': 1558, 'last_played': 1459795349}",russian,"С удовольствием прошел два раза данную игру поочередно, двумя персонажами. Проходил осмысленно набирая очки и навыки. Нравиться подобный жанр, но было-бы здорово, если в игре было больше разнообразных миссий, противников и ""крутых поворотов"". В целом игра достойна своих денег. Не очень нравиться монотонность в процессе игры. Нравится могущество главных героев: что первого, что второго. Они порадовали своими индивидуальными умениями и оружием. Так-же похвально, что в геймпаде задействованы все кнопки, а управление весьма приятное. Спасибо за игру! Рекомендую положительно!",1459797845,1459797926,True,1,0,0.519999980926513672,0,True,False,False,False,,,
21891823,"{'steamid': '76561198043990017', 'num_games_owned': 1006, 'num_reviews': 236, 'playtime_forever': 746, 'playtime_last_two_weeks': 0, 'playtime_at_review': 698, 'last_played': 1481474536}",russian,"Удивительно, насколько толково разработчики подошли к созданию данного переиздания.
Начнем с того, что оригинальный A.R.E.S. Extinction Agenda просто ужасен. Кривой, скучный, однообразный, со унылым дизайном и не больно-то отзывчивым управлением. 
Обновленное издание - та же, в сути, игра. Те же герой, сюжет, уровни, но...

Изменения в EX-издания таковы, что в них нет ни одного минуса. Вообще. Сами посудите:
+два играбельных персонажа, абилки и пушки которых, вроде бы одинаковые, работают по-разному;
+новая пачка треков с гитарными запилами на фоне для второго чара;
+под возможности героев переработаны и адаптированы старые уровни, а также добавлен один совершенно новый;
+с пунктом выше, кстати, связан небольшой сюжетный твист, плюс на 2 героев - 2 концовки;
+бестиарий тоже чуток пополнился несколькими образцами живой враждебной техники;
+появились сюжетные вставочки, симпатичные, но с простенькой анимацией (мелочь, а приятно);
+переработана система сбора ресурсов и крафта: во-первых, с игроком летает дроид-магнитик для этого дела; во-вторых, теперь вместо трех видов деталей и вытекающего из этого унылого гринда в оригинале в EX-издании всего один ресурс, а цвета теперь отмечают лишь количество деталек в одном кубике;
+БОЛЬШЕ АПГРЕЙДОВ! Разница в мощи стала реально ощутима;
+гранаты и хилки теперь существенно удобнее в использовании.

Из игры убрали никчемные бонусные костюмы за DLC и ранги, и это, если честно - совсем не обидная потеря. Без них лучше, имхо, ибо толку от них было не очень много. Сама игра стала повеселее, уже не такая скучная и как минимум затягивает на пару-тройку прохождений, хотя бы ради пробы разных героев и погони за новыми ачивами.

После этого масштабного реворка A.R.E.S. стал вполне достойным экшн-платформером, который больше увлекает динамичными схватками и меньше жрет нервы игрока, если сравнить с оригиналом. Такую игру уже не стыдно посоветовать к ознакомлению.",1458244031,1458244119,True,12,1,0.667550623416900635,0,True,False,False,False,,,
21626376,"{'steamid': '76561197999635298', 'num_games_owned': 0, 'num_reviews': 5, 'playtime_forever': 110, 'playtime_last_two_weeks': 0, 'playtime_at_review': 110, 'last_played': 1456525558}",english,"Contols are clucky, Movements are delayed, Just another megaman wannabe without the better platforming.",1457121193,1457121193,False,1,0,0.444164186716079712,0,True,False,False,False,,,
21059390,"{'steamid': '76561198069967807', 'num_games_owned': 0, 'num_reviews': 21, 'playtime_forever': 427, 'playtime_last_two_weeks': 0, 'playtime_at_review': 427, 'last_played': 1454956292}",japanese,"ロックマンことMEGAMAN式のアクションゲーム。
前作との大きな違いはキャラや背景のテクスチャー強化と操作ボタンの変更。
更に使用キャラが“アレス”と“タルス”の2体から選べること。

前回と比べると操作ボタンの配置が改良され、
回復やボム系の技がクールタイム制になりバランス調整がされている。

敵を倒して手に入るポイントも前作の3種類から1種類に減り、
サポートロボ(前作所持の場合)が回収するのでポイント集めだけなら今作の方がやり易いが、
前作と違いステージ各所に配置されている強化チップで
ステータス強化がアンロックするので1度クリアしたステージを
再度選択して強化チップの捜索とポイントも貯める必要がある。
ステージが追加され一撃死や落下死する場所があり
結局、難易度は前作よりも上がっている。

バランス調整をもう少しちゃんとしてほしかったのと
人間キャラなどが微妙にアメコミチックになったのが残念。
エンディングの内容も微妙に変えたりしているが
前作を持っているなら買わなくても良い。欲しいならセールで買いましょう。

唯一、良い点と言えるのがこのゲームsteamカードが良い値段で売れる事。",1454959592,1454959828,True,0,0,0,0,True,False,False,False,,,
20287890,"{'steamid': '76561197977179030', 'num_games_owned': 1374, 'num_reviews': 13, 'playtime_forever': 535, 'playtime_last_two_weeks': 0, 'playtime_at_review': 535, 'last_played': 1431270143}",italian,"Questa nuova versione di Ares non si tratta del banale “More of the same” che spesso mi è capitato di giocare in questi anni.

[b]FATTORE DIVERTIMENTO:[/b]
ARES EX riesce ancora a divertire per diverse ore. Come lo fa? Gli sviluppatori hanno preso tutto quello che era già venuto bene nella prima versione di Ares e lo hanno migliorato, introducendo nello stesso tempo anche alcune novità molto interessanti. 
Tutti i livelli sono stati revisionati ed ampliati introducendo nuove meccaniche e nuovi nemici. Viene reso utilizzabile Tarus, visto di sfuggita nel primo Ares, che amplia la storia e chiarisce alcuni retroscena. IL sistema di controllo del personaggio è stato rivisto e migliorato ed è stata introdotta una semplice componente GDR per gestire la crescita dei due personaggi disponibili in questa versione.

[b]MECCANICHE DI GIOCO:[/b]
In Ares EX alcune meccaniche di gioco sono state rivoluzionate e migliorate.
Ora non ci sono più 3 tipi di risorse riciclabili, ma una sola risorsa adatta per ogni potenziamento. 
Questo rende più semplice e rapido il potenziamento delle armi, delle abilità e dell’armatura.
Anche il sistema di controllo è stato ampiamente modificato, permettendo finalmente la completa personalizzazione dei pulsanti ed è possibile attribuire un tasto allo scatto! Anzi ai due scatti disponibili: uno verso l’alto e uno in avanti, combinali tra di loro dopo aver trovato i chip di potenziamento, per poter raggiungere punti prima fuori dalla nostra portata e trovare così altri chip di potenziamento o datacube con i dati dei vari nemici.


Per l'analisi critica completa, vi riporto il [url=https://www.youtube.com/watch?v=FWtG5bpNA7E]LINK[/url] al mio canale su YouTube ""Elviento Videogames Channel"" :)",1451907042,1451907042,True,0,0,0,0,True,False,False,False,,,
20052331,"{'steamid': '76561198058818423', 'num_games_owned': 0, 'num_reviews': 20, 'playtime_forever': 76, 'playtime_last_two_weeks': 0, 'playtime_at_review': 76, 'last_played': 1451349883}",english,"A lot of care and hard work was put into this game, and it shows. A quality game that feels a bit like Mega Man X, seems like it never quite reaches its full potential. I actually enjoy this game, even though I ragequit twice now because the platforming is really poorly done in certain areas.",1451350965,1451350965,True,1,0,0.506398499011993408,0,True,False,False,False,,,
19810269,"{'steamid': '76561198036677888', 'num_games_owned': 413, 'num_reviews': 40, 'playtime_forever': 252, 'playtime_last_two_weeks': 0, 'playtime_at_review': 198, 'last_played': 1642406668}",english,I can't belive Kira Yamato is a fucking anime.,1450640366,1450640366,True,0,1,0,0,True,False,False,False,,,
19259187,"{'steamid': '76561198041024763', 'num_games_owned': 0, 'num_reviews': 8, 'playtime_forever': 291, 'playtime_last_two_weeks': 0, 'playtime_at_review': 291, 'last_played': 1414637186}",english,Where can I get the soundtrack?!,1448415035,1448415035,True,0,0,0,0,True,False,False,False,,,
19172686,"{'steamid': '76561198096678637', 'num_games_owned': 489, 'num_reviews': 63, 'playtime_forever': 20, 'playtime_last_two_weeks': 0, 'playtime_at_review': 12, 'last_played': 1492978748}",portuguese,"O game inteiro é bom, dando força aos jogos 2D, lembra  
muito o megaman, achei o game um pouco repetitivo, e 
curto. mas é um jogo bom, não me arrempendi.",1448021621,1448021621,True,0,0,0,0,True,False,False,False,,,
18839700,"{'steamid': '76561198024225365', 'num_games_owned': 0, 'num_reviews': 8, 'playtime_forever': 403, 'playtime_last_two_weeks': 0, 'playtime_at_review': 333, 'last_played': 1518115944}",english,Good stuff!,1446479565,1446479565,True,0,0,0,0,True,False,False,False,,,
17397427,"{'steamid': '76561198155230110', 'num_games_owned': 743, 'num_reviews': 134, 'playtime_forever': 333, 'playtime_last_two_weeks': 0, 'playtime_at_review': 333, 'last_played': 1438704555}",french,"Un très bon jeu d'action/plateforme, parfumé au Megaman enrichi et avec un petit arrière goût de Super Metroid. Seul point négatif : la durée de vie assez courte (comptez entre 3 et 4 heures pour en venir à bout), même si la collectionnite la rallonge un peu. Attention toutefois si vous êtes mauvais dans ce genre de jeu : ce titre est assez dur.",1438772316,1438772316,True,4,0,0.578382551670074463,0,True,False,False,False,,,
16931619,"{'steamid': '76561198074849428', 'num_games_owned': 453, 'num_reviews': 214, 'playtime_forever': 193, 'playtime_last_two_weeks': 0, 'playtime_at_review': 193, 'last_played': 1434218243}",english,"Artstyle and story both fall in the ""functioning but forgettable"" category.
Gameplay is clunky and semi responsive.",1436298707,1704410269,False,0,0,0,0,True,False,False,False,,,
16903051,"{'steamid': '76561197972300211', 'num_games_owned': 412, 'num_reviews': 29, 'playtime_forever': 68, 'playtime_last_two_weeks': 0, 'playtime_at_review': 68, 'last_played': 1436144203}",english,"Casual difficulty eases things with enemy damage and what not, but that doesn't help the fact that it's a platforming NIGHTMARE. Definitely NOT the game I could relax too.",1436144310,1436144310,False,3,0,0.407467961311340332,0,True,False,False,False,,,
16833651,"{'steamid': '76561198028287945', 'num_games_owned': 0, 'num_reviews': 7, 'playtime_forever': 531, 'playtime_last_two_weeks': 0, 'playtime_at_review': 230, 'last_played': 1587828789}",english,"It's pretty clear the designers had the idea in mind to create a game like the old Mega Man X carts on super nes; with the bar set high for player skill and pattern learning. Only problem is, is that those old Mega Man X games had PRECISE controls and excellently laid out level designs. This game has neither. I want to recommend it, I really really do, but I just can't. The game plays like a flash game with upgraded graphics, nothing more.",1435786366,1435786366,False,6,0,0.46557125449180603,1,True,False,False,False,,,
16811372,"{'steamid': '76561198035369691', 'num_games_owned': 793, 'num_reviews': 13, 'playtime_forever': 155, 'playtime_last_two_weeks': 0, 'playtime_at_review': 155, 'last_played': 1435582600}",french,"Bien meilleurs que la première version A.R.E.S. Extinction Agenda EX corrige les défauts de la version précédente et nous offre un contenu plus important. Les musiques sont toujours aussi bonnes, les graphismes ainsi que l'ergonomie des menus ont été retravaillés. On regrettera néanmoins la faible durée de vie du jeu (environ 2-3h pour faire la campagne avec un personnage). Mais au prix proposé ce nouveau A.R.E.S. mérite sa place dans votre bibliothèque.",1435681744,1435681744,True,3,0,0.565217375755310059,0,True,False,False,False,,,
16354143,"{'steamid': '76561198031297560', 'num_games_owned': 0, 'num_reviews': 36, 'playtime_forever': 286, 'playtime_last_two_weeks': 0, 'playtime_at_review': 164, 'last_played': 1470492517}",thai,"ขอแบ่งการเล่นเป็น 2 แบบ
แบบที่ 1 controller 
- การควบคุมตัวละคร จะควบคุมได้ดั่งใจมาก
- การโจมตีถ้าใช้ก้านยิงจะยิงได้รอบทิศ แต่คุมทิศไม่ได้ดั่งใจ
แบบที่ 2 Mouse + Keyboard
- การควบคุมตัวละคร จะควบคุมไม่ได้ดั่งใจเลยออกแนวยากด้วยซ้ำไป
- การโจมตีใช้งานด้วย Mouse ง่ายมากยิงแม่นมาก

ถ้าใครชอบเล่นแนว Megaman น่าจะเข้าถึงได้ง่าย",1434194660,1434194660,True,0,0,0,0,True,False,False,False,,,
16318696,"{'steamid': '76561198027435960', 'num_games_owned': 0, 'num_reviews': 44, 'playtime_forever': 95, 'playtime_last_two_weeks': 0, 'playtime_at_review': 95, 'last_played': 1434073716}",english,A platformer that you can't rely on the jump button for.,1434074126,1445661306,False,3,0,0.445924878120422363,0,True,False,False,False,,,
15305270,"{'steamid': '76561198066480033', 'num_games_owned': 2258, 'num_reviews': 25, 'playtime_forever': 909, 'playtime_last_two_weeks': 0, 'playtime_at_review': 291, 'last_played': 1441894313}",schinese,"hard,but good ,and card can get your money back",1428754929,1428754929,True,8,4,0.599598586559295654,0,True,False,False,False,,,
15236477,"{'steamid': '76561198028104398', 'num_games_owned': 0, 'num_reviews': 9, 'playtime_forever': 75, 'playtime_last_two_weeks': 0, 'playtime_at_review': 75, 'last_played': 1428331831}",polish," the original A.R.E.S. is OK ,this version have stupid upgrade mechanics,resources....I collected 500 resources and I die in boss fight,after load checkpoint I have 400... ?",1428333018,1428333018,False,0,0,0,0,True,False,False,False,,,
