recommendationid,author,language,review,timestamp_created,timestamp_updated,voted_up,votes_up,votes_funny,weighted_vote_score,comment_count,steam_purchase,received_for_free,written_during_early_access,hidden_in_steam_china,steam_china_location,timestamp_dev_responded,developer_response
153377617,"{'steamid': '76561198135473387', 'num_games_owned': 884, 'num_reviews': 139, 'playtime_forever': 20, 'playtime_last_two_weeks': 0, 'playtime_at_review': 20, 'last_played': 1702305826}",english,"Game seems bugged. My cursor lags when I first tried to investigate. It can't be my laptop specs.

Processor	12th Gen Intel(R) Core(TM) i7-12700H   2.30 GHz
Installed RAM	16.0 GB (15.7 GB usable)",1702305878,1702305878,False,0,0,0,0,True,False,False,True,,,
36199528,"{'steamid': '76561198298028654', 'num_games_owned': 0, 'num_reviews': 23, 'playtime_forever': 281, 'playtime_last_two_weeks': 0, 'playtime_at_review': 148, 'last_played': 1509558717}",russian,"Я не могу сказать, что это самая гениальная игра, или даже самая гениальная визуальная новела из тех, с которыми мне приходилось сталкиваться... но все же она чем-то цепляет. Есть в этой истории что-то настоящее. Какая-то  пронзительность, которая  даже не смотря на все огрехи заставляет тебя продолжать в нее погружаться. 
Короче: в этой игре есть ДУША))

Если  говорить более сухо и конкретно:
+Атмосфера. Сочетание классического нуарного детектива и космической фантастики - непростая задача, однако разработчики справились с ней мастерски. Ощущение манящей и чем-то пугающей загадки не теряется до самого конца. 
+Мир. /чем-то определенно напомнил мне ""Конец Детства"" Артура Кларка/ Неординарный и достоверный одновременно. Тех же повстанцев несколько организаций только в кадре, они различаются по методам и целям, и активно грызутся друг с другом. Опять же сама ""борьба за свободу человечества"" не выставляется единственно осмысленным вариантом. 
+Персонажи. По настоящему сложные и многогранные - даже если при первой встрече кажутся плоскими и одномерными. Собственно, все как в жизни) Подчеркиваю: ""сложные и многогранные"" значит ""сложные и многогранные"" а не ""все - редкие уроды"")) Особенно удались коллеги ГГ - но даже эпизодические персонажи имеют интересные черты и заставляют в себя верить. 
+Механика допроса. Заставляет верить в то, что ты правда ведешь допрос. Расколоть подозреваемого ""методом тыка"" не выйдет (да, я пробовал), игра заставляет думать, вспоминать все факты, перебирать улики... короче, процесс трудный, но когда удается докопаться до правды - испытываешь настоящее блаженство) 

-Непонятная муть с сохранениями. Во время допроса сохранятся вообще нельзя...что очень сильно раздражает, ибо это единственный момент когда можно ""проиграть"", так что в первый раз  Автосохранение какое-то очень неясное, как оно работает - я так и не разобрался. 
-отсутствие кнопки fast-forward. Четверть часа прокручивать игру, иступлено щелкая по клавише Enter... хм, в сочетании с предыдущим пунктом это вводит в состоянии неконтролируемого бешенства)
-Некоторые сюжетные ходы достаточно шаблонны и предсказуемы
[spoiler]  Когда Blue признается ГГ в любви, и она не успевает ему ответить - сразу возникает непритное ощущение, что его в ближайшее время ждет ТРАГИЧЕСКАЯ ГИБЕЛЬ. Так и происходит [/spoiler]
 
Короче: 
В: Что перевещивает, плюсы или минусы? 
О: Безусловно, плюсы
В: Играть или не играть?
О: Безусловно, играть)",1509563204,1509563204,True,2,0,0.544558346271514893,0,True,False,False,False,,,
29215629,"{'steamid': '76561198299718188', 'num_games_owned': 0, 'num_reviews': 32, 'playtime_forever': 96, 'playtime_last_two_weeks': 0, 'playtime_at_review': 96, 'last_played': 1484337245}",english,"Selenon Rising is a horrible visual novel.

Just horrible.

Even if it's free don't do this to yourself. DON'T BUY THIS!
It's a broken mish mash of games and none of them are done right. The writing is the universal fail of this little incoherent incomplete mess.

Selenon Rising's story is just bad. It's directionless and incoherent. The characters are so poorly written it's impossible to get invested. The lazy weird art doesn't match whats being said. I'm talking characters and backgrounds... All suck.

Selenon Rising is a visual novel with bad art and bad writing.

Instant fail.",1484274803,1484274803,False,9,0,0.371946960687637329,0,True,False,False,False,,,
28336428,"{'steamid': '76561198005539606', 'num_games_owned': 0, 'num_reviews': 297, 'playtime_forever': 123, 'playtime_last_two_weeks': 0, 'playtime_at_review': 123, 'last_played': 1481594164}",english,"Finished the first episode. IT wasn't... *bad*, but it didn't have anything to it that made it stand out as *good*. 

* Interrogation mechanics cribbed from Ace Attorney and Danganronpa, but not as entertaining as either. 
* Interesting setting that you don't get to explore or learn much about. 
* Plot that changes gears from a crime procedural to a spy drama to some kind of shonen-y thing without warning. 
* All artwork that isn't character portraits seems underdeveloped. 

I guess I just wasn't hooked.",1481594460,1481594460,False,12,0,0.630719959735870361,1,True,False,False,False,,,
24447630,"{'steamid': '76561198263186470', 'num_games_owned': 0, 'num_reviews': 8, 'playtime_forever': 323, 'playtime_last_two_weeks': 0, 'playtime_at_review': 323, 'last_played': 1469129925}",english,"This is an interesting and unique visual novels that has its moments and faults.  

Things I liked:
- Interesting characters both main and supporting. Invested in Violet's story.
- Art style
- Story
- The investigations
- Many potential story seeds planted in this episode, hope they will bloom in the coming episodes
- The story continues in episode 2, can't wait for it.

Things I wished I could zap into oblivion with someone's psychic powers:
- Feels like I'm powerless in controlling Violet's choices
- Backgound music
- The world lacks depth as the supporting characters are not given time or space for their stories to be told
- Too few investigations
- Ending is abrupt. Does not feel like a clifhanger. Feels like a sudden stop when you expect to feel solid ground beneath your next step but instead find yourself free falling and painfully experiencing and abrupt splat! 

I enjoyed playing it once. Felt annoyed at its shortcomings. Will not replay episode 1 but am waiting for the release of episode 2 as I look forward to the continuation of the story.",1469131849,1469131849,True,3,0,0.53750145435333252,0,True,False,False,False,,,
24429447,"{'steamid': '76561197980034084', 'num_games_owned': 191, 'num_reviews': 1, 'playtime_forever': 1219, 'playtime_last_two_weeks': 0, 'playtime_at_review': 352, 'last_played': 1502055644}",english,"Oh. My. Word.

I both had fun playing this and got my heart ripped out toward the end. I can't wait to see where this goes, because I'm invested in Violet's story.",1469039974,1469039974,True,2,0,0.471363723278045654,0,True,False,False,False,,,
24326493,"{'steamid': '76561198013683638', 'num_games_owned': 662, 'num_reviews': 63, 'playtime_forever': 235, 'playtime_last_two_weeks': 0, 'playtime_at_review': 235, 'last_played': 1468407723}",english,"I absolutely love the setting of this game! The world is unique, detailed, and very intriguing. There is so much backstory and lore that really makes the world come to life, and only a bit of it has been seen yet. The characters are likable, the choices can change the alignment of your character. The plot is really good, and it’s a nice price for the content. I can’t wait for the next episode!",1468550762,1468550762,True,3,0,0.527857005596160889,0,True,False,False,False,,,
23879200,"{'steamid': '76561198028024953', 'num_games_owned': 0, 'num_reviews': 7, 'playtime_forever': 310, 'playtime_last_two_weeks': 0, 'playtime_at_review': 308, 'last_played': 1505848076}",english,I really like the story of this VN. I always have been a sucker for noire style games and that game mixes it with sci-fi. What's not to love,1467076477,1467076477,True,4,0,0.509599149227142334,0,True,False,False,False,,,
23576618,"{'steamid': '76561198074672646', 'num_games_owned': 6653, 'num_reviews': 596, 'playtime_forever': 303, 'playtime_last_two_weeks': 0, 'playtime_at_review': 303, 'last_played': 1464257287}",french,"[h1]Selenon Rising est une aventure interactive de science fiction[/h1]

Avant tout, il faut savoir que l’histoire est découpée en différents épisodes.

Des extra-terrestres ont attaqué la Terre. Ils ont fait un massacre et ils ont gagné. La Terre est désormais dirigée par un gouvernement centralisé rendant compte aux extra-terrestres installés sur la Lune.

Il existe une police spéciale dotée de pouvoirs psychiques (des mutants !) et vous jouez Violette, une de ces policières travaillant pour le gouvernement de collaborateurs. Violette a le pouvoir de lire les émotions chez un individu.

Vous menez une enquête !

Selenon Rising n’est pas un livre interactif, même s’il ressemble énormément. Avec ses mini-jeux (et oui, il y a des mini-jeux), Selenon Rising se positionne comme jeu d’aventure avec de gros éléments interactifs... ce qui est la caractéristique des jeux d’aventure, n’est-ce pas !

http://steamcommunity.com/sharedfiles/filedetails/?id=695713227

[url=www.graal.fr/2016/05/27/test-selenon-rising-la-version-pour-steam/]Pour découvrir une description plus complète du jeu et quelques prises écran de Selenon Rising, allez sur mon site.[/url]",1466025823,1466025823,True,1,0,0.523809552192687988,0,False,False,False,False,,,
23161968,"{'steamid': '76561198101799498', 'num_games_owned': 0, 'num_reviews': 15, 'playtime_forever': 347, 'playtime_last_two_weeks': 0, 'playtime_at_review': 205, 'last_played': 1501686763}",english,"Has great potential but the lack of choosing your own path and choses such as not being able to side with the selenon or being forced into a romance with blue was beyond infuriating i screamed when you couldnt agree with the dark one, but it has an interesting premise i just hope the devs address the romance and pathway chooses, such as having a chose to shoot or at least arrest Zarla.",1464037181,1464037813,True,1,0,0.47288668155670166,2,True,False,False,False,,,
23077315,"{'steamid': '76561198201467087', 'num_games_owned': 123, 'num_reviews': 34, 'playtime_forever': 704, 'playtime_last_two_weeks': 0, 'playtime_at_review': 241, 'last_played': 1536476095}",english,"I like the atmosphere because the music fits perfectly for the sci-fi theme. The game is episodic, so you will have to buy the other three to continue the story. This review is based on Episode 1.  The characters are intriguing and their personalities as well. The gameplay is similar to Ace of Attorney where you have to determine whether the person is telling the truth by presenting the evidence. There is a minor problem like the text not fitting into the box. It doesn’t happen often, but hopefully it can be fixed.",1463642905,1463642905,True,12,1,0.676936447620391846,0,False,False,False,False,,,
23023415,"{'steamid': '76561198065130303', 'num_games_owned': 2008, 'num_reviews': 62, 'playtime_forever': 1128, 'playtime_last_two_weeks': 0, 'playtime_at_review': 728, 'last_played': 1553784496}",russian,"Интересный сюжет, который написан красиво, стандартный VN-""геймплей"" разбавленный миниигрой с допросом, осмотром места преступления.. в дополнение ко всему - шикарный саундтрек.
Единственный минус, выборы возможно влияют не так сильно на повествование,
[spoiler]например мне не хотелось ехать к Голубому в гости, но игра не оставила мне выбора, казалось бы дав целых три опции.[/spoiler]
 Возможно я ошибаюсь, посмотрим что будет дальше...Пока-что всеми пальцами за!
",1463417647,1463417647,True,0,0,0,0,True,False,False,False,,,
22946796,"{'steamid': '76561198035256041', 'num_games_owned': 553, 'num_reviews': 8, 'playtime_forever': 200, 'playtime_last_two_weeks': 0, 'playtime_at_review': 200, 'last_played': 1463102626}",english,"[b]NOTE: This is my review for the first episode. I will add and change (maybe) my rating as the episodes release. There's also a demo available on the game's website.[/b]

Selnon Rising is a sci-fi noire visual novel by the same people who made Icebound. While this game is episodic, the first episode has shown a lot of promise and I was able to get 3 hours worth out of the first episode. You play as Violet, an esper who's special power is being able to read people's emotions. She is out to work on a new case with her partner, Blue. After completing what may be a simple murder case turns out to be much more and starts Violet on her journey to her decision on how to save humanity.

In the game, you are met with a couple of investigation scenes and interigation scenes. During the ladder, it's much like L.A. Noire with its system of presenting evidence and doubting someone based on their testimony with their emotions when you can't present something. Out of these parts, you can pretty much expect the usual with visual novels and choices. Similar to Mass Effect's renegade and paragon system, you will be forced to pick choices that will make you allign either towards blue (Law), red (chaos), or stay netural. I only did one playthrough and stayed relatively netural, so I'm not sure what changes there are between the three allignments.

For the first episode, I found myself really lost in the world. There are so many questions you find yourself asking and thankfully albeit slowly, the game does give you some answers. There are a few surprises, one even made me scream at my computer. GG writer, gg.  For the price, think of it as a Telltale game. There will be 4 episodes and while I'm not sure about the price, it'll likely be around the same price for a TTG game, If you like a sci-fi detective visual novel, then you can't go wrong Selenon Rising.",1463104908,1463105326,True,4,1,0.535638272762298584,0,True,False,False,False,,,
22836653,"{'steamid': '76561197994565624', 'num_games_owned': 0, 'num_reviews': 72, 'playtime_forever': 346, 'playtime_last_two_weeks': 0, 'playtime_at_review': 340, 'last_played': 1499735563}",english,"Selenon Rising leaves me with a feeling of ""nearly there.""  The characters are interesting, engaging, and easy to identify with.  The character art is suitably attractive and expressive.  The music is atmospheric and follows the action well.  The setting and story are both very intriguing.  The interview mechanic was challenging and fun: the ""correct"" solution was not always obvious, but always made sense in hindsight.
Selenon Rising has a lot going for it, but stumbles in places as well.  Some of the transitions are a little awkward, some of the scenarios not adequately set up.  This was mostly an issue early on, and the payoff for sticking with the game is pretty good.
The price seems right so far, maybe a little steep for the amount of content in episode 1.  Value for money will depend a lot on whether subsequent episodes will be released free, at a reduced price, or at the same price.  A demo, perhaps including the early Grange scenario, could encourage interest since it is difficult to communicate what the game is really about without one.",1462587985,1462588206,True,3,0,0.51350092887878418,1,True,False,False,False,,,
22828639,"{'steamid': '76561198010388375', 'num_games_owned': 2292, 'num_reviews': 74, 'playtime_forever': 227, 'playtime_last_two_weeks': 0, 'playtime_at_review': 227, 'last_played': 1462048297}",english,"[url=http://www.the-backlog.net/selenon-rising-episode-1-review/]My full review of Episode 1 can be found on The Backlog.[/url]

Selenon Rising is a scifi + noir visual novel in which you will follow Violet, an esper who has the power to read the thoughts of people. In Episode 1, you will dive into life with her, and you will quickly start to question who your true allies are. Alongside the ""regular"" visual novelness of this game, you will also need to perform investigations. This will start with you looking through an area to find clues, and then you will end up using your powers to try and get the truth about something out of someone. This happens twice within Episode 1, and both times will really make you think about what it is you need to choose for a situation.

I overall enjoyed my time with Selenon Rising, and I only really found one issue while I was playing it. During some text boxes, there will end up being far too much text for the size of the box, causing it to go out of that box. Other than that, the art and sounds are absolutely fantastic, and I really enjoyed how much the investigation parts made me have to think out what I was doing.

Disclaimer: I was provided a key by the publisher for review purposes.",1462550261,1462550261,True,6,0,0.536623775959014893,0,False,True,False,False,,,
22815475,"{'steamid': '76561198120348301', 'num_games_owned': 1313, 'num_reviews': 433, 'playtime_forever': 405, 'playtime_last_two_weeks': 0, 'playtime_at_review': 221, 'last_played': 1501717407}",english,"Interesting VN! I liked the first episode so far. The art style was good, BGs were decent, BGM was really nice. Also, the “action” during certain scenes was awesome. 

The gameplay of this game is like a mixture between Ace Attorney/Danganronpa, where you need to check if people are telling the truth or lying, and even present them a certain proof that contradicts their argument. There’s also choices (like any other non kinetic VN). 

I just found the introduction of characters really similar to Danganronpa. if you’ve played DR games, you’ll notice that when you play Selenon Rising. Overall, I recommend this VN, and I’m looking forward to play the next episodes.

7/10.",1462475524,1462475524,True,23,1,0.732326269149780273,0,True,False,False,False,,,
22787518,"{'steamid': '76561198041503910', 'num_games_owned': 219, 'num_reviews': 13, 'playtime_forever': 671, 'playtime_last_two_weeks': 0, 'playtime_at_review': 118, 'last_played': 1499694966}",english,"Let me start by saying that I beta-tested this game, so there may have been some edits or changes I wasn't aware of when it was released.

As far as the game is concerned though - I love it!

Visual novels have to grip me from the very beginning in order to get me invested in the story, and Selenon Rising is packed full of interesting characters, mysteries to solve, and investigation sequences that kept me playing from start to finish.

For Episode 1, you can expect a solid 2 hours of gameplay. More episodes will be released for the series, which is great because the ending + cliffhanger left me wanting more!

Reasons to buy this game:

-Short and to the point
-Investigation Sequences are great
-Characters have personality and charm
-Lovely movie/comicbook-style artwork

Selenon Rising is a new favorite that I'll definitely be keeping tabs on.",1462328487,1462328487,True,10,0,0.610390365123748779,0,False,True,False,False,,,
22771457,"{'steamid': '76561197996890045', 'num_games_owned': 3060, 'num_reviews': 293, 'playtime_forever': 66, 'playtime_last_two_weeks': 0, 'playtime_at_review': 66, 'last_played': 1462244057}",english,"Selenon Rising appears to be a cross between a graphic novel and a ""choose your own adventure"" story.

The concept behind the game is quite interesting. Aliens control the Earth and use human agents (part of an organisation called Spectra) with ESP ailities to control the human population, or else the aliens might get nasty with the humans themselves - so Spectra have the unenviable job of saving humans from themselves.

The concept, artwork, and (some of the) music are quite good.

Not being able to skip the introductory credits is a pain, so make sure you save the game as you go (escape and hit save).

I must admit i couldn't really get into the game. Maybe it was because the scenes took too long with so little happening. Or maybe it was because (I hate to admit) I failed at interviewing a suspect (I didn't find it intuitive at all).

Someone else with a different mindset might better enjoy this game. It seems well-crafted; but, unfortunately, I couldn't really get into it.

I would like to recommend this game because I liked so many elements within it. However, I can't recommend it as I didn't personally enjoy it.
However, since this is the first review of Selenon Rising on Steam, perhaps people should wait for some more positive reviews, as I feel sure that there would be people who would like a game of this nature (but it seems that I'm not one of them), and they may have a take on the game that is completely different to mine.
 
If I see any reviews or other information that make me re-evaluate Selenon Rising, I may give it another try.",1462243009,1462243009,False,16,1,0.522639214992523193,2,True,False,False,False,,,
