recommendationid,author,language,review,timestamp_created,timestamp_updated,voted_up,votes_up,votes_funny,weighted_vote_score,comment_count,steam_purchase,received_for_free,written_during_early_access,hidden_in_steam_china,steam_china_location,timestamp_dev_responded,developer_response
15781878,"{'steamid': '76561198066408623', 'num_games_owned': 0, 'num_reviews': 63, 'playtime_forever': 35, 'playtime_last_two_weeks': 0, 'playtime_at_review': 35, 'last_played': 1429545988}",english,"Great Survival Game, using a diferent but still pretty solid approach to the genre.
Good Multiplayer experience.",1431308290,1431308290,True,3,0,0.459229946136474609,0,False,False,True,False,,,
15759490,"{'steamid': '76561198094878517', 'num_games_owned': 0, 'num_reviews': 6, 'playtime_forever': 351, 'playtime_last_two_weeks': 0, 'playtime_at_review': 85, 'last_played': 1439708319}",english,"[h1]Shrooms is in EARLY ACCESS and it's Alpha Build can be subject to changes![/h1]

[b]This review will be updated with every new patch that Immersive Douro introduces into the Alpha.[/b]

Shrooms looked interesting in the trailer, and I thought that the devs were just playing with a female avatar instead of a male one because they preferred the sexy booteh, but I was wrong. Devs are WORKING on a male avatar... right? D:

Anyway, I had a blast getting lost in the game and being immersed in a words filled with shrooms and where biomes seem to be condensed into one small area. That was confusing and I really did not understand what was happening, but it was fun regardless. Harvesting, crafting and inventory confused me alot, because my mind has been hardwired to using the left and right clicks, the E key, etc. This is rather fresh, but can be infuriating at times. Using an item is very time-consuming and sometimes even infuriating(I'm looking at you, items that don't stack).

While it may seem I dislike the game, surprisingly, I do not. I enjoyed it, despite the limited possibilities I had. If the devs continue to add more into the game and work on it, I'm pretty sure it'll become something more.

If you do not like Early Access games, this might not be the game for you.

[u]So far, I've only discovered a few bugs[/u]:
[list]
[*] That certain Shrooms, such as the Berserker Torso Shroom and Swimmer MainHand(?) Shrooms don't stack, making consuming them difficult.
[*] I run an i7 processor, GTX860M graphics cards, but I've been having issues with the gameplay, namely delays and whatnot. I have no idea if this is just my machine running crudely or if it's the Alpha stages of the gameplay(Everyone else seems to be running fine).
[*] Falling from high ground sometimes does not register fall damage, specially when you end up falling on a slope.
[*] Diving down to the river floor can sometimes cause you to be stuck. The Character treats the river floor as a contact surface and walks around normally, while the oxygen level continues to drop.[/list]

[u]My suggestions are:[/u]
[list]
[*] Add Male Gender to be available (I know you guys are working on that Immersive Douro!)
[*] Maybe Character Customization?
[*] The ability to instantly craft an item when you have all the components instead of tediously clicking on the item to add it into the crafting layout.
[*] Character's interaction with his/her surroundings and environment. I noticed that the character fans herself when in the desert, but she doesn't shiver in the cold. It would also be nice to see the character interact with his/her environment, such as using hands to balance when climbing up a mountain/ steep slope.
[*] A tutorial to explain certain aspects of the game, I was really confused by the Build Item minigame/mechanic.
[*] Retweak the animations to look more natural. Movements are exaggerated, especially both the character and the Panther's attacking animations. Panther seems to continue attacking even if the character is down.
[*] Remove the numbers above the character that indicates increases or decreases, etc. Or at least until it's been worked out properly. Sometimes the numbers are seen flipped, it could potentially confuse the players. And if numbers are added, coding it so that each number appears to their respective players, or else the server will crop up with number everywhere when players enter a full out PvP battle royale.
[*] Add armor/clothing crafting options, as well as maybe the ability to build settlements.
[*] Maybe a few NPCs?[/list]

For a 1hr full of nonsense commentary and word fumbling, looping of sentences; please make yourself acquainted at https://www.youtube.com/watch?v=30GUj5zeSyU",1431192693,1431501089,True,10,0,0.485882729291915894,0,True,False,True,False,,,
15757960,"{'steamid': '76561198009526542', 'num_games_owned': 0, 'num_reviews': 41, 'playtime_forever': 159, 'playtime_last_two_weeks': 0, 'playtime_at_review': 159, 'last_played': 1431331856}",french,"Pour faire simple ce jeu promet beaucoup mais donne peu pour l'instant.

Il coute moins de 15€ certes mais le contenu actuel ne les vaut pas. Pourtant, les devs sont honnêtes et explique que c’est une EARLY EARLY ALPHA. 

Le jeu est sorti hier soir et propose déjà une map sympa, un système de survie et craft de base, suffisant pour poser les bases d'un bon jeu. 

Acheté, testé, approuvé !!!


[h1]I-/ Le gameplay[/h1]

Rapidement explorée, la map présente tout de même 6 biomes différents, et les contours sont délimités par des montagnes (ou murs invisibles dans la mer ^^).
Les ressources à farm sont présentes et les monstres aussi la nuit venue. Un système de craft intuitif et efficace, cependant quand il s’agit de Moder son corps là vient la difficulté.

Le gros intérêt du jeu, réside dans les modifications possibles sur votre corps. Pour résumer, chaque biome à ses ressources que vous pourrez utiliser pour modifier votre corps. Chaque ressource, modifie une partie de votre corps (torse ou jambes…) avec un effet particulier (meilleur à la nage ou au sprint…).
Il faut tout de même prendre attention aux toxines liées à ces modifications afin de ne pas perdre de la vie… ;)

[h1]II-/ Graphismes et ambiance sonore.[/h1]

Franchement, le jeu est en early access, et pourtant il n’est pas moche contrairement à d’autres. L’univers coloré et la bande son vous mettent bien dans l’ambiance. Et lorsque la nuit venue, vous êtes surpris par une panthère affamée, courez loin vers la lumière.
Je vous invite à aller voir mes screens sur mon profil pour plus d’infos^^

[h1]III-/ Les bugs ou autre éléments temporaires gênants.[/h1]

Comme précisé sur la page du jeu, il n’y a à l’heure actuelle pas de possibilités de sauvegarder. Ainsi, tout arrêt d'une partie en cours (serveur distant ou local) vous vaudra de redémarrer entièrement.
Ce n’est pas vraiment un bug, mais prenez garde à votre endurance !!! Si elle tombe à 0 vous ne pouvez plus nager et du coup vous coulez… xD Le bugs réside dans le fait que votre endurance à un comportement bizarre tendant à se vider ou se remplir sans vraiment de raisons parfois.

[h1]IV-/ Et la suite ?[/h1]

Et bien par la suite, les devs vont en premier mettre en place un système de sauvegarde, puis augmenter les crafts et nombres de mutations possibles. Après ils vont voir pour le système de construction puis … je ne suis pas dans les confidences des devs, mais ça sera un bon vieux survie/craft/construct façon science-fiction.

[h1]V-/ Conclusion.[/h1]

Si vous voulez aider ce jeu, alors n’hésitez pas achetez le. 
Si vous vous sentez réticent pour le moment, attendez quelques maj pour gagner en contenu en espérant que le prix n’augmente pas entre temps^^
Enfin, n’ayant pas implémenté de tuto dans le jeu, les devs ont quand même pris le temps de créer un guide en anglais sur leur site disponible ici http://projectshrooms.com/guide/",1431186924,1431187026,True,12,2,0.617455899715423584,6,True,False,True,False,,,
15752111,"{'steamid': '76561198004011377', 'num_games_owned': 0, 'num_reviews': 11, 'playtime_forever': 415, 'playtime_last_two_weeks': 0, 'playtime_at_review': 415, 'last_played': 1431639272}",english,"Shrooms takes a fresh and very different approach to the survival and exploration genre.
To survive, it doesn't just matter what you craft or the items you have, it also matters who you are!
Experimenting with different combinations of plants and mushrooms, figuring out what they do and how can you use them, seeing how they affect your cute character and the beautiful environment wich you are in... Can't wait for more!
Keep in mind that this is an Early Acess game and if you don't know what that means then [url=http://store.steampowered.com/earlyaccessfaq/] read about it here [/url].
The game has a lot of potential and I can't wait to see what kind of updates and new features will be rolling out soon.
",1431161050,1431161050,True,4,0,0.378435879945755005,0,False,False,True,False,,,
15747538,"{'steamid': '76561198010024933', 'num_games_owned': 0, 'num_reviews': 14, 'playtime_forever': 382, 'playtime_last_two_weeks': 0, 'playtime_at_review': 259, 'last_played': 1448244206}",english,"Very cool but very rough Early Acess game. It's a typical open world survival game in the same vein as Minecraft and Rust, but with the unique mechanic of beng able to mutate your character with various fungi and give them special abilities.

So far, the game doesn't expalin any of its mecahnics which makes things confusing- I can't figure out what mutations give me what abilities and how to activate them, and I have no idea how to restore my health (I think eating some food restores it but some doesn't???). [There is actually a guide to the game that the devloper helpfully linked to in the comments for this review, qhich certainly helps.] The game has a crafting system, but it's limited so far and there's a laggy minigame involved that doesn't really seem to affect the outcome. It's also very easy to die accidentally, whether by starving to death (there's a food meter under your health meter, and when that runs out you die instantly) or by the angry panthers that will chase you across the entire map.

All that said, still a neat game, interesting unique mechanics, cool environment to mess around in, all in all a promising foundation, very clearly in alpha but with a lot of potential.",1431130155,1431133171,True,12,1,0.516326665878295898,1,True,False,True,False,,,
15747522,"{'steamid': '76561198051928602', 'num_games_owned': 189, 'num_reviews': 22, 'playtime_forever': 13, 'playtime_last_two_weeks': 0, 'playtime_at_review': 13, 'last_played': 1434238184}",german,"Noch wenig Optionen und wenig Content, aber bin gespannt.
Edit: Es tut sich zu wenig",1431130026,1437650690,False,1,0,0.467843800783157349,0,False,False,True,False,,,
15745913,"{'steamid': '76561197999342177', 'num_games_owned': 1009, 'num_reviews': 65, 'playtime_forever': 35, 'playtime_last_two_weeks': 0, 'playtime_at_review': 35, 'last_played': 1431013858}",english,"[h1]Shroom Early Access – A Steam Review[/h1]

[i][Disclamer - I was provided a copy by the publisher for review purposes][/i]

[b]The good[/b]

[list]
[*]Interesting gameplay ideea, with the posiblity to become a nice Minecraft-type game for people that like doing shrooms
[*]Crafting with a nice mini-game twist
[/list]
[b]The not so good (take everything with a grain of salt, the game is in Alpha):  [/b]
[list]
[*]No tutorial. I just spawned in the map and got killed by 3 tigery-black-panthery things.
[*]The controls feel a little bit clunky, but I blame it on the Alpha.
[/list]
[b]The conclusion: [/b]

If you get onto the early access, don't expect much, the game is still in the very early stages of development. Despite that, the idea of eating stuff to modify your body is pretty nice and it keeps you engaged for a while. Unfortunatelly, I wasn't able to check the multiplayer, but the single player was pretty interesting. This is a game that has a good potential of becoming a great game. 

You can see me playing it here - http://youtu.be/bpcGFrG28Bk",1431120624,1431120624,True,10,1,0.392121374607086182,0,False,False,True,False,,,
15744502,"{'steamid': '76561198020085437', 'num_games_owned': 1081, 'num_reviews': 400, 'playtime_forever': 58, 'playtime_last_two_weeks': 0, 'playtime_at_review': 58, 'last_played': 1431024172}",english,"The game is still in a incomplete Alpha stage, not all features are in yet.
I have so far only tried this game solo, so my experience so far is limited to that.
But i did fool a bit around with the game, crafted some equipment, harvested some resources and ate some shrooms that mutated me :)

https://youtu.be/Cce1cmz226k",1431114082,1431114082,True,8,3,0.341536372900009155,0,False,False,True,False,,,
