recommendationid,author,language,review,timestamp_created,timestamp_updated,voted_up,votes_up,votes_funny,weighted_vote_score,comment_count,steam_purchase,received_for_free,written_during_early_access,hidden_in_steam_china,steam_china_location,timestamp_dev_responded,developer_response
160791367,"{'steamid': '76561198064199623', 'num_games_owned': 0, 'num_reviews': 34, 'playtime_forever': 11, 'playtime_last_two_weeks': 0, 'playtime_at_review': 11, 'last_played': 1498245702}",english,"Abandoned.  Currently 2024, no updates since 2015.",1710704260,1710704260,False,0,0,0,0,True,False,True,True,,,
114120482,"{'steamid': '76561197993280486', 'num_games_owned': 762, 'num_reviews': 17, 'playtime_forever': 26, 'playtime_last_two_weeks': 0, 'playtime_at_review': 26, 'last_played': 1434067171}",english,Dead game. Do not buy.,1650368076,1650368076,False,1,0,0.505880653858184814,0,True,False,True,False,,,
111659172,"{'steamid': '76561197989587179', 'num_games_owned': 1466, 'num_reviews': 25, 'playtime_forever': 14, 'playtime_last_two_weeks': 0, 'playtime_at_review': 14, 'last_played': 1437420244}",english,"year is 2022 do not buy the game it is a dead game no updates have been given

UPDATE year is now 2023 DO NOT BUY IT HAS HAD ZERO UPDATES AND IS BROKEN",1646553623,1694281994,False,1,0,0.505880653858184814,0,True,False,True,False,,,
70555793,"{'steamid': '76561197985532366', 'num_games_owned': 1428, 'num_reviews': 28, 'playtime_forever': 48, 'playtime_last_two_weeks': 0, 'playtime_at_review': 48, 'last_played': 1454859331}",english,"Game was abandoned ages ago, so do not buy it as even the current version is very very very basics and could barely be called a game!",1591738336,1591738336,False,3,0,0.492791503667831421,0,False,False,True,False,,,
67528037,"{'steamid': '76561198050542952', 'num_games_owned': 212, 'num_reviews': 39, 'playtime_forever': 71, 'playtime_last_two_weeks': 0, 'playtime_at_review': 71, 'last_played': 1584577595}",english,"bought it for kicks. just to see how bad it was for myself.
.
I seen it on a shlt posting group and the idea was sound.
but within a few minutes of playing you'll see how unfinished it is.
.
what a shame it was abandoned the girl player model is pretty cute and the transformations are interesting idea.",1587170155,1587170155,False,2,0,0.531612753868103027,0,True,False,True,False,,,
50284644,"{'steamid': '76561198122907724', 'num_games_owned': 0, 'num_reviews': 15, 'playtime_forever': 49, 'playtime_last_two_weeks': 0, 'playtime_at_review': 49, 'last_played': 1448754220}",english,"Looks like the game was abandoned... so don't get the game, last update was in 2015, its now 2019",1556036656,1556036656,False,5,0,0.551613092422485352,0,True,False,True,False,,,
49963859,"{'steamid': '76561197994547019', 'num_games_owned': 0, 'num_reviews': 11, 'playtime_forever': 31, 'playtime_last_two_weeks': 0, 'playtime_at_review': 31, 'last_played': 1450291395}",russian,"В целом, идея была хороша, но вот воплощение хромает на все конечности, что есть. Из раннего доступа так и не вышла. И похоже уже не выйдет.",1554451452,1554451452,False,0,0,0,0,True,False,True,False,,,
48065880,"{'steamid': '76561198834281866', 'num_games_owned': 0, 'num_reviews': 38, 'playtime_forever': 21, 'playtime_last_two_weeks': 0, 'playtime_at_review': 21, 'last_played': 1546510641}",english,"ABANDONED!!! and Reported!!!

https://youtu.be/uFOTPnwsivM

It also can be considered a SCAM thanks to what an ex developer posted on the discussion page. DO NOT BUY!!!",1546511915,1546511915,False,8,0,0.593250095844268799,0,True,False,True,False,,,
45472130,"{'steamid': '76561198057567703', 'num_games_owned': 0, 'num_reviews': 22, 'playtime_forever': 118, 'playtime_last_two_weeks': 0, 'playtime_at_review': 118, 'last_played': 1431639735}",english,Just Dont Buy,1540674618,1540674618,False,2,0,0.498427361249923706,0,False,True,True,False,,,
41593071,"{'steamid': '76561198052913068', 'num_games_owned': 0, 'num_reviews': 23, 'playtime_forever': 21, 'playtime_last_two_weeks': 0, 'playtime_at_review': 21, 'last_played': 1462847339}",english,"It had good potential but seems to have been abandoned since. 
It hasn't been updated for about 3 years (as of now)
Mechanic wise it was a good concept where what you ate helped you to survive and adapt better in the enviroment.
However there's not much to do or to see in the game and there's not much to figure out as there's very few enemies and adaptations to try.
I still have hope that it'll be updated in the future, but as it stands. Either wait for it to go on sale or to be gifted to you (most likely by someone who doesn't like you cause of how under-developed the game is.) but don't waste your money paying full price for it right now.",1524256542,1524256542,False,5,0,0.579565286636352539,0,True,False,True,False,,,
41486094,"{'steamid': '76561198003802364', 'num_games_owned': 324, 'num_reviews': 4, 'playtime_forever': 265, 'playtime_last_two_weeks': 0, 'playtime_at_review': 265, 'last_played': 1453445397}",english,"Cute concept, completely dead and abandoned. Shame.",1523728259,1523728259,False,6,0,0.588323414325714111,0,True,False,True,False,,,
37978196,"{'steamid': '76561198071688449', 'num_games_owned': 942, 'num_reviews': 7, 'playtime_forever': 60, 'playtime_last_two_weeks': 0, 'playtime_at_review': 60, 'last_played': 1443881044}",german,"Gerade im Multiplayer hätte das Spiel spaß machen können, es wurde an der oberfläche von einem Bausystem gekratzt da war auch schon wieder die luft raus.
Keine Upadest, kaum etwas zu machen... traurig aber auch das hier wird wohl nie zu einem echten Spiel heran wachsen obwohl die Idee sich durch Narung mutieren zu lassen und so das Erscheinungsbild zu verändern und neue fähigkeiten zu bekommen wirklich gut war.",1512140021,1512140021,False,1,0,0.504854321479797363,0,True,False,True,False,,,
31126609,"{'steamid': '76561198167559933', 'num_games_owned': 156, 'num_reviews': 6, 'playtime_forever': 616, 'playtime_last_two_weeks': 0, 'playtime_at_review': 592, 'last_played': 1538205170}",english,"This game was abandoned two years ago, despite the fact that it hasnt aged well with its following of players being mostly dissapointed by the updates coming to a screeching halt, however this may be heavily opinionated, I certainly believe this game had great potential, but even in its current state, with the multiplayer being a tad buggy and the like, it is still an excellent game, there is no other survival game on the market that uses this formula of mutating your body to adapt and survive, that said it would be an excellent, EXCELLENT surprise to hear this game being picked up by another developer, those on steam who are willing to take up this challenge, I salute you.",1492130354,1492130354,True,18,0,0.612486839294433594,0,True,False,True,False,,,
28510294,"{'steamid': '76561198105337851', 'num_games_owned': 0, 'num_reviews': 7, 'playtime_forever': 9, 'playtime_last_two_weeks': 0, 'playtime_at_review': 9, 'last_played': 1451558754}",english,The game has been completely abandoned. Do not buy.,1482336110,1482336110,False,31,1,0.745132803916931152,0,False,False,True,False,,,
26547706,"{'steamid': '76561197979402731', 'num_games_owned': 0, 'num_reviews': 218, 'playtime_forever': 99, 'playtime_last_two_weeks': 0, 'playtime_at_review': 99, 'last_played': 1437705065}",english,"I do not recommend this game, it has gone silent and no new updates for a long time.
There is nothing to really do in this game other then to cook meat, and try a couple different evolutions based on what mutations you get by interacting with the world.Should offer about a hour of entertainment but thats about it.Keep an eye on the forum if you are still interested but do not buy into this game until a developer can show signs of still being alive and working on this game.",1478909622,1478909622,False,17,0,0.637522339820861816,0,True,False,True,False,,,
26064984,"{'steamid': '76561198086707067', 'num_games_owned': 490, 'num_reviews': 19, 'playtime_forever': 318, 'playtime_last_two_weeks': 0, 'playtime_at_review': 318, 'last_played': 1476405202}",english,"The game needs a lot of improvements, I've had it for quite the long time... stopped playing it before they addded the building houses... I've tried to play it for the past two weeks and waiting for a server to load is aggravating... so far no load, I used to play mostly single player, and on a server with a friend... but now it's painfull to get on. 

Wish they fix this and I'll gladly get on more. I still like this game a lot, even though I only played it for a little while. Just wish some things were sharper too. Characters are cool in my book as well as the mutations idea...",1476607070,1476607070,True,3,0,0.454721748828887939,0,False,False,True,False,,,
25685692,"{'steamid': '76561197972269258', 'num_games_owned': 0, 'num_reviews': 18, 'playtime_forever': 5, 'playtime_last_two_weeks': 0, 'playtime_at_review': 5, 'last_played': 1450827579}",english,"Game still very much EA. There are lots of concepts which are not fleshed out and the game is clearly not finished. Additionally, the game has not been updated in over 9 months. To further issues the developer has not been around for the same period.

Honestly, it feels as if this game has been abandoned. As such I cannot recommend this game/developer.",1474785654,1474785654,False,8,0,0.578933596611022949,2,True,False,True,False,,,
25235244,"{'steamid': '76561198137424341', 'num_games_owned': 1842, 'num_reviews': 126, 'playtime_forever': 50, 'playtime_last_two_weeks': 0, 'playtime_at_review': 50, 'last_played': 1453071516}",english,"game need a lot of work but i hope for the best the idea is fresh and intresting but at the moment i write this review there was no update for more than 5 months we will see..


abandonware",1472500201,1673563591,False,0,0,0.491234272718429565,0,True,False,True,False,,,
24734924,"{'steamid': '76561198011118610', 'num_games_owned': 282, 'num_reviews': 30, 'playtime_forever': 382, 'playtime_last_two_weeks': 0, 'playtime_at_review': 371, 'last_played': 1438373099}",english,Another early access scam :(,1470449213,1470449213,False,8,0,0.420790135860443115,0,True,False,True,False,,,
24318284,"{'steamid': '76561198053376532', 'num_games_owned': 0, 'num_reviews': 5, 'playtime_forever': 162, 'playtime_last_two_weeks': 0, 'playtime_at_review': 158, 'last_played': 1437185755}",english,Just another game where the DEVS grab your money and run. It has been over six months not a word from the Devs. Cool concepts but going no where. Wish I could repay the Devs with a good old fashion CO CK PUNCH!,1468516483,1468516732,False,13,1,0.538245618343353271,0,True,False,True,False,,,
23691033,"{'steamid': '76561197987743391', 'num_games_owned': 0, 'num_reviews': 36, 'playtime_forever': 343, 'playtime_last_two_weeks': 0, 'playtime_at_review': 343, 'last_played': 1448134138}",english,"Cool art design and concept but that's it so far. Game play is fairly non existant right now, mechanics necessary to make it enjoyable to play haven't been implimented. The devs haven't done an update since December 2015 so I'm not sure the devs will put anything in to bring it more to a complete state. The devs were communicative at the start but all of that's kinda evaporated.

It's been well over a year since the last time the devs have made any communication. It's been abandoned, don't buy this. There is far too little content to find any enjoyment in the current product and no hope of it ever becoming more complete.",1466535992,1479543783,False,8,0,0.540019690990447998,0,True,False,True,False,,,
23490414,"{'steamid': '76561198064066770', 'num_games_owned': 608, 'num_reviews': 79, 'playtime_forever': 10, 'playtime_last_two_weeks': 0, 'playtime_at_review': 10, 'last_played': 1431116053}",english,"Abandonware. No updates for half year.

Thats sad, cuz it had ""plot"" and few intresting mechanics",1465590855,1465590855,False,29,2,0.598059177398681641,0,True,False,True,False,,,
22268678,"{'steamid': '76561197997356779', 'num_games_owned': 0, 'num_reviews': 31, 'playtime_forever': 217, 'playtime_last_two_weeks': 0, 'playtime_at_review': 217, 'last_played': 1459950246}",english,"It's an alright concept, but it still needs a lot of development to really warrent a purchase. As of right now (August 9th, 2016) the last update was almost 8 months ago (December 18th, 2015.) I'm unsure if the dev is really busy with developing this game, or has disappeared. Their last post ever on the steam forums was January 14th. Will be a good game if it's ever completed, but right now everything looks a little shakey with no Dev presence anywhere (Even their twitter, website, and facebook have been neglected and untouched since December/January.) So to avoid any heart ache and rage, avoid the game for now. (I'll definitly change my review after I find some trace of recent dev activity.)

edit: Okay, new edit. They're dead, Jim. Facebook ( https://www.facebook.com/immersivedouro/ ) and Twitter ( https://twitter.com/immersivedouro ) haven't been updated in almost a year, ""Official Forums"" ( http://projectshrooms.com/forum/viewforum.php?f=2&sid=ff06827f53b28783ff3c8d0570ee0e46 ) is so choked out with bot spam that there isnt even a point in opening any topic. The developer who initially posted Shrooms on Reddit has been innactive for 7 months (1 year if you only count information pertaining to Shrooms), and their main business page ( http://immersivedouro.com/cgi-sys/suspendedpage.cgi ) appears to have been repossessed by the web host (HostGator.) The three devs I know about have been either innactive or just playing games on Steam, most likely with the money gained from Shrooms. I had hopes that the developers would suddenly return and prove me wrong, but it sucks to be proven right.

Update from the Devs themselves! Apparently they had been fired and their employer chose to leave this game up on Steam while (possibly) hiring new devs who may or may not continue work on this game. I have a feeling this was the last nail in the coffin. Game is dead. Never forgetti rest in spaghetti.",1459949423,1483570231,False,50,1,0.800746321678161621,0,True,False,True,False,,,
20772947,"{'steamid': '76561198168948942', 'num_games_owned': 0, 'num_reviews': 16, 'playtime_forever': 16, 'playtime_last_two_weeks': 0, 'playtime_at_review': 16, 'last_played': 1453850417}",english,"It was definitely abandoned, i had high hopes when i bought it when it came out. Sadly it wasn't worth it",1453838594,1614234501,False,0,0,0.467936009168624878,1,True,False,True,False,,,
20317582,"{'steamid': '76561198117601334', 'num_games_owned': 142, 'num_reviews': 4, 'playtime_forever': 74, 'playtime_last_two_weeks': 0, 'playtime_at_review': 64, 'last_played': 1579971200}",russian,"Dat ass, ( ͡° ͜ʖ ͡°)",1451984943,1451984943,False,3,0,0.393921971321105957,0,True,False,True,False,,,
20299246,"{'steamid': '76561198031127696', 'num_games_owned': 0, 'num_reviews': 53, 'playtime_forever': 7, 'playtime_last_two_weeks': 0, 'playtime_at_review': 7, 'last_played': 1451930516}",german,"Nicht zu empfehlen.

Zuerst das wichtigste: EA. Das heisst, es kann sich noch alles zum besseren wenden.

Warum kann ich es nicht empfehlen?
 
1.) User Interface. Die Menüs sehen aus wie eine vt100 Console mit  Schriftgröße 50px
2.) Content: Es gibt sehr wenig davon.
3.) Bedienung: Unintuitiv par excellence.
4.) Speichern? Fehlanzeige.
5.) Grafik: Sehr schlechte fps (ca. 20fps), trotz altbackener Grafik (Erinnnert an ein Spiel aus 2003 (sieht auf den Screenshots interessanterweise besser aus, als im Spiel selbst) auf einem Rechner, der Skyrim mit ENB auf 50fps schafft

Zusammengefasst würde ich sagen: Derzeit ist es wenig mehr als eine Tech-Demo (die aussieht als wäre sie aus dem Jahr 2003). 
Es stecken gute Ideen dahinter, ich wage jedoch zu bezweifeln, dass dieses ""Spiel"" sich noch ins positive wenden wird.",1451931232,1451931232,False,0,0,0,0,True,False,True,False,,,
20296288,"{'steamid': '76561198220605129', 'num_games_owned': 0, 'num_reviews': 1, 'playtime_forever': 41, 'playtime_last_two_weeks': 0, 'playtime_at_review': 41, 'last_played': 1451926067}",russian,"автор верни деньги, почему можно замёрзнуть в пустыне?",1451925576,1451925576,False,1,4,0.277108669281005859,2,False,False,True,False,,,
20044653,"{'steamid': '76561197999219692', 'num_games_owned': 0, 'num_reviews': 44, 'playtime_forever': 69, 'playtime_last_two_weeks': 0, 'playtime_at_review': 69, 'last_played': 1451706065}",english,"An incredible interesting idea though still in very very early creation. it also seems highly in need of description for almost everything ingame. If your interested in this title id suggest keeping it on watch, it is still too early for a purchasable game. even on sale the price tag just does not justify payment for such an early access program. I had trouble even playing it for the first week after i had purchased it, then miraculously it started working. Id like to see this one developed further though i think i may wait awhile before i try playing it again. Extremely rough around the edges with an amazing amount of potential. id love to recommend this game, though at its current state of developement i cannot recommend it.",1451333941,1451333941,False,17,0,0.605822086334228516,0,True,False,True,False,,,
19929056,"{'steamid': '76561197995985473', 'num_games_owned': 2646, 'num_reviews': 321, 'playtime_forever': 6, 'playtime_last_two_weeks': 0, 'playtime_at_review': 6, 'last_played': 1451026549}",english,"Brimming with untapped potential based on concept alone, but *so* not ready for Early Access, much less for a price. Worth keeping an eye on, but not to buy. Not quite yet.",1451026855,1451026855,False,58,0,0.650241613388061523,0,True,False,True,False,,,
18942970,"{'steamid': '76561198023832658', 'num_games_owned': 593, 'num_reviews': 286, 'playtime_forever': 18, 'playtime_last_two_weeks': 0, 'playtime_at_review': 18, 'last_played': 1446853137}",english,"I was unable to get past the loading...screen, so I was unable to play, so I got a refund.",1446945387,1446945387,False,5,0,0.372481048107147217,0,True,False,True,False,,,
17717179,"{'steamid': '76561198126668581', 'num_games_owned': 0, 'num_reviews': 1, 'playtime_forever': 91, 'playtime_last_two_weeks': 0, 'playtime_at_review': 91, 'last_played': 1433517686}",portuguese,eu gostaria de saber se ja optimizaram o jogo.porque eu comprei e pedi o reembolso porque era muito lento no meu pc,1440548508,1440548508,True,0,2,0,0,True,False,True,False,,,
17633038,"{'steamid': '76561198091613577', 'num_games_owned': 0, 'num_reviews': 47, 'playtime_forever': 22, 'playtime_last_two_weeks': 0, 'playtime_at_review': 22, 'last_played': 1440096412}",english,loading simulator 2015 (multiplayer doesnt work.),1440096391,1440096391,False,7,0,0.403836935758590698,1,True,False,True,False,,,
16852224,"{'steamid': '76561198107803309', 'num_games_owned': 0, 'num_reviews': 41, 'playtime_forever': 348, 'playtime_last_two_weeks': 0, 'playtime_at_review': 348, 'last_played': 1435880514}",english,"[i]Key supplied by developer for review.[/i]
[h1]======================================[/h1]
[h1][b]Shrooms[/b][/h1] (Read on for the full review!)
[h1]======================================[/h1]

[h1]TL;DR[/h1]

Shrooms is definitely an alpha, but a unique one with fun and potential! Give it a buy if you're hopeful, or maybe hold off and see where it goes for a while if you're unsure.

[h1]======================================[/h1]

[h1][b]Pros[/b][/h1]
+Gameplay: Unique and interesting, barebones but good survival elements.
+Graphics: Exotic level design, variable player model.
+Audio: Sparse, but functional, good ambience.

[h1][b]Cons[/b][/h1]
-Couldn't go above 25FPS on any setting.
-Interface slightly clunky.
-Forest seems to be a deathtrap.

[h1][b]Neutral[/b][/h1]
+/-Slightly finicky targeting issues.

[h1]======================================[/h1]

[h1][b]Introduction[/b][/h1]

Hello and welcome to this review of Shrooms, a game where you...eat shrooms! Wait, wait, that's not all there is to this, you eat shrooms to alter your body which changes the way you interact with the world! There are critters, monsters, basic crafting, and survival elements brought into the mix!

[h1][b]Gameplay[/b][/h1]

There's only so much to Shrooms right now, but what's there is good! So for every shroom you eat, it alters a part of you from the head, arms, legs, or your torso. This gives them different effects or passives such as but not limited to: invisibility, damage absorption, damage reflection, a high damage punch, longer underwater time, etc. This will allow you to interact with the world and its inhabitants in different ways. A refreshing and fun game concept!

The general gameplay will have you running around collecting ingredients so that you can make tools so that you can more efficiently gather ingredients (or better ones) so that you can fight, keep warm, or stock up on bow ammo. Basically, you're doing what you have to to survive and eating mushrooms to help along the way!

[h1][b]Graphics[/b][/h1]

The graphics, while good, could use some improvement, especially given the FPS I get.
The environment design is exotic and unique, with a lot of glowing lights and unique land and rock formations, pretty water, and vegetation.

The UI is a bit large, but in terms of design seeks to be minimal, and currently could use a facelift. Getting around it is easy enough once you get used to it, though, with simple hotkeys, and everything spelled out conveniently in non-distracting places.

[h1][b]Audio[/b][/h1]

There isn't much there, but the ambience is nice, and the sounds your character makes sufficies with no crack or pop in the recording. For what they are, they're actually believable, too, which is nice.

[h1][b]Conclusion[/b][/h1]

All in all, in its current state, Shrooms is fairly barebones, but imaginative and unique, and it deserves credit for that. Unique player models for the mutations is a nice touch, which indicates not only time spent but love given. The survival elements are a nice touch, but lack commonalities to make them worthwhile, such as the ability to build a shelter. The world also feels a bit empty currently, with only two other critters to run into. An armadillo and panther. It's easy to envision this game becoming something great, however, and time will tell if the developers get it there!

[h1]======================================[/h1]

[i]If you liked this review or want to see more recommended games, be sure to follow our curator group: [url=http://steamcommunity.com/groups/Original_Curators_Group#curation]Follow Original Curator Group[/url][/i]",1435880567,1435880567,True,36,3,0.606923282146453857,13,False,False,True,False,,,
15847574,"{'steamid': '76561197963799987', 'num_games_owned': 0, 'num_reviews': 6, 'playtime_forever': 208, 'playtime_last_two_weeks': 0, 'playtime_at_review': 200, 'last_played': 1434044987}",english,"I started off as Big-Booty-Judy, enjoyed Judy's booty. Gathered some supplies, made a fire, and hunted animals etc...

Then I started experimenting with the shrooms/weeds. I grew horns, slung webs, shot a laser with my eyes, and swam like a fish.

Got overzealous and took too many shrooms. Started having psychedelic vision changes. Enjoyed Judy's Booty in psychedelic colors.

If this game had more variety/less bugs it could be a 10/10. As is - in early alpha stages - it's a 7/ or 8/10.",1431742937,1431742937,True,38,42,0.593462288379669189,1,True,False,True,False,,,
15845443,"{'steamid': '76561198124090858', 'num_games_owned': 118, 'num_reviews': 6, 'playtime_forever': 166, 'playtime_last_two_weeks': 0, 'playtime_at_review': 117, 'last_played': 1433873691}",portuguese,"Este jogo está muito bom. Gostei da Apresentação na Iberanime
Apesar de estar em Alpha já tem muitas funcionalidades, a iluminação é espetacular, a jogabilidade é boa.
Um bom jogo de Survival. 5 Estrelas - RECOMENDO
Parabéns Immersive Douro, pelo jogo bem conseguido!",1431729223,1431729223,True,4,3,0.554780185222625732,0,False,False,True,False,,,
15822945,"{'steamid': '76561198007268219', 'num_games_owned': 0, 'num_reviews': 101, 'playtime_forever': 34, 'playtime_last_two_weeks': 0, 'playtime_at_review': 34, 'last_played': 1431599733}",german,"Survival Sandbox... im Bikini ... :D
Eine eigene Fauna und Flora erinnert ein wenig an eine Mischung zwischen ""Planet Explorers"" und ""Starforge"".
Diese ""Early Access Version"" ist auf jeden Fall ein genaueren Blick wert. 
Bilde Dir Deine eigene Meinung:
https://youtu.be/3NAjaip5kyE",1431600265,1431600265,True,0,0,0,0,True,False,True,False,,,
15817421,"{'steamid': '76561197972011136', 'num_games_owned': 1271, 'num_reviews': 794, 'playtime_forever': 72, 'playtime_last_two_weeks': 0, 'playtime_at_review': 72, 'last_played': 1431554555}",french,"Pour le moment le jeu n'est pas super jouable et la survie est mal calibré.
Je pens qu'il y a du potentiel, mais pour le moment ce n'est pas encore prêt normale vu que c'est une vraie early access.
- Ce qu'il faut améliorer :

L'équilibre de la survie dans ce monde
L'animation du personnage pour les sauts
La hit box de certains objets les collisions
La map est vraiment petite
(Je mettrais un + quand le jeu sera plus avancé)",1431554827,1431554827,False,1,1,0.5,0,True,False,True,False,,,
15788556,"{'steamid': '76561198014316738', 'num_games_owned': 0, 'num_reviews': 1, 'playtime_forever': 154, 'playtime_last_two_weeks': 0, 'playtime_at_review': 82, 'last_played': 1488717674}",english,"Good game, shows alot of promise! :D",1431359477,1431359477,True,2,0,0.432497382164001465,0,False,False,True,False,,,
