recommendationid,author,language,review,timestamp_created,timestamp_updated,voted_up,votes_up,votes_funny,weighted_vote_score,comment_count,steam_purchase,received_for_free,written_during_early_access,hidden_in_steam_china,steam_china_location,timestamp_dev_responded,developer_response
20395418,"{'steamid': '76561198194254123', 'num_games_owned': 0, 'num_reviews': 12, 'playtime_forever': 93, 'playtime_last_two_weeks': 0, 'playtime_at_review': 61, 'last_played': 1499290290}",french,"un jeu tres tres tres réaliste si on ne fait pas gaffe au graphisme. pour les fan de warbirds ce jeu, est fait pour vous",1452255628,1452255628,True,0,0,0,0,True,False,False,False,,,
20333739,"{'steamid': '76561198274283853', 'num_games_owned': 0, 'num_reviews': 1, 'playtime_forever': 55, 'playtime_last_two_weeks': 0, 'playtime_at_review': 55, 'last_played': 1452027957}",english,"I thought this would be a suitable replacement for Microsoft Combat Flight Simulator. NOT! The realistic settings leave the aircraft uncontrollable, while on the other hand the ""easy"" setting doesn't allow for any manueverability. The soundtrack is horrible. OMG I got that lousy music going through my head! Dum dum dum do dee dumm do! I could go on, but I've made my point. Don't waste your money. Dum dum dum do de dum do dum de do do............",1452028546,1452028546,False,8,4,0.500008463859558105,0,True,False,False,False,,,
19922308,"{'steamid': '76561198041507470', 'num_games_owned': 0, 'num_reviews': 3, 'playtime_forever': 29, 'playtime_last_two_weeks': 0, 'playtime_at_review': 28, 'last_played': 1451002546}",english,SUX,1451000636,1451000636,False,4,0,0.30857965350151062,0,True,False,False,False,,,
19772282,"{'steamid': '76561197984960211', 'num_games_owned': 1212, 'num_reviews': 25, 'playtime_forever': 47, 'playtime_last_two_weeks': 0, 'playtime_at_review': 47, 'last_played': 1450485105}",english,"MMO subscription pricing for a game with an up front fee.

""While WarBirds Online is free, IENT is a business, so of course there are limitations. During the first month online you have complete access to all features at no charge. After the first month, you can still play free, but you are limited to an early war plane set, which varies from arena to arena. To access the full set of all aircraft in all arenas, Steam players can purchase day, week or month passes, which range from $2.99 to $15.95. If you just want to play in a specific event on a specific day, the Day Pass is best for you. If you want to play with the best planes, against the best players, whenever you want, the Month Pass is your best choice.""

Recommend you do not buy. Aces high is essentially a more populated version of the same thing with a sub, but no up front fee. I'll admit that the flight model, damage model and graphics are better here. Not ok at all that they charge for the base game if they're going for subscriptions. Feels greedy.

EDIT 1 2015/12/19: Apparently with steam you're supposed to get a month of sub with the purchase so the 15 you spend is supposed to cover the first month of online play. The UI advises to create an account after every training, instant action, mouseclick, but if you make a new account it won't link with steam correctly. Still recommend aces high over this one, free to download and play offline or on private servers, subscription for online arena play, higher server populations.",1450485694,1450539645,False,97,0,0.846430301666259766,4,True,False,False,False,,,
19000709,"{'steamid': '76561197993153538', 'num_games_owned': 0, 'num_reviews': 55, 'playtime_forever': 14, 'playtime_last_two_weeks': 0, 'playtime_at_review': 14, 'last_played': 1447256495}",english,"Man I loved this flight sim
went and bought it, does not even boot up crashes every time 
guess it does not like win 8.1",1447198937,1447198937,False,3,0,0.394997894763946533,0,True,False,False,False,,,
18443070,"{'steamid': '76561198082968104', 'num_games_owned': 852, 'num_reviews': 1, 'playtime_forever': 328, 'playtime_last_two_weeks': 0, 'playtime_at_review': 262, 'last_played': 1479378973}",english,If you like flying around and shooting things up this is a great game to play.,1444662951,1444662951,True,0,1,0.482758641242980957,0,False,False,False,False,,,
18250950,"{'steamid': '76561198006002015', 'num_games_owned': 1330, 'num_reviews': 67, 'playtime_forever': 41, 'playtime_last_two_weeks': 0, 'playtime_at_review': 41, 'last_played': 1443525790}",english,https://www.youtube.com/watch?v=b1R37zc4FgI,1443542696,1443542696,True,1,1,0.292455017566680908,0,False,False,False,False,,,
18179772,"{'steamid': '76561198122073541', 'num_games_owned': 0, 'num_reviews': 1, 'playtime_forever': 43751, 'playtime_last_two_weeks': 0, 'playtime_at_review': 2444, 'last_played': 1612738221}",english,"Highly Recommend this simulation! Been playing it since 2009, finally glad it is on steam. Very realistically structured, in terms of flight models of aircraft and weaponry and load outs. This isnt your typical shoot em up and fly home simulation. A lot of variables to keep you busy, and coming back. Very addictive once you get hang of it. Check in with some squads, and people will help you out :)",1443144581,1443144581,True,15,1,0.591613829135894775,0,True,False,False,False,,,
18173835,"{'steamid': '76561198155120682', 'num_games_owned': 0, 'num_reviews': 1, 'playtime_forever': 22, 'playtime_last_two_weeks': 0, 'playtime_at_review': 17, 'last_played': 1478038695}",english,"As some others may have mentioned - Warbirds is, at it's heart, an on-line, massive multiplayer, very realistic WWII flight simulation. It has  extensive offline options that can be enjoyed for itself - well worth the price - these are used by members of the on-line community to hone their skills and as a learning center for new players to develope their flying skills. They can be enjoyed for themselves but the real action is head-to-head play online.

It certainly does NOT require continual in-game purchases to upgrade and/or grinding to get into an aircraft that is competitive. From day one - in off-line and on-line play (depending on historical arena timeframes & subscription) all aircraft and loadouts are available. The selection is entirely up to you.

The flight models are as realistic as the WB development team can make them and they are based on actual performance data. Some aircraft are more forgiving than others - just as they were in real life. There is a learning curve as in all flight sims. A joystick will be the preferred controller - you don't need a super pricey model.

And the community is very welcoming and helpful, esp. for new players.  Well worth the investment!",1443111713,1445378523,True,6,0,0.536646902561187744,0,True,False,False,False,,,
18136181,"{'steamid': '76561198168273530', 'num_games_owned': 0, 'num_reviews': 3, 'playtime_forever': 97, 'playtime_last_two_weeks': 0, 'playtime_at_review': 94, 'last_played': 1443376187}",english,"played this for 10 years online. game USED to be a lot of fun. in the last few years, the game has gone downhill. 24 or so year old graphics can't compete with the new games here. sound effects are terrible. ( some of the ground vehicles sound like sewing machines that need oil) short of a couple of bad eggs(all games have them) the people are really great to play with. try it at least,you may like it.",1442864050,1443239027,False,12,2,0.519430100917816162,2,False,False,False,False,,,
18123421,"{'steamid': '76561197994436950', 'num_games_owned': 0, 'num_reviews': 1, 'playtime_forever': 191, 'playtime_last_two_weeks': 0, 'playtime_at_review': 160, 'last_played': 1604852166}",english,"(3 years of prior experience before Steam version) 

Right first things first this isn't War Thunder so if you are looking for flashy graphics this isn't the combat sim for you. Where this sim compromises on graphics it makes up for it in its large open area online combat in arenas spaning 100s of square miles full of targets, such as airbases, towns, docks, supply depots and carrier battle groups. The aim is in closing the enemies bases/towns etc. to allow friendy troop transports to paratroop and capture them for your side, with victory being achieved when you control all of the map (though don't expect it in a single day cause as mentioned they are LARGE maps). 

Flying is not to difficult as long you don't stall ('Realistic' flight mode), I recommend using a joystick not a gamepad, and flying the training and offline combat in easy flight mode first in order to get a feel of the 100+ aircraft (all of which are available to fly, none of this unlocking and paying for special types), though I do stress that all online flight is with the 'realistic' flight mode so get the hang of flying with it on before venturing into the online arenas.

The aircraft models are are mixture of realism and the need to allow ease of playability, and I will say straight away to head off the 'they don't fly realisticly' crowd, of course they won't this is a COMPUTER SIMULATION (this is why I put qoutes unquotes Realistic above), as with all sims compromises had to be made in order to have a large number of combat flyable types within a 4gig package ALL READY TO FLY FROM THE GET GO!! 
That being said each aircraft has its own quirks, and you need to know whether the type you are flying is a 'Turn and Burner' Like say the Spitfire and A6M Zero or a 'Boom and Zoomer' like the Bf109 and F4U Corsair, because this will dictate how you use them in combat. Also bombers, you need to know whether you will need a full fuel load or not cause this will dictate whether you would be able to take off or not with that heavy bomb load of yours.

The online community is for the majority freindly and approachabl with great comradeship within the arenas and the different sqauds available to join once you have been flying online a while. Though the number of online players will Vary from day to day and within in the different timezones due to us all spread out over different countries. 
I also recommend getting the free downloadable TeamSpeak com system since this is where all squad voice coms are controlled.

As a note basic online membership is around $13 a month or there abouts (don't qoute me on that) and that gets you unlimited access to the main arena.

I am sure to have forgotten to mention a large number of things but these are what I could remember off the top of my head for the time being.

This is Vulcan member of the 'Doolittle Raiders' signing off and I hope to meet you in the air sometime.",1442780597,1464433602,True,43,4,0.709257781505584717,1,False,False,False,False,,,
17951104,"{'steamid': '76561197960457662', 'num_games_owned': 0, 'num_reviews': 1, 'playtime_forever': 1250, 'playtime_last_two_weeks': 0, 'playtime_at_review': 134, 'last_played': 1646269834}",english,"Ive played the older versions of this game for a long time and loved those.  the new 2016 version runs very smoothly and it is a refreshing updated game!  the online play against other real pilots is a fun and exciting experience, especially the coordinated events that have large numbers of people sometimes upwards of 200 people flying missions at one time.  i reccomend this game to any avid WWII flying buffs that enjoy a realistic take on WWII dogfighting.",1441761329,1441761329,True,14,0,0.648913979530334473,0,False,False,False,False,,,
15998772,"{'steamid': '76561198074703939', 'num_games_owned': 0, 'num_reviews': 12, 'playtime_forever': 166, 'playtime_last_two_weeks': 0, 'playtime_at_review': 109, 'last_played': 1452460024}",german,EIn ganz blödes spiel bereue es das ich es gekauft habe nur alles aul Englisch keine vernünftige einstellungs erklärung somit kein spielen.,1432563598,1432563598,False,2,3,0.351380795240402222,0,True,False,False,False,,,
15767983,"{'steamid': '76561198068669707', 'num_games_owned': 0, 'num_reviews': 66, 'playtime_forever': 73, 'playtime_last_two_weeks': 0, 'playtime_at_review': 63, 'last_played': 1431250897}",german,"Sehr klassisches Flug Simulator Spiel. Es gibt mehr Flugzeuge als früher, Z.B. F86, Hawker Typhoon usw. Die Graphik hat sich verstärkt, aber leider bleibt 2001. Die Einstellung sind noch von 2001.  Es gibt wenige Online-Spieler. Nur für Sammler oder Flug Simulator Fan.

Und als Flug Simulator Fan, würde ich IL2 lieber spielen.",1431238570,1431238729,True,3,1,0.439948230981826782,0,True,False,False,False,,,
15764336,"{'steamid': '76561198195679643', 'num_games_owned': 0, 'num_reviews': 1, 'playtime_forever': 31, 'playtime_last_two_weeks': 0, 'playtime_at_review': 31, 'last_played': 1431357738}",english,"Won't load,complete waste of money do not buy",1431214105,1431214105,False,41,21,0.344284027814865112,13,True,False,False,False,,,
