recommendationid,author,language,review,timestamp_created,timestamp_updated,voted_up,votes_up,votes_funny,weighted_vote_score,comment_count,steam_purchase,received_for_free,written_during_early_access,hidden_in_steam_china,steam_china_location,timestamp_dev_responded,developer_response
122270788,"{'steamid': '76561197993621498', 'num_games_owned': 409, 'num_reviews': 1, 'playtime_forever': 5113, 'playtime_last_two_weeks': 0, 'playtime_at_review': 3638, 'last_played': 1670691486}",english,"At the time of writing, I've just gone over 60 hours playtime with this game. I don't often play games for that length of time, so this alone should tell you, Cue Club 2 is well worth your time.

I'd not long received my Steam Deck, and after trying out many games in my library, I was really in the mood for a pool game, which I didn't yet have. In terms of my history with pool games, I feel like the last time I got majorly into one was Bankshot Billiard 2, on the Xbox 360. I remember playing that game for many hours when it was released on Xbox Live Arcade back in the day. But my all time favourite pool game would be Arcade Pool on the Amiga. And I feel Cue Club 2 shares a lot of what I loved about that game, but in a much more modern package, with many more game types, including snooker. You still have the same top down view, but you can also play in 3D if you prefer. It's as simple as a click of the back button on your controller, to switch between the two views. I prefer to play mostly in the 2D top down view, but I do switch to the 3D view for the occasional long shot, where it does help with aiming, especially the long shots in snooker. 

I've been slowly trying to get all the achievements, which are mostly for beating each game type's tournament on each of the difficulty levels, as well as getting certain breaks in Snooker up to and including a 147, and also scoring so many points in the online mode. I haven't found anyone playing online sadly, but luckily this will not stop you earning the achievements, as there are a couple of bots in the online lobby. So you can still earn those points by playing bots, if you are having trouble finding anyone online to play. It's been great fun working my way through the achievements, and I'm now at 67 of 77, and I still have a good few hours of gameplay left trying to get the remainder. 

The physics for me are excellent. I'm certainly not an expert at pool/snooker in the real world, but the balls react as I would expect them to. You can add spin to the cue ball to curve it round other balls on the table, and it feels great doing this. There is nothing worse than getting a pool game, and the moment you start playing, the physics feeling wrong, so I'm very pleased with the physics here. 

Both pool and snooker play great, and although I was originally looking for a pool game, I've spent a ton of time playing snooker too, and it's brilliant. I'm still working on a 147 break, although I have managed to get the achievement for the 100 break which I'm happy about. 

I don't really have too much more I can say about this game. If you are looking for a pool or snooker game, you really can't go wrong with this one, and with it being a few years old, it won't break your bank either. I picked it up on sale for around £6.50, and got an absolute bargain, but i'd have paid the current full asking price (£12.99) if I'd had to. It's well worth that price. 

If you've got this far, just buy the game already.",1663242438,1663242438,True,3,0,0.555958688259124756,0,True,False,False,True,,,
122169489,"{'steamid': '76561199381373499', 'num_games_owned': 0, 'num_reviews': 1, 'playtime_forever': 32970, 'playtime_last_two_weeks': 451, 'playtime_at_review': 1964, 'last_played': 1712445769}",english,This game is so real-like..,1663042238,1663042238,True,0,0,0,0,True,False,False,True,,,
121362087,"{'steamid': '76561199240164681', 'num_games_owned': 0, 'num_reviews': 6, 'playtime_forever': 744, 'playtime_last_two_weeks': 0, 'playtime_at_review': 209, 'last_played': 1690236051}",english,i was looking for a billiards game. so i think this is what i was looking for! it's the best one!,1661678497,1661678497,True,0,0,0,0,True,False,False,True,,,
120738986,"{'steamid': '76561198450592456', 'num_games_owned': 0, 'num_reviews': 1, 'playtime_forever': 1327, 'playtime_last_two_weeks': 1, 'playtime_at_review': 323, 'last_played': 1712257708}",english,"Love the Cue Club 2 pool/snooker, has the best graphics of this game type.
If you want to play a great game of pool or snooker this is the one to buy",1660670608,1660670608,True,0,0,0,0,True,False,False,False,,,
120505553,"{'steamid': '76561198220463984', 'num_games_owned': 0, 'num_reviews': 31, 'playtime_forever': 644, 'playtime_last_two_weeks': 0, 'playtime_at_review': 339, 'last_played': 1660430999}",english,.,1660322358,1660322358,True,0,0,0,0,True,False,False,False,,,
120482844,"{'steamid': '76561198402610960', 'num_games_owned': 0, 'num_reviews': 33, 'playtime_forever': 153, 'playtime_last_two_weeks': 0, 'playtime_at_review': 144, 'last_played': 1708901049}",spanish,Simplemente excelente y muy relajante de jugar,1660287431,1660287431,True,1,0,0.495200246572494507,0,True,False,False,False,,,
120411500,"{'steamid': '76561198844532032', 'num_games_owned': 16, 'num_reviews': 4, 'playtime_forever': 5930, 'playtime_last_two_weeks': 184, 'playtime_at_review': 825, 'last_played': 1711758689}",turkish,**,1660166038,1660166038,True,0,0,0,0,True,False,False,False,,,
119677270,"{'steamid': '76561198333710339', 'num_games_owned': 0, 'num_reviews': 19, 'playtime_forever': 2072, 'playtime_last_two_weeks': 0, 'playtime_at_review': 1901, 'last_played': 1705918948}",english,"This game is the ultimate pc pool game. Sadly there's no jumpshot trickshot, but everything else is perfect as it is.",1659061032,1659061032,True,0,0,0,0,True,False,False,False,,,
119613756,"{'steamid': '76561198930848721', 'num_games_owned': 0, 'num_reviews': 16, 'playtime_forever': 1861, 'playtime_last_two_weeks': 0, 'playtime_at_review': 1397, 'last_played': 1702428664}",spanish,"Un juego de Pool que me a gustado bastante, tiene muchos modos de juegos, físicas realistas, visión 2D Y 3D, una IA muy buena con muchas variaciones de dificultad dependiendo el personaje al que te enfrentes, multijugador, torneos con amigos o con bots, personalización de los palos y la mesa, lo tiene casi todo.
Lo único que no me gusto es que no se puede agregar mods, por ejemplo: Me gustaría poder cambiar los personajes y sus nombres (O crearlos con una dificultad que yo elija), ya que al jugar muchas veces con los mismos personajes normales se vuelve monótono y aburrido. (Quiero jugar contra Goku en el nivel máximo de dificultad) como para dar un ejemplo xD
Aun así lo recomiendo comprarlo.",1658973371,1658973371,True,0,0,0,0,True,False,False,False,,,
118810291,"{'steamid': '76561198283333196', 'num_games_owned': 600, 'num_reviews': 10, 'playtime_forever': 3144, 'playtime_last_two_weeks': 0, 'playtime_at_review': 203, 'last_played': 1696341769}",schinese,BEST SNOOCK GAME I'v EVEV PLAYED,1657819979,1657819979,True,0,0,0,0,True,False,False,False,,,
118801890,"{'steamid': '76561198304481280', 'num_games_owned': 0, 'num_reviews': 29, 'playtime_forever': 1874, 'playtime_last_two_weeks': 0, 'playtime_at_review': 1463, 'last_played': 1710210396}",schinese,轻松休闲，有空就玩一局。,1657808864,1657808864,True,0,0,0,0,True,False,False,False,,,
118702469,"{'steamid': '76561198001462624', 'num_games_owned': 0, 'num_reviews': 3, 'playtime_forever': 3298, 'playtime_last_two_weeks': 0, 'playtime_at_review': 2598, 'last_played': 1668632894}",english,Excellent!,1657643756,1657643756,True,0,0,0,0,True,False,False,False,,,
118632719,"{'steamid': '76561199094190623', 'num_games_owned': 0, 'num_reviews': 3, 'playtime_forever': 1932, 'playtime_last_two_weeks': 0, 'playtime_at_review': 629, 'last_played': 1690659933}",english,nice,1657550779,1657550779,True,1,0,0.523809552192687988,0,True,False,False,False,,,
118502737,"{'steamid': '76561198171836519', 'num_games_owned': 46, 'num_reviews': 2, 'playtime_forever': 15371, 'playtime_last_two_weeks': 0, 'playtime_at_review': 856, 'last_played': 1701893132}",english,"The best of the snooker/pool games.
There is not enough variation between the difficulty levels, which make the hardest levels too easy to beat. Otherwise, it looks good and is fun to play.",1657361191,1660236169,True,0,0,0,0,True,False,False,False,,,
118464081,"{'steamid': '76561197997095067', 'num_games_owned': 0, 'num_reviews': 35, 'playtime_forever': 4211, 'playtime_last_two_weeks': 0, 'playtime_at_review': 2961, 'last_played': 1680735520}",english,Bought it to play the Snooker mode mainly but pretty much every game mode plays well. The physics is pretty good and the size of the tables feels right for each game mode. I actually prefer it over most other cue games,1657303217,1657303217,True,3,0,0.545454561710357666,4,True,False,False,False,,,
118436423,"{'steamid': '76561198378280477', 'num_games_owned': 174, 'num_reviews': 38, 'playtime_forever': 313, 'playtime_last_two_weeks': 0, 'playtime_at_review': 45, 'last_played': 1701187626}",english,It's definitely an upgrade.,1657265862,1657265862,True,0,0,0,0,True,False,False,False,,,
118273684,"{'steamid': '76561198061554386', 'num_games_owned': 0, 'num_reviews': 127, 'playtime_forever': 920, 'playtime_last_two_weeks': 0, 'playtime_at_review': 864, 'last_played': 1692540593}",spanish,"Muy buen juego, una pena que no pueda entablar una relación sentimental con el orangután.",1657044141,1657044141,True,0,2,0.483870983123779297,0,True,False,False,False,,,
118140784,"{'steamid': '76561198013537832', 'num_games_owned': 106, 'num_reviews': 2, 'playtime_forever': 4059, 'playtime_last_two_weeks': 0, 'playtime_at_review': 182, 'last_played': 1711219924}",french,"C'est un jeu super sympa, très agréable. La physique des boules est très réalistes. Très bon jeu en soldes actuellement, profitez-en ! Franchement, de réglages possibles. Très bon jeu.",1656866351,1656866351,True,0,0,0,0,True,False,False,False,,,
117999288,"{'steamid': '76561199225868504', 'num_games_owned': 10, 'num_reviews': 2, 'playtime_forever': 7541, 'playtime_last_two_weeks': 0, 'playtime_at_review': 6887, 'last_played': 1684519237}",polish,"very good pol and snooker game. just one problem is : not a lot of humans players online but rest is brillant, thanks",1656687114,1656687114,True,0,0,0,0,True,False,False,False,,,
117872331,"{'steamid': '76561198029659361', 'num_games_owned': 597, 'num_reviews': 73, 'playtime_forever': 463, 'playtime_last_two_weeks': 0, 'playtime_at_review': 145, 'last_played': 1657885411}",english,"Really good game, lots of settings to mess around with to set your own personal tastes, the physics are excellent and very true to life, tournament modes for up to 4 players, best pool/snooker game on here by far",1656522508,1656522508,True,0,0,0,0,True,False,False,False,,,
117457218,"{'steamid': '76561197997732348', 'num_games_owned': 0, 'num_reviews': 1, 'playtime_forever': 832, 'playtime_last_two_weeks': 0, 'playtime_at_review': 749, 'last_played': 1696274771}",english,Best pool game I've ever played...,1655989918,1655989918,True,0,0,0,0,True,False,False,False,,,
117430659,"{'steamid': '76561198339515364', 'num_games_owned': 0, 'num_reviews': 5, 'playtime_forever': 7108, 'playtime_last_two_weeks': 0, 'playtime_at_review': 6399, 'last_played': 1708296457}",spanish,"El juego de billar muy bien orientado, se pueden hacer buenas jugadas y no son fáciles, pues debemos tener buena puntería. Lo recomiendo es muy divertido.....!!!!!",1655936909,1655936909,True,0,0,0,0,True,False,False,False,,,
117427715,"{'steamid': '76561197971366401', 'num_games_owned': 35, 'num_reviews': 4, 'playtime_forever': 490, 'playtime_last_two_weeks': 0, 'playtime_at_review': 438, 'last_played': 1691830947}",english,"Beautifully coded game, perfectly designed. Infinitely re-playable in single player mode.

My only issues are:

1) Loading times. Even on a modern NVMe drive it's still slow to get past the loading screen.
I guess that's because it's so old it's not optimised from modern drive speeds.

2) Lack of online players. That can't be helped, I guess. COME ON FOLKS, GET ON BOARD!

3) Lack of visual effects. Some DoF effects would really make it beautiful. Especially in replays.

4) Cheesy late 90's/early 20's AI character graphics. Could do with a modern refresh. But it's fine.

If you want a pool/snooker sim, THIS IS IT!",1655932193,1655932357,True,0,0,0,0,True,False,False,False,,,
117400786,"{'steamid': '76561198963830917', 'num_games_owned': 362, 'num_reviews': 11, 'playtime_forever': 1072, 'playtime_last_two_weeks': 0, 'playtime_at_review': 926, 'last_played': 1707350502}",english,"this is a neat game and always getting regular updates and bug fixes, 
i took a break from this game because i play ""Shooters pool and snooker,"" undoubtedly the most realistic snooker game on the market with a huge only player base and lots of tournaments daily

give this game time and it could be a close rival ro shooters pool
keep up the good work DEVS",1655891771,1655891771,True,0,0,0,0,True,False,False,False,,,
117296943,"{'steamid': '76561198055366307', 'num_games_owned': 172, 'num_reviews': 22, 'playtime_forever': 129609, 'playtime_last_two_weeks': 0, 'playtime_at_review': 8571, 'last_played': 1686322286}",english,"I've had the game for three or four weeks and think it's fantastic. It does have it's faults such as a very basic chat system and very few players online, but there's enough to build a good multiplayer score if you love pool or snooker.

Overall opinion: Just buy it - I've played over 140 hours and expect to get much more out of the game. Scored five 147 breaks in snooker already.",1655741010,1655741010,True,3,0,0.549549520015716553,0,True,False,False,False,,,
117160461,"{'steamid': '76561198119991598', 'num_games_owned': 66, 'num_reviews': 2, 'playtime_forever': 831, 'playtime_last_two_weeks': 0, 'playtime_at_review': 180, 'last_played': 1655876215}",english,yeah it cool,1655523976,1655523976,True,0,0,0,0,True,False,False,False,,,
116988767,"{'steamid': '76561198303323330', 'num_games_owned': 0, 'num_reviews': 12, 'playtime_forever': 819, 'playtime_last_two_weeks': 0, 'playtime_at_review': 647, 'last_played': 1700529665}",english,Brilliant - Love it,1655236104,1655236104,True,0,0,0,0,True,False,False,False,,,
116826196,"{'steamid': '76561198884249114', 'num_games_owned': 25, 'num_reviews': 2, 'playtime_forever': 459, 'playtime_last_two_weeks': 0, 'playtime_at_review': 274, 'last_played': 1703473341}",schinese,特别好玩,1654968442,1654968442,True,0,0,0,0,True,False,False,False,,,
116059342,"{'steamid': '76561199088756273', 'num_games_owned': 560, 'num_reviews': 71, 'playtime_forever': 259, 'playtime_last_two_weeks': 0, 'playtime_at_review': 224, 'last_played': 1679241464}",brazilian,"Uma sinuca simples, porem honesta não chegar a ser um pool nation, mas nas cumpre seu papel, as tacadas não tem como fazer malabares porem a transição para 2d é muito boa, seria um pool nation ou pure pool pouquinho simpliicado, vai rodar liso em qualquer batata gamer. Comprem quando estiver em promoção.",1653602347,1653602347,True,1,0,0.523809552192687988,0,True,False,False,False,,,
116032557,"{'steamid': '76561198332382128', 'num_games_owned': 0, 'num_reviews': 14, 'playtime_forever': 11264, 'playtime_last_two_weeks': 19, 'playtime_at_review': 3188, 'last_played': 1712082951}",russian,super game i like it!!!,1653562357,1653562357,True,0,0,0,0,True,False,False,False,,,
115917131,"{'steamid': '76561198220309597', 'num_games_owned': 0, 'num_reviews': 2, 'playtime_forever': 406, 'playtime_last_two_weeks': 0, 'playtime_at_review': 186, 'last_played': 1666782974}",english,Best game ever !,1653346846,1653346846,True,0,0,0,0,True,False,False,False,,,
115854116,"{'steamid': '76561198141307377', 'num_games_owned': 0, 'num_reviews': 2, 'playtime_forever': 13621, 'playtime_last_two_weeks': 16, 'playtime_at_review': 5291, 'last_played': 1712057259}",english,"Have loved snooker/pool games on computers since the days of the BBC Model B. Very relaxing to play. Computer plays a very good game at pro level without being impossible to beat.
",1653236662,1692027603,True,0,0,0,0,True,False,False,False,,,
115837664,"{'steamid': '76561198844631944', 'num_games_owned': 0, 'num_reviews': 25, 'playtime_forever': 9, 'playtime_last_two_weeks': 0, 'playtime_at_review': 9, 'last_played': 1653214346}",english,"via proton experimental:

GNU/Linux 11 (bullseye) (64 Bit)
    Kernel-Name: Linux
    Kernel-Version: 5.10.0-14-amd64

Nvidia GTX 1650

work's fine including sound - thank you :)",1653214724,1653214724,True,0,0,0,0,True,False,False,False,,,
115835642,"{'steamid': '76561199135331207', 'num_games_owned': 0, 'num_reviews': 3, 'playtime_forever': 6255, 'playtime_last_two_weeks': 0, 'playtime_at_review': 729, 'last_played': 1663475801}",english,GG!,1653211504,1653211504,True,0,0,0,0,True,False,False,False,,,
115474230,"{'steamid': '76561198144422506', 'num_games_owned': 64, 'num_reviews': 1, 'playtime_forever': 2160, 'playtime_last_two_weeks': 0, 'playtime_at_review': 1389, 'last_played': 1708338405}",schinese,很好玩的一款桌球游戏,1652581497,1652581497,True,0,0,0,0,True,False,False,False,,,
114857203,"{'steamid': '76561198165408367', 'num_games_owned': 0, 'num_reviews': 42, 'playtime_forever': 1316, 'playtime_last_two_weeks': 0, 'playtime_at_review': 1263, 'last_played': 1702163628}",english,"While i really enjoy this game and have been a cueclub player since the first game in November 2000.. I have one major problem which is very annoying. When you load a tournament save, that save gets deleted on load and should your game crash, you therefore lose any progression in that tournament. Not ideal when playing against PRO level in long matches. Please let us keep saves and let us overwrite them. They do not affect any online play as its all local. I look forward to this becoming a thing.

Updated 30th Jan 2023: Still not implemented and I lost my save on a crash.",1651532579,1675091077,False,0,1,0,0,True,False,False,False,,1651570829.0,"Hello,

There is an auto-save feature and so if there is a crash or accidental power-off during a game then you can easily restore the match.

For tournaments, select 'Games > Tournament' from the main menu, then click on the button at the bottom of the screen labelled 'Resume Previous Game'. This will take you back to the last point in the match before the shut down.

From here, you can then select 'Save and Exit' from the in-game menu at any time, if you wish to have a break and resume the match later. The entry will appear in the usual save game slots.

I hope this helps."
114529438,"{'steamid': '76561198162853110', 'num_games_owned': 0, 'num_reviews': 1, 'playtime_forever': 1726, 'playtime_last_two_weeks': 0, 'playtime_at_review': 124, 'last_played': 1706388043}",english,"Probably the best Pool/Snooker game that you can get on steam, not that there's much competition mind you. Lots of customisation options, offline AI opponents who pose a good challenge and multiplayer, if you can find a match that is, there isn't a huge player base for this game sadly. Really fun and for sure worth the asking price; no DLC nonsense here either.",1651008129,1651008129,True,3,0,0.526627242565155029,0,True,False,False,False,,,
114331391,"{'steamid': '76561199033808651', 'num_games_owned': 0, 'num_reviews': 35, 'playtime_forever': 490, 'playtime_last_two_weeks': 0, 'playtime_at_review': 279, 'last_played': 1651362761}",english,"Its a really fun game with tons of game modes even a short story mode with interesting charecters to faceoff with. The difficutlies feel a bit off like it feells like they could of made expert mode NPC a bit more smart. The online game play out of like 20 matches it feels like every one online is a bot. No one aims there shot online.. No problem to me cause then it comes down to ""Ok low rating most likely lower difficutly""  I even tried to use chat to get them to talk like regular people but they only make comments like the bots do in story mode on bad shots you make or tricky shots there in. I love the achievements they look nice not dificult to get overall its a good game if your looking for a fun offline pool game.",1650712967,1650712967,True,2,0,0.523809552192687988,0,True,False,False,False,,,
114274269,"{'steamid': '76561198074375926', 'num_games_owned': 0, 'num_reviews': 3, 'playtime_forever': 1392, 'playtime_last_two_weeks': 0, 'playtime_at_review': 1392, 'last_played': 1642123745}",english,"Very good physical engine! and many different modes to select, great for filling up time",1650629447,1650629447,True,1,0,0,0,True,False,False,False,,,
114229119,"{'steamid': '76561199207329445', 'num_games_owned': 93, 'num_reviews': 29, 'playtime_forever': 413, 'playtime_last_two_weeks': 0, 'playtime_at_review': 222, 'last_played': 1694929096}",english,Good,1650551987,1650551987,True,1,0,0,0,True,False,False,False,,,
114218119,"{'steamid': '76561198030751248', 'num_games_owned': 0, 'num_reviews': 75, 'playtime_forever': 993, 'playtime_last_two_weeks': 24, 'playtime_at_review': 579, 'last_played': 1711328611}",english,"Better than Virtual Pool 4 easily.  Likely the best pool/snooker game you can buy on Steam.

Especially impressive is the lack of DLC.  All the table types, all the ball styles, all the pool cues, you get the full game when you buy it.

I was a bit reluctant when I saw how old the game is, but I can't imagine it looking better - in 4k video no less - sounding better, or playing better.  The only thing that 2016 date affects is the price.",1650535483,1650535776,True,5,0,0.546142220497131348,0,True,False,False,False,,,
114106462,"{'steamid': '76561198843121499', 'num_games_owned': 0, 'num_reviews': 6, 'playtime_forever': 16572, 'playtime_last_two_weeks': 0, 'playtime_at_review': 1583, 'last_played': 1707798036}",thai,"ฉันชอบน่ะ เกมส์นี้ เล่นแล้วเพลินดี สนุกด้วย เกมส์ทำได้สมบรูณ์ดีมาก ครับ

ใครชอบแนวนี้เชิญเลย...ขอบคุณ ครับ",1650339890,1667017273,True,1,0,0.523809552192687988,0,True,False,False,False,,,
114027859,"{'steamid': '76561197984012040', 'num_games_owned': 385, 'num_reviews': 19, 'playtime_forever': 1414, 'playtime_last_two_weeks': 0, 'playtime_at_review': 869, 'last_played': 1707868647}",english,A great way to take the edge off or learn a new pool game.,1650227724,1650227724,True,1,0,0,0,True,False,False,False,,,
113756950,"{'steamid': '76561198327530223', 'num_games_owned': 48, 'num_reviews': 8, 'playtime_forever': 1528, 'playtime_last_two_weeks': 0, 'playtime_at_review': 174, 'last_played': 1667926058}",english,"---{ Graphics }---
☐ You forget what reality is
☐ Beautiful
☑ Good
☐ Decent
☐ Bad
☐ Don‘t look too long at it
☐ MS-DOS

---{ Gameplay }---
☑ Very good
☐ Good
☐ It's just gameplay
☐ Mehh
☐ Watch paint dry instead
☐ Just don't

---{ Audio }---
☐ Eargasm
☑ Very good
☐ Good
☐ Not too bad
☐ Bad
☐ I'm now deaf

---{ Audience }---
☐ Kids
☑ Teens
☑ Adults
☐ Grandma

---{ PC Requirements }---
☐ Check if you can run paint
☐ Potato
☑ Decent
☐ Fast
☐ Rich boi
☐ Ask NASA if they have a spare computer

---{ Difficulty }---
☐ Just press 'W'
☐ Easy
☑ Easy to learn / Hard to master
☐ Significant brain usage
☐ Difficult
☐ Dark Souls

---{ Grind }---
☑ Nothing to grind
☐ Only if u care about leaderboards/ranks
☐ Isn't necessary to progress
☐ Average grind level
☐ Too much grind
☐ You'll need a second life for grinding

---{ Story }---
☑ No Story
☐ Some lore
☐ Average
☐ Good
☐ Lovely
☐ It'll replace your life

---{ Game Time }---
☐ Long enough for a cup of coffee
☐ Short
☐ Average
☐ Long
☑ To infinity and beyond

---{ Price }---
☐ It's free!
☐ Worth the price
☑ If it's on sale
☐ If u have some spare money left
☐ Not recommended
☐ You could also just burn your money

---{ Bugs }---
☐ Never heard of
☑ Minor bugs
☐ Can get annoying
☐ ARK: Survival Evolved
☐ The game itself is a big terrarium for bugs

---{ ? / 10 }---
☐ 1
☐ 2
☐ 3
☐ 4
☐ 5
☐ 6
☐ 7
☐ 8
☑ 9
☐ 10
",1649794805,1649794805,True,1,0,0,0,True,False,False,False,,,
113521834,"{'steamid': '76561198969169452', 'num_games_owned': 0, 'num_reviews': 14, 'playtime_forever': 428, 'playtime_last_two_weeks': 0, 'playtime_at_review': 259, 'last_played': 1659447106}",english,time vacuum,1649421642,1649421642,True,1,0,0,0,True,False,False,False,,,
113408218,"{'steamid': '76561198058989230', 'num_games_owned': 85, 'num_reviews': 8, 'playtime_forever': 1987, 'playtime_last_two_weeks': 0, 'playtime_at_review': 1059, 'last_played': 1709439547}",english,It's pool without the need for going out in public.,1649209939,1649209939,True,1,1,0.523809552192687988,0,True,False,False,False,,,
113261574,"{'steamid': '76561198886770170', 'num_games_owned': 0, 'num_reviews': 1, 'playtime_forever': 238, 'playtime_last_two_weeks': 0, 'playtime_at_review': 220, 'last_played': 1649727896}",schinese,真实、可靠。,1648967594,1648967594,True,0,0,0,0,True,False,False,False,,,
112841924,"{'steamid': '76561198033128227', 'num_games_owned': 0, 'num_reviews': 30, 'playtime_forever': 1898, 'playtime_last_two_weeks': 0, 'playtime_at_review': 75, 'last_played': 1667950914}",english,"Great Pool/Snooker game, well thought out difficulty level system, all the pool types / snooker types and lots of arcade type games too, easy to play system with 2d and 3d views available to player and multiplayer.  Best in it's class for sure.",1648281763,1648281809,True,0,0,0,0,True,False,False,False,,,
