recommendationid,author,language,review,timestamp_created,timestamp_updated,voted_up,votes_up,votes_funny,weighted_vote_score,comment_count,steam_purchase,received_for_free,written_during_early_access,hidden_in_steam_china,steam_china_location,timestamp_dev_responded,developer_response
64451068,"{'steamid': '76561198301878125', 'num_games_owned': 0, 'num_reviews': 12, 'playtime_forever': 202, 'playtime_last_two_weeks': 0, 'playtime_at_review': 18, 'last_played': 1584084217}",english,"I would like to recommend this game. The Bulldog Interactive keeps updating this game to become a perfect one. The game is easy to learn to play. The game-play is quite smooth. The music is comforting. I would recommend you playing this game when you are tired. It can really help you relax. You can also compete with others online. There are also puzzles and challenges for you to figure out solutions. I have once played Snooker 19 on Epic, but to be honest, the game design in that game is quite challenging. I think the design of this game is really impressive and suitable for mass players. Pool & Snooker are really dynamic and lively. Keep up with the good work and listen to players' advice. Well done!",1583236790,1583236790,True,1,0,0.519498586654663086,0,True,False,False,False,,,
64439284,"{'steamid': '76561199023274757', 'num_games_owned': 0, 'num_reviews': 15, 'playtime_forever': 323, 'playtime_last_two_weeks': 0, 'playtime_at_review': 30, 'last_played': 1661680818}",schinese,一代入坑，二代纯情怀玩家。一代绝对是那个年代的巅峰台球游戏，远非qq桌球可比。但是在现在看来，这个2代的桌球大师和同年代的台球游戏相比就差了很多了。不过，2D模式下绝对是第一！！！操作相对一代有些繁琐，但是适应了也还好。手边没手柄，也许用手柄会舒服很多。3D真心不敢恭维，烂到爆炸。无论是以物理引擎著称的virtual pool 4， 还是神级引擎打造，画面引擎可玩性皆优秀的pool nation fx， 再或者是画面满分的pure pool，这些3D界面的桌球真的比这个“小”游戏强太多。我是添加心愿了好久（因为情怀），今天打折买的。自认为作为2D桌球巅峰之作是没问题的，打折买还不算亏。想玩3D桌球还是首推Pool nation fx。,1583213498,1583213498,True,0,0,0,0,True,False,False,False,,,
64055734,"{'steamid': '76561198342635302', 'num_games_owned': 0, 'num_reviews': 7, 'playtime_forever': 685, 'playtime_last_two_weeks': 0, 'playtime_at_review': 263, 'last_played': 1649903695}",brazilian,me lembrei da época que joguei o 1... muito bom o jogo! recomendo!,1582561492,1582561492,True,0,0,0,0,True,False,False,False,,,
63688589,"{'steamid': '76561198308040980', 'num_games_owned': 0, 'num_reviews': 8, 'playtime_forever': 3787, 'playtime_last_two_weeks': 0, 'playtime_at_review': 1912, 'last_played': 1710609397}",german,bestes overhead billiard und snookerspiel,1581972515,1581972515,True,0,0,0,0,True,False,False,False,,,
63379012,"{'steamid': '76561198140418725', 'num_games_owned': 56, 'num_reviews': 1, 'playtime_forever': 424, 'playtime_last_two_weeks': 0, 'playtime_at_review': 302, 'last_played': 1622368618}",german,"Bei den Entwicklern scheint es gravierende Mängel in Sachen Snooker-Regeln zu geben. Physikalisches Wissen oder die Umsetzung dessen ist auch eher mangelhaft.

Es kostet zwar nicht viel, aber Spaß kommt bei diesem Spiel nicht auf.",1581500247,1581500247,False,1,0,0.474308311939239502,0,True,False,False,False,,,
62628094,"{'steamid': '76561199020906572', 'num_games_owned': 0, 'num_reviews': 1, 'playtime_forever': 2323, 'playtime_last_two_weeks': 0, 'playtime_at_review': 626, 'last_played': 1694970059}",english,"Excellent HD graphics and physics. This game also has full support for whichever controller you prefer - mouse, trackball, or gamepad. I personally use a trackball and had no issues setting up or taking shots. Although the game allows you take shots by pushing forward with a mouse, It also allows an option to shoot with the click of a button.",1580309387,1580309387,True,1,0,0,0,True,False,False,False,,,
62528275,"{'steamid': '76561198051517179', 'num_games_owned': 2832, 'num_reviews': 11, 'playtime_forever': 418, 'playtime_last_two_weeks': 0, 'playtime_at_review': 182, 'last_played': 1675699045}",english,"Great Pool game. I have one other Pool game in my library - which WAS also good (had the potential to be great) - but was abandoned by the developer (which released a second game WAY too soon to win my support again). This game however, the developers are supporting their product and still actively engage with the community regarding features and bugs/glitches.

I can definitely recommend this great game. (I have not tried playing against human opponents in online games - but I am really enjoying the Bar Championship)",1580151013,1580151013,True,1,0,0,0,True,False,False,False,,,
61954992,"{'steamid': '76561198339767443', 'num_games_owned': 0, 'num_reviews': 66, 'playtime_forever': 656, 'playtime_last_two_weeks': 0, 'playtime_at_review': 186, 'last_played': 1689549410}",brazilian,"Jogo simples e divertido, várias modalidades de jogo, com opção até 4 jogadores locais ou multi jogador online, e ainda tem bastante personalização entre tacos, bolas e mesas, bem completo vale a pena jogar!",1579220398,1579220398,True,0,0,0,0,True,False,False,False,,,
61906392,"{'steamid': '76561197973713576', 'num_games_owned': 0, 'num_reviews': 3, 'playtime_forever': 1118, 'playtime_last_two_weeks': 0, 'playtime_at_review': 431, 'last_played': 1704315921}",german,"Das beste Pool. Hatte erst die großen, also Pool Nation, Pool Nation FX und Pure Pool. So schön Pure Pool auch aussieht... das Menü ist... hat das von den Entwicklern mal einer überprüft? Nation FX sieht irgendwie nicht so gut aus. Und Nation ist zwar optisch ne Augenweite, aber dieser ""Zwang"" zu besonders Actionreichen Stößen nervt auf dauer gewaltig. Und dann kommt dieses kleine Cue Club daher. Tischgröße anpassbar! Das ist Soooo ein großer Punkt. Das selbe Spiel spielt sich auf einem 6er gaaanz anders als auf nem 9ner.  Die Regeln sind anpassbar. 2D und 3D in einem, beides wird auch heute noch ständig mit Patches verbessert. Alles ist irgendwie einstellbar. Und das Spiel braucht keine Mausakrobatik, man wählt vorm Stoß alles genauestens aus. Es ist einfach die Bombe unter den Billiardspielen. Selbst Snooker ist enthalten. Alle anderen Spiele hab ich deinstalliert. Außer Poolians Billiard 3d. Einfach weil ich auch gerne mal einfach nur Zuschaue. :) Von mir gaaaanz klare Kaufempfehlung, das Beste Billiard weit und breit, nur mit leichten grafischen Abstrichen.",1579127094,1579127094,True,1,0,0,0,True,False,False,False,,,
61801853,"{'steamid': '76561198072875915', 'num_games_owned': 93, 'num_reviews': 81, 'playtime_forever': 401, 'playtime_last_two_weeks': 0, 'playtime_at_review': 392, 'last_played': 1645908491}",english,Good Times...,1578932371,1578932371,True,2,0,0.520211458206176758,0,True,False,False,False,,,
61664070,"{'steamid': '76561199005410399', 'num_games_owned': 0, 'num_reviews': 2, 'playtime_forever': 815, 'playtime_last_two_weeks': 0, 'playtime_at_review': 766, 'last_played': 1605282952}",spanish,muy bueno,1578722161,1578722161,True,0,0,0,0,True,True,False,False,,,
61149986,"{'steamid': '76561198121853976', 'num_games_owned': 0, 'num_reviews': 1, 'playtime_forever': 6808, 'playtime_last_two_weeks': 0, 'playtime_at_review': 6393, 'last_played': 1645291260}",german,Kurzweilig und durchaus motivierend!,1577982960,1577982960,True,0,0,0,0,True,False,False,False,,,
61091894,"{'steamid': '76561197969393212', 'num_games_owned': 0, 'num_reviews': 2, 'playtime_forever': 27988, 'playtime_last_two_weeks': 0, 'playtime_at_review': 4410, 'last_played': 1701209243}",english,"Incredible game get proper mouse driver for your mouse and you´ll love this game.
The snooker part of it is the best i´ve ever tryed.",1577915337,1577915337,True,7,0,0.578329265117645264,0,True,False,False,False,,,
60991044,"{'steamid': '76561198407043944', 'num_games_owned': 102, 'num_reviews': 4, 'playtime_forever': 2323, 'playtime_last_two_weeks': 2, 'playtime_at_review': 387, 'last_played': 1712153559}",schinese,小时候就开始玩一代，印象很深，一代至少玩了500小时。二代和一代相比相差很大。二代不适合用鼠标键盘，适合用手柄玩。3D模式很僵硬，不如手机版本的3D桌球。2D还是不错的，球的击打效果非常丝滑。AI比较有挑战性，就是解球的时候脑子不好使，第一次解不到就永远也解不到了。掌声和欢呼的效果很好，单人游戏时玩的很舒服，音乐也很棒。虽然仍有很多缺点，但也很难找到比这个更好的台球类游戏了。,1577801488,1577801488,True,1,0,0.523809552192687988,0,True,False,False,False,,,
60871158,"{'steamid': '76561197973259706', 'num_games_owned': 0, 'num_reviews': 1, 'playtime_forever': 1288, 'playtime_last_two_weeks': 0, 'playtime_at_review': 1159, 'last_played': 1579640217}",english,"Good billiards game, its also really great that they continue updating and improving it, even so long after its release.",1577660145,1577660145,True,0,0,0,0,True,False,False,False,,,
60817606,"{'steamid': '76561198950995929', 'num_games_owned': 26, 'num_reviews': 1, 'playtime_forever': 894, 'playtime_last_two_weeks': 0, 'playtime_at_review': 482, 'last_played': 1614060569}",english,le jeu est tres fluide et professionnel,1577608689,1577608689,True,1,0,0.506578981876373291,0,True,False,False,False,,,
60659530,"{'steamid': '76561198307540410', 'num_games_owned': 0, 'num_reviews': 5, 'playtime_forever': 8845, 'playtime_last_two_weeks': 0, 'playtime_at_review': 7088, 'last_played': 1696621844}",french,Excellente simulation,1577440711,1577440711,True,1,0,0.506578981876373291,0,True,False,False,False,,,
60590375,"{'steamid': '76561197993685687', 'num_games_owned': 0, 'num_reviews': 440, 'playtime_forever': 1960, 'playtime_last_two_weeks': 0, 'playtime_at_review': 223, 'last_played': 1706694793}",french,"mise à jour répétitives pour pas grand chose,les coups sauvegardés sont mal enregistrés puisque à la relecture plus aucune boule ne rentre comme ça s'est passé,peu de choix de couleurs de boules.Avec toutes ses mise à jours il pourrait y avoir plus de changement.
Trop de mise à jours pour rien.",1577362957,1664611749,False,0,0,0,0,True,False,False,False,,,
60490789,"{'steamid': '76561198986934380', 'num_games_owned': 0, 'num_reviews': 2, 'playtime_forever': 2846, 'playtime_last_two_weeks': 0, 'playtime_at_review': 2577, 'last_played': 1697561136}",english,"A fantastic billiards simulator, if you have played a'lot of Pool & Snooker in real life you will notice that the physics for the rebound shots off the cushions is a little off, just a wee bit tight in my opinion. Other than that it is an excellent game, played 42 hours so far and I think it is a fair substitute for playing on a real table, highly recommended!",1577234254,1577234254,True,1,0,0,0,True,False,False,False,,,
60315325,"{'steamid': '76561198254142725', 'num_games_owned': 0, 'num_reviews': 19, 'playtime_forever': 1793, 'playtime_last_two_weeks': 0, 'playtime_at_review': 884, 'last_played': 1673015920}",german,Just what I was looking for. A billiard game to relax with nice lounge music.,1577020473,1577020473,True,0,0,0,0,True,False,False,False,,,
59310939,"{'steamid': '76561198999454796', 'num_games_owned': 0, 'num_reviews': 2, 'playtime_forever': 1990, 'playtime_last_two_weeks': 0, 'playtime_at_review': 1490, 'last_played': 1682136905}",english,Fun game of pool that is very user friendly. You can customize many things as well. Very realistic looking game of pool.,1575587885,1575587885,True,0,0,0,0,True,False,False,False,,,
58780347,"{'steamid': '76561198029378381', 'num_games_owned': 1229, 'num_reviews': 2, 'playtime_forever': 318, 'playtime_last_two_weeks': 0, 'playtime_at_review': 310, 'last_played': 1690630604}",polish,"Ciągłe aktualizacje, świetna fizyka i dobry klimat do wspólnej gry..",1575137989,1606340581,True,0,0,0,0,True,False,False,False,,,
58677888,"{'steamid': '76561198335855441', 'num_games_owned': 0, 'num_reviews': 4, 'playtime_forever': 1156, 'playtime_last_two_weeks': 0, 'playtime_at_review': 288, 'last_played': 1707752920}",schinese,"经过几年的更新，游戏性非常不错了
",1575089140,1619009473,True,0,0,0,0,True,False,False,False,,,
58632422,"{'steamid': '76561198007690981', 'num_games_owned': 0, 'num_reviews': 19, 'playtime_forever': 301, 'playtime_last_two_weeks': 0, 'playtime_at_review': 165, 'last_played': 1623091359}",english,"Pot as many Balls as you can.  Multiplayer seems quite bugged at the moment, hopefully will be fixed.  Its a fun Pool and Snooker game though. As of June 2021 Multiplayer seems better, but still a time delay when waiting for opponent to take a shot.",1575061916,1623010123,True,2,0,0.513054609298706055,0,True,False,False,False,,,
58453446,"{'steamid': '76561198326433399', 'num_games_owned': 0, 'num_reviews': 4, 'playtime_forever': 2306, 'playtime_last_two_weeks': 0, 'playtime_at_review': 1502, 'last_played': 1702673852}",english,Cue Club 2 and Virtual Pool 4 are my favorite titles for Billiards.  Both titles have some very strong positives. I like the many options in Cue Club 2. I am also very impressed that the developers continue to update the game for players. I would like to see the removal of the cartoon style players. The women need to be dressed in a more modest way for the younger players of the game. Playing against an Ape and a Robot really takes away from the experience.  The many table options and rooms are a real positive.  I would like to see some additional ball designs in the future.  I again praise the developers for their continued support of this great title!,1574964461,1617973328,True,0,0,0,0,True,False,False,False,,,
57674715,"{'steamid': '76561198310830135', 'num_games_owned': 101, 'num_reviews': 6, 'playtime_forever': 2302, 'playtime_last_two_weeks': 0, 'playtime_at_review': 657, 'last_played': 1651604360}",english,"我们需要中文
We need Chinese
中国語は必要
Nous avons besoin de chinois
Wir brauchen chinesisch
Necesitamos chino
potrzebujemy chin
Precisamos de chinês
Нам нужно китайский
เราต้องการภาษาจีน
Χρειαζόμαστε κινέζικα",1574483241,1574483241,True,1,0,0.455019265413284302,0,True,False,False,False,,,
57446266,"{'steamid': '76561198048749957', 'num_games_owned': 0, 'num_reviews': 1, 'playtime_forever': 309, 'playtime_last_two_weeks': 0, 'playtime_at_review': 309, 'last_played': 1574120355}",english,Nice chill game. No stress!,1574120410,1574120410,True,2,0,0.508242487907409668,0,True,False,False,False,,,
57412975,"{'steamid': '76561198047451930', 'num_games_owned': 0, 'num_reviews': 3, 'playtime_forever': 25421, 'playtime_last_two_weeks': 0, 'playtime_at_review': 13789, 'last_played': 1653498817}",polish,"Całkiem fajna gra dość realistyczna problem w grze online długo się przełącza między graczami ,wiele opccji gry",1574071478,1574071478,True,0,0,0,0,True,False,False,False,,,
57406216,"{'steamid': '76561198027505756', 'num_games_owned': 0, 'num_reviews': 68, 'playtime_forever': 5341, 'playtime_last_two_weeks': 0, 'playtime_at_review': 5147, 'last_played': 1620888677}",german,"Es macht Spaß, weil die Bälle doch recht realistisch reagieren und der Umgang mit dem Cue auch recht einfach gehandhabt wird.
In 3D bekommt man schnell das Gefühl von echtem Billard.",1574056270,1574056270,True,2,0,0.501557648181915283,0,True,False,False,False,,,
57234901,"{'steamid': '76561198008620131', 'num_games_owned': 0, 'num_reviews': 12, 'playtime_forever': 1029, 'playtime_last_two_weeks': 0, 'playtime_at_review': 306, 'last_played': 1678481273}",english,"Excellent game, lots of options and modes. Recommended!",1573846398,1573846398,True,2,0,0.513054609298706055,0,True,False,False,False,,,
57174732,"{'steamid': '76561198163443179', 'num_games_owned': 0, 'num_reviews': 254, 'playtime_forever': 221, 'playtime_last_two_weeks': 0, 'playtime_at_review': 93, 'last_played': 1662397006}",english,"It is a game of pool and snooker. it has a lot of game types (8 ball, 9 ball, etc) and it also has difficulty levels so everyone can have their own challenge. Also, you can play it in 2D ( top down view) or 3D which is very cool. I recommend this game to anyone who likes Pool.",1573758406,1573758406,True,5,0,0.521626055240631104,0,True,False,False,False,,,
57093855,"{'steamid': '76561198959424963', 'num_games_owned': 0, 'num_reviews': 2, 'playtime_forever': 29749, 'playtime_last_two_weeks': 0, 'playtime_at_review': 772, 'last_played': 1707221572}",english,good game,1573645656,1573645656,True,2,0,0.513054609298706055,0,True,False,False,False,,,
57071152,"{'steamid': '76561197961692527', 'num_games_owned': 0, 'num_reviews': 10, 'playtime_forever': 1360, 'playtime_last_two_weeks': 0, 'playtime_at_review': 234, 'last_played': 1706723075}",english,fantastic game if you love pool or snooker. played for 3 hours straight .,1573600299,1573600299,True,3,0,0.515302479267120361,0,True,False,False,False,,,
57070006,"{'steamid': '76561198016408863', 'num_games_owned': 0, 'num_reviews': 3, 'playtime_forever': 6018, 'playtime_last_two_weeks': 176, 'playtime_at_review': 207, 'last_played': 1712430452}",english,"Quite repetitive, first one was better",1573598254,1573598254,False,2,0,0.480142027139663696,0,True,False,False,False,,,
56630139,"{'steamid': '76561198004007581', 'num_games_owned': 61, 'num_reviews': 2, 'playtime_forever': 13, 'playtime_last_two_weeks': 0, 'playtime_at_review': 7, 'last_played': 1645377092}",schinese,"我们需要中文
We need Chinese

话说怎么改玩家名？",1573049862,1573049862,True,7,0,0.618528604507446289,0,True,False,False,False,,,
56353052,"{'steamid': '76561198062931899', 'num_games_owned': 0, 'num_reviews': 3, 'playtime_forever': 5526, 'playtime_last_two_weeks': 0, 'playtime_at_review': 4853, 'last_played': 1608867565}",french,extra,1572752253,1572752253,True,1,0,0.506578981876373291,0,True,False,False,False,,,
55978879,"{'steamid': '76561198003169678', 'num_games_owned': 125, 'num_reviews': 26, 'playtime_forever': 2416, 'playtime_last_two_weeks': 0, 'playtime_at_review': 543, 'last_played': 1690211679}",schinese,從小時候玩一代 到現在二代 確實是最好的桌球遊戲~,1572517918,1572517918,True,0,0,0,0,True,False,False,False,,,
55897571,"{'steamid': '76561198011633154', 'num_games_owned': 0, 'num_reviews': 19, 'playtime_forever': 9131, 'playtime_last_two_weeks': 0, 'playtime_at_review': 2048, 'last_played': 1710451868}",german,"Habe nun schon einige Pool Games durch, aber dieses Billard Spiel gefällt mir bisher am besten! 
Die Physik passt einfach und ist glaubwürdig.  
Ausserdem gibt es sehr viel Einstellungsmöglichkeiten. Größe des Tisches, Bälle und Cues. Farbe der Bespannung und Taschen. Man kann sogar die Linien der Tische anpassen!  
Es gibt natürlich auch noch verschiedene Designs der Bälle und Cues. 
Gibts Fragen oder Probleme zum Game, kommt ziemlich schnell eine Antwort vom Entwickler. 
Updates? Fast Wöchentlich!

",1572422541,1572422541,True,4,0,0.54674220085144043,0,True,False,False,False,,,
55854549,"{'steamid': '76561198048048796', 'num_games_owned': 0, 'num_reviews': 678, 'playtime_forever': 2255, 'playtime_last_two_weeks': 0, 'playtime_at_review': 376, 'last_played': 1686687375}",english,good game i love,1572255910,1572255910,True,2,0,0.523164451122283936,0,True,False,False,False,,,
55478176,"{'steamid': '76561198207824368', 'num_games_owned': 0, 'num_reviews': 3, 'playtime_forever': 11457, 'playtime_last_two_weeks': 0, 'playtime_at_review': 11428, 'last_played': 1678544908}",english,Best of all times in its types...,1570364952,1570364952,True,4,0,0.541387975215911865,0,True,False,False,False,,,
55369846,"{'steamid': '76561198052614240', 'num_games_owned': 0, 'num_reviews': 9, 'playtime_forever': 567, 'playtime_last_two_weeks': 0, 'playtime_at_review': 506, 'last_played': 1686785805}",spanish,Cool game to relax the mind.,1569881362,1569881362,True,0,0,0,0,True,False,False,False,,,
55229258,"{'steamid': '76561198014162073', 'num_games_owned': 0, 'num_reviews': 72, 'playtime_forever': 61, 'playtime_last_two_weeks': 0, 'playtime_at_review': 54, 'last_played': 1634448577}",english,"AI is far too good, particularly on Novice setting.  It should have a much higher miss rate than what it has.",1569147073,1569147073,False,0,0,0,0,True,False,False,False,,1569243125.0,"Hi, if you go to 'Options > Match Settings' there are menus for Bar Challenge and Tournament, go in here and adjust difficulty down to Novice or Amateur, this should help. For Quick Matches there are 5 difficulty levels from Novice to Pro, but we will look at adding further controls here to give a broader range of settings. Thanks for the feedback."
55216142,"{'steamid': '76561198152524242', 'num_games_owned': 267, 'num_reviews': 21, 'playtime_forever': 188, 'playtime_last_two_weeks': 0, 'playtime_at_review': 138, 'last_played': 1572446853}",schinese,"我们需要中文
We need Chinese
中国語は必要
Nous avons besoin de chinois
Wir brauchen chinesisch
Necesitamos chino
potrzebujemy chin
Precisamos de chinês
Нам нужно китайский
เราต้องการภาษาจีน
Χρειαζόμαστε κινέζικα",1569077996,1569077996,True,55,2,0.810284256935119629,0,True,False,False,False,,,
54504269,"{'steamid': '76561198128503834', 'num_games_owned': 20, 'num_reviews': 10, 'playtime_forever': 3716, 'playtime_last_two_weeks': 20, 'playtime_at_review': 1161, 'last_played': 1712441561}",english,CUE CLUB my 1st snooker game 1st time i played in 1999 :),1565197646,1565197646,True,0,0,0,0,True,False,False,False,,,
54076403,"{'steamid': '76561198288009562', 'num_games_owned': 0, 'num_reviews': 154, 'playtime_forever': 1994, 'playtime_last_two_weeks': 0, 'playtime_at_review': 1089, 'last_played': 1679145992}",italian,"Divertente e alta rigiocabilita'
Ma da giocatore reale di 8 e 15,italiana e goriziana per piu di 11 anni..posso dire che la meccanica non e' realistica,il  problema piu grosso di questo gioco e' che quando tiri  palle di sponda a effetto....l'effetto che gli dai praticamente non esiste!
per coloro che sono giocatori ""virtuali"" saranno comunque molto felici e apprezzeranno lo sforzo dei sviluppatori ;)",1563035499,1563035499,True,2,0,0.522293031215667725,0,True,False,False,False,,,
54050922,"{'steamid': '76561198362552957', 'num_games_owned': 0, 'num_reviews': 7, 'playtime_forever': 2797, 'playtime_last_two_weeks': 0, 'playtime_at_review': 404, 'last_played': 1705760405}",portuguese,Muito bom,1562926921,1562926921,True,0,0,0,0,True,False,False,False,,,
53995015,"{'steamid': '76561198048562966', 'num_games_owned': 307, 'num_reviews': 23, 'playtime_forever': 4002, 'playtime_last_two_weeks': 0, 'playtime_at_review': 3409, 'last_played': 1708113421}",english,"The definitive pool/snooker game available. Lots of content from tournaments, bar challenges, 8-ball, 9-ball, snooker, speed pool & killer pool (plus more). 

worth a buy!🥊",1562694011,1674853963,True,2,0,0.549071609973907471,0,True,False,False,False,,,
53944386,"{'steamid': '76561198339146141', 'num_games_owned': 0, 'num_reviews': 17, 'playtime_forever': 478, 'playtime_last_two_weeks': 0, 'playtime_at_review': 275, 'last_played': 1562924113}",german,"Sehr geil! Grafik ist top, Musik entspannend und viele Einstellmöglichkeiten.",1562527260,1562527260,True,1,0,0,0,True,False,False,False,,,
53813049,"{'steamid': '76561198039387554', 'num_games_owned': 0, 'num_reviews': 9, 'playtime_forever': 324, 'playtime_last_two_weeks': 0, 'playtime_at_review': 17, 'last_played': 1609019062}",polish,"wg mnie to najlepszy symulator bilarda, w stosunku do poprzednika gorszy jest mechanizm celowania, fizyka jest bardzo dobra, Polecam.",1562430937,1562430937,True,0,0,0,0,True,False,False,False,,,
53575936,"{'steamid': '76561198161361135', 'num_games_owned': 0, 'num_reviews': 1, 'playtime_forever': 43, 'playtime_last_two_weeks': 0, 'playtime_at_review': 43, 'last_played': 1561907592}",schinese,大力出奇迹,1562274067,1562274067,True,0,0,0,0,True,False,False,False,,,
52807388,"{'steamid': '76561198112606289', 'num_games_owned': 11820, 'num_reviews': 10, 'playtime_forever': 16, 'playtime_last_two_weeks': 0, 'playtime_at_review': 16, 'last_played': 1561608394}",koreana,일반 당구게임중에서는 그런되로 할만한 게임같아요~~추천!!!,1561978192,1561978192,True,1,0,0.525547444820404053,0,True,False,False,False,,,
52207298,"{'steamid': '76561198046078098', 'num_games_owned': 0, 'num_reviews': 25, 'playtime_forever': 976, 'playtime_last_two_weeks': 0, 'playtime_at_review': 289, 'last_played': 1562882448}",czech,"Oddechová hra, ve slevě jasná koupě, velmi to připomíná svého času pool na facebooku :) Simulátor to ale opravdu moc není.",1561845217,1561845217,True,0,0,0,0,True,False,False,False,,,
51830185,"{'steamid': '76561198196248437', 'num_games_owned': 0, 'num_reviews': 6, 'playtime_forever': 1708, 'playtime_last_two_weeks': 0, 'playtime_at_review': 1634, 'last_played': 1668783165}",schinese,用来打发时间还不错,1561803204,1561803204,True,0,0,0,0,True,False,False,False,,,
51356056,"{'steamid': '76561198042945138', 'num_games_owned': 790, 'num_reviews': 54, 'playtime_forever': 4130, 'playtime_last_two_weeks': 0, 'playtime_at_review': 3819, 'last_played': 1639896653}",english,"decent pool simulator, Pool Nation is better. Why are all my female opponents big titty thots tho",1561118614,1561118614,True,2,0,0.547735869884490967,0,True,False,False,False,,,
