recommendationid,author,language,review,timestamp_created,timestamp_updated,voted_up,votes_up,votes_funny,weighted_vote_score,comment_count,steam_purchase,received_for_free,written_during_early_access,hidden_in_steam_china,steam_china_location,timestamp_dev_responded,developer_response
93578982,"{'steamid': '76561198115346935', 'num_games_owned': 0, 'num_reviews': 1, 'playtime_forever': 1908, 'playtime_last_two_weeks': 0, 'playtime_at_review': 1894, 'last_played': 1657885167}",french,"jeu merdique

En mode multi, impossible de voir ce que fait l'adversaire en temps réel (peu admissible en 2021) !!!!  Juste droit à une vidéo post coup.

regret sur l'achat ... aucune MAJ n'a corrigé ce prob pourtant essentiel dans une partie à 2!
N'omporte quelle appli sur androïd réalise le temps réel sans probl !!!",1623435713,1623435713,False,0,0,0,0,True,False,False,False,,,
93495534,"{'steamid': '76561198376536814', 'num_games_owned': 455, 'num_reviews': 102, 'playtime_forever': 357, 'playtime_last_two_weeks': 0, 'playtime_at_review': 117, 'last_played': 1668886707}",spanish,10 Point Good,1623297557,1623297557,True,2,0,0.533188283443450928,0,True,False,False,False,,,
93495353,"{'steamid': '76561198111650728', 'num_games_owned': 0, 'num_reviews': 1, 'playtime_forever': 94537, 'playtime_last_two_weeks': 408, 'playtime_at_review': 13555, 'last_played': 1712452940}",english,"This is the best by far pool game out there! Highly recommend picking this up! This game is very realistic, great graphics, music, and has many games to choose from! 6 ball, 7 ball, 8 ball, 9 ball, 10 ball, Snooker, and killer pool! 5 different difficulty levels ranging from novice to pro, and pro is extremely hard to master. I have played 215 hours on this game and have won all the trophies except for the 147 break on snooker and the multiplayer badge where you have to get to 1000 points by just playing games in multiplayer mode for a 5 star rating.

Suggestions for improvement: Have some additional in game music. I like the tracks but wish there were a couple new ones added. 
For multiplayer mode, after completing a match, have it return to the multiplayer screen rather than the main menu. Have an option to rematch against the opponent after completing a match.
",1623297201,1623297201,True,4,0,0.571984469890594482,0,True,False,False,False,,,
93331947,"{'steamid': '76561198220518907', 'num_games_owned': 12, 'num_reviews': 8, 'playtime_forever': 3661, 'playtime_last_two_weeks': 0, 'playtime_at_review': 863, 'last_played': 1628899866}",english,"GREAT GAME, ENJOY IT VERY MUCH",1623032900,1623032900,True,0,0,0,0,True,False,False,False,,,
93012679,"{'steamid': '76561198250627610', 'num_games_owned': 0, 'num_reviews': 2, 'playtime_forever': 3561, 'playtime_last_two_weeks': 0, 'playtime_at_review': 3280, 'last_played': 1706263808}",polish,.,1622579150,1622579150,True,0,0,0,0,True,False,False,False,,,
92989050,"{'steamid': '76561198028886968', 'num_games_owned': 0, 'num_reviews': 5, 'playtime_forever': 213, 'playtime_last_two_weeks': 6, 'playtime_at_review': 191, 'last_played': 1711598131}",english,"In my opinion, this is the best billiards game out there.
Tons of options and gorgeous graphics. Uses very little
system resources so it can probably play on most
current systems. Very relaxing,too.",1622550252,1622550252,True,0,0,0,0,True,False,False,False,,,
92930668,"{'steamid': '76561198073887933', 'num_games_owned': 51, 'num_reviews': 11, 'playtime_forever': 5121, 'playtime_last_two_weeks': 0, 'playtime_at_review': 403, 'last_played': 1668797614}",english,"Quite possibly the best pool & snooker game I have ever played. The physics are really good, and general play is great. Very enjoyable.",1622465437,1622465437,True,0,0,0,0,True,False,False,False,,,
92645034,"{'steamid': '76561198104787875', 'num_games_owned': 372, 'num_reviews': 22, 'playtime_forever': 1971, 'playtime_last_two_weeks': 0, 'playtime_at_review': 1171, 'last_played': 1708199774}",russian,Топ,1622066549,1622066549,True,1,0,0.488165676593780518,0,True,False,False,False,,,
92395574,"{'steamid': '76561198393379789', 'num_games_owned': 553, 'num_reviews': 330, 'playtime_forever': 6246, 'playtime_last_two_weeks': 0, 'playtime_at_review': 3485, 'last_played': 1691045977}",schinese,"这个游戏的成就基本上都是金闪闪的（解锁率低于10%）。而实际上这些金闪闪的成就基本上都没有难度。为什么解锁率那么低呢，因为AI对手的动作慢吞吞，所有动作还不能跳过，都要等球权交给你的时候你才能玩。节奏实在是比较慢，大多数人玩一段时间就失去耐心了。

仅有少数成就（其中一个是斯诺克单杆147）比较难。",1621666882,1621666882,True,0,0,0,0,True,False,False,False,,,
92037889,"{'steamid': '76561198041544132', 'num_games_owned': 0, 'num_reviews': 10, 'playtime_forever': 842, 'playtime_last_two_weeks': 0, 'playtime_at_review': 213, 'last_played': 1651333784}",dutch,Multiplayer zijn gewoon robots,1621081867,1621081867,True,1,0,0.525862038135528564,0,True,False,False,False,,,
91934359,"{'steamid': '76561198168499227', 'num_games_owned': 13, 'num_reviews': 8, 'playtime_forever': 616, 'playtime_last_two_weeks': 0, 'playtime_at_review': 218, 'last_played': 1702644279}",english,"The original 'Cue Club' game from many years ago was already wonderful, now this one has it all in 3D (optionally) and plays perfectly. Absolutely recommended!",1620921360,1620921360,True,1,0,0,0,True,False,False,False,,,
91806996,"{'steamid': '76561198088890298', 'num_games_owned': 252, 'num_reviews': 25, 'playtime_forever': 2455, 'playtime_last_two_weeks': 0, 'playtime_at_review': 1181, 'last_played': 1708898070}",english,Great game!,1620716780,1620716780,True,0,0,0,0,True,False,False,False,,,
91806394,"{'steamid': '76561198051740093', 'num_games_owned': 16449, 'num_reviews': 40, 'playtime_forever': 2725, 'playtime_last_two_weeks': 0, 'playtime_at_review': 854, 'last_played': 1620997910}",english,"The best pool / snooker game on steam! All variants of pool and snooker are in the game (6, 7, 8 ball...) and the AI can be set to a really challenging difficulty. You can switch between 2d and 3d view during a match and change the look of nearly everything (tables, balls...) to your liking. The devs are still updating and improving the game. Since there´re no additional costs like dlc, even the normal price is absolutely fair.",1620715610,1620715610,True,7,0,0.571290373802185059,0,True,False,False,False,,,
91596217,"{'steamid': '76561198357538344', 'num_games_owned': 0, 'num_reviews': 1, 'playtime_forever': 4399, 'playtime_last_two_weeks': 0, 'playtime_at_review': 70, 'last_played': 1700215978}",schinese,"我们需要中文!!!
We need Chinese!!!
中国語は必要!!!
Nous avons besoin de chinois!!!
Wir brauchen chinesisch!!!
Necesitamos chino!!!
potrzebujemy chin!!!
Precisamos de chinês!!!
Нам нужно китайский!!!
เราต้องการภาษาจีน!!!
Χρειαζόμαστε κινέζικα!!!
",1620406182,1620406182,True,0,0,0,0,True,False,False,False,,,
91281555,"{'steamid': '76561198051663166', 'num_games_owned': 0, 'num_reviews': 22, 'playtime_forever': 9329, 'playtime_last_two_weeks': 116, 'playtime_at_review': 1819, 'last_played': 1712349558}",english,I like it.,1619948884,1619948884,True,0,0,0,0,True,False,False,False,,,
91027685,"{'steamid': '76561198055567257', 'num_games_owned': 2326, 'num_reviews': 120, 'playtime_forever': 1275, 'playtime_last_two_weeks': 0, 'playtime_at_review': 462, 'last_played': 1623671596}",turkish,Güzel bir bilardo simulatörü multiplayer de var ama rakipleriniz çoğunlukla bot oluyor,1619563889,1619563889,True,0,0,0,0,True,False,False,False,,,
90913977,"{'steamid': '76561198240993000', 'num_games_owned': 0, 'num_reviews': 11, 'playtime_forever': 4711, 'playtime_last_two_weeks': 0, 'playtime_at_review': 2475, 'last_played': 1631715182}",english,"This game would be fun if the balls behaved ONLY according to physics, and the physics of billiard balls (elastic contact with cloth friction) is decent in this game.  However, your luck depends on your opponent. The last player in the pro tournament (Maya-something) is like no other, an unlike Ronnie O'Sullivan, this pro can pot reds from behind the red's triangle into the baulk end pockets anytime ... when you try to play safe, one of your balls will always be left open for him, and he never leaves anything pots or easy safety shots for you. His luck is too much to be believed.  All the competitors before him at the pro-level are lucky to pot three balls in row.  This lack of realism makes playing the pro-tournament ... less than fun. It's not ""challenging"" it's just ridiculous.",1619377112,1619377112,False,7,1,0.577495813369750977,0,True,False,False,False,,,
90790251,"{'steamid': '76561197977536331', 'num_games_owned': 2816, 'num_reviews': 131, 'playtime_forever': 3841, 'playtime_last_two_weeks': 0, 'playtime_at_review': 3841, 'last_played': 1619638714}",italian,"Il miglior gioco del biliardo in circolazione, Palla 8, Palla 9, Snooker e tutti in diverse varianti. Una marea di opzioni colori delle stecche dei tavoli ecc...  5 livelli di difficoltà. Possibilità di giocare in 2D o 3D. L'unico difetto potrebbe essere il numero degli avversari che sono forse un po' pochi e alla lunga stufa di scontrarsi sempre con gli stessi giocatori.",1619198546,1619198546,True,2,0,0.517241418361663818,0,True,False,False,False,,,
90784593,"{'steamid': '76561199093220580', 'num_games_owned': 0, 'num_reviews': 2, 'playtime_forever': 1848, 'playtime_last_two_weeks': 0, 'playtime_at_review': 1072, 'last_played': 1666460641}",english,"great fun goog graffics controller friendly
",1619191409,1619191409,True,0,0,0,0,True,False,False,False,,,
90489145,"{'steamid': '76561197995000532', 'num_games_owned': 283, 'num_reviews': 67, 'playtime_forever': 306, 'playtime_last_two_weeks': 0, 'playtime_at_review': 263, 'last_played': 1706042240}",english,"Best Pool and Snooker game on Steam after many years. Recommended, just buy it, it has everything this kind of genre can offer.",1618698602,1618698602,True,0,0,0,0,True,False,False,False,,,
90206503,"{'steamid': '76561198010947052', 'num_games_owned': 46, 'num_reviews': 2, 'playtime_forever': 6876, 'playtime_last_two_weeks': 0, 'playtime_at_review': 605, 'last_played': 1667247918}",polish,"Trzyma poziom 1. CC. Jak dla mnie w tego typu grach najważniejsza jest fizyka, a ta działa tu bez zarzutu. Z sentymentu do pierwszej części kupiłem, zainstalowałem i nie żałuję, choć cena mogłaby być trochę niższa.",1618256700,1618256700,True,0,0,0,0,True,False,False,False,,,
89549201,"{'steamid': '76561199013340941', 'num_games_owned': 0, 'num_reviews': 1, 'playtime_forever': 10757, 'playtime_last_two_weeks': 0, 'playtime_at_review': 5254, 'last_played': 1709314703}",german,"Super Spiel, fast wie im richtigen Leben! Bestes Billardspiel das ich kenne.",1617352201,1617352201,True,0,0,0,0,True,False,False,False,,,
89226130,"{'steamid': '76561199028733075', 'num_games_owned': 0, 'num_reviews': 1, 'playtime_forever': 289, 'playtime_last_two_weeks': 0, 'playtime_at_review': 289, 'last_played': 1617515576}",english,too many bugs,1616902757,1616902757,False,0,0,0.45602986216545105,0,True,False,False,False,,,
89209972,"{'steamid': '76561198011231860', 'num_games_owned': 450, 'num_reviews': 27, 'playtime_forever': 239, 'playtime_last_two_weeks': 0, 'playtime_at_review': 194, 'last_played': 1651781315}",german,"ein wirklich wunderschönes POOL spiel. ich bin sehr begeistert.
errinert mich auch mit 2D an die alte DOS zeit pool.exe
yep für fr/sonnabend abend bei ein paar bier ideal :D",1616879967,1616879967,True,0,0,0,0,True,False,False,False,,,
89110696,"{'steamid': '76561198168477437', 'num_games_owned': 0, 'num_reviews': 64, 'playtime_forever': 685, 'playtime_last_two_weeks': 0, 'playtime_at_review': 411, 'last_played': 1709499911}",english,game is awesome but when playing online its not easy to connect with friends and there is a wait when switching players turn. these are online issues only and not big ones.,1616757804,1616757804,True,0,0,0,0,False,False,False,False,,,
88492327,"{'steamid': '76561198165608954', 'num_games_owned': 0, 'num_reviews': 1, 'playtime_forever': 5193, 'playtime_last_two_weeks': 0, 'playtime_at_review': 2238, 'last_played': 1710351798}",german,"Sehr unterhaltsam, dabei sehen die Kugel- und Ballbewegungen realistisch aus. Auch das Spiel gegen einen menschlichen Partner (statt Computergegnern) macht einfach Spaß.",1615829778,1615829778,True,0,0,0,0,True,False,False,False,,,
88397188,"{'steamid': '76561198194490061', 'num_games_owned': 0, 'num_reviews': 15, 'playtime_forever': 469, 'playtime_last_two_weeks': 0, 'playtime_at_review': 99, 'last_played': 1640444176}",spanish,"Buen simulador de billar, sería interesante si pudieran añadirle algunos retos de billar para que sea mas completo.",1615687683,1615687683,True,0,0,0,0,True,False,False,False,,,
87183656,"{'steamid': '76561199102787659', 'num_games_owned': 114, 'num_reviews': 4, 'playtime_forever': 274, 'playtime_last_two_weeks': 0, 'playtime_at_review': 225, 'last_played': 1687971464}",english,العاب الموب احسن منها,1613936106,1613936106,False,0,1,0.386178284883499146,0,True,False,False,False,,,
87036992,"{'steamid': '76561198860463354', 'num_games_owned': 0, 'num_reviews': 4, 'playtime_forever': 3256, 'playtime_last_two_weeks': 0, 'playtime_at_review': 392, 'last_played': 1693244994}",russian,"Лучший бильярд из того во что играл, а играл во многие били, и ещё не маловажное не требователен к железу!",1613753583,1613753737,True,1,0,0.488165676593780518,0,True,False,False,False,,,
86563581,"{'steamid': '76561198054429292', 'num_games_owned': 0, 'num_reviews': 12, 'playtime_forever': 6498, 'playtime_last_two_weeks': 0, 'playtime_at_review': 214, 'last_played': 1710515136}",polish,"Zdecydowanie polecić mogę tą grę. Jestem fanem gier bilardowych. Gierka stworzona po to by odpocząć sobie od wszystkich gier AAA
Pierwszy raz z tą grą zetknąłem się w 2000 roku kiedy to ojciec pokazał mi, że taki bajer występuje na PC. Ale to była pierwsza część serii. Szczerze warta swojej ceny. A jeśli jeszcze upolujecie ją na promocji to jeszcze lepiej. Każdy kto lubi gry bilardowe na pewno polubi ten tytuł.",1613240121,1613240121,True,0,0,0,0,True,False,False,False,,,
86160209,"{'steamid': '76561198007372721', 'num_games_owned': 0, 'num_reviews': 16, 'playtime_forever': 7191, 'playtime_last_two_weeks': 0, 'playtime_at_review': 6938, 'last_played': 1698156542}",english,the best pool/snooker game on steam in my opinion have many more hours than steam says as i had no internet for a year well worth the money.,1612726222,1612726222,True,2,0,0,0,True,False,False,False,,,
85963453,"{'steamid': '76561198359459848', 'num_games_owned': 0, 'num_reviews': 9, 'playtime_forever': 2609, 'playtime_last_two_weeks': 0, 'playtime_at_review': 1723, 'last_played': 1614461158}",english,"I used to love the original Cue Club back in the days and I love Cue Club 2 as well. There are fancier pool games available in the market, but this one is simple, has lower system requirements, and still has fancy graphics.

The achievements don't seem to be that interesting though. I wish beating Level 5 would unlock the achievements from Level 1-4 as well, but it doesn't work that way. So, one has to beat Level 1-5 separately.

Let's see if I can get all the achievements.",1612469886,1612469886,True,1,0,0,0,True,False,False,False,,,
85801150,"{'steamid': '76561197996585334', 'num_games_owned': 790, 'num_reviews': 65, 'playtime_forever': 268, 'playtime_last_two_weeks': 0, 'playtime_at_review': 247, 'last_played': 1612246247}",english,"Don't let the bad character and cover art fool you.  This is likely the best pool and snooker game on Steam.  With tons of available options, customization and rule variations.",1612244930,1612244930,True,0,0,0,0,True,False,False,False,,,
85580786,"{'steamid': '76561199045234975', 'num_games_owned': 0, 'num_reviews': 2, 'playtime_forever': 5551, 'playtime_last_two_weeks': 0, 'playtime_at_review': 1448, 'last_played': 1653081905}",english,Awesome Game . Probably one of the best Pool and Snooker games I have played in a long time excellent graphics and easy gameplay would suit any age group from 9-99 don't just take my word for it give it a try you won't regret it 100% .,1611951491,1611951491,True,0,0,0,0,True,False,False,False,,,
85365657,"{'steamid': '76561198059213155', 'num_games_owned': 0, 'num_reviews': 3, 'playtime_forever': 4272, 'playtime_last_two_weeks': 482, 'playtime_at_review': 1398, 'last_played': 1712373392}",schinese,very good game,1611639872,1611639872,True,0,0,0,0,True,False,False,False,,,
85348483,"{'steamid': '76561198154119743', 'num_games_owned': 0, 'num_reviews': 1, 'playtime_forever': 2193, 'playtime_last_two_weeks': 0, 'playtime_at_review': 744, 'last_played': 1633968527}",english,fun,1611610416,1611610416,True,0,0,0,0,True,False,False,False,,,
85348237,"{'steamid': '76561198189398850', 'num_games_owned': 0, 'num_reviews': 6, 'playtime_forever': 1028, 'playtime_last_two_weeks': 0, 'playtime_at_review': 1006, 'last_played': 1625744344}",english,"graphics ,ball movment are good , the controls after 2021 update still suck its a shame ...",1611610083,1611610083,False,0,0,0,0,True,False,False,False,,,
85161805,"{'steamid': '76561198104698815', 'num_games_owned': 0, 'num_reviews': 16, 'playtime_forever': 316, 'playtime_last_two_weeks': 0, 'playtime_at_review': 194, 'last_played': 1705414877}",polish,"totalne guwno,w opcji,,nowicjusza gość gra jakby 20 lat grał,nie idzie pokonać,co za kretyńska gra",1611345447,1611345447,False,1,0,0,0,True,False,False,False,,,
84930746,"{'steamid': '76561198849946100', 'num_games_owned': 276, 'num_reviews': 61, 'playtime_forever': 15, 'playtime_last_two_weeks': 0, 'playtime_at_review': 15, 'last_played': 1611002925}",spanish,"Que asco de juego, perdí mi tiempo comprando esta porquería. Lo descargué pensando que era mejor que la primera versión, pero esto apesta. Es una burla de juego. No lo recomiendo si te gustó la primera versión.",1611003090,1611003090,False,1,0,0.437086105346679688,0,True,False,False,False,,,
84902619,"{'steamid': '76561198394757068', 'num_games_owned': 0, 'num_reviews': 1, 'playtime_forever': 368, 'playtime_last_two_weeks': 0, 'playtime_at_review': 351, 'last_played': 1709223859}",french,"tres bon jeu detente assurer
",1610965169,1610965169,True,0,0,0,0,True,False,False,False,,,
84431280,"{'steamid': '76561198078468384', 'num_games_owned': 0, 'num_reviews': 104, 'playtime_forever': 205, 'playtime_last_two_weeks': 0, 'playtime_at_review': 185, 'last_played': 1610391034}",english,"Pretty simple & I would recommend this game, however it's a huge shame that when playing multiplayer, the shots plays for the shooter, and then the other player watches is. It'd be so much better if you could both watch the shots at the same time rather than a replay, a huge stain on what would otherwise be a superb multiplayer game.",1610288211,1610288211,True,0,0,0,0,True,False,False,False,,,
84421430,"{'steamid': '76561198274940527', 'num_games_owned': 164, 'num_reviews': 13, 'playtime_forever': 4207, 'playtime_last_two_weeks': 7, 'playtime_at_review': 488, 'last_played': 1712054904}",english,"On one hand I don't mind this game. The physics are ok, there are lots of game modes to choose from, there are tournaments and single play and the controls are workable. 

The practice table is pretty bad, the controls for setup aren't great and there should be preset practice challenges (like the pros use for practice) where you can practice specific elements of your game (cue ball control around the table, a certain spin, swerve, angles off the cushions etc). You don't even have a setting where you can have the colours replaced (which breaks any chance of creating some rhythm mid practice).

The main reason I can't recommend this game is that the AI on the harder levels are the worlds most unbelievable flukers. You can put them in the hardest spot and they pull out a crazy double or foul but then snooker you (in a gamemode where you don't get a freeball/ball in hand/opponent play again) so you lose a life as well. The odd once in a blue moon fluke is ok (as in the real game) but I have played an AI who has had 3 outlandish flukes in one frame. 

I quite enjoy playing the harder levels outside of this as you can see how to improve your overall game/matchplay skills (you can see the spin and cue angle they are using before their shot). But the harder level games will always be close margins of victory and I can not reward a game where you can work hard and virtually earn a victory against a tough opponent to lose to outrageous flukes.",1610276483,1610277130,False,0,0,0.469798654317855835,0,True,False,False,False,,,
84319840,"{'steamid': '76561198813179453', 'num_games_owned': 0, 'num_reviews': 5, 'playtime_forever': 3484, 'playtime_last_two_weeks': 0, 'playtime_at_review': 220, 'last_played': 1696623720}",czech,Pohodová hra . Dobře se hraje. Zabaví na dlouho,1610145257,1616368636,True,0,0,0,0,True,False,False,False,,,
84308946,"{'steamid': '76561198330305542', 'num_games_owned': 0, 'num_reviews': 26, 'playtime_forever': 345, 'playtime_last_two_weeks': 0, 'playtime_at_review': 200, 'last_played': 1611647113}",english,better than most pool games on steam. simple gameplay mechanics with decent graphics. overall would give this game a solid 8/10,1610133510,1610133510,True,0,0,0,0,True,False,False,False,,,
84246752,"{'steamid': '76561198010322549', 'num_games_owned': 772, 'num_reviews': 25, 'playtime_forever': 8833, 'playtime_last_two_weeks': 0, 'playtime_at_review': 3273, 'last_played': 1708729661}",polish,"Bardzo dobry symulator gry w bilard, odświeżony po latach, bo tak naprawdę niewiele się różni od pierwszej wersji gry z 1999 roku. Poprawiona oprawa graficzna, dodany widok w wersji 3D i tablica rekordów. Niezła muzyka w grze, chociaż w jedynce była nieco lepsza, a tak poza tym, niemal to samo co ponad 20 lat temu.",1610053416,1610053416,True,0,0,0,0,True,False,False,False,,,
83996500,"{'steamid': '76561198260876913', 'num_games_owned': 0, 'num_reviews': 43, 'playtime_forever': 3431, 'playtime_last_two_weeks': 1, 'playtime_at_review': 436, 'last_played': 1712154232}",english,simple and nice,1609774392,1609774392,True,0,0,0,0,True,False,False,False,,,
83863932,"{'steamid': '76561198084831039', 'num_games_owned': 0, 'num_reviews': 24, 'playtime_forever': 3249, 'playtime_last_two_weeks': 0, 'playtime_at_review': 204, 'last_played': 1704271215}",english,"Long time ago, I played Cue Club, I liked it, I was looking for Cue Club in steam, and I found that Cue Club 2 was out, so I tried it, it is almost the same formula that Cue Club has. I like this game because it is simple, the controls are good (I use a keyboard and a mouse), the graphics of the backgrounds and AI players, for me, are ok, not so spectacular, the background music, for me, is ok. Cue club2 allows to adjust the level of difficulty. I like the simplicity of the game. If you are a simple guy like me and like pool games, give this game a try.",1609636213,1609636213,True,0,0,0,0,True,False,False,False,,,
83539521,"{'steamid': '76561198005994240', 'num_games_owned': 0, 'num_reviews': 6, 'playtime_forever': 253, 'playtime_last_two_weeks': 0, 'playtime_at_review': 228, 'last_played': 1710531064}",english,"If you love playing pool, then you'll love this one! Good graphics, game play is good. It's a good game for Pool lovers.",1609305346,1609305346,True,0,0,0,0,True,False,False,False,,,
83203001,"{'steamid': '76561198048338441', 'num_games_owned': 0, 'num_reviews': 3, 'playtime_forever': 733, 'playtime_last_two_weeks': 0, 'playtime_at_review': 377, 'last_played': 1693091246}",english,Best game for Snooker I've come across on PC for sure!,1608991695,1608991695,True,0,0,0,0,False,False,False,False,,,
82904394,"{'steamid': '76561198089260579', 'num_games_owned': 0, 'num_reviews': 17, 'playtime_forever': 280, 'playtime_last_two_weeks': 0, 'playtime_at_review': 13, 'last_played': 1645262078}",english,"Seems like nice game, if anywhere in the game of snooker it actually told one how to nominate a colour then I might have finished a frame.  Not helpful when this git keeps telling me to hurry up while I'm trying to figure it out. I live in hope.

Hope has arrived thanks to help from the developer, I'll go again and update. Originally gave it a thumbs down by mistake which I have corrected.

Got the hang of things now, been playing snooker, nice lounge, nice sounds, very relaxing.",1608667868,1623691002,True,0,0,0,0,True,False,False,False,,1608720956.0,"Hi, thanks for this feedback. To nominate a colour in snooker, move the round aiming target directly over the ball then click the left mouse button or gamepad A button. I hope this helps."
82626507,"{'steamid': '76561198111452727', 'num_games_owned': 0, 'num_reviews': 8, 'playtime_forever': 3148, 'playtime_last_two_weeks': 0, 'playtime_at_review': 2298, 'last_played': 1645203923}",english,great game,1608300962,1608300962,True,0,0,0,0,True,False,False,False,,,
