recommendationid,author,language,review,timestamp_created,timestamp_updated,voted_up,votes_up,votes_funny,weighted_vote_score,comment_count,steam_purchase,received_for_free,written_during_early_access,hidden_in_steam_china,steam_china_location,timestamp_dev_responded,developer_response
155290061,"{'steamid': '76561198171908327', 'num_games_owned': 0, 'num_reviews': 73, 'playtime_forever': 1149, 'playtime_last_two_weeks': 0, 'playtime_at_review': 1149, 'last_played': 1704440509}",english,Great game. Loved the pixel art. Storyline was original. Puzzles were a good difficulty. Recommend anyone to play.,1704440580,1704440580,True,1,0,0.502881824970245361,0,True,False,False,True,,,
140553061,"{'steamid': '76561198050289175', 'num_games_owned': 91, 'num_reviews': 4, 'playtime_forever': 1687, 'playtime_last_two_weeks': 0, 'playtime_at_review': 1687, 'last_played': 1687524184}",english,What a fantastic game.  Would love a sequel.  Cheers to the devs,1687525847,1687525847,True,1,0,0.502881824970245361,0,True,False,False,True,,,
137500185,"{'steamid': '76561198048668312', 'num_games_owned': 11251, 'num_reviews': 311, 'playtime_forever': 496, 'playtime_last_two_weeks': 0, 'playtime_at_review': 496, 'last_played': 1681183491}",russian,"Прекрасный квест, про который никто не знает (16 обзоров за 7 лет это такое…). Ну, или как в случае со мной, все эти годы держат её в библиотеке, изредка поглядывая на крайне неказистый внешний вид и откладывая её в еще более дальний ящик. А ведь у этого приключения есть всё -  отличный фэнтезийный сюжет, как обычно начинающийся с амнезии главного героя, очутившегося в каком-то средневековом королевстве, и постепенно приходящий к путешествиям во времени и манипуляции событиями прошлого (ход рискованный, но вполне себя здесь оправдывающий). Есть замечательный добрый юмор, который так приятно щекочет чувство ностальгии по квестам из 90-х. Есть очень логичное и понятное действие, в котором ты почти всегда догадываешься, что же игра от тебя хочет, подходя к решению загадок игры не перебором всех предметов инвентаря на всём вокруг, а с холодной головой и пониманием логики игры. Визуально игра, конечно, не особо блещет, пиксель-арт может и умеет быть красивым, но здесь он простенький и особых дизайнерских изысков не демонстрирует. Но с точки зрения насыщенности локаций деталями, того количества вещей, которые ты можешь познать, игра чувствует себя прекрасно, давая игроку ощущение настоящего приключения. Проходится игра часов за 5-6, не давая истории выдохнуться и потерять свою свежесть, а заканчиваясь именно там, где она и должна завершиться. Игра не спекулирует ностальгичностью, а отдаёт ей дань уважения, создавая при этом свой характер и своё лицо, за что создателям большой почёт и уважение.",1682791212,1682791212,True,19,0,0.705034911632537842,0,False,False,False,True,,,
131296398,"{'steamid': '76561198064392148', 'num_games_owned': 0, 'num_reviews': 231, 'playtime_forever': 296, 'playtime_last_two_weeks': 0, 'playtime_at_review': 296, 'last_played': 1674335161}",english,"What a charming tale to play! Clearly inspired by the games from the old days, this little gem is a fun and well-designed PnC game filled with adventure, romance and magic.
It is definitely a must play for any PnC games afficionados!",1674336474,1674336474,True,2,0,0.526424169540405273,0,True,False,False,True,,,
122548874,"{'steamid': '76561197966890002', 'num_games_owned': 183, 'num_reviews': 4, 'playtime_forever': 308, 'playtime_last_two_weeks': 0, 'playtime_at_review': 308, 'last_played': 1662928567}",english,"This really scratched the itch for a well written, classic Sierra / LucasArts style adventure game. Funny, cute, and fun little fairy tale adventure in the tone of Princess Bride or Stardust that never felt bloated for the sake of making it longer.

I played through the entire game on a Steam Deck, and it worked beautifully that way.",1663697419,1663697536,True,1,0,0.502881824970245361,0,True,False,False,True,,,
122123290,"{'steamid': '76561198072182182', 'num_games_owned': 0, 'num_reviews': 352, 'playtime_forever': 215, 'playtime_last_two_weeks': 0, 'playtime_at_review': 215, 'last_played': 1662951823}",english,"A hapless young adventure-player gets sucked into a world of fairy tale intrigue and romance along with his trusty pink crowbar and three vegetarian gumballs.  You know, it's really goofy -- purposefully so most of the time -- but it's really earnest and sweet, and has enough self-knowledge to capitalize on its own naivete without being [i]too[/i] self-aware.  Oh, that self-awareness!  It'll reach right up and poke you in the a$$ when you least expect it!  Fun fact:  the scariest character in the game is none other than Artie, the rock-collecting forest guardian.  That guy will literally [i]kill[/i] you over a colorful mineral.

Puzzles are solid, not too difficult, but occasionally spike into head-scratcher territory.  You won't tear your hair out, I think.

I want to brag on the game's storytelling a little.  Despite the fact that this is a relatively simple fantasy world (the time travel element does mix things up in the second act), and even though the game is only about three hours long, it does an [i]excellent[/i] job at building a believably strong relationship between Lily and Paul -- you can totally see [i]why[/i] they care about each other so much.  It doesn't matter that Paul is only about 1.5 degrees removed from Guybrush Threepwood.   

(I originally got a little ticked because I couldn't blow the game up to fullscreen, and I was ready to drop it out of hand -- but then, I'd been going around humming Michael Jackson's ""Man in the Mirror"" all day long in anticipation of playing it, and on top of that, I remembered that I've played through things a lot clunkier and glitchier than this, so I gave it whirl . . . and it was a very pleasant experience!  I actually had a lot more fun with [i]Beard in the Mirror[/i] than that overrated sepia turd [i]Grim Fandango[/i], I kid you not.)",1662952756,1663328212,True,4,0,0.561800658702850342,0,True,False,False,True,,,
96197274,"{'steamid': '76561198118948364', 'num_games_owned': 0, 'num_reviews': 2, 'playtime_forever': 501, 'playtime_last_two_weeks': 0, 'playtime_at_review': 459, 'last_played': 1627829217}",english,brilliant old school point and click witty and the puzzles are not too easy if you like point and click you will love this,1626977995,1626977995,True,1,0,0.502881824970245361,0,True,False,False,False,,,
94349762,"{'steamid': '76561198014453566', 'num_games_owned': 1236, 'num_reviews': 185, 'playtime_forever': 455, 'playtime_last_two_weeks': 0, 'playtime_at_review': 455, 'last_played': 1609593521}",english,"[url=https://store.steampowered.com/curator/7520163/]You can find hundreds of other reviews through our Curator page[/url]

[h1]""It really grows on you.""[/h1]

It would be very easy to label The Beard in the Mirror as a throwback to the early years of adventure gaming, so I’ll do just that. The Beard in the Mirror is a throwback to the early years of adventure gaming, resplendent in its simple pixel graphics and dumb icon interface. It very much wants to roost among the classics, specifically Sierra’s seminal library. To this end, it offers you a points system that rewards you for extracurricular puzzle solving, and even provides a myriad of ways for your character to meet his humourous end. However, it is, after all, a modern game aping a classic, so rather than smugly kill you off and banish you back to your last save, it describes how you would have died before backtracking you to your poorly-made decision and hopes hindsight has provided you some wisdom.

It’s the story of Paul, an aimless twenty-something trying to find some direction in life after leaving home and graduating college. He’s awoken one morning by a strange girl at his bedside who claims to know him, but he holds no memory of. Distraught at not being recognised, the girl flees, and Paul chalks this night-time visit up as a particularly vivid dream. This mindset is challenged when he awakes and finds himself locked in his room. After ransacking the place to locate a key, he finds his bedroom door now leads to a forest path he’s pretty certain wasn’t there the morning before. Neither was the angry guy, waiting in ambush, who accuses Paul of numerous crimes he considers himself completely incapable of performing.

Paul doesn’t remember the world he’s forced to explore, but the world seems to remember him. The majority of the adventure is trying to make sense of that, and finding his place inside the chaos of it all. Though this sounds like quite a heavy task, Paul spends most of his journey unable to comprehend the weight of it all. Much of the game makes fun of his inability to treat his situation with the gravity it deserves. For example, when forced to ransack his room looking for a solution to the locked door, you’ll quickly find his favourite crowbar, spray-painted pink and lovingly adorned with a frilly bow. You’d think this the ideal tool for prying open his door and securing his freedom, but he’s very attached to his crowbar and doesn’t want to risk chipping the paintjob.

To the credit of the developer, there’s a kind of absurdist humour running roughshod throughout. A local cobbler finds the idea that someone isn’t interested in his exquisite wares so impossible, he takes disinterest in his goods as a genius bargaining ploy, and haggles himself into oblivion. Guards that show no interest in gatekeeping new areas behind routine fetch quests are cross-examined by Paul for not living up to the trope correctly. It’s all pretty light-hearted, until the reasons Paul can’t remember anything starts to become apparent wherein, well, it’s still pretty light-hearted. But there’s certainly a shift in tone as the game processes; it never forgets that it’s a goofball at heart that’s asking you to make your way through a foreign world, solving all of life’s problems with whatever rubbish you’ve managed to cram into your pockets, but it also never forgets how things started. With a mystery.

The Beard in the Mirror makes you work towards the answers you’ll find, but it doesn’t drag them out. With around a four hour lifespan, it’s never going to compare in size with some of the goliaths of old, but it doesn’t need to. It knows the story it wants to tell, and that story gets told. It fleshes out a world that shouldn’t exist, finishing a fable that it never really starts and shunts Paul begrudgingly along into adulthood. It also provides three unique uses for vegan-produced vegetable-flavoured gumballs. That’s a remarkable achievement in itself.

[url=http://www.honestgamers.com/15178/pc/the-beard-in-the-mirror/review.html]// Full Review[/url]",1624640533,1624640533,True,4,0,0.58040928840637207,0,False,False,False,False,,,
90915331,"{'steamid': '76561198021615574', 'num_games_owned': 0, 'num_reviews': 41, 'playtime_forever': 76, 'playtime_last_two_weeks': 0, 'playtime_at_review': 76, 'last_played': 1619372044}",english,"I would give a sideways review if they were available, as this seems like a true labor of love, a tribute to a lost age of gaming and not a terrible experience.  OTOH, I couldn't get myself to finish it.  The story was pretty trite and the graphics were jarring (a really bad color palate).  I smiled a few times but in the end I just didn't think it was very good.

It was competent though, and I would say to the devs not to give up if they are still making games.",1619378783,1619378783,False,0,0,0.48410952091217041,0,True,False,False,False,,,
74996704,"{'steamid': '76561198116211741', 'num_games_owned': 920, 'num_reviews': 220, 'playtime_forever': 866, 'playtime_last_two_weeks': 0, 'playtime_at_review': 221, 'last_played': 1616181945}",english,"This game is great!  It is a strong addition to your adventure game collection.

On the surface, it has a story reminiscent of classic games such as Universe or Curse of Enchantia.  A young man wakes up to find he has been transported to a fantasy world.

Soon, however, it soon becomes apparent that there’s a little bit more going on with the story!  We have a fun little plotline involving time travel, and some surprisingly memorable characters make an appearance!  A nice dash of humor keeps the tone of the game light, but ultimately the story was the driving force that kept me playing.

I played this game about a year ago, and every time I scroll past it in my library, I get a little nostalgic for it.  It really left a very positive impression on me.  I am definitely going to end up playing through this one several more times.
",1598523748,1598523748,True,2,0,0.51589047908782959,0,False,False,False,False,,,
63681899,"{'steamid': '76561198198570321', 'num_games_owned': 0, 'num_reviews': 28, 'playtime_forever': 426, 'playtime_last_two_weeks': 0, 'playtime_at_review': 426, 'last_played': 1581962397}",english,"I decided to upvote this game after finishing it - it has a decent (but not very engaging) story with some charming moments, mostly good puzzles and great music.

The Beard in the Mirror is a fantasy adventure game made by 2 people over a long time: it's a work of love but it's a work that was done on limited resources: the artwork could use some additional detail and shading, many things were not animated and many of the scenes were largely empty.

The story is a good take on ""stranger in a strange land"" but there were several points where the solution to puzzles were not very believable. The conversations were all right but there wasn't much depth to the world. There are some funny one-liners.

All in all, a good old-school point-and-click adventure, I'm glad I played it but there's not much replay value. Recommended to any fan of the genre.

Note: like others mentioned, I ran into issues with the game resolution. Keep in mind, that this is an old AGS adventure so it's display support is not as up-to-date as the current version of AGS. Windowed mode with 4x scaling worked for me; none of the full-screen ones did. If you have issues during start-up, run the winsetup utility that sits in the game folder to configure resolution.",1581963274,1581963568,True,0,0,0.497118145227432251,0,True,False,False,False,,,
55342566,"{'steamid': '76561198001071004', 'num_games_owned': 1514, 'num_reviews': 98, 'playtime_forever': 412, 'playtime_last_two_weeks': 0, 'playtime_at_review': 412, 'last_played': 1569794592}",english,"Point & Click adventures are my favorite genre of computer game.  I am a fan with equal appreciation for Sierra and LucasArts titles.  The Beard in the Mirror has a Sierra type interface with the humor of a LucasArts adventure.  The graphics and animation are high quality, although the game fades to black whenever a sophisticated animation would have been required and ends up wrecking the immersion.  There are ways to die, but the rather than forcing you restore a previous save, the game allows you to rewind and make alternate choices.  There are a couple of timed and arcade sequences.  Be careful and save often because I ran in to a situation where the rewind feature restored the game state with only a few seconds left on the timer and made it almost impossible to progress without extreme precision.  I was able to perform the correct maneuver after multiple attempts, but it would have been less stressful if I had a save game that left me with more time on the clock.

The writing for the game was edited well.  I did not find any typos or translation errors that are typical of indie releases.  The music was adequate -- it doesn't have a soundtrack that I would listen to outside of the game itself.  I did not earn the maximum amount of points in my initial playthrough, and I have not yet decided if I want to try again and earn them all.  I don't believe that the missing points will have much of an impact on the narrative or experience.

Should you play this game?  If you are a fan of point & click adventures, then yes.

Developers: Please use a version of the AGS engine that allows for borderless fullscreen gameplay on future titles.",1569796360,1569796360,True,1,0,0.502881824970245361,0,True,False,False,False,,,
48091995,"{'steamid': '76561198016989249', 'num_games_owned': 0, 'num_reviews': 145, 'playtime_forever': 1023, 'playtime_last_two_weeks': 0, 'playtime_at_review': 816, 'last_played': 1546620355}",english,"Great quest with very interesting storyline, very good puzzles and great atmosphere. 100% recommendation for lovers of good old games.",1546595354,1546595354,True,4,0,0.52069389820098877,0,True,False,False,False,,,
47852657,"{'steamid': '76561198031670464', 'num_games_owned': 578, 'num_reviews': 485, 'playtime_forever': 443, 'playtime_last_two_weeks': 0, 'playtime_at_review': 443, 'last_played': 1477534707}",greek,"Στα [+]
•  Η ιστορία δέν είναι κακή, κάποιοι γρίφοι είναι έξυπνοι καί μερικοί διάλογοι καλογραμμένοι. 

Στα [-]
•  Ερασιτεχνικά γραφικά, κακοφτιαγμένες καί άδειες εικόνες, χωρίς ιδιαίτερο ενδιαφέρον. 
•  Συνηθισμένοι καί απλοικοί κατά κανόνα γρίφοι. 
•  Εκνευριστικά καί άσκοπα φλύαρο. Αν χρονομετρήσει κανείς τήν διάρκεια τών διαλόγων καί τήν διάρκεια τής κίνησης τού ήρωα, τής εξερεύνησης τών χώρων, τών δοκιμών μέ τά αντικείμενα τού inventory κλπ. κλπ. δράσης, η αναλογία θά είναι γύρω στά 3-5 πρός 1! 

Βαθμολογία: 1,5/5

http://adventures-index10.blogspot.com/2013/08/the-beard-in-mirror-lizo-paul-tba-home.html",1545875765,1545875765,False,0,0,0,0,True,False,False,False,,,
45534332,"{'steamid': '76561198302208299', 'num_games_owned': 287, 'num_reviews': 149, 'playtime_forever': 587, 'playtime_last_two_weeks': 0, 'playtime_at_review': 474, 'last_played': 1538801689}",english,"I only tried this because it was marked down super low in one of Steam's big sales and I'm always desperate for new Point-and-Click adventure games but I'm glad I did.  I don't mind the old fashioned 16-bit pixelated graphics.  The graphics just felt nostalgic and normal for a P&C adventure game to me.  They really went all out with making it feel retro as they offer a modern take on the old fashioned ""hint-line"" but instead you can send them a message.  That played both against and in favor of this game for me.  On the one hand I'm not an 8 year old kid with all summer to figure out a puzzle anymore... so if I get stuck I'd like to be able to look for a quick hint or walkthrough so I can keep going without having to send a message and wait for response.  On the other hand being stuck with something (can't remember what now) led me to the one semi-walkthrough video which was a livestream on YouTube where he reads the text out loud for you and gives the characters voices... his voices were almost more fun than playing the game myself.  So yeah, be aware there isn't really a walkthrough if you get stuck but if you have the time to try different combinations and click through various items on the screen you should be able to get there eventually without one.  Most of the puzzles are pretty easy, the game largely leads you from one thing to another.

There is a lot of humor in the game and in Sierra-esque style it has some humorous deaths but I gotta be honest it's more cheesy humor.  The whole game feels like King's Quests cheesy 3rd cousin, the dialogue especially gets quite cheesy.  However the overall story isn't bad.  It's a guy out of his element, there's some time travel, there's magic, sword fights, romance... for a fairly short game it actually packs quite a lot in and considering the budget they made it with it's pretty good all around but you might find yourself cringing at some of the more cheesy awkward parts.

If you already like retro P&C Adventure games give this one a shot you'll probably enjoy it.  If you're new to the Genre maybe stick with a classic like the King's Quest or Monkey Island series as your introduction.",1540973250,1541006105,True,2,0,0.489408284425735474,0,True,False,False,False,,,
44456136,"{'steamid': '76561197972012674', 'num_games_owned': 110, 'num_reviews': 1, 'playtime_forever': 896, 'playtime_last_two_weeks': 0, 'playtime_at_review': 896, 'last_played': 1535595391}",english,"This is the second point and click game that I've played in the last year along with Broken Age since probably the original release of Grim Fandango (Appropriately, I bought this game at the Retrogamecon where this game fit right in).  The two games couldn't be more different in story, but where Broken Age had a much larger production budget and a lot more flash to it, you find that isn't as necessary with these types of adventures as long as you enjoy the journey.

I loved the old Sierra games when I was a kid, and I felt right at home when I loaded this game up and played through.  The story itself would have been right at home in that era if not for some of the more modern influences/reflections (Which don't detract from the story).  The story itself isn't flashy, and it's not meant to be.  

I've read some reviews and some people are expecting Lucasarts-in-their-prime level storytelling from a 2 person development team, but that would be a mistake.  The charm in this game is that it feels like the story has a personal connection to the developer, and I think that comes across really well.

I hope we get to see more from this team, and learn more about Paul's story.",1535596922,1535596922,True,1,0,0.502881824970245361,0,False,False,False,False,,,
42503244,"{'steamid': '76561197964345647', 'num_games_owned': 921, 'num_reviews': 250, 'playtime_forever': 164, 'playtime_last_two_weeks': 0, 'playtime_at_review': 164, 'last_played': 1528180464}",english,"Disclaimer: Special thanks to the developer [url=https://store.steampowered.com/search/?developer=Oh%2C%20a%20Rock%21%20Studios]Oh, a Rock! Studios[/url] for providing me the key and the opportunity to explore and give an honest review of their indie adventure game.


Pixel Art: 2/5......(Nothing flashy)
Immersion: 2/5....(Not a very engaging story) 
Gameplay: 2/5.....(Classic adventure pixel hunting) 
Controls: 3/5.....(Basic point & click) 
Value: 2/5........(Over priced)
Difficulty: 3.5/5...(Puzzles can be obscure) 
--------------
Overall 2.2 (Difficulty always excluded)


I often want to support indie developers, but I have to say I cannot recommend this game, especially for its asking price...

I have played SO many Adventure Game Studio productions that were free and more entertaining.

I appreciate their efforts, but this game just was not for me and I could not justify the cost.

The graphic design is very basic and probably its biggest draw back.  If the story was engaging, I could over look this, but nothing was really speaking to me :(
",1528179592,1528179592,False,3,0,0.457294076681137085,0,False,True,False,False,,,
