recommendationid,author,language,review,timestamp_created,timestamp_updated,voted_up,votes_up,votes_funny,weighted_vote_score,comment_count,steam_purchase,received_for_free,written_during_early_access,hidden_in_steam_china,steam_china_location,timestamp_dev_responded,developer_response
41672002,"{'steamid': '76561197990448462', 'num_games_owned': 0, 'num_reviews': 256, 'playtime_forever': 206, 'playtime_last_two_weeks': 0, 'playtime_at_review': 206, 'last_played': 1524617854}",english,"You don't get into the Adventure Game Studio scene if you don't love oldschool point-and-clicks, but The Beard in the Mirror really wears its love for LucasArts and Sierra adventures on its sleeve. It especially delights in letting you get killed in ridiculous Sierra-esque ways but does so with a modern sensibility: you won't lose progress and there are no apparent unwinnable states. 

BitM's puzzles just drip with the classic 90s silliness, but in a way where one step usually clearly leads you to the next. They often feel every bit as silly as Gabriel Knight 3's infamous cat-hair mustache puzzle, but far less demanding of absurd leaps of moon-logic. The least intuitive of the puzzles, in fact, are often one-step solutions that, if all else fails, can be brute-forced. The more complex the puzzle, the more clearly the solution comes together. It's gratifying to play a game that feels like it belongs in that classic milieu without throwing away what we've learned about accessibility and fairness in game design.

The story itself is probably the weakest link -- a suitable but convoluted and sometimes confusing magic-fueled romp through time and space. It's not the sort of thing I'd make a franchise of, but it's a decent frame for a fun fan-letter to classic adventures. This is the first point-and-click from ""Oh, a Rock!"" Studios, whose main output is visual novels, but I hope they keep at it. It's a better first effort than I've seen from some of my favorite adventure devs. I'm excited to see where this goes.",1524619234,1524620248,True,8,0,0.640297591686248779,0,False,True,False,False,,,
41231613,"{'steamid': '76561198301499572', 'num_games_owned': 0, 'num_reviews': 39, 'playtime_forever': 1416, 'playtime_last_two_weeks': 0, 'playtime_at_review': 1416, 'last_played': 1522686917}",english,"I liked that you could fast travel by pressing ESC. All P&C should have a fast travel option.

Good humor and dialogue.

Graphics are typical pixel art. Color scheme is nice and calming.

The time-travelling aspect of the story went completely over my head...too confusing. Just seems like a nightmare time loop, imo...

The game is short (and I take forever to finish games). But I also finished this quickly because I really enjoyed playing this.

A light, funny, short P&C.",1522687019,1522687019,True,3,0,0.547837495803833008,0,True,False,False,False,,,
30237395,"{'steamid': '76561198044691780', 'num_games_owned': 0, 'num_reviews': 10, 'playtime_forever': 623, 'playtime_last_two_weeks': 0, 'playtime_at_review': 623, 'last_played': 1487504943}",english,"A true nostalgia trip for early 90's pixely point&click adventure game fans. An ordinary, somewhat shy guy gets whisked away to a fantasy land and tasked with a quest that he neither understands much of or feels up to - but nevertheless sets out on this unexpected journey of discovery and growth. Along the way he'll make friends and enemies. He'll meet some crazies and non-human forms of inteligent life. As you'd expect from a fantasy tale, there's swords, magical creatures - and love. But all of that has its own unique flavor, specific to the creators -- a wife and a husband -- and the flerd between Paul and Lily feels all the more personal and adorkable for that. The game itself leans to the comedic side, and the puzzles especially require some unorthodox, out-of-the-box thinking -- but while the solutions might not be evident at once, they're fair and require only that you mind your surroundings and inventory. I enjoyed it thoroughly, and while I've never played King's Quest or Simon the Sorcerer (which, I think, might've been major inspirations), as a LucasArts adventure fan I some of my favorite things out of it, too.

Pros:
- the old-school graphics! Today's mainstream where games seem to revel in being hi-res festivals of murkiness -- and I love me some pixels and saturated, juicy colors
- the comedy - I've always preferred the funny point&clicks with odd-ball characters, and this one has plenty
- the heart - the game's a passion project that was made on and off for 10 years! You have to admire this kind of devotion!

Cons:
- there's one Click Time Event that I found annoying (but the creators say there's an option to skip it if you've failed twice)
- one puzzle leads to a dead end after much effort taken, which seems a bit unfair (but the actual solution isn't far away, actually)",1488276506,1488276506,True,5,0,0.569249749183654785,0,True,False,False,False,,,
29706593,"{'steamid': '76561197993154288', 'num_games_owned': 0, 'num_reviews': 22, 'playtime_forever': 141, 'playtime_last_two_weeks': 0, 'playtime_at_review': 104, 'last_played': 1511507933}",english,Had a lot of fun playing this -- took around 4 hours (Steam isn't showing the playtime correctly for some reason).   Thanks for the adventure!,1486254369,1486254369,True,2,0,0.489722400903701782,0,True,False,False,False,,,
27851473,"{'steamid': '76561198043971561', 'num_games_owned': 887, 'num_reviews': 2, 'playtime_forever': 353, 'playtime_last_two_weeks': 0, 'playtime_at_review': 352, 'last_played': 1499867754}",english,"A fun and well-designed adventure that is brimming with humor and captures the style and feel of classic Sierra adventure games but without being mind-numbingly hard.

It's well-worth a purchase for any fans of classic adventure games.
",1480263969,1480263969,True,4,0,0.526156306266784668,0,False,False,False,False,,,
26258518,"{'steamid': '76561198059623957', 'num_games_owned': 0, 'num_reviews': 5, 'playtime_forever': 278, 'playtime_last_two_weeks': 0, 'playtime_at_review': 278, 'last_played': 1477627480}",english,"Amazing story, setting, characters, puzzles...everything. This game was a blast to play. The puzzles weren't overly difficult, but they weren't too easy either. The story and characters are engaging and hilarious. I loved every second of it.",1477627757,1477627757,True,9,1,0.585126876831054688,0,True,False,False,False,,,
26247762,"{'steamid': '76561198030733627', 'num_games_owned': 0, 'num_reviews': 8, 'playtime_forever': 281, 'playtime_last_two_weeks': 0, 'playtime_at_review': 281, 'last_played': 1477584787}",english,"This was a nice retro-graphic point-and-click adventure.  It took me about 4 hours to play through, which I consider to be a good length for the $10 price.  The story starts off a bit confusing, however it does make sense as you play through.  An interesting take on an ""amnesic character"" in a strange land.

The puzzles were not overly simple but never lead to my being so confused that I couldn't finish.  After completing the story I felt satisfied, and its got a nice lead up for a sequel which I'd be glad to buy if they make it.

If you're a fan of old-school adventures with a fantasy setting I'd definately recommend it.",1477586052,1477586052,True,15,1,0.684160590171813965,0,True,False,False,False,,,
26222762,"{'steamid': '76561197984737819', 'num_games_owned': 0, 'num_reviews': 74, 'playtime_forever': 40, 'playtime_last_two_weeks': 0, 'playtime_at_review': 39, 'last_played': 1479529153}",english,"I LIKE this Kinda strange ""guy out of his element game"" that plays and feels very old skool...some decent humor so far -hoping for more comedy ... I am not very far yet but Ill stick with it for a bit and update my review-

I am still having issues with FULLSCREEN--
 I get an error when trying to go to full screen mode REGARDLESS of my selections in the AGS tool... I even installed AGS and no... the best I can do is get it to run at 1280 x 800 in a window- unchecking the window box simply causes an error message to display- 

https://s17.postimg.org/ke6abf9i7/issues.png

https://s17.postimg.org/7y9khog67/ags.png",1477437642,1477700383,True,9,2,0.438117504119873047,0,True,False,False,False,,,
