recommendationid,author,language,review,timestamp_created,timestamp_updated,voted_up,votes_up,votes_funny,weighted_vote_score,comment_count,steam_purchase,received_for_free,written_during_early_access,hidden_in_steam_china,steam_china_location,timestamp_dev_responded,developer_response
123263856,"{'steamid': '76561199393624846', 'num_games_owned': 150, 'num_reviews': 76, 'playtime_forever': 356, 'playtime_last_two_weeks': 0, 'playtime_at_review': 356, 'last_played': 1664767555}",turkish,Bi poh anladıysam arab olam awk.,1664767905,1664767905,True,0,0,0,0,True,False,False,True,,,
101118121,"{'steamid': '76561198246431050', 'num_games_owned': 0, 'num_reviews': 40, 'playtime_forever': 1639, 'playtime_last_two_weeks': 0, 'playtime_at_review': 1501, 'last_played': 1634361964}",english,Hell Fucking Yeah this game is badass the cats are cute pussies and are gonna destroy the cute female dogs/bitches this game is fucking amazing you can clean their shit and earn money and you can fucking have super cute cats its fucking perfect.,1634353685,1634353685,True,0,0,0,0,True,False,False,False,,,
62196948,"{'steamid': '76561198193015934', 'num_games_owned': 0, 'num_reviews': 3, 'playtime_forever': 375, 'playtime_last_two_weeks': 0, 'playtime_at_review': 375, 'last_played': 1579636687}",english,its a great game,1579636727,1579636727,True,0,0,0,0,False,True,False,False,,,
54833354,"{'steamid': '76561197974484281', 'num_games_owned': 2306, 'num_reviews': 1398, 'playtime_forever': 232, 'playtime_last_two_weeks': 0, 'playtime_at_review': 232, 'last_played': 1561648241}",english,Bad,1566882559,1566882559,False,0,0,0.455198168754577637,0,False,False,False,False,,,
29206526,"{'steamid': '76561198035473538', 'num_games_owned': 1343, 'num_reviews': 13, 'playtime_forever': 422, 'playtime_last_two_weeks': 0, 'playtime_at_review': 422, 'last_played': 1484322260}",english,"A standard ""defend-the-king"" game in a cat skin. The premise is interesting but the game just doesn't deliver. 

The earlygame relies too much on 'grinding' through a separate mini-game which involves scooping out a litterbox - read: repetitive poop scoop which is no fun at all. No health bars on the regular enemies makes it more of a guessing game rather than a strategy challenge. And the biggest issue I have with this game is the combination of the bosses having too much health, being able to spawn multiple minions and that individual arrows fired are rendered - I came to write this review because I [u]literally[/u] spent an hour going from level 1 to 50, and took the final boss down to half health... only to be greeted by a pop-up which said ""Fatal memory overflow"". Clicking ""OK"" killed the game... and all my progress.

A quick check of the Discussions showed that memory and game crashes have been an issue for at least 6 months.

0/10 will not recommend. Impossible to complete.",1484239134,1484239134,False,3,0,0.576568007469177246,0,False,False,False,False,,,
28883755,"{'steamid': '76561198262329144', 'num_games_owned': 168, 'num_reviews': 8, 'playtime_forever': 1207, 'playtime_last_two_weeks': 0, 'playtime_at_review': 199, 'last_played': 1632361496}",russian,"Короче я ошибался, игра по своему годная(я раньше думал это симулятор кошачьего толчка), но есть баги, когда игра может вылетать(из-за быстрых событий в игре), тут оказывается можно в толчке сутками не сидеть, а есть хитрые быстрые способы заработать бабла( я просто раньше эту механику не замечал, короче быстро можно поднять денег на ворах, они очень много за раз воруют, особенно если рядом с ним поставить мечника в защитной стойке), ну и второй режим меня даже больше прикольнул, когда нужно штурмовать крепость, он открывается после каких-то условий, в целом неплохо, есть моменты с которыми я немного не согласен и наличие багов, но поиграть можно.
И да ребят, я её через столько лет спустя смог пройти=)",1483223161,1617997692,True,0,0,0.553903341293334961,0,True,False,False,False,,,
28615616,"{'steamid': '76561198075820042', 'num_games_owned': 3556, 'num_reviews': 454, 'playtime_forever': 313, 'playtime_last_two_weeks': 0, 'playtime_at_review': 256, 'last_played': 1482628620}",english,"Simple turret defense game featuring cats.
Out of memory CTD often.",1482628661,1482628661,False,0,0,0.464527010917663574,0,False,False,False,False,,,
23716655,"{'steamid': '76561198059286918', 'num_games_owned': 1004, 'num_reviews': 992, 'playtime_forever': 316, 'playtime_last_two_weeks': 0, 'playtime_at_review': 316, 'last_played': 1466085910}",russian,"Хочешь типа планшетную игру в стимач? а хуй тебе .Иди на роботу говно чисти.
-Какое говно ,начальник я поиграть хочу.
-ГАВНО ЧИСТИ. Ты чистишь кошачье говно с лотка а там находишь бабос а за бабос покупаешь апгрейды и вообще все.
-Начальник вы ебанутый? Что одна валюта и на апгрейды и на армию.
-О какой ты сообразительный,на тебе спрей -пшикай на гавно  и чисти гвоно. Потрушивай лопаткой,кидай гавно в пакет .
-Начальник я хочу планшетную парашу а не фармить монеты чистя кошачий сортир.
-ПИДАРАС БЛЯ говно чисти.

10 с 10 Чистки симуляторов кошачьего сортира.
(А по сути игра говна,лагает одна валюту на все и фармар бабла за щет чистки сортира- это пиздец ребзя)
",1466640610,1466640610,False,3,0,0.367709845304489136,0,False,False,False,False,,,
23432488,"{'steamid': '76561197995326858', 'num_games_owned': 0, 'num_reviews': 11, 'playtime_forever': 562, 'playtime_last_two_weeks': 0, 'playtime_at_review': 562, 'last_played': 1465572934}",english,"7/10
Cute/silly fun, well balanced, challenging, slightly tedious.

I bought it during the 50% off sale just to give it a try. My first time playing, I enjoyed it enough that I played for almost three hours straight.

Some people have mentioned a problem launching the game, but I haven't encountered that, nor any other problems.

I get why some people are getting stuck. Near the beginning, your progress will be a crawl unless you do the two mini games at least once each. Once you do this, you're able to buy some upgrades that make the battles go much better. Once you get a few upgrades, the battles themselves will give you all the money you need. They're very well balanced so that it's a tough challenge to come out ahead on money, but if you plan it right, you will.

The mini games are just silly phone-app type games that are a bit monotonous, but they're not terrible. They're just there as a way for you to earn extra money IF you need to. They help to ensure that you won't be stuck if you can't come out ahead in the battles. In one, you have to feed the cats in a dumbed down version of a diner game. In the other, you have to scoop their litter box. The only real challenge or interest in the litter box game is just seeing how fast you can rack up the money and how many hidden treasures you can find.

There's also a spy-dog on the main screen who offers to sell you items at very high prices. I found out by accident that once you buy these, they are permanently available to you in the main game at a small cost. Once you can buy some of these, it makes getting to higher waves in the main game much easier, which means you'll gain plenty of money in every battle.

At $2.50, I consider this a great buy. It's cheesy fun, something different.  $5 is probably about just right for this game if it speaks to you, but if you can get it on sale, I recommend it even if you're just somewhat curious.",1465293978,1465294157,True,3,0,0.523809552192687988,0,True,False,False,False,,,
22837769,"{'steamid': '76561198138509083', 'num_games_owned': 192, 'num_reviews': 23, 'playtime_forever': 269, 'playtime_last_two_weeks': 0, 'playtime_at_review': 12, 'last_played': 1590584183}",schinese,给好评的原因很简单，这游戏应该是我在某宝上1元喜加一买的。还是用steam半价打折卷买的我已经记不清了。去年12月，他掉了一张闪亮的卡牌。我就挂了25元出售，结果今天买出去了。囧,1462595613,1462595613,True,2,2,0.535763382911682129,0,False,False,False,False,,,
22241207,"{'steamid': '76561197985759517', 'num_games_owned': 6121, 'num_reviews': 72, 'playtime_forever': 215, 'playtime_last_two_weeks': 0, 'playtime_at_review': 158, 'last_played': 1463627448}",english,"Game won't launch, dev non-responsive for over a month. Take a pass on this game.",1459797208,1459797208,False,15,0,0.644276320934295654,2,False,False,False,False,,,
20891668,"{'steamid': '76561198050135590', 'num_games_owned': 1031, 'num_reviews': 77, 'playtime_forever': 225, 'playtime_last_two_weeks': 0, 'playtime_at_review': 225, 'last_played': 1454236292}",english,"If you like scooping poop, this is game for you!",1454326944,1454326944,True,1,5,0.367904067039489746,0,False,False,False,False,,,
20877668,"{'steamid': '76561197963927864', 'num_games_owned': 0, 'num_reviews': 184, 'playtime_forever': 208, 'playtime_last_two_weeks': 0, 'playtime_at_review': 208, 'last_played': 1454268442}",japanese,"ネコの王に俺はなるッ！！
攻めてくる犬軍団と戦うゲーム
戦闘はタワーディフェンスみたいな感じ

Chowでネコの兵士に餌を食わせて
Pottyでネコのトイレ掃除でお金を稼いで
アップグレードして戦闘という流れ

戦闘は犬軍団が何Waveか攻めてきて
一定Waveごとにすげぇ硬いボスが出てくる
裏口に兵士を配置すると戦闘中にお金を稼いでくれる
ネコの王様のHPがなくなったら負けで
またトイレ掃除をする羽目になる

ネコのトイレからは戦闘で使うアイテムも発掘できるのと
アップグレードの金額がすげぇ高いのと
戦闘中にも常にお金が要るので
ネコのトイレ掃除はかなり一生懸命やらないといけない
犬軍団が超強いので
プレイ時間の大半をネコのトイレ掃除に費やすかもｗ

ゲームの中で一生懸命ネコのトイレ掃除をしたい人は買い

・戦闘時のアイテム効果
ミルク：兵士を回復
ハンマー：ドアを修理
毛糸玉：転がして敵にダメージ&敵を押し戻す
ランタン：蜂のタゲを取る
魚の骨：敵にダメージを与える罠
スーパーバブルス：兵士にバリアを張る
ネコのトイレ：敵を減速
catnip：兵士をパワーアップ",1454263118,1454263118,True,7,0,0.588466942310333252,0,False,False,False,False,,,
20177191,"{'steamid': '76561198123139182', 'num_games_owned': 7808, 'num_reviews': 21, 'playtime_forever': 288, 'playtime_last_two_weeks': 0, 'playtime_at_review': 286, 'last_played': 1465891002}",english,"still crashing with ""out of memory error"". avoid it. btw you recommend 8 GB RAM for a 90's style ~flash game! WOW...",1451650529,1451650529,False,2,1,0.373772740364074707,0,False,False,False,False,,,
19822714,"{'steamid': '76561198019191114', 'num_games_owned': 426, 'num_reviews': 17, 'playtime_forever': 309, 'playtime_last_two_weeks': 0, 'playtime_at_review': 309, 'last_played': 1450701154}",english,"I tried, but never got through the first boss fight at the 10th wave. Lost interest because it's not clear how to proceed - do I need to grind harder for me money to unlock more powerful stuff before I can kill the boss, or am I doing something totally wrong?

I'd happily switch my tactics if that's the problem, but am not interest in a pure grindfest.",1450701874,1450701874,False,5,0,0.561493098735809326,0,False,False,False,False,,,
18892436,"{'steamid': '76561197970602587', 'num_games_owned': 6364, 'num_reviews': 3660, 'playtime_forever': 149, 'playtime_last_two_weeks': 0, 'playtime_at_review': 149, 'last_played': 1446734165}",english,"https://youtu.be/oHcbiUmg6rw

Cat based tower defense with a pun based title should be right up my ally.  However, 'Reigning Cats' crashed multiple times while play and has a punishingly slow progression speed crippled by the need to play repetitive mini-games to earn game currency.",1446739095,1446739095,False,0,0,0.467557281255722046,1,False,False,False,False,,,
18438520,"{'steamid': '76561197998603809', 'num_games_owned': 0, 'num_reviews': 7, 'playtime_forever': 722, 'playtime_last_two_weeks': 0, 'playtime_at_review': 722, 'last_played': 1444710962}",english,"I cannot recommend this game in its current state as it has several flaws; as of Oct. 11, 2015.

One major flaw: Bugs. The game has crashed several times on me while playing one of the ""mini-games"". In this mini-game you clean the communal cat litter box. You essentially shovel excrement when it pops up in the litter box and while shoveling you can happen to find all sorts of items... or get nothing its a cr*p shoot. If you are not shoveling, then you are spraying to rid the communal litter box of stench. 
The game has crashed on me consistently when shoveling when clicking moderately fast. And crashed once while spraying the stench. Others have reported it crashing while clearing waves. Fortunately, that didn't happen to me. This would be extremely painful as there is no auto-saving. So, if the game closes while clearing waves, then you lost all of the progress. You have to complete all of the waves or exit the current wave and Save to keep all of your progress.

The other flaw is Design/Ideas. As with other tower defense games, you can unlock and upgrade your defense units. This game has a one time purchase feature with a buff for all of your units versus upgrades for individual units. These upgrades are accomplished with money. As it is a tower defense game, you would think the majority of your money could be made with clearing waves.... Unfortunately this is not the case, at least not in the beginning. The mini-games was where I made the most money. There are two. One is a kind of ""feed your troops"" game which I was a little confused about at first as there was no mention of what to do. I did figure it out, but you can only attempt this mini-game after clearing some waves. A decent amount of money can be made from this. However, this presents some difficulty as you need money to purchase upgrades to progress further.
The other mini-game is maintaining the litter box, which I mentioned has problems above. It has been frustrating to try to save money for upgrades only to have it crash and lose all the time attempting to dig for gold. Why is this one of the main ways to make money in a tower defense game? Also, there are items that you can only find while digging in the litter box, you cannot purchase these in a store. The only way to purchase these items is if you unlock the airlift support feature and then the items you can purchase are completely random. When these items are purchased, you must immediately use them; you can't save the items for when you need them. 

There is a feature to increase the speed of the game.... by one speed. For some of the bosses, dealing with them is very tedious and you wish there was an increase speed button to increase the speed even more to get through. As once my units where established, there was nothing else for me to do but sit and watch my units slowly decrease the bosses health bar. 

I did eventually beat the game without getting all the upgrades. Tip to beat the game: get lots of items from the litter box. After I did, it unlocked one of the modes. However, this disabled the ability to level up my units as they were upgraded to the maximum level. The achievements for this game require you to reach the max level for upgrades. This is no longer possible with my current game. There is no feature to start a new game; I would have to uninstall the game and then reinstall it or clear the saved files for the game. All things I have to do outside the game, not in the game. As all my units are fully upgraded and no other upgrades are available, money becomes useless. There is nothing to strive for aside from trying to clear as many waves as possible, which just becomes tedious as some of the bosses just take time to kill. You can just walk away and come back and the boss will be dead. A few of the bosses do take effort. But overall, this game in its current state doesn't have me wanting more. 

I will say I did have one interesting experience. I was listening to music while maintaing the communal litter box when some epic music songs started playing. Shoveling cat excrement while listening to epic music was interesting and took some of the dullness out of what I was doing. 

Synopsis: Don't buy in its current state. It becomes tedious to play. Granted the game is cheap, if you do purchase the game, don't set your expectations high.",1444625939,1444625939,False,2,0,0.540407180786132813,0,False,False,False,False,,,
18176150,"{'steamid': '76561198127087302', 'num_games_owned': 2225, 'num_reviews': 77, 'playtime_forever': 897, 'playtime_last_two_weeks': 0, 'playtime_at_review': 439, 'last_played': 1459704671}",german,"Geil! Ich darf die Sch♥♥♥e von Katzen wegmachen und bekomm dafür immer um die 100 Dollar.
Damit kann ich meine Mitzen aufrüsten gegen böse Hunde, die meine Katzenburg angreifen.
Nach getaner Schlacht gehts auf zum Futter Restaurant, wo ich die Füttern darf. Natürlich fressen die Katzen viel zu schnell, so dass einige von ihnen es mit §&%$""$ Danken. Andere freuen sich und geben mir Geld.
Damit kann ich meinen Mitzen König und seine Burg hochleveln. 

Manchmal verliert man aber auch gegen eine Biene... -.-
Die hat sich einfach auf dem Auto eines Hundes mit ihrem Nest gemütlich gemacht. seufz...
",1443122626,1443122626,True,2,0,0.556735336780548096,0,False,False,False,False,,,
17963467,"{'steamid': '76561198079748456', 'num_games_owned': 0, 'num_reviews': 51, 'playtime_forever': 1109, 'playtime_last_two_weeks': 0, 'playtime_at_review': 1016, 'last_played': 1466956866}",english,"This game is fun when it is working.. The game for several people keeps crashing. When you are farming poop for money it may crash but the most fustrating part is when it crashing during end game boss!!! The game is unplayable if you are looking to complete it or maintain a stable game.

(Updates: Please read comments for further important info on the game.)

If you want to play it casual sure go for it. The game is cute.. A basic tower defense game with mainly kittens and puppies! You build your castle and you must defend it against several animals like bees and bad puppies! As you farm in either this shop serving cat customers or in the cat litter scooping up poop it sure has several hours of playing time to keep you entertained (when the game isnt crashing) 

http://steamcommunity.com/sharedfiles/filedetails/?id=516104659

Final thoughts? Do not bother with the game until the game is fixed. Like srsly fixed not just some minor patch. 50% of the time it will crash with a ""Memory Error"" problem.

In general the game is a cute and has a fun concept. Do not need much skill to complete it just farm loads (hrs and days just scooping poop) and bam you should be able to still beat it. if you are lucky enough it does not give you any errors. Skip this game and find yourself a more stable title!

http://steamcommunity.com/sharedfiles/filedetails/?id=516104841",1441845274,1442663023,False,29,1,0.660221338272094727,5,False,False,False,False,,,
17823519,"{'steamid': '76561197998842815', 'num_games_owned': 0, 'num_reviews': 1, 'playtime_forever': 55, 'playtime_last_two_weeks': 0, 'playtime_at_review': 55, 'last_played': 1441160572}",english,"This game has potential to be good but there are some major flaws :

- the potty feature is absolutely pointless and too easy to get stuff and gold while the feeding feature is absolutely too boring, there should be a balance between the 2.

- menu and help features are not enough and should be much improved, no idea or no help whatsoever on the usage of the items at all.

- tutorial should be improved to provide more info, such at least let players know archer does not do shlt in night.

- I bought the game based on the description this game has various modes, however there is no such option in the game to select those modes from get go, if I have to earn it, I get it and no problem, but at least at the menu I should have such info.

Overall, the design and idea of this game looks very decent, but the info to help players to get into the game is absolutely lacking and a better job is needed on this area. 

Overall, I will still recommend this.",1441083419,1441083419,True,2,0,0.532019674777984619,1,False,False,False,False,,,
17806386,"{'steamid': '76561197973298631', 'num_games_owned': 0, 'num_reviews': 16, 'playtime_forever': 5826, 'playtime_last_two_weeks': 0, 'playtime_at_review': 551, 'last_played': 1685506215}",english,"The game is funny and challenging.

I got this game from groupees.com for 3 bucks as a bonus but it feels like it's worth is more than what I paid for.

It's  a different kind of Tower Defense, it requires decision making wether you have to take the beating alone to gain more gold at game over, or you can continue to dare and try if your cat defenses are strong enough for the next wave.

There are 6 cats with different attacks and each with 2 modes(needs upgrading). And the king can have up to 6 different modes/attacks.

There are a total of 13 dogs with different attacks and you need to remember how to deal with them so you can protect the king.

The Bosses are quite challenging, but there's a line up of who's coming first so you can prepare and set up your defenses accordingly.

The mini games are a nice change of pace since the main game can get frantic. [strike]But the only thing is the litter box can be tedious.[/strike]

Since last update, there are now two game modes where the king requires donation everytime you go to battle and the other one is more casual and relax mode.

There are three additional games to unlock, one you have to buy from the dog, the other one from finishing the main game, and the third which is night mode only(hard).

Overall, it's a fun game and yes it has some flaws, but it looks like the developer is putting a lot of efforts and constantly updating it. You can see the dedication and love that the developers puts in it.

If you love tower defense, I think you should give this a try.",1440993728,1440995134,True,5,1,0.51869732141494751,0,False,False,False,False,,,
