recommendationid,author,language,review,timestamp_created,timestamp_updated,voted_up,votes_up,votes_funny,weighted_vote_score,comment_count,steam_purchase,received_for_free,written_during_early_access,hidden_in_steam_china,steam_china_location,timestamp_dev_responded,developer_response
20860918,"{'steamid': '76561198246525090', 'num_games_owned': 178, 'num_reviews': 3, 'playtime_forever': 16455, 'playtime_last_two_weeks': 0, 'playtime_at_review': 13180, 'last_played': 1704439129}",english,"Alright so I originally played this game on Kongregate quite a few months ago. I stopped playing after I reformatted my computer and basically forgot it existed. And then I ran back into it on steam. I hesitated to buy it, because I could originally play for free on Kong - but I decided to go ahead and support the dev and buy the game. It's about 5 bucks, and really it's worth it to me.

Yes, this is an idle game - but there is a lot to do actively, if you're willing to spend time on it. Moreover the game is being expanded pretty constantly - it doesn't look like much now, but as an early access player you can help shape the game into something even better.

If idle and incremental games are your thing, this is quite a nice title that is still being expanded. It's different than games like Clicker Heroes - But that's part of its charm, too.",1454200103,1454200103,True,3,1,0.476197510957717896,1,True,False,True,False,,,
20792955,"{'steamid': '76561198011765865', 'num_games_owned': 248, 'num_reviews': 167, 'playtime_forever': 201, 'playtime_last_two_weeks': 0, 'playtime_at_review': 146, 'last_played': 1454008840}",english,"Yes, this is the game, ""Idle"" civilization, It is Idle element but different from what it shows.

From what they offer, this game is based on City-Management type game but with ""Idle"" type, and if you really notice what  is the idle they mean... its the whole. Graphics is idle, gameplay is idle, nothing special effects but gives boost on your civilization, war with other civilization but with less brutallity but more idle war. Gain resources to upgrade idle facilities, you can even gain until Quintrilion, even though i don`t know how much zeros. 

I mean everything is idle. Thats the game suppose to be.
My only problems is how you get the Civilization Points, and use it for raising perks when building new Cities. I mean, if you wish to gain more perks, you need to build back your city, but when you already build city big enough, and you wish to reset to gain perks, you might think twice before doing so. 

Other than that is the game price is around $5, which is pretty expensive for this small game. 
Overall this game is not bad, maybe this is my first clicker game, but like I said, when I bored, I play this game :p

7/10",1453928357,1453928357,True,1,0,0.510956704616546631,0,False,False,True,False,,,
20722064,"{'steamid': '76561198033010035', 'num_games_owned': 0, 'num_reviews': 20, 'playtime_forever': 4652, 'playtime_last_two_weeks': 0, 'playtime_at_review': 4122, 'last_played': 1540542871}",french,Addiction !!!!!,1453631770,1453631770,True,0,0,0,0,True,False,True,False,,,
20551912,"{'steamid': '76561198077894643', 'num_games_owned': 479, 'num_reviews': 2, 'playtime_forever': 187, 'playtime_last_two_weeks': 0, 'playtime_at_review': 100, 'last_played': 1698446171}",english,"Can't play, just got this game and created a new game and its stuck on a info page and nothing happens",1452911540,1452911540,True,0,0,0.476858347654342651,1,True,False,True,False,,,
20541735,"{'steamid': '76561197975027361', 'num_games_owned': 669, 'num_reviews': 18, 'playtime_forever': 20, 'playtime_last_two_weeks': 0, 'playtime_at_review': 20, 'last_played': 1452872698}",german,"Early Access Review:

Erinnert leider sehr an Adventurer Capitalist,
Zahlen die nach oben laufen ohne dass man etwas dafür tun muss.
Nette Musik und das System was dahinter stecken soll auch nett aber derzeit noch kein Kauf wert,
hoffe da kommt noch einiges, Minigames oder dergleichen zur Beschäftigung.


Aber seht selbst was in den ersten 20 Minuten zu tun ist.

https://youtu.be/jQo5DsKQA2s",1452872917,1452872917,False,2,0,0.5215110182762146,0,True,False,True,False,,,
20453742,"{'steamid': '76561198034199687', 'num_games_owned': 0, 'num_reviews': 333, 'playtime_forever': 649, 'playtime_last_two_weeks': 0, 'playtime_at_review': 649, 'last_played': 1488377041}",english,"This review is early access, so beware.

In this idle game you won't idle or indeed clicker a lot. The game generates ressources while offline though so it's an idle game to this regard or you can leave it on and purchase updates every hour or so while it grinds.
There is a lot of tactical depth and exploration in this game so I would consider this a attention-heavy idler similar to a normal strategy game actually.

There's already a lot of content and I enjoy playing it. There are a lot of bugs like with the population displaying broken numbers but nothing truly game-breaking actually. Some stuff still needs balancing.
Updates come reliably and the dev is working on the game (content updates not alibi updates). Thumbs up, man.

Edit: Had to update sadly. Thumbs down because this game was abandoned by the dev, check update hisrtory.",1452451367,1491932206,False,0,0,0.504253745079040527,3,True,False,True,False,,,
20385617,"{'steamid': '76561198043670852', 'num_games_owned': 810, 'num_reviews': 10, 'playtime_forever': 45848, 'playtime_last_two_weeks': 0, 'playtime_at_review': 10366, 'last_played': 1516481241}",english,"More under read more.

Even though it's in EA and not f2p, this is still pretty good for how it is. It's slow at first, but it starts to stack up over time. It's not like the other ones, i.e. Tap Heroes, Clicker Heroes, or Sakura Clicker, it's more like Adventure Capitalist where you sit and gradually upgrade your mineral per second. I recommend this to those who want something to check on every now and then, or play while watching a TV show or binge watching YouTube.

Edit: The music also sounds like old school Runescape, that's just my opinion.

Edit 2: With the update that fixed minor things, it seemed to have gotten a bit better. I, honestly, enjoy the new wage system. Just be careful, if you type in ""100"", it'll get rid of all your coins per second.

Edit 3: After playing over a hundred hours, I can honestly say this is the best clicker/idle game I've played, it's really quite enjoyable. It's not too clicky or too grindy, you can even restart every 30 minutes if you gain enough culture points (One Civilization Point per 125 Culture) in a short amount of time.",1452208722,1452624355,True,13,3,0.595302462577819824,3,True,False,True,False,,,
20349734,"{'steamid': '76561198084202567', 'num_games_owned': 0, 'num_reviews': 6, 'playtime_forever': 1244, 'playtime_last_two_weeks': 0, 'playtime_at_review': 1172, 'last_played': 1583432870}",swedish,"Really Nice, but very ugly!",1452085807,1452085807,True,0,0,0,0,True,False,True,False,,,
20341597,"{'steamid': '76561198029655788', 'num_games_owned': 86, 'num_reviews': 33, 'playtime_forever': 32233, 'playtime_last_two_weeks': 0, 'playtime_at_review': 8022, 'last_played': 1564864717}",english,"One of the best idle-like games. Would suggest to anyone who is into Idle games. It is still in EA, but the game is receiving a graphical makeover soon. Plenty more stuff will be added on along the way. Wort the money. 5/5",1452053613,1452054859,True,8,0,0.507209956645965576,0,True,False,True,False,,,
20269279,"{'steamid': '76561198041320964', 'num_games_owned': 0, 'num_reviews': 29, 'playtime_forever': 328, 'playtime_last_two_weeks': 0, 'playtime_at_review': 95, 'last_played': 1478739694}",english,"Wow, this game came out of nowhere and it is exceptional. If you like games like adveture capitalist, I warn you, you will likely become addicted.",1451853583,1451853583,True,4,1,0.461020678281784058,0,True,False,True,False,,,
20125150,"{'steamid': '76561198055109785', 'num_games_owned': 589, 'num_reviews': 21, 'playtime_forever': 3306, 'playtime_last_two_weeks': 0, 'playtime_at_review': 744, 'last_played': 1476270089}",english,If you liked Adventure Capitalist most likely you'll like this game,1451504652,1451504652,True,12,0,0.531099855899810791,0,True,False,True,False,,,
20123095,"{'steamid': '76561198004493142', 'num_games_owned': 0, 'num_reviews': 39, 'playtime_forever': 5552, 'playtime_last_two_weeks': 0, 'playtime_at_review': 2169, 'last_played': 1452986310}",russian,"Сразу к делу. Это не игра. Те, кто знаком с Idle - проходим мимо обзора, покупаем (если фанатики), получаем удовольствие. 
Смысл игры прост. Даже проще, чем надо. Вы - создате королевство. Все, остальной ""сюжет"" вам предлагают за кликанье мышкой. Ваша задача - напдлодить как можно больше людей, выучить как можно больше технологий, запить все это культурными мероприятиями, завоевать соседей с помощью силы (а еще тут есть крестовые походы! Мы сожжем всех еретиков!). Сбрасываем результат, получаем бонусы, повторяем. Это игра для настоящих ценителей садомазохизма или Idle игр. 
Как человек, который задрачивает Irdle игры (да, я больной), могу сказать, что у команды разрабаточиков получилось реализовать желание играть дальше. Когда подходишь к лимиту - сливай все ради бонуса в 1%. 
Вам нравится получать удовольствие от цифр, которые никак не учавствуют в вашей жизни? Это ваша игра. Я уже иду на очередной заход.",1451500688,1451500688,True,12,9,0.614690005779266357,3,True,False,True,False,,,
19860060,"{'steamid': '76561198179811907', 'num_games_owned': 949, 'num_reviews': 6, 'playtime_forever': 4398, 'playtime_last_two_weeks': 0, 'playtime_at_review': 581, 'last_played': 1533856746}",english,Very interesting and addicting game with a 4 out of 5 star ratings,1450839686,1450839686,True,1,0,0.491204321384429932,0,True,False,True,False,,,
19801951,"{'steamid': '76561198157494118', 'num_games_owned': 0, 'num_reviews': 13, 'playtime_forever': 965, 'playtime_last_two_weeks': 0, 'playtime_at_review': 61, 'last_played': 1457032808}",english,"A really fun game! It looks simple, but is much more deep then it appears! :D",1450612944,1450612944,True,0,0,0,0,True,False,True,False,,,
19732563,"{'steamid': '76561198093275908', 'num_games_owned': 118, 'num_reviews': 8, 'playtime_forever': 34, 'playtime_last_two_weeks': 0, 'playtime_at_review': 34, 'last_played': 1450291258}",dutch,"I haven't played long, but for what i see right now at my screen.. it's pretty decent. I could play this game for hours if i want to.. :)",1450285861,1450285861,True,0,0,0,0,True,False,True,False,,,
19710078,"{'steamid': '76561198036766038', 'num_games_owned': 559, 'num_reviews': 58, 'playtime_forever': 4427, 'playtime_last_two_weeks': 0, 'playtime_at_review': 1996, 'last_played': 1496704424}",english,It'd be nice if this was more tribal wars and less cookie clicker but it's not bad at what it is regardless.,1450179749,1450179749,True,1,0,0.49622577428817749,0,True,False,True,False,,,
19650692,"{'steamid': '76561198259556702', 'num_games_owned': 0, 'num_reviews': 6, 'playtime_forever': 621, 'playtime_last_two_weeks': 0, 'playtime_at_review': 531, 'last_played': 1449336319}",polish,"Pełna recenzja: http://how2play.pl/gamerlifestyle/idle-civilizaton-recenzja/

Plusy:
Przyjemny i rozbudowany rozwój królestwa
Niezobowiązujący system rozgrywki
Przystępna cena

Minusy:
Muzyka, która drażni
 

9/10 – Perian nie spał trzy dni",1449924047,1449924047,True,0,0,0,0,True,False,True,False,,,
19571648,"{'steamid': '76561198019048736', 'num_games_owned': 1039, 'num_reviews': 53, 'playtime_forever': 7441, 'playtime_last_two_weeks': 0, 'playtime_at_review': 3085, 'last_played': 1466632322}",english,The features are many and unlocked by time. The game is a lot deeper than what it looks like at first glance! Strongly recommended for any idle game fan.,1449605833,1449605833,True,4,0,0.488816380500793457,0,True,False,True,False,,,
19518683,"{'steamid': '76561198043363775', 'num_games_owned': 0, 'num_reviews': 5, 'playtime_forever': 18175, 'playtime_last_two_weeks': 0, 'playtime_at_review': 9569, 'last_played': 1486327691}",english,"Simple game but very addicting, Looking forward to more features added later on.",1449382136,1449382136,True,0,1,0,0,True,False,True,False,,,
19497068,"{'steamid': '76561198014306402', 'num_games_owned': 1341, 'num_reviews': 283, 'playtime_forever': 2025, 'playtime_last_two_weeks': 0, 'playtime_at_review': 1709, 'last_played': 1482294609}",schinese,"[strike]这款挂机算是中规中矩吧，基本可以说不需要点击（点击只能挣到三种初级资源），所以安心挂着就好，我反正懒得点

就看着自己的小村庄成长为大城市（地图上的城市建筑会多起来），囤积资源供奉神祗，然后发兵讨伐其他的行省（目前一家都没打下来……）[/strike]

开发者停更很久了，怕不是要坑，暂时不推荐",1449311049,1489682454,False,0,0,0.48657718300819397,0,True,False,True,False,,,
19492263,"{'steamid': '76561198038240937', 'num_games_owned': 0, 'num_reviews': 10, 'playtime_forever': 10732, 'playtime_last_two_weeks': 0, 'playtime_at_review': 3920, 'last_played': 1464890391}",english,"I bought it today and I do not regret any penny of it. It is very fun to play and to watch your civilization grow.
Many people pointed out the ""bad"" graphics of this game, but I have to say I like the style of it very much. In my opinion it's fitting for that scenario. It reminds me of some good old gems back in the days (okay that weren't idle games^^) but this graphic adds much to the feeling of Idle Civilization.

If you have some money to spend and you like idle games only the slightest, you should fill your steam library with this one.",1449289272,1449289272,True,1,0,0.523809552192687988,0,True,False,True,False,,,
19483211,"{'steamid': '76561198014293251', 'num_games_owned': 825, 'num_reviews': 35, 'playtime_forever': 22, 'playtime_last_two_weeks': 0, 'playtime_at_review': 22, 'last_played': 1449255410}",english,Cookie Clicker: 1066 Edition,1449255434,1449255434,False,7,0,0.428465723991394043,0,True,False,True,False,,,
19472788,"{'steamid': '76561198118668930', 'num_games_owned': 0, 'num_reviews': 11, 'playtime_forever': 16, 'playtime_last_two_weeks': 0, 'playtime_at_review': 16, 'last_played': 1449213952}",english,"it should be a bit cheaper for what it is
",1449214150,1449214150,False,11,1,0.426947861909866333,1,True,False,True,False,,,
19452568,"{'steamid': '76561198052298725', 'num_games_owned': 0, 'num_reviews': 31, 'playtime_forever': 107, 'playtime_last_two_weeks': 0, 'playtime_at_review': 107, 'last_played': 1449054207}",schinese,"我不知道 应该怎么去写这个测评

我虽然蛮喜欢玩这种挂机游戏 但是在深层的脑海 

觉得这种类型游戏 只适合做在网页上的

总之玩了一会就疲劳了 不太建议 高于5元价格入



",1449121971,1449121971,True,0,0,0,0,True,False,True,False,,,
19447310,"{'steamid': '76561198091299723', 'num_games_owned': 269, 'num_reviews': 5, 'playtime_forever': 17978, 'playtime_last_two_weeks': 0, 'playtime_at_review': 5458, 'last_played': 1468197756}",english,Very catchy. Recommend it.,1449095706,1449095706,True,2,1,0.500990092754364014,0,False,False,True,False,,,
19437472,"{'steamid': '76561197993053560', 'num_games_owned': 1950, 'num_reviews': 15, 'playtime_forever': 681, 'playtime_last_two_weeks': 0, 'playtime_at_review': 681, 'last_played': 1449060162}",english,Pleasure killed the rat.,1449065745,1449065745,False,3,1,0.338852256536483765,0,False,False,True,False,,,
19428513,"{'steamid': '76561197979968207', 'num_games_owned': 0, 'num_reviews': 19, 'playtime_forever': 50499, 'playtime_last_two_weeks': 0, 'playtime_at_review': 4294, 'last_played': 1481646233}",english,"I've been playing the web game on Kongregate for a little over a week now. It's a pretty solid idle/management game. The devs have been helpful when messaged, and I highly recommended them. Imported my save to the steam version from my browser with ease. Here's to another 100+ hours",1449024540,1449024540,True,5,0,0.525253236293792725,0,False,False,True,False,,,
19407655,"{'steamid': '76561198006866749', 'num_games_owned': 0, 'num_reviews': 13, 'playtime_forever': 32332, 'playtime_last_two_weeks': 0, 'playtime_at_review': 3138, 'last_played': 1489543068}",english,"Okay...
A fairly short review. I've been playing this game for some 4 hours now. I must say that I love it. I regularly play grand stragtegy games and the like and  I'm constantly on the look out for 'kingdom/empire building games similar to this. I very much enjoy games that provide me with the extreme statistics that this game provides eg many hundeds-thousands-millions-billions-trillions etc. Of said resources. I'm enjoying the style and the UI is fine. 
It's a very simple game but has a lot to offer. It's simple but offers a satisfying amount of depth and/but with little complexity. It's very much a 'click game' as it's title suggests. Being early access I find myself being quite patient and still considering it's pros and cons.
I love the adventurer/hero extention. Gives the kingdom building a more personal/rpg feel.
The game for me is kind of reminiscent of 'kings of dragon pass' which was a totally  wonderful game but I had a few hang ups which I found lacking for the game I wanted to play.

All that being said, I only have a few issues/wishes right now:

1st: I would like the world map to be bigger... MUCH bigger. 
Considering the staggering numbers of people/tropps/resources etc that you can acquire, it would make for a much better kingdom/empire building game we could have a considerably larger world to conquer/explore/trade with.

2nd: Although there is a quite deep research tech tree with many techs to research, I would like it to be bigger/have more options.

3rd: I would like a slightly deeper/more indepth dimplomacy/trade system. Just more options really.

Sadly, that's it for now. Still, great little game.
 I pray that future updates are not just tweaking and bug fixing but expanded content, similar to the above mentioned etc... Keep up the good work.
",1448957842,1448957842,True,5,0,0.526337325572967529,4,True,False,True,False,,,
19401249,"{'steamid': '76561198256235984', 'num_games_owned': 58, 'num_reviews': 6, 'playtime_forever': 280, 'playtime_last_two_weeks': 0, 'playtime_at_review': 230, 'last_played': 1502052351}",brazilian,Muito bom,1448930074,1448930074,True,0,0,0,0,True,False,True,False,,,
19388955,"{'steamid': '76561197971877162', 'num_games_owned': 0, 'num_reviews': 312, 'playtime_forever': 46, 'playtime_last_two_weeks': 0, 'playtime_at_review': 46, 'last_played': 1448892373}",english,"For an Idle game, it is fairly dull.  The aethetic just is very bland to me.  Your civilization is hidden behind the crafting screen which I didn't like, and the early game consists of clicking on just a few resources and managing what your population does.  

Yes, I know this is what all idle games are about.  But I just didn't feel the excitement for IC early game like I did for others such as Adventure Capitalist, which is free btw.  

IC is actually free on Kongregate but the dev will be adding most of the love to the Steam version.  He needs to pay for new music and a few new systems.  

Later on you can build troops and attack npc villages.  This can be a bit exciting until you mis-gauge the strength of the village you're attacking and lose all your troops.  Unlike most online strategy games, IC doesn't tell you the strength of the village you're attacking.  This can lead to frustration as you lose an attack and have to spend another 10 minutes amassing an army again.  

In my opinion, the dev should spend most of the money this game has made on better presentation.  Right now, it looks like a children's coloring book and consists of just a few screens of UI.  The game is only a 17.8 mb file.  

According to steamspy, this game sold pretty well and has a decent player base.  I refunded though because I was just bored throughout.  A bit slow initially building farms and resources buildings.  Also listening to the same music track loop over and over gets tedious.  The dev says he will also be replacing that, which is a great thing.  I just dont think IC is worth 5 bucks unless you enjoy playing these idle games for only 15 minutes at a time while you scan the news feeds.  Which, is what these games are all about anyway.",1448893171,1448893171,False,28,0,0.52394711971282959,0,True,False,True,False,,,
19344688,"{'steamid': '76561198103326628', 'num_games_owned': 102, 'num_reviews': 6, 'playtime_forever': 3454, 'playtime_last_two_weeks': 0, 'playtime_at_review': 1901, 'last_played': 1475092615}",german,"Hi,

dieses Spiel ist eine schöne Nebenbeschäftigung. Die Grafik, Musik und das Balancing sind noch ausbaufähig aber das Gamekonzept überzeugt für ein Casual Idle Game.

5 € sind es defenitiv Wert trotz Early Acess.

Was mir besonders gefällt ist, dass selbst nach 15 Stunden noch Dinge im Spiel sind, die man erreichen kann um sein kleines Königreich auszubauen. Erneut past hier das Preis/Lesitungsverhältnis. (Es gibt Vollpreistitel von großen Publishern die innerhalb von 10 Stunden komplett durch sind)

Für leute die High Quality Grafiken/Bilder haben möchten, ist das Spiel aber definitv nichts. Man fühlt sich ein wenig in die 90er zurückversetzt (-; Man merkt, dass vor allem das Augenmerk auf die Mechanik gerichtet wurde. Diese ist wirklich gut gelungen. Ein bisschen wild wirken aber manchmal die Mouseovereffekte und die GUI könnte noch etwas übersichtlicher werden.

Der Musikansatz ist sehr gut. Der Titel ist aber leider viel zu kurz und die Endlosschleife eines so kurzen Musikstückes führt nach Max 10 min dazu, dass der Ton abgeschaltet wird. Hier sollte man dringend etwas nachlegen. Aber es ist ja auch noch Early Acess von daher ertstmal ""gar kein Problem""^^

---
Dear Developer thanks for this lovly small Game. I enjoy to see my kingdom developing^^ and hope for some good future polishing. Keep up your good work!
---

Buy it if you like games with a good idea in mind.
It is worth 5 Bucks^^ 

Graphic/GUI --> 4/10
Gameplay --> 6/10
Gamefun/idea -->8/10
Longtime Motivation --> 8/10
Music --> 5/10

Lg

",1448741983,1448741983,True,1,1,0.448486357927322388,0,True,False,True,False,,,
19336508,"{'steamid': '76561197999543028', 'num_games_owned': 0, 'num_reviews': 32, 'playtime_forever': 1115, 'playtime_last_two_weeks': 0, 'playtime_at_review': 707, 'last_played': 1541488103}",english,"well it is an idle game, a very well made one with many layering features, a nice looking town in the background that grows as you buy and upgrade stuff and it is designed to last quite a long time, 10 hours so far and noware near any form of end.",1448721762,1448721762,True,0,0,0,0,True,False,True,False,,,
19331067,"{'steamid': '76561197990538929', 'num_games_owned': 828, 'num_reviews': 25, 'playtime_forever': 6425, 'playtime_last_two_weeks': 0, 'playtime_at_review': 526, 'last_played': 1584213907}",english,"If you like CivClicker, you will love this!",1448706558,1448706558,True,1,0,0.428814023733139038,0,True,False,True,False,,,
19319698,"{'steamid': '76561198059859091', 'num_games_owned': 409, 'num_reviews': 23, 'playtime_forever': 13610, 'playtime_last_two_weeks': 0, 'playtime_at_review': 2571, 'last_played': 1457385798}",english,"Cool game.

kinda hope to see more content pumped into this",1448662749,1448662749,True,1,0,0.474999994039535522,1,True,False,True,False,,,
19315518,"{'steamid': '76561198086018347', 'num_games_owned': 0, 'num_reviews': 33, 'playtime_forever': 203, 'playtime_last_two_weeks': 0, 'playtime_at_review': 106, 'last_played': 1448719623}",english,"Review and Gameplay Video:
https://www.youtube.com/watch?v=KtFIOelqnBs

Pros:
-Cheap
-Complex compared to other clicker games
-Makes you come back and develop your settlement further
-Many Achievements

Cons:
-Graphics could be touched upon
-May become repetitive after a while
-Multiplayer?
-Steam Workshop?

But the real question is would I recommend this game? For the price of 2 burgers definitely, if you are into idle clicking games, although multiplayer would be appreciated, but still this is an EA game and supporting the devs will make the game even better, so why not?",1448651382,1448651382,True,4,0,0.517695367336273193,0,True,False,True,False,,,
19308292,"{'steamid': '76561198078501915', 'num_games_owned': 0, 'num_reviews': 3, 'playtime_forever': 663, 'playtime_last_two_weeks': 0, 'playtime_at_review': 651, 'last_played': 1448850356}",english,"Just a glorified Clicker Heroes...no placement, no actual ""play"" just waiting for resources. A little dissapointed truth be told.",1448631865,1448631865,False,14,2,0.536305427551269531,0,True,False,True,False,,,
19307599,"{'steamid': '76561198059635872', 'num_games_owned': 807, 'num_reviews': 35, 'playtime_forever': 25, 'playtime_last_two_weeks': 0, 'playtime_at_review': 25, 'last_played': 1448575903}",polish,Gówno,1448629421,1448629421,False,0,0,0,0,True,False,True,False,,,
