recommendationid,author,language,review,timestamp_created,timestamp_updated,voted_up,votes_up,votes_funny,weighted_vote_score,comment_count,steam_purchase,received_for_free,written_during_early_access,hidden_in_steam_china,steam_china_location,timestamp_dev_responded,developer_response
31851655,"{'steamid': '76561198054562434', 'num_games_owned': 273, 'num_reviews': 16, 'playtime_forever': 4101, 'playtime_last_two_weeks': 0, 'playtime_at_review': 4047, 'last_played': 1495011247}",english,It’s pretty mediocre as far as idle games but I can’t recommend it while it’s being outshined by free games.,1495247690,1495247690,False,9,0,0.499388664960861206,0,True,False,True,False,,,
31786465,"{'steamid': '76561197980053814', 'num_games_owned': 0, 'num_reviews': 12, 'playtime_forever': 7088, 'playtime_last_two_weeks': 0, 'playtime_at_review': 5304, 'last_played': 1482160228}",english,"This game started off nice, but died because of lack up updates, i reccomend playing something better.",1494939378,1494939378,False,12,0,0.543265402317047119,0,True,False,True,False,,,
31712148,"{'steamid': '76561197972699907', 'num_games_owned': 1200, 'num_reviews': 4, 'playtime_forever': 1061, 'playtime_last_two_weeks': 0, 'playtime_at_review': 1061, 'last_played': 1465295109}",english,Abandonware. Dont buy,1494631719,1494631719,False,15,0,0.518025815486907959,0,True,False,True,False,,,
31672831,"{'steamid': '76561198234946148', 'num_games_owned': 0, 'num_reviews': 14, 'playtime_forever': 112, 'playtime_last_two_weeks': 0, 'playtime_at_review': 112, 'last_played': 1484416896}",english,"I tried to have fun, but I couldn't. You just sit around as the numbers increase and the long boring newspapers come in. It really lacks content and the dev doesn't seem to care. Overall, I would love to refund this so I could spend my $5 on something better. If you want a dev that really cares, get hyper knights. They respond to like 85% of the reviews, and comment on the games discussions. They even update the game, unlike this guy.",1494451599,1494451599,False,6,0,0.544288873672485352,0,True,False,True,False,,,
31661380,"{'steamid': '76561198063429364', 'num_games_owned': 61, 'num_reviews': 3, 'playtime_forever': 117, 'playtime_last_two_weeks': 0, 'playtime_at_review': 117, 'last_played': 1470765334}",polish,"Nice game and i will forever remember the generousity of creator, who presented me key for this game after i made my critical comments about some things in kongregate version.",1494405351,1494405351,True,0,0,0.463576167821884155,0,False,True,True,False,,,
31514242,"{'steamid': '76561197989224389', 'num_games_owned': 0, 'num_reviews': 103, 'playtime_forever': 640, 'playtime_last_two_weeks': 0, 'playtime_at_review': 596, 'last_played': 1506405224}",english,"Pointless but fun up until you figure out that the game is pointless and a complete waste of time.

I said fun right?  I love the music too.",1493762883,1493762928,True,0,0,0.48144608736038208,0,True,False,True,False,,,
31496753,"{'steamid': '76561198051256192', 'num_games_owned': 151, 'num_reviews': 2, 'playtime_forever': 2174, 'playtime_last_two_weeks': 0, 'playtime_at_review': 1354, 'last_played': 1698520359}",english,"This game is fun, for that price.  Yes, it may seem Unfinished, but to get to that point, you must really put alot of time into the game.  The dev has a decent amount of content into the game, but I am afraid he may be taking a break from developing the game, for an undisclosed amount of time.

Anyway, yes there are games (example:Clicker heroes) that have ""More content"" and by more, I mean the same exact thing as the past 200-5k levels in that game.  This game, atleast, you can deicde how to  build each colony.  Yes, there is no main difference between colonies.  You can build the exact same way every time, and the points wont go down.  You can, however deicde if you want to focus more on war or econ per colony, which might  affect some of the gameplay.",1493681264,1493681264,True,1,0,0.504132270812988281,0,True,False,True,False,,,
31244822,"{'steamid': '76561198001454607', 'num_games_owned': 0, 'num_reviews': 30, 'playtime_forever': 384, 'playtime_last_two_weeks': 0, 'playtime_at_review': 384, 'last_played': 1555814866}",english,"Liked the bit I played, but it feels unfinished. Maybe 83.4567890123% there, roughly.",1492635843,1492635843,False,4,0,0.406299382448196411,0,True,False,True,False,,,
31125677,"{'steamid': '76561198000540305', 'num_games_owned': 0, 'num_reviews': 11, 'playtime_forever': 3193, 'playtime_last_two_weeks': 0, 'playtime_at_review': 2093, 'last_played': 1491296349}",english,"Please dont buy it !
Devs gone idle !
No fun !
Bad graphics !
Its better to play free browser idle games than this !

This game will rest in peace in my ""trash can"" gamefolder",1492125387,1492125387,False,0,0,0,0,True,False,True,False,,,
30962431,"{'steamid': '76561197964914136', 'num_games_owned': 1048, 'num_reviews': 8, 'playtime_forever': 2009, 'playtime_last_two_weeks': 0, 'playtime_at_review': 2009, 'last_played': 1472207287}",german,"Leider keinerlei Updates mehr seit fast einem Jahr, der Entwickler hat das Spiel auch seit Mitte 2016 nichtmehr auf Steam gestartet. Das Spiel könnte viele Updates brauchen, die wir aber nie bekommen werden wie es scheint.",1491404160,1491404160,False,0,0,0,0,True,False,True,False,,,
30816325,"{'steamid': '76561198017809370', 'num_games_owned': 121, 'num_reviews': 2, 'playtime_forever': 3823, 'playtime_last_two_weeks': 0, 'playtime_at_review': 2729, 'last_played': 1464868641}",french,à l'abandon,1490803704,1490803704,False,0,0,0,0,True,False,True,False,,,
30288932,"{'steamid': '76561197976884847', 'num_games_owned': 865, 'num_reviews': 36, 'playtime_forever': 68, 'playtime_last_two_weeks': 0, 'playtime_at_review': 68, 'last_played': 1452980021}",english,Spent an hour on it and disliked it so much I uninstalled and never thought of it again. Fairly horendous. Do not recommend.,1488512968,1488512968,False,0,0,0.441158503293991089,1,True,False,True,False,,,
30221824,"{'steamid': '76561198050674355', 'num_games_owned': 94, 'num_reviews': 58, 'playtime_forever': 2590, 'playtime_last_two_weeks': 0, 'playtime_at_review': 2351, 'last_played': 1499617543}",english,"Why hasn~t the game been updated for so long, what happened:",1488208818,1488208818,True,0,0,0,1,True,False,True,False,,,
29907799,"{'steamid': '76561198022393548', 'num_games_owned': 4249, 'num_reviews': 54, 'playtime_forever': 3426, 'playtime_last_two_weeks': 0, 'playtime_at_review': 3136, 'last_played': 1521615713}",english,"not a single update since july... another abandoned game that will be in early access forever.

shame on the developpers.",1487015368,1487015368,False,11,0,0.577598154544830322,0,True,False,True,False,,,
29743012,"{'steamid': '76561198050589707', 'num_games_owned': 502, 'num_reviews': 168, 'playtime_forever': 6171, 'playtime_last_two_weeks': 0, 'playtime_at_review': 4407, 'last_played': 1497501412}",english,"This game hasn't updated in so long, and honestly, it needs to do so.

What you have here is a much different clicker experience. It's really like Adventure communist (which this came before btw) in that you have multiple different resources, but unlike that, each building costs a specific resource, but each one you can alsi immdeiately gather manually. Only, one resource you cannot gather, is population, which also must be allocated between each resource in order to idly gather it. Population requires food, and room, whihc is increased via houses.

After building enough structures, you gain the ability to start building an army, which is used for exploration (random bonuses and resources can be gained from these, depending on how many troops or people you send exploring), and raiding NPC villages and towns of varying and scaling difficulty and strength, (for a special resource which you can use to build monuments).

You can prestige by creating a new colony, after doing so, you have Civilization Points which you can use to spend on perks. Standard fare for the most part.

The game itself is pretty good, it's a nice breath of fresh air from the somewhat monotony that clicker games essentially are suffering from (what with the clones of clicker heroes which barely have any difference and all).

Things it could help to have added:
- Multiplayer Raids
- Some kind of Guild system where you launch joint-attacks on massive fortresses for special artifacts with help from other players.
- Tougher NPC towns for when you have literally thousands of Templars
- NPC Towns that scle based on the number of Colonies you've built.
- NPC Raids upon your town, Walls are basically useless. Or more tougher raids.
- Leaderboards.

Right now, I can't recommend the game as I just have no interest in it right now. Sadly, it doesn't have much in the way of end-game content and is a bit incomplete for hte time being. With any hope, it'll get updated more with more content, features, but right now, just don't bother.

If I gave a rating, I'd give it a 5/10 honestly. It's intersting, but has very little here as far as clicker games go.",1486394279,1486394279,False,5,0,0.519685029983520508,0,True,False,True,False,,,
29525637,"{'steamid': '76561198004423189', 'num_games_owned': 4454, 'num_reviews': 423, 'playtime_forever': 210, 'playtime_last_two_weeks': 0, 'playtime_at_review': 210, 'last_played': 1484950698}",russian,"На первый взгляд, это обычный кликер. Ну, вы их знаете. Собери ресурс Х, чтобы собрать побольше ресурса Y, чтобы собрать ресурс Z, чтобы купить убер-усилители X, Y, Z, разлочить T и повторить всё сначала. Только что ресурсы здесь добываются как зданиями (которые всё дороже), так и людьми (которые служат мультипликатором - но тоже дороже с каждым человеком). А unlock'и покупаются в виде ""исследований"". И точно как всегда, наиболее вкусные усилители доступны только если начать всё с нуля (что даёт ""очки цивилизации"", тем больше, чем дальше вы продвинулись, за которые можно разлочивать перманентные усилители).

На второй взгляд игра веселее. Потому что здесь есть захват строений на локальной карте, прокачиваемые герои с квестами, а после определённых апгрейдов разлочивается и дипломатия с войнами и пактами.

И всё портится тем, что автор игру сильно не доделал. Модификаторов мало. Имеющиеся поломаны. Цена, которую я вижу, совершенно нереальна - например, уже четвёртая лесопилка, приносящая примерно 400 дерева в секунду, стоит пару миллионов этого самого дерева. Что, впрочем, ничего не значит, потому что я могу её купить, имея в инвентаре дерева всего с десяток тысяч, и у меня ещё чего-то останется. Зато для покупки 1001-го человека нужно 10^28 единиц еды. Реальных, а не воображаемых. И каждый новый человек ещё повысит эту цену, да...

В общем, если бы автор не появлялся последний раз в прошлом июле, я бы дал игре шанс.  В текущем состоянии - нет. Я не настолько мазохист.",1485542078,1485551567,False,13,0,0.654355943202972412,0,True,False,True,False,,,
29496621,"{'steamid': '76561198011571954', 'num_games_owned': 0, 'num_reviews': 11, 'playtime_forever': 1899, 'playtime_last_two_weeks': 0, 'playtime_at_review': 1899, 'last_played': 1485487643}",english,"I think the devs have gone Idle.... It is a good game but can't currently reccomend it as the devs have not done an update in over 6 months. Along with that, they have not been active in the community forums for just as long. The game is good for the first few play threws (about 2 hours) then drops off very quickly.",1485412615,1485412615,False,7,0,0.568627476692199707,0,True,False,True,False,,,
29379116,"{'steamid': '76561198009932639', 'num_games_owned': 0, 'num_reviews': 37, 'playtime_forever': 6059, 'playtime_last_two_weeks': 0, 'playtime_at_review': 5535, 'last_played': 1474132528}",english,"Nice game concept... that had some visual updates too.
but that was the last of the updates it got.
As of jan 2017 no word of the dev.",1484931418,1484931418,False,6,0,0.526991665363311768,0,True,False,True,False,,,
29316087,"{'steamid': '76561198024349855', 'num_games_owned': 804, 'num_reviews': 138, 'playtime_forever': 47158, 'playtime_last_two_weeks': 0, 'playtime_at_review': 30664, 'last_played': 1696588381}",english,"A great game to idle and kill time.
Recruit an army
Invade the green army scum and conqure all lands!
Make 100,000 new colonies just to own all the wonders...
Make friends with neighboring kingdoms.
Make enemies with neighboring kingdoms.
Ignore the neighboring kinds.. Who cares.

",1484658797,1484658797,True,1,0,0.455566555261611938,0,True,False,True,False,,,
29148689,"{'steamid': '76561197996972957', 'num_games_owned': 0, 'num_reviews': 81, 'playtime_forever': 970, 'playtime_last_two_weeks': 0, 'playtime_at_review': 910, 'last_played': 1483657739}",english,"TL:DR;
Development seems to stop, game has no endgame content, there are bugs like achievements not unlocking.
Only for fans of idle games, otherwise gets boring really fast.


Review:
Idle Civilisation has nothing to put it apart from other idle games, with maybe one exception. However there is no real sense of progression as some basic expected functions are hidden behind a very expensive buildings.

Graphics 4/10:
Despite retro looks the game is actually quite ugly. There is something both in the colony map and in the world map, that puts me off - lack of colour, area design perhaps? 
Interface is clunky and cramped, research matrix is barely readable, tavern screen has popup covering some of your heroes making navigation difficult, etc etc.

Audio 4/10:
Apparently music was supposed to be next large update to the game. Right now it's just few annoying loops and whooshing sounds. Monotonous, boring, but there are  option settings for volume and muting!

Gameplay 6/10:
It's difficult sometimes to understand why incremental games are so popular. 
This one clearly has little to it, as the massive increase in amounts is not really offset by skills/techs or other things like that. I am not sure how on earth I would ever get 100 000 000 people without leaving game running with CE speedhack for weeks.

One thing that is good however are somewhat nice Hero Quests and Rare Sightings. These are creative and fun to read, but their number is limited.

Conclusion:
Buy only on sale or if real fan of idle games. There is maybe like two dozen hours of action before you get bored to death like me.",1483993326,1483993361,False,3,0,0.429488062858581543,0,True,False,True,False,,,
28895351,"{'steamid': '76561198058675608', 'num_games_owned': 372, 'num_reviews': 44, 'playtime_forever': 34, 'playtime_last_two_weeks': 0, 'playtime_at_review': 34, 'last_played': 1483259556}",english,"This game emulates things from other games out there that are 100% free to play.

also, heads up, game isn't all that exciting to play anyway.  Not exactly sure why I tried it.

why pay *anything* for a game when I can play for free elsewhere?",1483259927,1483259927,False,2,0,0,0,True,False,True,False,,,
28458966,"{'steamid': '76561198044487745', 'num_games_owned': 385, 'num_reviews': 10, 'playtime_forever': 17914, 'playtime_last_two_weeks': 0, 'playtime_at_review': 11020, 'last_played': 1482108964}",english,"I tried, I really really tried, 300 hours I tried, This game just isn't worth playing, there is no end game, you conquor the war game in less than 3 hours of gameplay, and than your just upgrading things in a increasingly rediculous prestige system, the menuing sucks, and the game just doesnt flow, its clunky.

I tried man but honestly, 1/10 I wouldn't recommend this game to anyone. Sorry, Not fun while it lasted, and I am happy to never play it another minute",1482109085,1482109085,False,23,3,0.629687309265136719,5,True,False,True,False,,,
28425256,"{'steamid': '76561198079367479', 'num_games_owned': 0, 'num_reviews': 4, 'playtime_forever': 16754, 'playtime_last_two_weeks': 0, 'playtime_at_review': 16338, 'last_played': 1469626492}",english,not worth the money,1481981749,1481981749,False,2,0,0.325134873390197754,0,True,False,True,False,,,
28342535,"{'steamid': '76561198042913113', 'num_games_owned': 0, 'num_reviews': 281, 'playtime_forever': 6007, 'playtime_last_two_weeks': 0, 'playtime_at_review': 4037, 'last_played': 1481949192}",english,"[h1]Is it a Clicker game? Is it a Strategy game? You decide.[/h1]

This is easily one of the best clickers I've ever played, and that's due largely to the fact that it adequately disguises the clicker elements in a deep set of strategic rules that always empower the player. 

I've played over a thousand hours of Clicker Heroes, which I still play to this day, and I've found I'm a pretty big fan of clicker games, as I enjoy the playstyle of making small changes to effect big developments. 

This game doesn't let me down on that front. It was a bit overwhelming at first, as I wasn't completely clear on how things related to each other. A couple of hours later, I was playing like a pro and already dreaming up strategies to get further and further. 

[b]Play a little, idle a lot, idle a little, play a lot.[/b]

One of the nicest things about Idle Civilizations is that it doesn't leave you idling for hours, waiting for things to do. If you want to setup a good idle build, you can do that, but you can also sit at the computer and do quests, raids, exploration, or just plain development, while you wait for resources to build. 

This is perhaps one of the best things about the game, is that it can feel completely like a strategy game if you want it to, or a clicker idle game if that's what you'd prefer. 

Either way, this game is definitely worth the very generously low asking price.

[b]A must buy for clicker fans[/b]

",1481632862,1481632862,True,3,0,0.551005423069000244,2,True,False,True,False,,,
