recommendationid,author,language,review,timestamp_created,timestamp_updated,voted_up,votes_up,votes_funny,weighted_vote_score,comment_count,steam_purchase,received_for_free,written_during_early_access,hidden_in_steam_china,steam_china_location,timestamp_dev_responded,developer_response
34726561,"{'steamid': '76561198044204581', 'num_games_owned': 0, 'num_reviews': 9, 'playtime_forever': 910, 'playtime_last_two_weeks': 0, 'playtime_at_review': 840, 'last_played': 1517713151}",english,"The variety enemy types and classes are awesome.
The graphics are semi realistic.
10/10 would listen to more Simon and what's her name.",1504494819,1507346595,True,0,0,0,0,True,False,False,False,,,
34724784,"{'steamid': '76561198170573313', 'num_games_owned': 126, 'num_reviews': 16, 'playtime_forever': 1641, 'playtime_last_two_weeks': 0, 'playtime_at_review': 543, 'last_played': 1650674281}",english,"i love this game, and i hope that there becomes more upgrades, more defences and lots more ENEMYS",1504485865,1504485865,True,0,0,0,0,True,False,True,False,,,
34715810,"{'steamid': '76561198045283341', 'num_games_owned': 0, 'num_reviews': 2, 'playtime_forever': 2412, 'playtime_last_two_weeks': 0, 'playtime_at_review': 1993, 'last_played': 1667888757}",english,"I have had Raw Data for a year.  When it came out it was still in beta.  As they added on it became clear that it was a really good game.  The playability is excellent.  Not too hard, not too easy.  It has become my go-to game.  If I want some VR fun now it is Raw Data.  The individual or two player campaigns are a lot of fun, and the PvP is a lot of fun (even though I am meat)!  It has a good mix of a simple story.  I highly recommend Raw Data to anyone who is new to VR or already been in a while.  I can't wait to see what they do in the future.  Totally worth the money.",1504455722,1504455722,True,1,0,0.523809552192687988,1,True,False,True,False,,,
34692015,"{'steamid': '76561198002571680', 'num_games_owned': 0, 'num_reviews': 9, 'playtime_forever': 630, 'playtime_last_two_weeks': 0, 'playtime_at_review': 494, 'last_played': 1647055287}",english,"REVIEWED ON: Oculus Rift
This game is exceptional. It's not without it's flaws, but overall this a strong contender for best VR title currently available. 

PRESENTATION -
Though thematically similar to Robo Recall, this title is far more interesting both in it's style and its presentation. The art direction is second to none, with some of the most clever and interesting concepts on display in the VR category. Taking strong cues from Ghost in the Shell, Metal Gear Solid, Syndicate, The Matrix, Equilibrium and Blade Runner; the art department has done an incredible job of building it's own world while providing just the right amount of homage.

UI & FIRST IMPRESSIONS -
The interface is decent, but not fantastic. For some reason we couldn't get into the Steam Home menu from the game, only Oculus home. The menu's are a bit buggy. For instance, my microphone remained muted after we turned off the ""Mute Outgoing Voice"" feature in the menus. We had to toggle it a few times, but eventually it kicked back over. With that said: it had an option to mute outgoing voice, which is actually a great quality-of-life addition to the game. Pulling people into matches is also equally problematic. With some people not seeing invitations or finding it challenging to join the game. However 4 out of 5 times things worked perfectly, and we had a generally painless experience getting everything to work.

GRAPHICS -
Really second-to-none for VR games right now. The graphic style, character design, weapon design, animations; while not game-changing, are as good as it gets in VR right now. Everything is heavily borrowed from other works as mentioned above, but as with all creative endeavors the measure of quality is how those things are mixed together. Nothing is new, really, so it's a matter of whether a team can take previous concepts and add their own spin.

Raw Data leans on Asian Techno-Punk themes but includes some cool atomic-age references and some stuff that's also pretty out there. In the later half of the game there's a stand out level involving a trip to a psychodelic batanical garden that is exceptional. Tripping face on fauna pollen as the hexagonal panels imitating the sky flicker in and out above you; all while you blast away at robots that may or may not be real, is an extraordinary experience and is easily the games strongest moment.

There are however some reused environments that get kind of samey. The graphics are for the most part top shelf, but there is a bit of a creative inconsistency that adds some surprise to the game but also keeps it from being AAA good.

SOUND -
Good, but not great. There are flourishes of a auteurs hand: like a cutesy Japanese PA voice slowly glitching between chipper pleasantries, and sinister threats. The skree of de-limbed robots hurling themselves towards you in the dark. And some pretty crisp gun reports when you just mad-dog akimbo blast a horde of robots in an overstimulated panic.

The voice acting is also decent, but not exceptional. The Jarvis AI as a character is pretty on point, being a solid mix of Tony Starks AI buddy and a clueless corporate tour guide. Your in-ear handler is pretty cooky cutter, but delivers her lines well.

With that said, this isn't doom. The music and sound effects mostly serve a purpose. They weren't really designed to be a crucial part of the experience. There are no meticulously crafter effects soundscapes ala Alien Isolation, nor is there too strong of a thematic approach like the campy 80s tech swells of Robo Recall. It's all very good, but only good enough so as not to notice, not to feel strongly one way or the other about.

CONTROLS -
A mixed bag of awesome and irritating. Things generally work well, but there are some things that elicited several WTF's. Almost all of the issues are borne out of the limitations of the controllers combined with some poorly defined spacial areas. For instance, the pistol character doesn't get his second pistol till a few levels in. Before that you have to manually pull a magazine from your belt loop. The problem is the location of said magazine is on your hip, but it doesn't quite align to where your looking, nor does it quite align to where your actual body is. So sometimes you look down and the magazine is right there, and sometimes you look down and it's rotated 90 degrees away from your hand. This can break the flow of a fun fire fight.

Also, a friend had several instances where he threw his ninja sword and that shit basically just went out for cigarettes and never came back. Weapons when dropped usually warp back to a players hand, but in this case it just... forgot, we guess. Our friend basically just spent the rest of the match sadly checking for his sword over his shoulder, only to sadly find it missing and just punching robots with his little lady ninja arms. 

Shotgun controls are finnicky. But they usually are in VR. Triggering special abilities is for the most part painless, with a few exceptions. Not sure if this is everyones experience but anything that required triggering a special by putting your hands close to your head, just never works reliably. Two characters specifically require putting hands near your head to charge up, but for some reason it just wouldn't work sometimes, or trigger at random times, or kind of glitch on and off. 

The traversal mechanic is good. Warping is in no way disorienting, and the walking mechanic is fine. Nothing new, but well executed. 

WRITING & STORY -
Generic, with both some cliche but also funny moments. A good example of some interesting ideas, that needed more polish. The world is pretty fully realized, but the characters are neither annoying near endearing. They're just kind of there. And things are usually so hectic you basically ignore them anyway. There are some rougher moments though. The levels with the the bog-standard megalomaniacal CEO bloviating over a loud speaker while hordes of robots come at you, are so bad as to be irritating. We've been there, we've done that. Ten billion times.

If video game writers were to be believed, every asshole above middle-management in an evil corporation, is just waiting with his finger on the fucking loudspeaker button just waiting for some would-be hero to break in. Do these guys have this prepared? Like in the shower in the shower every morning going over talking points hoping that todays the day?

""You will fail in your quest terrorist! Should I go with quest? No lets go with mission. Ill say mission. More contemporary.""

As mentioned above there is one mission where you travel to a psychedelic corporate retreat that was so clever it almost seemed like it came from another game. The dialogue writing in this section is so head-and-shoulders above the rest, it's almost jarring; but is an entirely welcome change of pace.

LEVEL DESIGN AND PACING -
It's a wave shooting. And realistically, even though there are ten maps, there are five maps. Putting a fog effect on a previous map, is not a new map guys. That's just lazy. It was okay the first time it happens, but when it happens four more times it gets to be a bit incensing. 

With that said, its still way more content then any other VR shooter, so if it's the best of the bunch what is there to complain about? Still better than whatever-the-fuck happened with Robo-Recall and their one-map that they somehow think is three that they then make you replay over and over like they think you won't notice. 

We get it, Epic, you like de-limbing people. You have a sadism fetish. It's okay, just get a FetLife account like the rest of us.

FINAL THOUGHTS -
Even for all it's flaws, the game amalgamates to being greater than the sum of it's parts. We've played this VR game more than any other, and for now it's the app to beat. It's both familiar and new, and more than anything the action, which is what we spoke about the least, is really the main feature here. It's a fun, frantic and violent escapist experience. 

9/10",1504376545,1504376545,True,5,0,0.597523212432861328,0,False,True,True,False,,,
34563726,"{'steamid': '76561198033407271', 'num_games_owned': 334, 'num_reviews': 47, 'playtime_forever': 94, 'playtime_last_two_weeks': 0, 'playtime_at_review': 24, 'last_played': 1508949426}",french,coment vous allez,1503959385,1503959385,True,0,1,0.474452555179595947,0,False,False,True,False,,,
34560586,"{'steamid': '76561198039827435', 'num_games_owned': 0, 'num_reviews': 30, 'playtime_forever': 339, 'playtime_last_two_weeks': 0, 'playtime_at_review': 143, 'last_played': 1508671370}",english,"I have the VIVE just 3 Days, but this is the best i have seen yet.

No Motions sickness and great FPS, no drops.
A must buy after you have test the VIVE 1-2 days.

 
",1503949239,1503949239,True,0,1,0,0,True,False,True,False,,,
34544840,"{'steamid': '76561198410794516', 'num_games_owned': 0, 'num_reviews': 105, 'playtime_forever': 119, 'playtime_last_two_weeks': 0, 'playtime_at_review': 117, 'last_played': 1517131963}",japanese,"銃＋テレポートは正直あまり面白くないかも。
剣＋ステップはそれなりに楽しめる。ただし酔う。",1503894497,1506796091,True,3,0,0.554973840713500977,0,True,False,True,False,,,
34519109,"{'steamid': '76561198000710092', 'num_games_owned': 0, 'num_reviews': 4, 'playtime_forever': 188, 'playtime_last_two_weeks': 0, 'playtime_at_review': 188, 'last_played': 1503955248}",english,Great game! Recently added new PvP mode is great! Keep it up guys!,1503801101,1503801101,True,0,0,0,0,True,False,True,False,,,
34475526,"{'steamid': '76561198397626505', 'num_games_owned': 0, 'num_reviews': 1, 'playtime_forever': 89, 'playtime_last_two_weeks': 0, 'playtime_at_review': 89, 'last_played': 1503394501}",english,"I like the game even though you need to get used to the controllers at first, but other than that its pretty awesome.
very much recommended",1503645642,1503645642,True,0,0,0,0,True,False,True,False,,,
34462251,"{'steamid': '76561198061158416', 'num_games_owned': 0, 'num_reviews': 4, 'playtime_forever': 10479, 'playtime_last_two_weeks': 0, 'playtime_at_review': 5826, 'last_played': 1523671580}",english,"This is, definitively, one of the best VR games currently available. Single player has a lot of content, but PVP is where this game really shines. I replay old missions often, as the 4 different classes offer completely different experiences. I run this on an RX480 with no issues, but keep in mind that you won't be able to effectively supersample unless you have a card better than that. Otherwise, I cannot recommend this enough.",1503589122,1503589122,True,0,0,0,0,True,False,True,False,,,
34392949,"{'steamid': '76561198117615418', 'num_games_owned': 0, 'num_reviews': 57, 'playtime_forever': 300, 'playtime_last_two_weeks': 0, 'playtime_at_review': 300, 'last_played': 1501951899}",french,"RAW DATA est dans ma liste de jeux préférés de la VR. 
Graphiquement il est super beau et nous procure du stress tellement qu'on y est dedans.
Je le recommande pour les amateurs de VR, c'est un super bon jeu.

Le soucis, c'est que je le trouve répétitif. Mais dernièrement, j'ai pu constater de nouvelles mises à jours, que je n'ai pas testé. Je présume qu'il y a de quoi encore s'amuser.",1503314169,1503314169,True,0,1,0,0,True,False,True,False,,,
34364281,"{'steamid': '76561198031201473', 'num_games_owned': 0, 'num_reviews': 41, 'playtime_forever': 535, 'playtime_last_two_weeks': 0, 'playtime_at_review': 476, 'last_played': 1507323279}",english,One of my first and still one of my favorite VR games to demo to people new to VR. Its super fun and easy to grasp. But most importantly not buggy and the support for the game is uncanny.,1503199069,1503199069,True,1,0,0,0,True,False,True,False,,,
34298602,"{'steamid': '76561198018482347', 'num_games_owned': 267, 'num_reviews': 24, 'playtime_forever': 718, 'playtime_last_two_weeks': 0, 'playtime_at_review': 620, 'last_played': 1646774696}",english,"Raw Data is one of those essential must have VR games. It makes you realise how much fun you can have in a FPS VR title. You will be facing hoards of robots that want to kill you, you're mission is to take the Data from their core. There is serval maps to choose from and all have slightly diffrenet objectives while facing these hoards of robots. So far there is 4 diffrenet classes to choose, Duel weeled pistols, Sword master, Shotgun, and a archer who shoots arrows from his bow which feels very badass. This is the type of game where I can just take out all my fustration, it does a great job on immersing you into this futuristic setting where robots are normal to see around. 

Has been one of the best co-op experinces I've had in VR, you can see this game has been built up for mutiplayer from the start. Nothing is better than showing off you're badass moves tearing up robots infront of you're mates. PvP is really addictive, fast pacing 4v4 action. I really hope they add a competitive mode for PvP as it would keep me coming back daily. Leaderboards for PvP would also be great, I'm sure we'll see this in future updates. 

You must have this for you're VR headset as it is some of the most fun you can have in virtual reality right now.",1502938121,1502938121,True,1,0,0,0,True,False,True,False,,,
34283259,"{'steamid': '76561197972851337', 'num_games_owned': 2226, 'num_reviews': 129, 'playtime_forever': 117, 'playtime_last_two_weeks': 0, 'playtime_at_review': 117, 'last_played': 1501848758}",english,"In it's current form it's kinda lacking on content. A endless mode would be fun. MP seems dead. I refunded this after almost hitting the 2hr mark. 

Don't get me wrong, the game itself is good but imo it's not worth the current price.",1502914139,1502914139,False,6,0,0.470501601696014404,0,True,False,True,False,,,
34270659,"{'steamid': '76561197999464289', 'num_games_owned': 0, 'num_reviews': 35, 'playtime_forever': 1672, 'playtime_last_two_weeks': 0, 'playtime_at_review': 1195, 'last_played': 1561605653}",english,One of the best gaming experiences I'v ever had!,1502865410,1502865410,True,4,1,0.523809552192687988,0,True,False,True,False,,,
34257535,"{'steamid': '76561198271135969', 'num_games_owned': 0, 'num_reviews': 7, 'playtime_forever': 374, 'playtime_last_two_weeks': 0, 'playtime_at_review': 319, 'last_played': 1507087025}",english,Most polished game for VR. I'd love to see this game become more open world with customization. I assume the server capacity would need to be increased for this.,1502809065,1502809065,True,0,0,0,0,True,False,True,False,,,
34247229,"{'steamid': '76561198109064447', 'num_games_owned': 176, 'num_reviews': 8, 'playtime_forever': 882, 'playtime_last_two_weeks': 0, 'playtime_at_review': 539, 'last_played': 1557605292}",english,"Great game well worth the price can play for hours and not get bored, missions where i need to get on my kness and move around the whole game, simply incredible, few gltichs but nothing i didnt expect, nothing to game breaking",1502761776,1502761901,True,0,0,0,0,True,False,True,False,,,
34220489,"{'steamid': '76561197984080647', 'num_games_owned': 782, 'num_reviews': 30, 'playtime_forever': 993, 'playtime_last_two_weeks': 0, 'playtime_at_review': 677, 'last_played': 1584722251}",english,Damned amazing.  I cannot recommend this enough.,1502651145,1502651145,True,0,0,0,0,False,False,True,False,,,
34220322,"{'steamid': '76561198057795395', 'num_games_owned': 0, 'num_reviews': 73, 'playtime_forever': 825, 'playtime_last_two_weeks': 0, 'playtime_at_review': 706, 'last_played': 1574728042}",english,"I would have recommended this game. But the latest updates have ruined the expierence. PVP is bugged as hell and doesnt work properly. You cant set controler to grip hold anymore which I liked and the graphics have been downsized and it looks crappy now. 

Please add back the features you removed like player shadow and grip hold.",1502650545,1502650545,False,0,0,0.457257747650146484,1,True,False,True,False,,1502734922.0,"Hey Gingas,

Sorry to hear you've had a negative experience with the latest Raw Data Update.

If you have the time, would you mind elaborating on what specific issues you're experiencing with PvP?

Also, like WhiteSun has stated, the ""Hold"" control scheme is still still available and can be accessed through the in-game options. Apologies again for any confusion!

Best regards,
Survios_CS"
34204925,"{'steamid': '76561198115966236', 'num_games_owned': 0, 'num_reviews': 5, 'playtime_forever': 1129, 'playtime_last_two_weeks': 0, 'playtime_at_review': 350, 'last_played': 1569822398}",english,This is the most immersive and intuitive programs that I have run since I have joined the gaming world a couple of months ago.  Very easy to pick up and become immersed in.  Recommend highly to anyone that wants a challenge.,1502593350,1502593350,True,0,0,0,0,True,False,True,False,,,
34197010,"{'steamid': '76561197961428884', 'num_games_owned': 0, 'num_reviews': 11, 'playtime_forever': 43, 'playtime_last_two_weeks': 0, 'playtime_at_review': 43, 'last_played': 1505165603}",english,"Fun shooter, multiplayer, pretty, 

Had alot of problems with the game, connection timeout, i was 3'' tall ingame,
the problem was SteamVr Home BETA so i disabled this and now all is fine.
Thank you for the amazing support survios_cs

I can't seem to shoot superbullet over counters and sometimes i evade the bullets and it still hits me but i have fun with this game.",1502562111,1505165949,True,0,0,0.497407138347625732,1,True,False,True,False,,1502734466.0,"Hey Anarchy_98,

Apologies again for this issue you're experiencing with the game!

Would you mind contacting us at support@survios.com so we can assist you with this issue?

Thank you for your patience!"
34154167,"{'steamid': '76561198160510616', 'num_games_owned': 0, 'num_reviews': 3, 'playtime_forever': 596, 'playtime_last_two_weeks': 0, 'playtime_at_review': 473, 'last_played': 1552418853}",english,most bang for the buck in VR,1502396179,1502396179,True,1,0,0.480225980281829834,1,True,False,True,False,,,
34143606,"{'steamid': '76561198384127453', 'num_games_owned': 0, 'num_reviews': 33, 'playtime_forever': 1457, 'playtime_last_two_weeks': 0, 'playtime_at_review': 809, 'last_played': 1556595028}",english,"Bought this game on sale but after wished I would not have waited because the game is way better than I expeted!
people kept saying its a wave shooter etc, ,so yeah a wave shooter but so much more to it and so well done with lots of options and everything about it is AAA and I find myself playing it more than any other vr game sofar its so addictive!
Just buy it it's well worth the price. ""Amazing""",1502361485,1502361485,True,1,0,0,0,True,False,True,False,,,
34140097,"{'steamid': '76561198284569293', 'num_games_owned': 0, 'num_reviews': 19, 'playtime_forever': 1132, 'playtime_last_two_weeks': 0, 'playtime_at_review': 569, 'last_played': 1581901944}",english,"Update: I can no longer recommend until they add support for the Index controllers, and I've read that they will not be doing that, or any other work on this title. 

If you have room scale VR, this game is a must have, and well worth the $44. It needs some tweaks here and there but it's fun as hell to play once you get the hang of it. So far I'm even loving the PvP, and that's not always my thing.",1502346253,1601443573,False,0,0,0,0,True,False,False,False,,,
34066497,"{'steamid': '76561198081353767', 'num_games_owned': 0, 'num_reviews': 6, 'playtime_forever': 397, 'playtime_last_two_weeks': 0, 'playtime_at_review': 347, 'last_played': 1524277436}",english,Awesome action fun!,1502045699,1502045699,True,0,0,0,1,True,False,True,False,,,
34064048,"{'steamid': '76561198057313795', 'num_games_owned': 0, 'num_reviews': 51, 'playtime_forever': 905, 'playtime_last_two_weeks': 0, 'playtime_at_review': 826, 'last_played': 1508848092}",english,You will feel comfortable with all the options given to you. Great graphics. Great design. Fun to play. a Must have.,1502038413,1502038413,True,7,0,0.564773678779602051,0,True,False,True,False,,,
34047520,"{'steamid': '76561198279637791', 'num_games_owned': 0, 'num_reviews': 1, 'playtime_forever': 234, 'playtime_last_two_weeks': 0, 'playtime_at_review': 197, 'last_played': 1511586227}",english,Just start playing this game it looks and feels amazing.  Can't stop playing the game.  It keeps pushing you to stick with it even though some of the levels are hard.  I would recommend getting this game now.,1501970980,1501970980,True,0,0,0,0,True,False,True,False,,,
34007551,"{'steamid': '76561198011625119', 'num_games_owned': 0, 'num_reviews': 39, 'playtime_forever': 828, 'playtime_last_two_weeks': 0, 'playtime_at_review': 660, 'last_played': 1647137267}",english,This should be the standard that all VR games are held to. Great starting content and Devs that don't quit!! Updates and new content for free! Worth every penny!,1501819377,1501819377,True,10,0,0.609081149101257324,0,True,False,True,False,,,
34004264,"{'steamid': '76561198193177038', 'num_games_owned': 0, 'num_reviews': 1, 'playtime_forever': 532, 'playtime_last_two_weeks': 0, 'playtime_at_review': 76, 'last_played': 1509761056}",english,"This is an awesome game to put your HTC Vive to use. The mechanics and controls of the game are so easy to understand. Grab the gun from the hip, grab the clip from the other side, insert into the gun, boom you just reloaded. Reach over and grab the sword from your back, boom now youre wielding a sword. Crouch behind objects for cover, ball up your fist and punch, and block. This game I give a 10 out of 10. Check it out.",1501803366,1501803366,True,0,0,0,0,True,False,True,False,,,
33998690,"{'steamid': '76561198007265918', 'num_games_owned': 0, 'num_reviews': 10, 'playtime_forever': 1304, 'playtime_last_two_weeks': 0, 'playtime_at_review': 1016, 'last_played': 1540653529}",french,"Une de mes meilleurs jeux VR (HTC Vive). L'action est excellente, la visée est précise, et l'ambiance est très bonne elle aussi. Un bon contenu pour un jeu VR (une dizaine de missions solo, du multi (co-op / PVP), tout y est. De plus, 4 personnages complètemen différents dans le gameplay sont jouable, du ninja au sabre laser à l'archer en passant par le cow boy au double flingue, chacun peut y trouver son style de jeu. Je recommande !",1501784234,1501784234,True,0,0,0,0,True,False,True,False,,,
33989381,"{'steamid': '76561198369781416', 'num_games_owned': 0, 'num_reviews': 5, 'playtime_forever': 18279, 'playtime_last_two_weeks': 0, 'playtime_at_review': 14553, 'last_played': 1690473242}",english,I am absolutely blown away by this game and love every minute of it and being able to play with someone else adds so much to it too i have played with people from all over the world.,1501755670,1533087031,True,6,0,0.571293413639068604,0,True,False,False,False,,,
33978524,"{'steamid': '76561198087775997', 'num_games_owned': 0, 'num_reviews': 16, 'playtime_forever': 209, 'playtime_last_two_weeks': 0, 'playtime_at_review': 79, 'last_played': 1585209818}",english,"https://www.youtube.com/watch?v=hrB-_nIer88
and
https://www.youtube.com/watch?v=sFZjqVnWBhc

0100101001001010010010101001000101000101000101001111010010100101001001001001010010101001010101010101010101010101001010010001010101010101010101011001100101001010101010010101010110101010101010101011000101010101

Starting     MS-DOS....

C:\>C:\DOS\DAFT\ROBOTROCK-HUMANAFTERALL.EXE
",1501705104,1501705104,True,0,0,0,1,False,False,True,False,,,
