recommendationid,author,language,review,timestamp_created,timestamp_updated,voted_up,votes_up,votes_funny,weighted_vote_score,comment_count,steam_purchase,received_for_free,written_during_early_access,hidden_in_steam_china,steam_china_location,timestamp_dev_responded,developer_response
75981208,"{'steamid': '76561197970827075', 'num_games_owned': 0, 'num_reviews': 12, 'playtime_forever': 90, 'playtime_last_two_weeks': 0, 'playtime_at_review': 90, 'last_played': 1600122025}",english,"This is a smoking pile of crap - glad I spent only $7.99 steam sale on it - but will be trying for a refund anyway.

Launched in Oculus, the controls let me point - but not move - the menu's are cryptic and misleading as well - like the game looks like it wants you to move - but you can't move - and menu options move you.. ?? weird stuff here - save your money and time and avoid this.",1600122409,1600122409,False,0,0,0.470824927091598511,0,True,False,False,False,,,
75966411,"{'steamid': '76561198066629137', 'num_games_owned': 2087, 'num_reviews': 32, 'playtime_forever': 20, 'playtime_last_two_weeks': 0, 'playtime_at_review': 20, 'last_played': 1600101167}",english,"No Index support
no controller rotation, snap or otherwise. You get to just wind up in your own cables
grip ONLY for grabbing items, meaning I can't do anything under duress
some lady talking in my head the entire time, often while other people are also talking
""campaign"" is just standing around shooting stuff in the head.
wasted twenty minutes of my life this game either needs an update or just top fade away.",1600101381,1600101381,False,2,0,0.510839879512786865,0,True,False,False,False,,,
75944025,"{'steamid': '76561197981383337', 'num_games_owned': 435, 'num_reviews': 49, 'playtime_forever': 135, 'playtime_last_two_weeks': 0, 'playtime_at_review': 135, 'last_played': 1600060007}",english,"This game is great, one of the best VR shooters out there. The pvp is amazing and by far the best part imo...but it just really needs to be promoted more or go f2p cause people are sleeping on this great shooter and it'd be a shame for it to die. It's so fluid feeling and just a great co-op and single player experience as well though. I will down rate until some change happens cause we need more playerbase and this games pvp is just amazing.

8.5/10",1600060570,1600060570,False,1,0,0.359313428401947021,0,True,False,False,False,,,
75927149,"{'steamid': '76561198220602688', 'num_games_owned': 120, 'num_reviews': 18, 'playtime_forever': 365, 'playtime_last_two_weeks': 0, 'playtime_at_review': 342, 'last_played': 1632017388}",english,"cool
",1600028798,1600028798,True,0,0,0.47826087474822998,0,True,False,False,False,,,
75920084,"{'steamid': '76561198044423399', 'num_games_owned': 0, 'num_reviews': 3, 'playtime_forever': 28, 'playtime_last_two_weeks': 0, 'playtime_at_review': 28, 'last_played': 1599983032}",english,"This game might be good, but I'll never know because it doesn't support basic index controls, with 10 mins of trying I just want my money back.",1600019317,1600019317,False,1,0,0.476931631565093994,1,True,False,False,False,,,
75857262,"{'steamid': '76561197970774806', 'num_games_owned': 0, 'num_reviews': 203, 'playtime_forever': 149, 'playtime_last_two_weeks': 0, 'playtime_at_review': 125, 'last_played': 1600535678}",english,"Very fun, but small, VR Game. Especially in Coop. Get it in a sale, like now. 

Especially weapon handling and reloading is mayor fun!",1599925939,1599925939,True,0,0,0,0,True,False,False,False,,,
75831276,"{'steamid': '76561198092751713', 'num_games_owned': 329, 'num_reviews': 20, 'playtime_forever': 340, 'playtime_last_two_weeks': 0, 'playtime_at_review': 340, 'last_played': 1599885964}",english,"I played coop with a friend, took us five hours to beat. Was a fun time, worth it when on sale.",1599886664,1599886664,True,1,0,0.483571797609329224,0,True,False,False,False,,,
75822976,"{'steamid': '76561198082275065', 'num_games_owned': 0, 'num_reviews': 6, 'playtime_forever': 231, 'playtime_last_two_weeks': 0, 'playtime_at_review': 130, 'last_played': 1690650394}",english,great game and graphics,1599871902,1599871902,True,1,0,0.492763638496398926,0,True,False,False,False,,,
75817283,"{'steamid': '76561197987808753', 'num_games_owned': 0, 'num_reviews': 1, 'playtime_forever': 1797, 'playtime_last_two_weeks': 0, 'playtime_at_review': 1695, 'last_played': 1678922985}",german,Eines der geilsten Spiele die es gibt!!!,1599861941,1599861941,True,0,0,0.483091771602630615,0,True,False,False,False,,,
75218300,"{'steamid': '76561198880717778', 'num_games_owned': 219, 'num_reviews': 92, 'playtime_forever': 843, 'playtime_last_two_weeks': 0, 'playtime_at_review': 230, 'last_played': 1605480262}",czech,"It's a wave shooter which is not my favourite genre of FPS, but it's done very very well.
- weapons really fits and are done very good
- you have 4 different charaters you can play
- each character has it's own perks which are opening by playing them
- it has COOP mode, so you can play with friends
- it has difficulties
- it has PVP mode (I'm not PVP player, but I count it as pro)

I recommend, it's fun to play, and also very relaxing.",1598877309,1598877309,True,0,0,0,0,True,False,False,False,,,
75089473,"{'steamid': '76561198026393778', 'num_games_owned': 0, 'num_reviews': 21, 'playtime_forever': 30, 'playtime_last_two_weeks': 0, 'playtime_at_review': 30, 'last_played': 1598667403}",english,I wish I had visited the forums 1st and noticed they offer no support at all for the index controllers.. Nobody is asking for finger tracking.. but a basic option to turn around is all they need to add.,1598672677,1598672677,False,3,0,0.515243887901306152,0,False,False,False,False,,,
74902176,"{'steamid': '76561198998309937', 'num_games_owned': 255, 'num_reviews': 128, 'playtime_forever': 6350, 'playtime_last_two_weeks': 0, 'playtime_at_review': 2224, 'last_played': 1709734728}",polish,"(English translation at the bottom)

Zastanawiałem się długo i miałem dać 9/10, ale daje 10/10. Gra jest niesamowita.

Mamy do dyspozycji 10 stosunkowo dużych poziomów (czas przejścia). Z których każdy dzieli się na pięć części, dzięki czemu można złapać oddech. Poziomy są mocno zróżnicowane, choć pierwsze dwa mogą zniechęcić.

Podobnie sytuacja wygląda z bohaterami. Mamy do wyboru czterech całkowicie odmiennych bohaterów. Każdy dysponuje sześcioma umiejętnościami, które odblokowywujemy za przejście poziomu. Czyli odblokowanie wszystkich umiejętności dla wszystkich postaci to 24 poziomy gry. Każdy bohater jest fajny i oferuje odmienny sposób rozgrywki. I tutaj tak samo, bez odblokowanych umiejętności potrafią zniechęcić.

Osobiście polecam wybranie teleportu jako sposobu poruszania się.

Przewodnik w naszej kwaterze głównej. Wykonanie wszystkich zadań przewodnika, ułatwi zrozumienie gry. I tutaj tradycyjnie, ...gra potrafi zniechęcić, jeżeli tego  nie zrobimy. Dodatkowo tutaj właśnie, warto przetestować sobie na spokojnie każdą odblokowaną umiejętność. Sterowanie, jest bardzo dobre, jest rozbudowane i wygodne. Ale ...potrafi zniechęcić, jeżeli nie przeczytamy co do czego i jak.

Watek fabularny jest rozbudowany, dodatkowo zbierając po pięć ""dżingli"" z każdego poziomu. Odblokowywujemy interesujące ścieżki audio, listy i opisy które to otwierają szerzej historię.

Poziomy trudności są dobrze dobrane, grając samemu na normal, jest normalnie. Na hard jest trudno, a na nightmar koszmarnie. Granie w dwójkę zdecydowanie ułatwia rozgrywkę. Przeszedłem grę sam na normal później na hard i da się. Na tę chwilę przeszedłem sam jeden poziom na nightmar (jeden próbowałem). Nie gra w nią na dzisiaj wielu ludzi, ale da się zagrać online jeżeli się chce.

Grę gorąco polecam. Uważam, że przebija wiele znanych i popularnych tytułów. Większość z mojej biblioteki, i inne w które grałem a nie posiadam, w tym te uważane za topowe. Przekleństwem gry jest według mnie to jak gra się zaczyna. Ciężko się odnaleźć, a postacie nie wydają się być interesujące. Po trofeach widzę, że mało kto dał grze szansę, a naprawdę warto.

Tak jak pisałem w mojej opinii to 10/10. Polecam.


I've been wondering for a long time and I've had to give 9/10, but I'll give it 10/10. The game is amazing.

We have at our disposal 10 relatively large levels (transition time). Each of which is divided into five parts, so you can catch your breath. Levels vary widely, although the first two can discourage.

The situation is similar with the heroes. We have four completely different heroes to choose from. Each has six skills that we unlock for level transitions. That is, unlocking all skills for all characters is 24 levels of the game. Each hero is cool and offers a different way of playing. And here, in the same way, without unlocked skills, they can discourage.

I personally recommend choosing a teleport as a way of moving.

A guide at our headquarters. Completing all the tasks of the guide will make it easier to understand the game. And here traditionally, ... the game can discourage you if you don't. In addition, here it is worth to test yourself quietly each unlocked skill. The control, it is very good, it is extensive and convenient. But... can discourage if we do not read what and how.

The story is expanded, additionally collecting five ""jingles"" from each level. We unlock interesting audio tracks, lists and descriptions that open the story more widely.

Difficulty levels are well chosen, playing alone on normal, is normal. On hard it is difficult, and on the nightmar nightmar horribly. Playing with someone in two makes it much easier to play. I went through the game alone to normal later on hard and it is possible. At this time I went through one level on nightmar (one I tried myself without the other person). It's not played by many people today, but you can play online if you want.

I highly recommend the game. I believe it is better than many well-known and popular titles. Most of my library, and others that I played and do not have, including those considered top. The curse of the game, in my opinion, is how the game begins. It's hard to get started, and the characters don't seem to be interesting. Watching the trophies I see that few people gave the game a chance, and it is really worth it.

As I wrote in my opinion is 10/10. Recommend.",1598379450,1707220429,True,6,0,0.600358784198760986,3,True,False,False,False,,,
74885634,"{'steamid': '76561198418250222', 'num_games_owned': 0, 'num_reviews': 11, 'playtime_forever': 722, 'playtime_last_two_weeks': 0, 'playtime_at_review': 706, 'last_played': 1611150250}",english,worth,1598357792,1598357792,True,0,0,0.471282988786697388,0,True,False,False,False,,,
74815003,"{'steamid': '76561197963366484', 'num_games_owned': 777, 'num_reviews': 210, 'playtime_forever': 261, 'playtime_last_two_weeks': 0, 'playtime_at_review': 217, 'last_played': 1676511902}",english,I have had this game for over two years and find it frustrating because the multiplayer lobby system never seems to work and I want to play it coop.  I find what I have played of the game to be rather generic but it is a decent title for when it was released.,1598238443,1598238443,False,0,0,0,0,True,False,False,False,,,
74795515,"{'steamid': '76561198327039199', 'num_games_owned': 11, 'num_reviews': 6, 'playtime_forever': 1301, 'playtime_last_two_weeks': 0, 'playtime_at_review': 948, 'last_played': 1682276392}",english,Scary!,1598206755,1598206755,True,0,0,0,0,True,False,False,False,,,
74760368,"{'steamid': '76561198018674229', 'num_games_owned': 1227, 'num_reviews': 31, 'playtime_forever': 21, 'playtime_last_two_weeks': 0, 'playtime_at_review': 21, 'last_played': 1598154998}",english,"Seems like a fun game, but the complete inability to turn ruins the experience. Probably not a problem if you have a lot of room but even before I got into a proper level, my controllers would lose tracking because I hold it up at an angle that hides it from one of my base stations while my body blocks the other.

If I could just turn in-game, it'd be infinitely more playable. If you have the room or hardware other than the index, it might still be worth picking up.

The devs apparently have no plans on updating the game, which is a shame.",1598155685,1598155685,False,2,0,0.504197180271148682,0,False,False,False,False,,,
74581077,"{'steamid': '76561198881290024', 'num_games_owned': 0, 'num_reviews': 34, 'playtime_forever': 154, 'playtime_last_two_weeks': 0, 'playtime_at_review': 154, 'last_played': 1594262624}",english,Why can't we just use the weapons we want to use instead of making them character based? Not recommended.,1597870545,1597870545,False,3,2,0.42193758487701416,0,True,False,False,False,,,
74475206,"{'steamid': '76561198006914667', 'num_games_owned': 0, 'num_reviews': 118, 'playtime_forever': 445, 'playtime_last_two_weeks': 0, 'playtime_at_review': 445, 'last_played': 1597659312}",english,"I bought this on day 1 when it came out for VR,  I have so many memories in this and have watched this game grow,  its a lot of fun and I should buy it for my brother then I would play it more. 
This game has great co-op and can also be played solo, if you like shooters your going to love this. 
This game can be hard as you have to dodge and shoot but lots of fun with many game modes and levels. 
I would rate this 4/5",1597697303,1597697303,True,0,0,0,0,True,False,False,False,,,
74251224,"{'steamid': '76561198246839712', 'num_games_owned': 522, 'num_reviews': 48, 'playtime_forever': 1478, 'playtime_last_two_weeks': 0, 'playtime_at_review': 1441, 'last_played': 1597696725}",english,Intense action,1597339899,1597339899,True,1,0,0.5,0,False,False,False,False,,,
74226228,"{'steamid': '76561198013356720', 'num_games_owned': 300, 'num_reviews': 76, 'playtime_forever': 81, 'playtime_last_two_weeks': 0, 'playtime_at_review': 81, 'last_played': 1593890618}",german,Miese Performance und kaum Spieler.,1597302384,1597302384,False,0,0,0.482568502426147461,0,False,False,False,False,,,
73999556,"{'steamid': '76561197985613370', 'num_games_owned': 376, 'num_reviews': 38, 'playtime_forever': 41, 'playtime_last_two_weeks': 0, 'playtime_at_review': 41, 'last_played': 1596929568}",english,"On Oculus Rift S controllers, gun angles are completely wrong. You have to bend your hand forward to correctly align pistol and shoot. Barely playable.",1596929822,1596929822,False,3,0,0.566378533840179443,0,True,False,False,False,,,
73280428,"{'steamid': '76561198097694334', 'num_games_owned': 0, 'num_reviews': 14, 'playtime_forever': 175, 'playtime_last_two_weeks': 0, 'playtime_at_review': 114, 'last_played': 1595900432}",english,No Smooth Turning in 2020? Come on dude. Immersion ruining. You have it for all other platforms. It needs added like 2 years ago.,1595713799,1595713799,False,5,0,0.50829845666885376,0,True,False,False,False,,,
73270976,"{'steamid': '76561198003586982', 'num_games_owned': 763, 'num_reviews': 4, 'playtime_forever': 15, 'playtime_last_two_weeks': 0, 'playtime_at_review': 15, 'last_played': 1593926914}",english,"Unfortunately on the Index you'll require a full 360 degree playspace. Snap turning is unsupported on the Index despite existing on other headsets, and I've still been unable to find a workaround. Got it on sale so I'll hang on to it in the hopes that someone figures out a way to make it work, but I can't recommend it for other Index users.",1595698912,1595698912,False,4,0,0.56886899471282959,0,True,False,False,False,,,
73012911,"{'steamid': '76561198143817370', 'num_games_owned': 125, 'num_reviews': 28, 'playtime_forever': 489, 'playtime_last_two_weeks': 0, 'playtime_at_review': 487, 'last_played': 1651952666}",english,good game,1595269099,1595269099,True,0,0,0.492957741022109985,0,True,False,False,False,,,
72871932,"{'steamid': '76561197974158808', 'num_games_owned': 250, 'num_reviews': 82, 'playtime_forever': 417, 'playtime_last_two_weeks': 0, 'playtime_at_review': 417, 'last_played': 1595025317}",english,I want a sequel! Loved the story!,1595039786,1595039786,True,2,1,0.538461506366729736,0,True,False,False,False,,,
72694145,"{'steamid': '76561198006585831', 'num_games_owned': 592, 'num_reviews': 21, 'playtime_forever': 1128, 'playtime_last_two_weeks': 0, 'playtime_at_review': 1105, 'last_played': 1599245413}",english,"Played on the Oculus Rift S.

Was the first full game I'd played to completion, and I really enjoyed it. I picked it up on a sale for £5.10 - and I feel I've gotten my monies worth - not sure I'd say it's worth the full £29.99 though. The game has 10 levels at 5 waves a level (so 50 waves total). Some of the levels are similar in design (they change elements but are ultimately the same level - but I'm cool with this given the changes in level and introduction of new enemies on these levels) but overall I liked the levels.

There are four heros, each with six unlockable abilities. You can unlock all 6 abilities by playing and finding all of the collectables on the first five levels for each character. The shotgun felt a bit weird to me, but might just be me.

I've played co-op with a friend and has been decent too, not experienced any issues - covering my friends face with my hand and blocking his vision has been fun though! Haven't tried the PvP mode yet.",1594757063,1594757169,True,0,0,0,0,False,False,False,False,,,
72442144,"{'steamid': '76561198085609338', 'num_games_owned': 0, 'num_reviews': 32, 'playtime_forever': 176, 'playtime_last_two_weeks': 0, 'playtime_at_review': 110, 'last_played': 1672700783}",english,"My favorite thing to do in this game is play as the ninja, love the feeling of being a badass teleporting ninja throwing his enemies around with telekinesis and chopping off heads. would recommend this game primarily to people with a friend with vr, but just as fun by yourself. unlike the walking dead saints and sinners which is a bad game even if you could bring your friends.",1594395060,1594395060,True,0,0,0.476190477609634399,0,False,True,False,False,,,
72266770,"{'steamid': '76561198036123379', 'num_games_owned': 0, 'num_reviews': 8, 'playtime_forever': 58, 'playtime_last_two_weeks': 0, 'playtime_at_review': 30, 'last_played': 1594171675}",english,"the entire game's pretty lame, gets boring after about an hour

combat's not satisfying, and that's the whole point of the game
also cheap defend-the-point gameplay",1594171658,1594171658,False,4,0,0.501402437686920166,0,True,False,False,False,,,
72147502,"{'steamid': '76561198063052074', 'num_games_owned': 0, 'num_reviews': 124, 'playtime_forever': 31, 'playtime_last_two_weeks': 0, 'playtime_at_review': 31, 'last_played': 1593609611}",french,"Le jeu a mal vieilli ,",1594023381,1594023381,False,1,0,0.497925341129302979,0,True,False,False,False,,,
71922117,"{'steamid': '76561198182522331', 'num_games_owned': 134, 'num_reviews': 2, 'playtime_forever': 24, 'playtime_last_two_weeks': 0, 'playtime_at_review': 24, 'last_played': 1578020719}",english,Waiting for Index support...,1593746706,1593746706,False,20,3,0.606330156326293945,0,True,False,False,False,,,
71885454,"{'steamid': '76561198400096447', 'num_games_owned': 0, 'num_reviews': 29, 'playtime_forever': 277, 'playtime_last_two_weeks': 0, 'playtime_at_review': 209, 'last_played': 1614950610}",polish,gg,1593703470,1593703470,True,0,0,0,0,True,False,False,False,,,
71884772,"{'steamid': '76561198389089429', 'num_games_owned': 175, 'num_reviews': 2, 'playtime_forever': 289, 'playtime_last_two_weeks': 0, 'playtime_at_review': 59, 'last_played': 1595450343}",english,good game,1593702845,1593702845,True,0,0,0,0,True,False,False,False,,,
71686307,"{'steamid': '76561198066610690', 'num_games_owned': 164, 'num_reviews': 39, 'playtime_forever': 111, 'playtime_last_two_weeks': 0, 'playtime_at_review': 111, 'last_played': 1593467848}",english,"Every other VR shooter I have played either does not require much rotation, or allows you to rotate with a button press. This game doesn't seem to have a button for rotation, and you have to rotate a lot. This makes it difficult to play in standing mode. Otherwise, it seems okay. Probably worth the price when 80% off.",1593468382,1593468382,False,6,0,0.533931434154510498,0,True,False,False,False,,,
71553407,"{'steamid': '76561198976484131', 'num_games_owned': 0, 'num_reviews': 2, 'playtime_forever': 192, 'playtime_last_two_weeks': 0, 'playtime_at_review': 192, 'last_played': 1586600141}",french,"La langue française me manque beaucoup , les missions ne se passent que dans des espaces clos c'est un peu dommage , sinon le jeu a un bon potentiel ..",1593331983,1593331983,False,1,0,0.491329461336135864,0,True,False,False,False,,,
71451122,"{'steamid': '76561198296011299', 'num_games_owned': 97, 'num_reviews': 16, 'playtime_forever': 318, 'playtime_last_two_weeks': 0, 'playtime_at_review': 138, 'last_played': 1593660931}",english,coll agmw,1593224600,1593224600,True,0,1,0,0,True,False,False,False,,,
71445631,"{'steamid': '76561198797036425', 'num_games_owned': 138, 'num_reviews': 5, 'playtime_forever': 544, 'playtime_last_two_weeks': 0, 'playtime_at_review': 492, 'last_played': 1603490613}",english,"Okay, this is an outstanding game in multiplayer with 1 or more friends. i played the absolute hell out of this with my bud and we had planned to get 100% completion and hove another friend join us in doing so. Then my friend got a valve index and we tried to play it once. we haven't played it since, the index support on this game is absolutely horrible and i doubt i will be playing or installing this again until there is index support implemented. if you or your friends don't have indexes then absolutely buy this game. personally i didn't enjoy it solo but multiplayer is great and one of the best wave shooters i have ever played.",1593218065,1593218065,True,9,0,0.63351595401763916,0,True,False,False,False,,,
71402733,"{'steamid': '76561198046650462', 'num_games_owned': 0, 'num_reviews': 6, 'playtime_forever': 18, 'playtime_last_two_weeks': 0, 'playtime_at_review': 18, 'last_played': 1587308960}",english,Not properly playable with Valve Index. Devs don't seem to care.,1593179465,1593179465,False,0,0,0.476190477609634399,0,True,False,False,False,,,
71265018,"{'steamid': '76561198009370605', 'num_games_owned': 843, 'num_reviews': 52, 'playtime_forever': 255, 'playtime_last_two_weeks': 0, 'playtime_at_review': 255, 'last_played': 1592942354}",english,"Wave shooter game. There are several playable characters (which use pistol gun, shotgun, bow, or sword), which are more or less appropriate to use depending on the level. I enjoyed the sword dude the most, mostly because you mostly swing around your sword (plus eventually use skills) and it's fun. Until you find the explosive robots. Not great, but it still can be dealt with (kite them, they start charging the explosion, teleport away). The game is not even bad, until you reach a level where you are pretty much forced to physically crouch, which is something I personally do not enjoy.",1592991846,1592991846,False,6,6,0.479944735765457153,0,False,False,False,False,,,
71155386,"{'steamid': '76561198087735490', 'num_games_owned': 0, 'num_reviews': 30, 'playtime_forever': 156, 'playtime_last_two_weeks': 0, 'playtime_at_review': 156, 'last_played': 1592787641}",english,"[h1]TL;DR[/h1]
Raw Data is a fun game with questionable UI design choices.

[h1]Summary[/h1]
Okay, I can only play this game in short bursts because, while it is fun, it doesn't really do a good job of mitigating motion sickness or accounting for small playspaces. Below is a list of gripes, followed by a list of things I think the game does well.

[h2]Gripes[/h2]
[list]
[*]Many of the UI elements are stuck to your face so you have to utilize your glance to to read text on the edges of the lenses. 
[*]Hints and titles often sit in the middle of your vision and block the action
[*]As someone who gets easily motion sick, limiting and flat out disabling the teleport [i]at all[/i] is borderline unacceptable. This is only exacerbated by a small playspace.
[*]Game elements are often placed outside of my playspace so I can't reach mission critical elements, and the teleport ability can only get so close to map geometry. I'm sure you can imagine how frustrating this is.
[*]The sword, while it is the most fun in my opinion, is very difficult to use because it has to be swung pretty fast to do any noticeable damage. It will probably do more damage to your real life walls than anything in the game if you have a small playspace like me.
[*]The pistol is not quite aligned with the Oculus Touch controller and feels like I have to slightly turn my wrists outward to line up the sights
[*]The player characters' arms feel like their shoulders sit higher than normal, which is weird since I often have the opposite problem being 6'2"" (188 cm)
[/list]

[h2]Things the game does well[/h2]
[list]
[*]The game looks good.
[*]The game sounds good.
[*]The pistol and bow feel good to use and like they reward skillful play.
[*]Most enemies react satisfyingly to being hit.
[*]There's an actual story with solid voice acting and dialogue.
[*]Feels good to unlock stuff and try it put immediately between every mission.
[/list]

[h2]Conclusion[/h2]
This game is great, especially with friends, if you can tolerate weird UI design choices and a little motion sickness. I have to play it in short bursts because of all the weirdness, but honestly that's okay, since my pudgy body tends to poop out around the same time I get sick or frustrated with things being outside my playspace.",1592790952,1592790952,True,15,0,0.672080159187316895,0,True,False,False,False,,,
