recommendationid,author,language,review,timestamp_created,timestamp_updated,voted_up,votes_up,votes_funny,weighted_vote_score,comment_count,steam_purchase,received_for_free,written_during_early_access,hidden_in_steam_china,steam_china_location,timestamp_dev_responded,developer_response
161395222,"{'steamid': '76561198333027986', 'num_games_owned': 256, 'num_reviews': 17, 'playtime_forever': 817, 'playtime_last_two_weeks': 6, 'playtime_at_review': 811, 'last_played': 1711504963}",german,"fully recommend, very fun",1711323217,1711323217,True,0,0,0,0,True,False,False,True,,,
160789377,"{'steamid': '76561198035706137', 'num_games_owned': 0, 'num_reviews': 1, 'playtime_forever': 62, 'playtime_last_two_weeks': 0, 'playtime_at_review': 62, 'last_played': 1710702603}",english,"Crashed Before even starting the  game, tried multiple times, kept crashing",1710702666,1710702666,False,3,0,0.522713661193847656,0,True,False,False,True,,,
160613635,"{'steamid': '76561198065475618', 'num_games_owned': 0, 'num_reviews': 24, 'playtime_forever': 6, 'playtime_last_two_weeks': 0, 'playtime_at_review': 6, 'last_played': 1710536087}",english,If you're using the Quest Link do not even bother buying the game. It crashes everytime on startup.,1710536280,1710536280,False,3,0,0.56081080436706543,0,True,False,False,True,,,
159798092,"{'steamid': '76561198946740707', 'num_games_owned': 183, 'num_reviews': 6, 'playtime_forever': 39, 'playtime_last_two_weeks': 0, 'playtime_at_review': 39, 'last_played': 1709488915}",english,"Did not enjoy, its a super basic game where you just stand still in a room wave after wave
Not fun at all",1709496792,1709496792,False,1,0,0.447635471820831299,0,False,False,False,True,,,
159005685,"{'steamid': '76561197994049547', 'num_games_owned': 0, 'num_reviews': 28, 'playtime_forever': 18, 'playtime_last_two_weeks': 0, 'playtime_at_review': 18, 'last_played': 1708637002}",english,"If you have an HTC Vive or Valve Index, just skip it.  Even if it is a dollar.  They did not implement snap turning controls on our platform, and they refuse to make even a minor update to add it. This is a long-standing issue that CANNOT be solved, since no mechanism exists to map the controls.  This game is old enough to pre-date Steam Input, and they have never bothered to add it as a patch since.

So if you're not one of the Oculus crowd, this game is basically hamstrung from the start.  Sad, but true.",1708637881,1708637881,False,2,0,0.545454561710357666,0,True,False,False,True,,,
158063448,"{'steamid': '76561198022667949', 'num_games_owned': 892, 'num_reviews': 200, 'playtime_forever': 12, 'playtime_last_two_weeks': 0, 'playtime_at_review': 12, 'last_played': 1707642541}",russian,Дропнул на обучении,1707642611,1707642611,False,0,0,0,0,True,False,False,True,,,
155811143,"{'steamid': '76561198159656382', 'num_games_owned': 60, 'num_reviews': 6, 'playtime_forever': 257, 'playtime_last_two_weeks': 0, 'playtime_at_review': 257, 'last_played': 1687998478}",english,good,1705063479,1705063479,True,0,0,0,0,True,False,False,True,,,
155080169,"{'steamid': '76561199385950355', 'num_games_owned': 0, 'num_reviews': 2, 'playtime_forever': 2582, 'playtime_last_two_weeks': 253, 'playtime_at_review': 756, 'last_played': 1712436579}",english,Very fast pace Love It!,1704221009,1704221009,True,1,0,0.523809552192687988,0,True,False,False,True,,,
154908296,"{'steamid': '76561198117026250', 'num_games_owned': 556, 'num_reviews': 517, 'playtime_forever': 362, 'playtime_last_two_weeks': 0, 'playtime_at_review': 362, 'last_played': 1704039865}",english,i kill robots,1704040483,1704040483,True,0,1,0.460358083248138428,0,False,False,False,True,,,
154587932,"{'steamid': '76561199546140798', 'num_games_owned': 0, 'num_reviews': 1, 'playtime_forever': 1402, 'playtime_last_two_weeks': 22, 'playtime_at_review': 133, 'last_played': 1712436562}",english,This game doesn't support 4 players even though it is co-op. Very disappointed in this game.,1703725808,1703725837,False,1,2,0.484835267066955566,0,True,False,False,True,,,
154141922,"{'steamid': '76561198048970217', 'num_games_owned': 608, 'num_reviews': 116, 'playtime_forever': 37, 'playtime_last_two_weeks': 0, 'playtime_at_review': 37, 'last_played': 1703262610}",english,"Controls are very very poor for Valve index, if not. Not even thought about. Can't turn or properly move. Thats all i've got to say.",1703262753,1703262753,False,2,0,0.443762749433517456,0,False,False,False,True,,,
153388559,"{'steamid': '76561198048439979', 'num_games_owned': 0, 'num_reviews': 83, 'playtime_forever': 1020, 'playtime_last_two_weeks': 0, 'playtime_at_review': 1020, 'last_played': 1584841002}",english,"So fun, co-op with friends is a blast.",1702316976,1702316976,True,1,0,0.523809552192687988,0,True,False,False,True,,,
153100526,"{'steamid': '76561198398539061', 'num_games_owned': 94, 'num_reviews': 38, 'playtime_forever': 351, 'playtime_last_two_weeks': 0, 'playtime_at_review': 255, 'last_played': 1702369035}",english,".
",1702017345,1702017345,True,0,0,0.414820045232772827,0,True,False,False,True,,,
150347736,"{'steamid': '76561198066199748', 'num_games_owned': 1781, 'num_reviews': 27, 'playtime_forever': 71, 'playtime_last_two_weeks': 0, 'playtime_at_review': 71, 'last_played': 1699562654}",english,"I do not recommend this game. The screenshots and the description are misleading. It's just a ""defeat x enemy waves"" shooter with zero variety in gameplay structure",1700304490,1700304490,False,7,2,0.541056692600250244,0,False,False,False,True,,,
148593547,"{'steamid': '76561198012310734', 'num_games_owned': 731, 'num_reviews': 46, 'playtime_forever': 96, 'playtime_last_two_weeks': 0, 'playtime_at_review': 43, 'last_played': 1697886461}",english,"Old controls, outdated gameplay, crash frenzy, fall out of the map more than a few times in the first hour of playing. This sucks.",1697883235,1697883235,False,4,2,0.53218764066696167,0,False,False,False,True,,,
148197897,"{'steamid': '76561198091359540', 'num_games_owned': 352, 'num_reviews': 220, 'playtime_forever': 1320, 'playtime_last_two_weeks': 0, 'playtime_at_review': 178, 'last_played': 1708717506}",english,"2 Player Mode is fun, game looks good, lots of details in the gun, would be more fun if multiplayer was less buggy:

Enemies are completely invisible sometimes, weapons sometimes lose stickyness after respawning, weapons are sometimes just gone after respawning, weapons are sometimes invisible after respawning (except magazine)

Also, please let us skip intro cutscenes",1697285951,1708964848,True,1,0,0.515265107154846191,0,True,False,False,True,,,
147289544,"{'steamid': '76561198000998015', 'num_games_owned': 0, 'num_reviews': 1537, 'playtime_forever': 2057, 'playtime_last_two_weeks': 0, 'playtime_at_review': 2057, 'last_played': 1661816989}",english,Sword Combat.,1696003579,1696003579,True,1,0,0.488820910453796387,0,True,True,False,True,,,
147130890,"{'steamid': '76561198048370488', 'num_games_owned': 428, 'num_reviews': 147, 'playtime_forever': 205, 'playtime_last_two_weeks': 0, 'playtime_at_review': 205, 'last_played': 1695824248}",english,"meh, brought it for £5 and that's about what it's worth, some strange screen tearing here and there as well along with weird key bindings like when you're holding right stick in to activate abilities ect if you have snap turning on it'll still turn you and is really disorientating and annoying, i most likely won't be finishing this tbh. 

also it's actually a tower defence, i feel like it would've benefited from being a straight survival like COD zombies or something but hey, you might like that.",1695824716,1695824716,False,3,0,0.554530918598175049,0,True,False,False,True,,,
147097834,"{'steamid': '76561199227925298', 'num_games_owned': 94, 'num_reviews': 10, 'playtime_forever': 640, 'playtime_last_two_weeks': 0, 'playtime_at_review': 629, 'last_played': 1708995927}",english,This is one of the best games I have ever played in my entire life. This needs more attention n matter how old it is. If this gets more attention it could be so big and we could get new updates. People give these old gems a chance.,1695771890,1695771890,True,0,0,0,0,True,False,False,True,,,
146839002,"{'steamid': '76561198149088654', 'num_games_owned': 0, 'num_reviews': 12, 'playtime_forever': 100, 'playtime_last_two_weeks': 0, 'playtime_at_review': 100, 'last_played': 1684083686}",english,"This is a 6 years old game with 6 years old controls. It needs to be updated to nowadays standards!
There is no proper locomotion and turning. Also the game just bugged on one mission, and we couldn't continue as the robots were stuck in their container.",1695453781,1695453781,False,0,0,0.476190477609634399,0,False,False,False,True,,,
145625290,"{'steamid': '76561198870378349', 'num_games_owned': 704, 'num_reviews': 33, 'playtime_forever': 16, 'playtime_last_two_weeks': 0, 'playtime_at_review': 16, 'last_played': 1693771509}",english,"I am so glad I got this on a deep sale, because this game does not have proper controls for VR. Using the Valve Index Knuckles, there is no way to turn around even though the control menus suggest otherwise. 


Would completely avoid this and play something else instead, it is never going to have proper support for modern VR hardware.",1693785104,1693785104,False,0,0,0,0,False,False,False,True,,,
142023612,"{'steamid': '76561198158428595', 'num_games_owned': 99, 'num_reviews': 28, 'playtime_forever': 1185, 'playtime_last_two_weeks': 0, 'playtime_at_review': 832, 'last_played': 1705077390}",english,best game 2023,1689291893,1689291893,True,0,0,0.463073700666427612,0,True,False,False,True,,,
141880297,"{'steamid': '76561199013410907', 'num_games_owned': 115, 'num_reviews': 47, 'playtime_forever': 167, 'playtime_last_two_weeks': 0, 'playtime_at_review': 167, 'last_played': 1658042103}",english,Was ahead of its time for VR,1689134961,1689134961,True,2,0,0.547325074672698975,0,True,False,False,True,,,
141482578,"{'steamid': '76561198046630863', 'num_games_owned': 0, 'num_reviews': 33, 'playtime_forever': 774, 'playtime_last_two_weeks': 0, 'playtime_at_review': 687, 'last_played': 1688844998}",english,Fun title.,1688683232,1688683232,True,0,0,0.463073700666427612,0,True,False,False,True,,,
140251081,"{'steamid': '76561197965066413', 'num_games_owned': 671, 'num_reviews': 684, 'playtime_forever': 66, 'playtime_last_two_weeks': 0, 'playtime_at_review': 30, 'last_played': 1710552039}",english,"I got this in a VR bundle.  It wasn't for me, but I could see how some folks could have a good time.",1687052518,1687052518,True,1,0,0.522058844566345215,0,False,False,False,True,,,
139878190,"{'steamid': '76561198009145942', 'num_games_owned': 0, 'num_reviews': 37, 'playtime_forever': 57, 'playtime_last_two_weeks': 0, 'playtime_at_review': 57, 'last_played': 1681043373}",german,Badly Designed Controls,1686470849,1686470849,False,0,0,0,0,False,False,False,True,,,
139562854,"{'steamid': '76561199221873737', 'num_games_owned': 0, 'num_reviews': 37, 'playtime_forever': 228, 'playtime_last_two_weeks': 0, 'playtime_at_review': 149, 'last_played': 1686271652}",english,"really fun, i wouldnt buy for full price get a code from instant gaming or something for like $5. me and a friend bought i can play no issue at all but my friends hands will not load in game.",1685915364,1685915364,True,0,0,0,0,False,False,False,True,,,
138063116,"{'steamid': '76561198007343154', 'num_games_owned': 0, 'num_reviews': 449, 'playtime_forever': 312, 'playtime_last_two_weeks': 0, 'playtime_at_review': 312, 'last_played': 1563325247}",english,"I am a 45 yo father, probably one of the oldest people playing this game. I am a single father to my Son, who is 14 now. My son got this game from his uncle, so we installed it on his computer and he started playing. By the end of the week he had 24 hours on this game. This was horrible for me, as it was already hard for me to find ways to spend time with my son, as he is always out with his friends or just watching YouTube. So I decided to make a Steam account and get this game to see if I could maybe play alongside him. I loaded into the game, picked my character and world and started playing but I was stuck on what you where supposed to do. I asked my Son for help and he hosted a game for me to join. I loved it as it was the best time I had spent with my Son since my wife had died. This game has ever since brought me and my son closer again and now we actually spend time together outside the house together as well. This game reminded me that there's fun to be had in everything, and it has brought both me and my Son many happy memories.",1683663408,1683663408,True,4,0,0.445321589708328247,0,True,False,False,True,,,
137564689,"{'steamid': '76561197984524933', 'num_games_owned': 1377, 'num_reviews': 335, 'playtime_forever': 98, 'playtime_last_two_weeks': 0, 'playtime_at_review': 33, 'last_played': 1688286208}",russian,Унылая скучная убивалка железяк. Перемещение очень скудное вся игра сводится к затюкиванию ходячих кукол на аренках волна за волной. Как многие уже писали игра очень устарела геймплейно. Подойдёт разве что детям никогда не игравшим в VR для ознакомления.,1682874827,1682874827,False,0,0,0,0,True,False,False,True,,,
136721322,"{'steamid': '76561199485085742', 'num_games_owned': 0, 'num_reviews': 2, 'playtime_forever': 245, 'playtime_last_two_weeks': 0, 'playtime_at_review': 186, 'last_played': 1690880926}",english,"Unbelievable game play! Keep coming back to this game! Our whole family plays it's challenging, engaging and arcade like gaming is outstanding you will not be disappointed 🏋️🤘 very good graphics as well needs to be played on a good computer - you wouldn't try to play a $1000 game on a $200 computer",1681535884,1681535884,True,0,0,0.47826087474822998,0,True,False,False,True,,,
136329447,"{'steamid': '76561198027141633', 'num_games_owned': 0, 'num_reviews': 3, 'playtime_forever': 28, 'playtime_last_two_weeks': 0, 'playtime_at_review': 28, 'last_played': 1508494389}",russian,нормали,1680949158,1680949158,True,0,0,0,0,True,False,False,True,,,
135460271,"{'steamid': '76561198214932136', 'num_games_owned': 0, 'num_reviews': 28, 'playtime_forever': 62, 'playtime_last_two_weeks': 0, 'playtime_at_review': 62, 'last_played': 1640089680}",koreana,대기실에서 큐돌려놓고 활쏘고 놀다가 1시간 지나서 그냥 끔,1679820704,1679820748,False,0,0,0,0,True,False,False,True,,,
135102962,"{'steamid': '76561198116418908', 'num_games_owned': 0, 'num_reviews': 7, 'playtime_forever': 35, 'playtime_last_two_weeks': 0, 'playtime_at_review': 24, 'last_played': 1679659445}",tchinese,"物件互動、整理動作都很棒，
我不會特別寫心得，
不好玩就退申請退款，
這遊戲我覺得很棒。",1679409497,1679409497,True,0,0,0,0,True,False,False,True,,,
134921975,"{'steamid': '76561198041357242', 'num_games_owned': 388, 'num_reviews': 24, 'playtime_forever': 393, 'playtime_last_two_weeks': 0, 'playtime_at_review': 393, 'last_played': 1676321676}",english,"Game is completely broken and unplayable in 2023.
Headset - Valve Index
GPU - 3070
CPU - i9-9900k

This game has constant stuttering no matter what settings you change, it makes the game unplayable and there have been no updates or announcements made to fix this issue, so i now have a AAA VR game sitting in my steam library i cannot play anymore.

If you plan on buying this game, don't, it is abandoned and there haven't been any updates since 2018.",1679178447,1679178447,False,9,1,0.619237661361694336,0,False,False,False,True,,,
134760572,"{'steamid': '76561198153919062', 'num_games_owned': 0, 'num_reviews': 43, 'playtime_forever': 861, 'playtime_last_two_weeks': 0, 'playtime_at_review': 629, 'last_played': 1700424645}",french,"Globalement le jeu est plutôt bien et je le recommande, même si en terme de note de lui donnerai à peine plus que la moyenne. Pourquoi ?

Déjà il n'a pas reçu de mise à jour depuis 2018, ce qui sous-entend d'après moi que le développement a été arrêté.
Ensuite, pour parler du contenu :
- Le jeu propose 10 missions avec une histoire.
- 4 personnages jouables avec des armes et des compétences différentes.
- Un mode Solo, coop 2 joueurs, et PVP.
Un jeu simple mais mine de rien assez complet. Pourquoi aussi peu alors ?

Parce qu'il coûte plus cher que quasiment n'importe quel autre jeu VR connu (exception faite pour Half Life: Alyx mais c'est Half Life bordel !). 38€ pour ça, ça aurait pu passer si tout était bien. Sauf que non.

Le tracking des grips n'est vraiment pas au point. Je n'arrive même pas à attraper mes armes par moment. Le support gaucher qui, comme sur 80% des jeux, n'est fait qu'à moitié. Un gaucher ça tient l'arc avec sa main gauche, en fait, donc il doit être sur sa hanche gauche. Pas droite.
Niveau gameplay c'est plutôt plat. On passe notre temps à se battre contre des robots de différents types. Mention spéciale aux 2 ou 3 niveaux qui apportent quand même du gameplay un peu plus varié avec une courte séquence de puzzle, de l'exploration ou un combat de boss.
Enfin, dernier truc dommage : pas de sous titre, et le jeu est entièrement en anglais, donc ça inclut de savoir parler anglais. Heureusement, c'est quand même relativement audible.

Alors pourquoi je le recommande alors ?

Le système de personnage est relativement bien fait et le système de compétence permet de diversifier nos attaques. Le concept des tourelles est vachement cool aussi.
L'histoire en elle-même, bien que courte, reste prenante et intéressante.
Même si on passe notre temps à se battre, ça en vaut quand même le coup parce qu'on a pas trop cette sensation de répétition. Les environnements et les ennemis sont variés.
Enfin, mais c'est une histoire personnelle, j'ai eu des fous rires sur le jeu avec un ami. D'ailleurs, je recommande vraiment d'y jouer avec un ami plutôt que seul.

En conclusion, le jeu est excellent pour découvrir la VR et reste intéressant malgré son prix beaucoup trop élevé à mon goût et ses petits défauts qui au final relève plus du jeu en lui-même que de ses mécaniques. Il fonctionne quand même très bien avec un PC pas fou. Il faut beaucoup plus le coup en promo, ou il atteint un prix de 20€ je crois.",1678982625,1678982625,True,0,0,0,0,True,False,False,True,,,
134744902,"{'steamid': '76561198036393944', 'num_games_owned': 298, 'num_reviews': 8, 'playtime_forever': 41, 'playtime_last_two_weeks': 0, 'playtime_at_review': 41, 'last_played': 1674612808}",english,This waveshooter doesn't have enough variety and the movement's wack.,1678957825,1678957825,False,1,0,0.486836910247802734,0,True,False,False,True,,,
133677300,"{'steamid': '76561198136153331', 'num_games_owned': 515, 'num_reviews': 240, 'playtime_forever': 10, 'playtime_last_two_weeks': 0, 'playtime_at_review': 10, 'last_played': 1617725584}",tchinese,:),1677428582,1677428582,True,3,0,0.536121666431427002,0,True,False,False,True,,,
133565707,"{'steamid': '76561198017340647', 'num_games_owned': 0, 'num_reviews': 47, 'playtime_forever': 65, 'playtime_last_two_weeks': 0, 'playtime_at_review': 65, 'last_played': 1677318029}",spanish,"Es un juego de oleadas por 40 pavos. Suerte que me lo compré por 5$ Instant Gaming. No es que sea malo, es que no es bueno.",1677318235,1677318235,False,0,1,0.484848499298095703,0,False,False,False,True,,,
133138832,"{'steamid': '76561198444067042', 'num_games_owned': 0, 'num_reviews': 80, 'playtime_forever': 712, 'playtime_last_two_weeks': 0, 'playtime_at_review': 526, 'last_played': 1688931536}",english,"This game is a hidden gem, It gets hard without turrets or shields when you reach the tram level, so get used to the tower defense aspect too",1676767798,1688921931,True,0,0,0,0,True,False,False,True,,,
132907316,"{'steamid': '76561198291191941', 'num_games_owned': 0, 'num_reviews': 8, 'playtime_forever': 74, 'playtime_last_two_weeks': 0, 'playtime_at_review': 74, 'last_played': 1677168559}",english,"No Snap turn for Index, but fun Idea though",1676480382,1676480382,False,0,0,0.476190477609634399,0,True,False,False,True,,,
132365429,"{'steamid': '76561198025357616', 'num_games_owned': 0, 'num_reviews': 4, 'playtime_forever': 22, 'playtime_last_two_weeks': 0, 'playtime_at_review': 22, 'last_played': 1675768217}",english,"Unfortunately it's too dated, playing on a PICO 4 with VD there was a problem and the resolution was too high causing unplayable stutter on my rtx 3080. No way to change resolution in game and changing steam SS didn't help. Unfortunately unplayable with modern hardware in 2023 without caveats",1675769174,1675769174,False,7,2,0.633653044700622559,0,False,False,False,True,,,
130603073,"{'steamid': '76561198112639485', 'num_games_owned': 0, 'num_reviews': 31, 'playtime_forever': 25, 'playtime_last_two_weeks': 0, 'playtime_at_review': 25, 'last_played': 1673394158}",english,"Hands down boring. I played the demo a lot at a demo kiosk a while back and kind of enjoyed it, and I thought I would get this now that I have my own headset. The shooting is meh compared to what I remember at the demo kiosk, but maybe that's because I was more enamored with shiny new VR back then since I didn't have my own headset. Pistol and Sword were the only fun weapons, and when you only have 4 weapons, that's a problem. 

The story is outright tone deaf. Fighting against a corrupt evil software and robotics corporation? And yet in the EULA, they have all the standard evil big company clauses, like waiving all legal rights, including juries, as well as clauses that say they can infect your computer with malware and somehow not be responsible. The absolute irony of a story about fighting evil corrupt Eden Corp, while moonlighting as an evil company yourself. I cannot take this game's story seriously, and I cannot enjoy the game when they ruin it with such a tone deaf story like this. 

If you can get this game at 75% off and don't care about the story, then maybe you'll have fun, but otherwise, it's not worth it.",1673395303,1673395303,False,0,0,0.476190477609634399,0,True,False,False,True,,,
130596806,"{'steamid': '76561198841183312', 'num_games_owned': 0, 'num_reviews': 42, 'playtime_forever': 412, 'playtime_last_two_weeks': 0, 'playtime_at_review': 412, 'last_played': 1550694131}",russian,"Тот случай когда играешь и думаешь, нихера себе какой уровень проработки задумки механики и тд. И такой думаешь ну нет этот уровень это какаято пробная хрень для ознакомления должно быть что то помасштабнее, после опять тоже самое далее вроде пошире дело идет но всеравно ждешь что вот вот начнется, тут херак конец игры, и ты такой а где где оно то самое ан нету,.. Это всеравно что купить спорткар и толкаться в пробке так и ненайдя свободного места разогнаться, вот коротко ощущения оставшиеся от этой игры.",1673386968,1676650484,False,0,0,0,0,True,False,False,True,,,
130399643,"{'steamid': '76561198137349289', 'num_games_owned': 2329, 'num_reviews': 1371, 'playtime_forever': 15, 'playtime_last_two_weeks': 0, 'playtime_at_review': 15, 'last_played': 1546309040}",english,👍,1673147788,1673147788,True,2,0,0.492667555809020996,0,True,False,False,True,,,
130358210,"{'steamid': '76561198141550626', 'num_games_owned': 0, 'num_reviews': 6, 'playtime_forever': 303, 'playtime_last_two_weeks': 0, 'playtime_at_review': 303, 'last_played': 1672128376}",english,"It's a pretty fun game (esp. with co-op) but it comes with some serious caveats (hence the negative):
#1 there are numerous bugs which the developer refuses to fix, the most infamous being losing guns after you die and being unable to get them back
#2 some of the VR movement options are incomplete meaning, you won't be able to configure your right thumbstick for vertical movement. Kind of a strange choice considering it is a VR-exclusive game...
#3 replayability is low; once you beat it you're probably not coming back to it",1673106333,1673106333,False,5,0,0.602192461490631104,0,True,False,False,True,,,
