recommendationid,author,language,review,timestamp_created,timestamp_updated,voted_up,votes_up,votes_funny,weighted_vote_score,comment_count,steam_purchase,received_for_free,written_during_early_access,hidden_in_steam_china,steam_china_location,timestamp_dev_responded,developer_response
106944765,"{'steamid': '76561199103445236', 'num_games_owned': 0, 'num_reviews': 9, 'playtime_forever': 164, 'playtime_last_two_weeks': 0, 'playtime_at_review': 164, 'last_played': 1640908567}",english,"It's spooky, weird, and downright creepy. I played this game when it came out on big fish and I was unprepared for some of the scenes. [spoiler](The maternity room with the squishing pregnant bellies and the childhood home with the ambient sounds of child abuse.)[/spoiler]

Pros:
#Creepy and good to play around Halloween.
#Puzzles are complicated and require thought on some of them (Others require codes and diagrams hidden in the world)
#The actor who played Charles seemed like he had a lot of fun. He's probably the best part of this game, imo.

Cons:
#Not for children (or at least children under 12)
#Ambient sounds, and scenery in scenes may trigger distress in certain people, such as abuse survivors. There's abuse mentioned and depicted upon [spoiler]mannequins[/spoiler].",1640909670,1671314867,True,0,0,0,0,True,False,False,False,,,
97896356,"{'steamid': '76561198272281248', 'num_games_owned': 0, 'num_reviews': 1, 'playtime_forever': 436, 'playtime_last_two_weeks': 0, 'playtime_at_review': 435, 'last_played': 1710716235}",english,"I absolutely hate this game. Keep in mind, this is coming from someone who ADORES the series and has played ""Return to Ravenhearst"" dozens of times over the years (as well as other Mystery Case Files). This game is a frustrating atrocity who can be described no more accurately than ""Pretentious"" citing issues such as puzzles lacking logical function and the typical in-screen nudges and hit-boxes so small that you could be using the correct item in the correct spot and be told you are wrong for a half hour. All of this is in addition to the change of mechanic where it is no longer a 'search and find' puzzle, it is staring at your screen for half a lifetime waiting for something to move and for a lifetime more to realize that the last item is smaller than your cursor (again, pretentious). The shifting items was a fun little side quest in other games like 'Dire Grove' but it is deplorable as a main mechanic. The ambiance and atmosphere is not enough to forgive the overall disappointment both in story and function, a complete letdown in every way and too much of a headache to be enjoyable. I was ecstatic to finally have an extension to my favorite game of all time, but this game is so awful that I hesitate to move on to the next ones. Again, please keep in mind all of this is coming from someone who knows the series and has finished the game already, but this review comes in the middle of a replay for the sake of story AND giving it another chance beyond my bias of the first playthrough. I can honestly say that I hate this game. The only reason to play it would be storyline, but you might want to have a walkthrough ready on another screen, or save yourself the trouble and just look up a summary.",1629430054,1629430054,False,0,0,0,0,True,False,False,False,,,
96324087,"{'steamid': '76561198021612656', 'num_games_owned': 0, 'num_reviews': 7, 'playtime_forever': 214, 'playtime_last_two_weeks': 0, 'playtime_at_review': 200, 'last_played': 1627181036}",english,"I loved all of the previous MCF games, but this one is not fun. I bought the games specifically because I wanted hidden object nostalgia from my elementary school days. This? This is a point-and-click, random-puzzle, gamey-logic thing with very minimal hidden object aspects. And on top of that, I can't even shotgun the game and move on with my life, because it bugs out every 15 minutes, locks me into a single room, and then auto-closes when I tab over to a different window.",1627180074,1627180074,False,0,0,0,0,True,False,False,False,,,
95871439,"{'steamid': '76561198061196724', 'num_games_owned': 153, 'num_reviews': 9, 'playtime_forever': 264, 'playtime_last_two_weeks': 0, 'playtime_at_review': 264, 'last_played': 1626481088}",english,Great point and click game but softlocks constantly!! I played this series growing up on Big Fish Games and never had a problem with it constantly crashing. Steam pls fix this. Aside from that the puzzles are good and really make you think.,1626481445,1626481445,True,0,0,0,0,True,False,False,False,,,
90020601,"{'steamid': '76561199007537463', 'num_games_owned': 0, 'num_reviews': 6, 'playtime_forever': 3111, 'playtime_last_two_weeks': 0, 'playtime_at_review': 529, 'last_played': 1679707249}",english,"This game brings back really good memories of when I used to play it with my nanny a lot. It's still just as fun as I remembered! The puzzles are a bit challenging, but I never get bored of them!",1617994224,1617994224,True,0,0,0,0,True,False,False,False,,,
87773911,"{'steamid': '76561198281862962', 'num_games_owned': 0, 'num_reviews': 3, 'playtime_forever': 865, 'playtime_last_two_weeks': 0, 'playtime_at_review': 470, 'last_played': 1691753083}",english,"First time i played it i was simply amazed of how complex it is, and the creative ideas just left me speachless. 
I loved it as much as the second Ravenhearst. I would recommed to anyone who enojyed the second one, to play this one.",1614766787,1614766787,True,1,0,0.52173912525177002,0,True,False,False,False,,,
86929651,"{'steamid': '76561198112810310', 'num_games_owned': 0, 'num_reviews': 2, 'playtime_forever': 1671, 'playtime_last_two_weeks': 0, 'playtime_at_review': 916, 'last_played': 1615162313}",english,"This game is disturbing. Pregnant woman, freak babies, popping pimples full of puss, clipping nose hairs, clipping toenails. Full of mental and physical child abuse. Had a hard time playing without taking breaks and feeling sick to my stomach. I like mystery and villains, but this was plain sick.",1613625077,1613625077,False,0,1,0.433070838451385498,0,True,False,False,False,,,
84182919,"{'steamid': '76561199125549752', 'num_games_owned': 0, 'num_reviews': 2, 'playtime_forever': 732, 'playtime_last_two_weeks': 0, 'playtime_at_review': 732, 'last_played': 1609883775}",english,love the game,1609973526,1609973526,True,0,0,0,0,True,False,False,False,,,
76573723,"{'steamid': '76561198056327431', 'num_games_owned': 0, 'num_reviews': 17, 'playtime_forever': 570, 'playtime_last_two_weeks': 0, 'playtime_at_review': 507, 'last_played': 1604896184}",english,"This game is a huge departure from the original series and that's why I don't recommend it. It is basically a ""Telltale Games style"" point and click adventure. For me, I wanted this to be another hidden objects game but it's technically not. It's really a puzzle solving game. The bottom line is (in my opinion), the publishers added more stuff fans don't want, and got rid of the stuff fans do want. The only reason to play this game is to uncover more of the story of the Ravenhearst series.",1601091285,1601091285,False,1,0,0.453466564416885376,0,True,False,False,False,,,
73973659,"{'steamid': '76561198277544747', 'num_games_owned': 0, 'num_reviews': 27, 'playtime_forever': 903, 'playtime_last_two_weeks': 0, 'playtime_at_review': 903, 'last_played': 1596845035}",english,"I dislike how they made the object search ONLY morphing objects. they completely switched the gameplay of the entire series. The puzzles were either way to complicated or way too easy, little to no middle ground. compared to the first two, this one is terrible. but, it is essential to understanding the overall plot to the ravenhearst arc, so if you're interested in getting the full story, i just recommend using a walkthrough through the whole game and save yourself a couple hours.",1596891648,1596891648,False,1,1,0,0,True,False,False,False,,,
73592504,"{'steamid': '76561198049213193', 'num_games_owned': 0, 'num_reviews': 140, 'playtime_forever': 394, 'playtime_last_two_weeks': 0, 'playtime_at_review': 394, 'last_played': 1596258781}",english,"I would love to recommend this game, but it is far, far too broken right now.  My friends and I ran into some soft locking before I had to switch to a new hard drive.  We gave up after the 3rd time it happened.  So, new hard drive, still Windows 10 regular edition.  Re-installing the game was a challenge because the first install would not work, the game window just kept disappearing.  A few restarts and another reinstall later and it worked but I couldn't find the save data to restore.  (It doesn't cloud save but that's not a big deal).  So we restart.  About twenty minutes in, game soft locks.  Okay, maybe clicked out of the window too much to see the guide.  Relaunch, make sure to stay in the window.  Play another four minutes and it soft locks AGAIN.  I will happily change this rating if the game can ever be fixed.",1596259549,1596259549,False,2,0,0.5,0,True,False,False,False,,,
72326429,"{'steamid': '76561198004423189', 'num_games_owned': 4454, 'num_reviews': 423, 'playtime_forever': 496, 'playtime_last_two_weeks': 0, 'playtime_at_review': 496, 'last_played': 1594246121}",russian,"Я давно знаком с этой серией - ещё с первых частей, которые были обычным ""поиском предметов"", но с той или иной закавыкой. Поэтому когда они появились на Стиме (да ещё и по весьма приличной цене), я купил их все...

...и немедленно пожалел. Старые, первые части интегрированы со Стимом из рук вон плохо: они идут в окошке, в ""родном"" для них разрешении, которое не превышает 1024х768. А для Hidden Objects это катастрофа, если на экране с трудом можно что-то разобрать.

Наконец, перебирая их все подряд, я дошёл до первой рабочей -  13th Skull. Ничего особенного, обычная Hidden Objects новой волны: простенькая адвенчура, в которую плохо интегрированы собственно картинки с поиском предметов.

Сейчас, от нечего делать, запустил Escape From Ravenhearst, чисто потупить перед сном. Начало ничем не выдающееся (разве что Hidden Objects-картинки выделяются, но об этом ниже), и поначалу это всё то же, всё так же: инвентарь на несколько предметов, три-четыре локации, простенькие головоломки. Но стоит пройти чуть дальше, загадки начинают усложняться, а потом игра внезапно превращается ... в абсолютно полноценную хоррор-адвенчуру в духе 7th Guest! (Ну, во всяком случае, в ""экспертном"" режиме, не знаю, как там в Basic). С 7th Guest они очень похожи: здесь тоже героине противостоит злобный маньяк с паранормальными способностями, и тоже сюжет состоит в последовательности более-менее мрачных сцен (ну, честно говоря, и сюжет здесь тоже, как и в 7-м госте - не самое сильное место, но тем не менее на нервы давит. И звуковое сопровождение весьма этому помогает). Но что куда важнее, тут тоже всё набито очень неплохими головоломками! Более того - редкое явление даже в мире полноценных адвенчур - все головоломки совершенно логичны, и если решение не самоочевидно - где-то есть чёткое указание, что именно и как надо делать. Вот только догадаться, где же ключ (и что это именно ключ) бывает очень непросто (зачастую это указание находится к тому же за несколько локаций от самой головоломки - и это отдельный плюс). Лично я, к стыду своему, завалил две задачи: у той, что с ростом, я не нашёл, куда ключ применить (при том что, задним числом, это было очевидно, блин), а в финальной ключей просто не заметил. :(

Так вот, об обязательных Hidden Objects: здесь они интегрированы крайне своеобразно: тебе не говорят, что именно ты ищешь, как это бывает обычно. Тебе известно только общее количество, а найти надо предметы, которые изменяют форму. При этом сама сцена интегрирована прямо с игровой локацией, без непонятной фигни в оформлении. Свежее решение! Не говоря уж о том, что позволяет избежать всех этих опостылевших сцен ""чтобы найти ключ, надо сначала найти яблоко, четыре шахматных фигуры, две пары очков и жука. Не спрашивайте, почему.""

Единственным серьёзным недостатком игры является её нестабильная работа в Win10. Временами (прямо с третьей большой локации и до самого конца) при нажатии кнопки перехода в другую комнату ничего не происходит, а игра зависает навсегда. Переключиться в окно, вызвать менеджер задач, снять задачу, зайти в игру обратно: другого решения у меня нет (игру-то можно закрыть и ""крестиком"" в окне, на самом деле - только она не закроется, менеджером всё равно снимать придётся). Подозреваю, что может помочь режим совместимости с Win98, но это от отчаяния: совместимость с ХР не помогает никак (а проверить 98 я не могу - сохранения игра делает в реестр, и при выставленной совместимости всё слетает, потому что реестр 98-я отрабатывает не так). Попробуйте в начале игры, вдруг поможет?

В целом - очень рекомендую любителям головоломок - и 7th Guest в особенности.",1594247250,1594361521,True,12,0,0.693006634712219238,0,False,False,False,False,,,
71865697,"{'steamid': '76561198000711913', 'num_games_owned': 610, 'num_reviews': 1, 'playtime_forever': 168, 'playtime_last_two_weeks': 0, 'playtime_at_review': 168, 'last_played': 1593681832}",english,"I thought this was going to be the Collector's Edition like the others, but it isn't. Fairly disappointed, but hopefully this can be remedied and updated later. I heard this game was buggy, but it never crashed for me. I was able to play all the way through to the end, no problem.",1593682004,1593682004,True,1,0,0.523809552192687988,0,True,False,False,False,,,
71817419,"{'steamid': '76561198379522321', 'num_games_owned': 0, 'num_reviews': 8, 'playtime_forever': 655, 'playtime_last_two_weeks': 0, 'playtime_at_review': 371, 'last_played': 1649474525}",english,"I Love this game don't get me wrong. I thoroughly enjoyed the atmosphere it created and it felt like the stakes were higher in this game compared to the last. The soundtrack was good and the new places were creepy as all hell. It really made me glad that it was just a point and click adventure. 

The reason for the down vote is purely because the game crashes alot. If you love this series and are willing to risk it then I'd buy this game when it's on sale, perhaps you'll have better luck than I.",1593620678,1593620678,False,1,0,0,0,True,False,False,False,,,
71090627,"{'steamid': '76561199048745925', 'num_games_owned': 0, 'num_reviews': 1, 'playtime_forever': 867, 'playtime_last_two_weeks': 0, 'playtime_at_review': 476, 'last_played': 1633606370}",english,I think this game is brilliant. I've got the Collector's Edition but to be honest the extras you get with that version don't lessen the game play here. Some of the puzzles are hard whereas others are simple enough. Dark and sinister and proof that using actors for parts in games works very well.,1592679310,1592679310,True,0,0,0,0,True,False,False,False,,,
70424022,"{'steamid': '76561198035721580', 'num_games_owned': 0, 'num_reviews': 1, 'playtime_forever': 553, 'playtime_last_two_weeks': 0, 'playtime_at_review': 188, 'last_played': 1709009851}",english,Truly a masterpiece. 10/10,1591508071,1591508071,True,0,0,0,0,True,False,False,False,,,
69596693,"{'steamid': '76561199057391877', 'num_games_owned': 0, 'num_reviews': 2, 'playtime_forever': 767, 'playtime_last_two_weeks': 0, 'playtime_at_review': 413, 'last_played': 1690713234}",english,"Very catchy story line, with fun puzzles. interesting concept of finding morphing objects.",1590144454,1590144454,True,0,0,0,0,True,False,False,False,,,
67478039,"{'steamid': '76561198210410708', 'num_games_owned': 137, 'num_reviews': 18, 'playtime_forever': 379, 'playtime_last_two_weeks': 0, 'playtime_at_review': 379, 'last_played': 1587105631}",english,"so because i had nostalgia for the first 2 games i decided to purchase the entire Ravenhearst series, the first two games went well, played well, all a round fun time. then we come to Ravenhearst 3, this game is so glitchy and buggy, it kept crashing comptly locking up my computer until i did a restart, but i sludged my way through. that is until it wouldn't let me finish the game because i couldn't examine pile of rocks to get the final handle.

in closeing: DO NOT PURCHASE! it is too buggy and glitchy to actually play let alone finish, if you want to play it, purchase it on bigfishgames.com",1587107134,1587107134,False,1,0,0,1,True,False,False,False,,,
66143539,"{'steamid': '76561198103605048', 'num_games_owned': 0, 'num_reviews': 2, 'playtime_forever': 449, 'playtime_last_two_weeks': 0, 'playtime_at_review': 449, 'last_played': 1585552068}",english,"I enjoyed this game, but wasn't a fan of it crashing every couple minutes. Was still able to get through the entire thing though.",1585552158,1585552158,True,0,0,0,0,True,False,False,False,,,
64463396,"{'steamid': '76561198263417324', 'num_games_owned': 0, 'num_reviews': 1, 'playtime_forever': 728, 'playtime_last_two_weeks': 0, 'playtime_at_review': 528, 'last_played': 1707779940}",english,"this game constantly glitches and freezes. for me, every 10 15 minutes.",1583256408,1583256408,False,2,0,0.519999980926513672,0,True,False,False,False,,,
62997019,"{'steamid': '76561198229209368', 'num_games_owned': 0, 'num_reviews': 16, 'playtime_forever': 594, 'playtime_last_two_weeks': 0, 'playtime_at_review': 304, 'last_played': 1654950350}",english,"Love MCF so bought this when on sale. Horribly buggy and has crashed three separate times in four hours of gameplay. Buy it from Big Fish's website, not Steam.

EDIT: Had forgot how buggy this game was and attempted to replay it. Got about halfway through and after 6 separate red screens/freezes, I gave up.",1580888804,1655079828,False,5,0,0.580419540405273438,0,True,False,False,False,,,
62788180,"{'steamid': '76561199013136305', 'num_games_owned': 126, 'num_reviews': 20, 'playtime_forever': 343, 'playtime_last_two_weeks': 0, 'playtime_at_review': 209, 'last_played': 1680100101}",english,"Ok. Ive played the original 2011 game and i spent over 6 hours on it, my total play time currently is 3 hours, the token door feature was entirely removed and this has made many of the atmospheric objects useless, overall its a good game if you want the story but the other features such as the: object solving was extremely easy and the beloved strategy guide and clues you uncover are no longer written down/ even there in game. Please update the game and add in these key features which make this game extremely unique.",1580556873,1580556873,True,0,0,0,0,True,False,False,False,,,
62717330,"{'steamid': '76561198043036339', 'num_games_owned': 0, 'num_reviews': 4, 'playtime_forever': 321, 'playtime_last_two_weeks': 0, 'playtime_at_review': 321, 'last_played': 1580355804}",english,One of the better entries in the Ravenhearst line.  Liked the morphing object game.  It was a nice change up from the usual HOGs.  Puzzles were decent on the whole.,1580446763,1580446763,True,0,0,0,0,True,False,False,False,,,
57395080,"{'steamid': '76561198351759002', 'num_games_owned': 0, 'num_reviews': 1, 'playtime_forever': 1163, 'playtime_last_two_weeks': 0, 'playtime_at_review': 201, 'last_played': 1708279419}",english,A really good game! I love it,1574034417,1574034417,True,0,0,0,0,True,False,False,False,,,
51683204,"{'steamid': '76561198134098720', 'num_games_owned': 0, 'num_reviews': 3, 'playtime_forever': 159, 'playtime_last_two_weeks': 0, 'playtime_at_review': 159, 'last_played': 1561363548}",english,Amazing game that i played the first two when i was younger. Felt great to play this now.,1561787415,1561787415,True,0,0,0,0,True,False,False,False,,,
