recommendationid,author,language,review,timestamp_created,timestamp_updated,voted_up,votes_up,votes_funny,weighted_vote_score,comment_count,steam_purchase,received_for_free,written_during_early_access,hidden_in_steam_china,steam_china_location,timestamp_dev_responded,developer_response
162093373,"{'steamid': '76561198228117460', 'num_games_owned': 0, 'num_reviews': 1, 'playtime_forever': 376, 'playtime_last_two_weeks': 38, 'playtime_at_review': 376, 'last_played': 1712129645}",english,I have always loved the mystery case files games would recommend to anyone who likes point and click games the story lines are very interesting!,1712129736,1712129736,True,0,0,0,0,True,False,False,True,,,
161966491,"{'steamid': '76561198002178416', 'num_games_owned': 946, 'num_reviews': 112, 'playtime_forever': 431, 'playtime_last_two_weeks': 331, 'playtime_at_review': 431, 'last_played': 1711993583}",english,,1711993592,1711993592,True,0,0,0,0,True,False,False,True,,,
159158551,"{'steamid': '76561198138629651', 'num_games_owned': 19, 'num_reviews': 4, 'playtime_forever': 889, 'playtime_last_two_weeks': 11, 'playtime_at_review': 477, 'last_played': 1711550615}",english,cool,1708788420,1708788420,True,0,0,0,0,True,False,False,True,,,
157819993,"{'steamid': '76561199403051415', 'num_games_owned': 0, 'num_reviews': 6, 'playtime_forever': 246, 'playtime_last_two_weeks': 0, 'playtime_at_review': 246, 'last_played': 1707279288}",english,"Good game, dark, but good. Shorter than I expected but still fun.",1707358476,1707358476,True,0,0,0,0,True,False,False,True,,,
157815646,"{'steamid': '76561198802657137', 'num_games_owned': 0, 'num_reviews': 4, 'playtime_forever': 400, 'playtime_last_two_weeks': 0, 'playtime_at_review': 338, 'last_played': 1707775513}",english,game keeps crashing and freezing whole pc and i have a 3060 geforce rtx so its the game and not my pc,1707351940,1707351940,False,0,0,0,0,True,False,False,True,,,
156223182,"{'steamid': '76561198803080441', 'num_games_owned': 0, 'num_reviews': 12, 'playtime_forever': 2387, 'playtime_last_two_weeks': 0, 'playtime_at_review': 1068, 'last_played': 1706125833}",english,"The game is fun. I only have a couple problems with it, one is the clock in the mothers house will not go past the 425 can't use the 740 or 10. Also sometimes going into another room screen goes red",1705572575,1705572575,True,0,0,0,0,True,False,False,True,,,
153499767,"{'steamid': '76561198371395224', 'num_games_owned': 0, 'num_reviews': 12, 'playtime_forever': 703, 'playtime_last_two_weeks': 0, 'playtime_at_review': 681, 'last_played': 1702534751}",english,"It has one of the best graphics in mcf, sound design and overall style. A little disturbing at times but still fun",1702464080,1702464080,True,0,0,0,0,True,False,False,True,,,
153332720,"{'steamid': '76561199030287468', 'num_games_owned': 0, 'num_reviews': 2, 'playtime_forever': 170, 'playtime_last_two_weeks': 0, 'playtime_at_review': 170, 'last_played': 1702236775}",english,grew up with this game on disc is the best the steam version broken to the point i had to get refunded it was sad i contacted big fish about the problem and i am still waiting on word hopefully one day this issue will be fixed,1702245939,1702245939,False,0,0,0,0,True,False,False,True,,,
149327483,"{'steamid': '76561199125083497', 'num_games_owned': 0, 'num_reviews': 1, 'playtime_forever': 453, 'playtime_last_two_weeks': 0, 'playtime_at_review': 453, 'last_played': 1698864583}",english,"I was not a fan of the morphing objects instead of the usual hidden objects. Many of the puzzles seemed to be way over complicated, even for this franchise.",1698864768,1698864768,False,0,0,0,0,True,False,False,True,,,
148995840,"{'steamid': '76561199472943952', 'num_games_owned': 0, 'num_reviews': 1, 'playtime_forever': 302, 'playtime_last_two_weeks': 0, 'playtime_at_review': 302, 'last_played': 1698430535}",czech,"Hru doporučuji ostatním hráčům. Někdy jsem musela opravdu hodně přemýšlet a občas si ani nevěděla rady, ale vždy jsem si poradila. Jinak už jsem tuhle hru dohrála 5x a za mě fakt super",1698431044,1698431044,True,0,0,0,0,True,False,False,True,,,
148803199,"{'steamid': '76561199166392048', 'num_games_owned': 0, 'num_reviews': 7, 'playtime_forever': 445, 'playtime_last_two_weeks': 0, 'playtime_at_review': 445, 'last_played': 1679949720}",english,great!,1698172868,1698172868,True,0,0,0,0,True,False,False,True,,,
148657232,"{'steamid': '76561198279140910', 'num_games_owned': 483, 'num_reviews': 406, 'playtime_forever': 800, 'playtime_last_two_weeks': 0, 'playtime_at_review': 57, 'last_played': 1698009102}",english,"I don't like this game, just how many times can you reuse the ravensheart setting before it gets dull?

They also introduced morphing objects instead of hidden objects. So you have to stare at one spot to see if it changes.

However there's one good thing about this game, the atmosphere in the 2nd half of the game does get creepy, disturbing and disgusting.",1697964488,1697968482,False,3,0,0.561578273773193359,0,True,False,False,True,,,
148421108,"{'steamid': '76561198410443384', 'num_games_owned': 0, 'num_reviews': 3, 'playtime_forever': 279, 'playtime_last_two_weeks': 0, 'playtime_at_review': 279, 'last_played': 1697604580}",english,"Was a really fun game when I got the hang of it down. There wasn't an ability to use the hint button to find out another area you could go to if you got stuck so there were, I think 3 spots, that i had to look up a guide for because I couldn't figure out what to do but it was a lot of fun. And the puzzles that came up were really challenging. The only other thing that was kind of iffy was how difficult some of the changing objects were to see, but I got them in the end. I really love HOG so was excited to have this one pop up on my recommended.",1697604955,1697604955,True,0,0,0,0,True,False,False,True,,,
146359070,"{'steamid': '76561199135836936', 'num_games_owned': 0, 'num_reviews': 1, 'playtime_forever': 860, 'playtime_last_two_weeks': 0, 'playtime_at_review': 860, 'last_played': 1694811247}",english,the most playable game,1694811819,1694811819,True,0,0,0,0,True,False,False,True,,,
145018284,"{'steamid': '76561198218657020', 'num_games_owned': 594, 'num_reviews': 142, 'playtime_forever': 482, 'playtime_last_two_weeks': 0, 'playtime_at_review': 482, 'last_played': 1655040883}",english,"I just have to recommend this part because its just such a cool and intereting story. Its just so sad and disappointing that this is the most broken game of the series. I normally have to restart the game like 10 times in a playthrough, But still its so worth doing it because the acting of the people is so good and makes so much fun too look at. So please play it for yourself and have the mental strength to play through it even if its kinda annoying. I think its the best part of the series. I can totally hoghly recommend this game for the story and the gameplay. But not for the bug",1693003281,1693003281,True,1,0,0.523809552192687988,1,True,False,False,True,,,
142632654,"{'steamid': '76561198331950018', 'num_games_owned': 0, 'num_reviews': 3, 'playtime_forever': 260, 'playtime_last_two_weeks': 0, 'playtime_at_review': 260, 'last_played': 1690103824}",english,"Game Keren
",1690103832,1690103832,True,0,0,0,0,True,False,False,True,,,
140485066,"{'steamid': '76561198027247271', 'num_games_owned': 0, 'num_reviews': 1, 'playtime_forever': 127, 'playtime_last_two_weeks': 0, 'playtime_at_review': 127, 'last_played': 1687423507}",english,"The game itself I'd recommend. The story is part of Rvaenhearst saga and it's definitely the best HOG story that I've ever came across. However, this game is very badly optimized, especially on win 11. It randomly decides to glitch and freeze. I had to force close it from task manager every 2 minutes.",1687423710,1687423710,True,0,0,0,0,True,False,False,True,,,
140418720,"{'steamid': '76561198273471755', 'num_games_owned': 112, 'num_reviews': 4, 'playtime_forever': 101, 'playtime_last_two_weeks': 0, 'playtime_at_review': 101, 'last_played': 1687293669}",english,My all-time favorite game of the series! Grew up playing this game and I don't really mind how glitchy/broken it is. They really should have ended the Ravenhearst Plotline with this game.,1687312296,1687312296,True,0,0,0,0,True,False,False,True,,,
140007083,"{'steamid': '76561199513781207', 'num_games_owned': 0, 'num_reviews': 2, 'playtime_forever': 499, 'playtime_last_two_weeks': 0, 'playtime_at_review': 499, 'last_played': 1686680102}",english,amazing game good puzzles really works your brain and good story line just wish i knew what order they was in,1686680180,1686680180,True,0,0,0,0,True,False,False,True,,,
139699539,"{'steamid': '76561198049061100', 'num_games_owned': 0, 'num_reviews': 8, 'playtime_forever': 436, 'playtime_last_two_weeks': 0, 'playtime_at_review': 397, 'last_played': 1686164358}",english,"While the game has an engaging story and I am a fan of Mystery Case Files series, this game keeps crashing and resetting progress. It's incredibly frustrating, and I wish it would've been fixed before being launched on steam. This is the only reason I don't recommend it.",1686161941,1686161941,False,0,0,0,0,True,False,False,True,,,
138468245,"{'steamid': '76561198393721734', 'num_games_owned': 0, 'num_reviews': 55, 'playtime_forever': 259, 'playtime_last_two_weeks': 0, 'playtime_at_review': 134, 'last_played': 1684459388}",english,"This game is not like the others, you aren't looking for items from a list, you are looking for items that are changing, And puzzles aren't intuitive at all. But it is still fun and I would recommend it if it didn't crash and freeze ALL the time. I am not even that far in the game and it has happened at least 6 times, and one time was so bad I had to restart my computer because I couldn't get to my Steam. I saw in community posts that it seems like this has been a problem since 2020 at least. I have reinstalled, verified files...nothing works.",1684383036,1684383036,False,0,0,0,0,True,False,False,True,,,
138246123,"{'steamid': '76561198433400410', 'num_games_owned': 77, 'num_reviews': 48, 'playtime_forever': 380, 'playtime_last_two_weeks': 0, 'playtime_at_review': 380, 'last_played': 1683996942}",english,It's fun and I like the new hidden object searching mechanic,1683997078,1683997078,True,0,0,0,0,True,False,False,True,,,
137854861,"{'steamid': '76561198215145748', 'num_games_owned': 197, 'num_reviews': 30, 'playtime_forever': 91, 'playtime_last_two_weeks': 0, 'playtime_at_review': 91, 'last_played': 1683241846}",english,"Not my favourite HOG but still enjoyable. Some interesting puzzles though all the HOP pages are morphing objects which gets a bit repetitive for me. It crashes a lot which can be frustrating but I found if you have a lot of rooms to click through to get to your destination wait a second or two in each page and it greatly reduces the number of crashes. This game is not for the squeamish, some of it is straight up gross! If that was unclear I'd probably give it a 6/10. Worth playing but definitely flawed.",1683332858,1683332858,True,0,0,0,0,True,False,False,True,,,
136287121,"{'steamid': '76561198967119205', 'num_games_owned': 0, 'num_reviews': 2, 'playtime_forever': 363, 'playtime_last_two_weeks': 0, 'playtime_at_review': 363, 'last_played': 1680889753}",english,"The game is great, but it is full of bugs, glitches and soft crashing. During the 4th arch of the game I crashed every 5-10 minutes and when it was not crashing the game stuttered and my fps dropped.

The puzzles are really great and intriguing, I enjoyed the game overall and found the story interesting as well.",1680890014,1680890014,False,0,0,0,0,True,False,False,True,,,
135928042,"{'steamid': '76561198048929142', 'num_games_owned': 0, 'num_reviews': 1, 'playtime_forever': 281, 'playtime_last_two_weeks': 0, 'playtime_at_review': 193, 'last_played': 1680478236}",english,"This game is fun but the game breaking bug is just unbearable.  It worked fine up until the middle of the second location, and then all of a sudden like every 15-30 minutes or so the game will completely freeze.  The cursor won't click on anything and your only option is to force the game to close and then restart it.  The first time this happened to me I actually got a red screen with broken audio that wouldn't actually let me alt tab out to run task manager or anything and I had to force restart my whole computer.  When you try to access any Steam tech support they just redirect you to Big Fish Games.  From reading the community tab posts for this game I gather that I'm not the first person to have this issue.  It shouldn't be sold then, in my opinion.  It sucks too because it IS playable and it's fun...up until it's not. So far it's done this to me 3 times. Torn between sucking it up and trying to keep going or getting a refund.  

EDIT: They wouldn't refund me so instead I've decided to keep count of every time it does this until I finish the game and post it here so no one makes the mistake of getting this game. The final count was 9 times, with the average time between crashes 10 minutes and the most egregiously short time between crashes being 4 minutes.  Do not buy this game.",1680406373,1680478290,False,0,0,0,0,True,False,False,True,,,
135296045,"{'steamid': '76561198108147681', 'num_games_owned': 0, 'num_reviews': 57, 'playtime_forever': 388, 'playtime_last_two_weeks': 0, 'playtime_at_review': 288, 'last_played': 1687605368}",english,Game is terrible but a good time,1679652377,1679652377,True,0,0,0,0,True,False,False,True,,,
134379261,"{'steamid': '76561199031276690', 'num_games_owned': 91, 'num_reviews': 58, 'playtime_forever': 399, 'playtime_last_two_weeks': 0, 'playtime_at_review': 399, 'last_played': 1678409009}",schinese,"老卡死我真的会谢
解密更简单，流程更短了，甚至有点太短了。。",1678409051,1678409051,True,0,0,0,0,True,False,False,True,,,
133931993,"{'steamid': '76561198954804241', 'num_games_owned': 0, 'num_reviews': 51, 'playtime_forever': 311, 'playtime_last_two_weeks': 0, 'playtime_at_review': 273, 'last_played': 1706403354}",english,"This, Return to Ravenhearst, and Dire Grove are what I consider to be the three best hidden object games I've ever played. It's an absolute blast to explore Charles' unhinged mind and the things designed with it, I still prefer Dire Grove to this game but all of them are fantastic.

9/10",1677784011,1698647051,True,0,0,0,0,True,False,False,True,,,
132105507,"{'steamid': '76561198096000132', 'num_games_owned': 0, 'num_reviews': 14, 'playtime_forever': 414, 'playtime_last_two_weeks': 0, 'playtime_at_review': 414, 'last_played': 1675398532}",english,"Folks at Big Fish Studios, you ok?  I'm hoping that this was a brainstorming session that went overboard rather than someone's lived experience.

This game is not for the squeamish:  bodily fluids, childhood trauma, even a little participation in dummy abuse.  It's also not for the impatient.  With the switch to morphing object scenes, you could be waiting and staring and staring and waiting to get the last one or two items.  Even worse, this game crashes a lot.  Sometimes every few minutes.  By the end, I was using a guide just to be done with it because exploration is painful when you have to restart the game every two rooms.  And you better wear your walking shoes because there's no fast travel to be found here and you will have to backtrack a ridiculous amount.

Some of the puzzles were really interesting and novel (and that's saying something considering the number of HOG and puzzle games I've played), but that enjoyment is short-lived when the next crash is waiting just around the corner.  Even with all this, I don't regret playing it even if I was pretty frustrated toward the end.

I can't really recommend it, but if these downsides aren't dealbreakers for you, get it on deep discount and godspeed with your pus collecting.",1675401427,1675401427,False,0,0,0.476190477609634399,0,True,False,False,True,,,
130612917,"{'steamid': '76561198131501865', 'num_games_owned': 0, 'num_reviews': 2, 'playtime_forever': 1340, 'playtime_last_two_weeks': 0, 'playtime_at_review': 935, 'last_played': 1673659493}",english,"Sadly it crashes every 5 minutes. It's good but it's the most any game has crashed that I've played

It asked me to revise my review since I played 6 more hours.......It's crashed 20 times since then. Have to ctr alt delete then sign out half the time. And I still don't recommend the game if you are wondering still 

I literally beat the game a few seconds after I posted that........haha. Final puzzle had me for awhile but I got to say, if you overlook the 40 to 60 crashes you might experience, this probably is the most satisfying set of puzzles. I feel like a mean genius for sure. Definitely harder than Return to Ravenhearst, Dire Grove, and 13th Skull, the games I've played. I didn't use a walkthrough a single time. I did for the visiting hour puzzle when I played this 10 years ago or so. I was so mad at how dumb the answer to the puzzle was I quit. And I actually remembered it so not sure if I would have figured it out for myself today lol. But no help other than that.......but the amount of backtracking not knowing what to do was brutal. And the use for the bed sheet was stupid.",1673410146,1673659812,False,0,0,0,0,True,False,False,True,,,
128525435,"{'steamid': '76561198133602752', 'num_games_owned': 0, 'num_reviews': 12, 'playtime_forever': 666, 'playtime_last_two_weeks': 0, 'playtime_at_review': 346, 'last_played': 1710138592}",english,love me a good old mystery and fucked up obsessions,1670992556,1670992556,True,0,0,0.476190477609634399,0,True,False,False,True,,,
128319858,"{'steamid': '76561197995304152', 'num_games_owned': 1312, 'num_reviews': 33, 'playtime_forever': 438, 'playtime_last_two_weeks': 0, 'playtime_at_review': 420, 'last_played': 1670709244}",turkish,Don't buy it through Steam. Every 10 minutes it's softlocking and you'll need to use Task Manager to close the game.,1670708209,1670708209,False,2,0,0.545454561710357666,0,True,False,False,True,,,
128045483,"{'steamid': '76561198028626619', 'num_games_owned': 0, 'num_reviews': 64, 'playtime_forever': 560, 'playtime_last_two_weeks': 0, 'playtime_at_review': 560, 'last_played': 1670339449}",english,"Creepier than earlier games. What anoyed me most, that searching for hidden objects is raplaced with searching for morphing objects (which was a bonus in some ealier games). You can locate first objects pretty fast, but when only few remain, you have to continue staring at the specific part of the screen to notice motion (especially with smaller objects) and object morphs like one every 30 or 60 seconds.
Besides that, it would be an ok game if not the technical problems - the crashes a lot or areas stop being clickable and you have to restart the game. Especially towards the end of the game, when it stops responding almost every 5 minutes.",1670340154,1670340154,False,3,0,0.565217375755310059,0,True,False,False,True,,,
127065890,"{'steamid': '76561198088717196', 'num_games_owned': 213, 'num_reviews': 22, 'playtime_forever': 445, 'playtime_last_two_weeks': 0, 'playtime_at_review': 445, 'last_played': 1669482539}",english,"after the horror i suffered in the first 2 games, the finale in the 3rd one made me so relaxed",1669482659,1669482659,True,0,0,0,0,True,False,False,True,,,
126414721,"{'steamid': '76561197972819587', 'num_games_owned': 0, 'num_reviews': 3, 'playtime_forever': 1184, 'playtime_last_two_weeks': 0, 'playtime_at_review': 722, 'last_played': 1669464792}",english,"Although it's a bit dated, it's the best hands down of the series.  Not for kiddies, teens and adults only.  I highly recommend it.",1669225629,1669225629,True,0,0,0,0,True,False,False,True,,,
123846661,"{'steamid': '76561198167845538', 'num_games_owned': 0, 'num_reviews': 2, 'playtime_forever': 32, 'playtime_last_two_weeks': 0, 'playtime_at_review': 32, 'last_played': 1665802408}",english,"Story and puzzles aren't bad, but I enjoy the point-and-click hidden objects much better. In this version you need to find objects that are changing. Why fix what's not broken?",1665802560,1665802560,False,0,0,0,0,True,False,False,True,,,
122446808,"{'steamid': '76561197993919579', 'num_games_owned': 1783, 'num_reviews': 57, 'playtime_forever': 428, 'playtime_last_two_weeks': 0, 'playtime_at_review': 428, 'last_played': 1663523891}",english,"I enjoy most hidden object games, but didn't care for this one.
-hidden object scenes replacing with finding morphing objects, some of which are very tiny and hard to see
-several puzzles in game with no directions on what the goal is
-no map to move to locations, along with a contorted layout
-BUGGY.  The game semi-froze many times where my cursor disappeared or did not respond, but game was still running, along with a few outright crashes.  Once I got three incidents of the game crashing or not responding within 15 minutes.
-sound effects that can loop very frequently, and a lot of twitching mannequins etc end up being annoying
-some gross-out stuff, like a pimple-popping puzzle",1663524088,1663524088,False,0,0,0,0,True,False,False,True,,,
121955871,"{'steamid': '76561199342809492', 'num_games_owned': 0, 'num_reviews': 1, 'playtime_forever': 404, 'playtime_last_two_weeks': 0, 'playtime_at_review': 404, 'last_played': 1662687549}",english,The game is super buggy. I would have to force close and restart it just to continue moving. One of the puzzles only showed up as a red screen. Also I had to restart the game because of the blue pill glitch.,1662687657,1662687657,False,1,0,0.528688490390777588,0,True,False,False,True,,,
120895211,"{'steamid': '76561198032908740', 'num_games_owned': 0, 'num_reviews': 13, 'playtime_forever': 978, 'playtime_last_two_weeks': 0, 'playtime_at_review': 969, 'last_played': 1672115178}",english,"Been playing through all of the Mystery Case Files in order (or as best I can anyways) and this is the first one that keeps crashing/softlocking.
I'll give it a plus for the fact that you don't lose much progress when this happens but it is frequent.
Some of these puzzles are also just incredibly obtuse, to the point that I think the game expects you to write down every detail yourself in your own notebook just to solve things (the one in game certainly does not contain enough information)",1660928954,1660928954,False,0,0,0,0,True,False,False,False,,,
118318480,"{'steamid': '76561198107353217', 'num_games_owned': 409, 'num_reviews': 5, 'playtime_forever': 243, 'playtime_last_two_weeks': 0, 'playtime_at_review': 183, 'last_played': 1657111750}",english,"Such a disappointment compared to the first two games in this series. I can not in good conscience recommend this game. The only reason I made it past the intro at all is my stubbornness to finish playing through this series. The whole intro sequence was incredible frustrating, the ""hidden object"" puzzles are not in fact hidden objects at all like the previous games, instead you must look for a purple shimmer on objects. That appears once every like 5 minutes. On a purple background. 

The game is incredibly unstable and buggy. One such reoccurring bug is when you click an arrow to move on to a new location. The game thinks you've gone there, but visually you haven't. You can't interact with the menu or anything in the environment. The only fix is Alt+F4 and hope you don't lose progress. 

I'm gonna finish this game out for completionist reasons but honestly, I would not buy it. I don't think I got my money's worth and I bought the game at half price.",1657108161,1657108161,False,0,0,0,0,True,False,False,False,,,
116165213,"{'steamid': '76561199010306207', 'num_games_owned': 0, 'num_reviews': 7, 'playtime_forever': 203, 'playtime_last_two_weeks': 0, 'playtime_at_review': 203, 'last_played': 1653780803}",english,"I simply love the Ravenhearst collection! However, I would dare to say that it needs an improvement in 3D modeling because, in some parts, the mannequins were quite... ugly and cringy; for example, the part when Charles shows himself in front of you with that robot with a TV head. 
Besides, the game should have a little bit of soundtrack, as it happened for the 2nd part (Returning to Ravenhearst), with such a great one that I use to hear it for studying and even writing!
Everything else is just fine. A little bit glitchy at times and all, but it's worth it. Challenging game, pay 100% attention to details!",1653781425,1653781425,True,0,0,0,0,True,False,False,False,,,
112171258,"{'steamid': '76561198030980870', 'num_games_owned': 464, 'num_reviews': 37, 'playtime_forever': 126, 'playtime_last_two_weeks': 0, 'playtime_at_review': 126, 'last_played': 1595797928}",english,"Mystery Case Files seems to have the  formula for hidden-object-puzzle-detective games perfected. Giant company ethics aside, Escape from Ravenhearst is another solid title in the genre.",1647264025,1647264025,True,0,0,0,0,True,False,False,False,,,
111143682,"{'steamid': '76561198098275050', 'num_games_owned': 536, 'num_reviews': 19, 'playtime_forever': 6846, 'playtime_last_two_weeks': 0, 'playtime_at_review': 6724, 'last_played': 1645956825}",english,game crashes every 10min,1645949750,1645949750,False,0,0,0,0,True,False,False,False,,,
108144437,"{'steamid': '76561198349972709', 'num_games_owned': 354, 'num_reviews': 5, 'playtime_forever': 719, 'playtime_last_two_weeks': 0, 'playtime_at_review': 719, 'last_played': 1642347577}",english,Really good hidden mystery / puzzle game. The second and third one was really well designed. Very fun to play as a group - I played this with my family and we thoroughly enjoyed it!,1642347893,1642347893,True,2,0,0.545454561710357666,0,True,False,False,False,,,
