recommendationid,author,language,review,timestamp_created,timestamp_updated,voted_up,votes_up,votes_funny,weighted_vote_score,comment_count,steam_purchase,received_for_free,written_during_early_access,hidden_in_steam_china,steam_china_location,timestamp_dev_responded,developer_response
50533623,"{'steamid': '76561198034193738', 'num_games_owned': 2536, 'num_reviews': 274, 'playtime_forever': 206, 'playtime_last_two_weeks': 0, 'playtime_at_review': 70, 'last_played': 1561895261}",english,"[b]Mystery Case Files 8: Escape from Ravenhearst[/b] (MOG-adventure)
[i]Review based on Steam (SE) version. [/i]

People are disappearing in Blackpool, bringing our detective back to the gates of the now-ruined Ravenhearst Manor once again.

Options include separate sliders for Music, Effects and Environment, Windowed, Custom Cursor, Hi-def and Subtitles.  Choice of Casual or Master Detective (""Quit Holding My Hand!"") mode.

What can I say about this game?  Big Fish was once again pushing the envelope when they developed EFR, so the gameplay is not like any other game out there.  There are no lists, no silhouettes, no items to return to the scenes...  Instead, what we have is an adventure game with [b]M[/b]orphing [b]O[/b]bject [b]S[/b]cenes.

[b]How it works:[/b]

The ghosts of Ravenhearst cannot help you directly, but they can alter the appearance of objects for a brief time.  When you come upon a [b]MOS[/b], the number of items you need to find will be pictured in Emma's locket, which you carry with you during the game.  Finding these spiritually-charged articles will enable the spirits to call your attention to a specific area of the scene.  In other words, they help you find items that will be helpful in your investigation.

There IS a rapid-misclick penalty... Morphing items you've already found will be returned to the scene!

[b]Story:[/b]

The story is told in a variety of ways, from encounters with the ghosts of Ravenhearst to journal entries to news clippings to live-action cutscenes.  The acting is pretty good, with the occasional over-the-top, [i]CAN YOU FEEL ME NOW?[/i] performance. *snicker*

If you read the game's description, you will have hopefully noticed the [b]WARNING[/b] there.  When they say that this is an intense psychological thriller, they mean it.  I won't spoil anything here, but some of the scenes you'll encounter and tasks you'll be required to do can evoke feelings ranging from discomfort to disgust to dread to Oh-my-god-I'm-going-to-have-nightmares-tonight!

[b]Sights and Sounds:[/b]

Some of the artwork in this game is absolutely breathtaking.  I do have special feelings towards this game since I was at Big Fish's pre-release party, but this is not just nostalgia speaking.  I so wish that the devs had included wallpapers in the CE version, as there are some I-want-to-frame-this-and-put-it-on-my-wall scenes.  Lucky me, one of the artists shared some of the promo posters with me, so I actually have them on my wall! :elkgrin: 

The soundtrack is beautifully mood-setting, as you would expect from a Ravenhearst game.  Quality sound effects and environmental tracks round out the sound package nicely.

[b]Interface:[/b]

We have a retractable, scrolling toolbar that holds any items we find, per usual.  We do NOT have [b]HINTS[/b] during the adventure portion of the game, although hints are available during the MOS scenes.  The rate at which they refill depends on which gameplay mode you choose.

[b]Puzzles:[/b]

We have a lot to read in our [b]journal[/b], but even if you're playing on Casual Mode, there will be neither hints, nor puzzle solutions documented by our intrepid detective.  You're going to have to actually write the clues down yourself, folks!  Since this is the standard edition of the game (hence no strategy guide), you'll very likely need the [url=https://www.bigfishgames.com/blog/walkthrough/mystery-case-files-escape-from-ravenhearst-walkthrough/]WALKTHROUGH[/url] at some point, so enjoy that handy dandy link!

Puzzles are [b]SKIPPABLE[/b]... Mostly.  When a puzzle requires the use of an inventory item, there is no SKIP available.

[b]What is the CE Content?[/b]

For those curious about what Bonus Content was included with the CE, I'll list it here:
[i][b]NOT available in the Steam version[/b][/i]
[list]
[*]Strategy Guide (pictures only, no text)
[*]Morphing Items in the Journal (find them all to unlock two black & white, classic-style hidden object scenes)
[*]Door tokens
[/list]
Door tokens, for those who aren't familiar, are small circular partial-images that go into your inventory.  You have to ""charge"" the tokens by placing the images back into the scenes from which they were taken.  There is no distinguishable pattern to where these pieces might have come from, so it's a real challenge to find where they all belong.  You cannot proceed past a certain point in the game until you charge and place them all, so the CE is actually much more difficult than the SE version!

There is no bonus chapter in the CE, so you won't be missing any of the story if you play this (Steam) version.

[b]Verdict:[/b]

This third visit to Ravenhearst manor is not for children or the faint of heart, as the story is truly twisted and disturbing.  Although the idea of morphing object games never caught on, [i]Escape from Ravenhearst[/i] is beautifully put-together, and outstanding as only a Mystery Case Files game can be.  Absolutely recommended for adventure-lovers and fans of the Ravenhearst storyline.

[i]PS: Don't be fooled by the time I have listed in-game - I've played the CE version of EFR three times over the years, and only played the Steam version long enough to get some details for my review... and to visit the beautiful scenery once again~[/i]",1557266892,1557267134,True,28,0,0.766179084777832031,4,False,False,False,False,,,
45633472,"{'steamid': '76561198013130865', 'num_games_owned': 0, 'num_reviews': 88, 'playtime_forever': 416, 'playtime_last_two_weeks': 0, 'playtime_at_review': 416, 'last_played': 1541385153}",english,"I have played plenty of messed up games over the years, and Escape from Ravenhearst is certainly one of them. The content warning was inadequate. I didn't blink through any of the gross out or gory parts, but I don't think one has to be ""faint of heart"" not to want to listen to ambient child abuse sound effects while playing a casual hidden object game. I'm not talking about a scene within the *context* of the story - I am talking about using it as background noise. If someone on the development team said ""Is this possibly in poor taste?"", please listen to them next time. If no one on the development team said that, please reconsider your hiring practices.

With those sound effects muted, there are other points that can be used when determining whether or not to recommend this game ...

The use of morphing ""hidden"" objects almost exclusively (I remember one list-style hidden object puzzle) was a negative for me. Imagine playing a classic hidden object game but the objects you are looking for blink occassionally. To me, it feels like cheating. The only challenging ones were the letters (because of their size). Many hidden object games will scatter morphing objects for achievement hunting, but this is the first I played that made it the primary mechanic.

I found it strange that there wasn't even a single sentence to explain the puzzles. A couple were completely unintuitive and visually cluttered, making it difficult to know what was part of the interface versus the scenery.

Dennis Kleinsmith did a great job as Charles. He reminded me of some of the classic, eloquent Dr. Who villains that children can be scared of while still having fun. It's really too bad this story couldn't back off its more unseemly elements and be accessible to younger players. The writing is split between adult and juvenile content in such a jarring way. The grubby old degenerate chicken-dancing in the final level is a testament to that.

Good Lord - I didn't think I would ever write that sentence in a review. This game is just too much of a mess to recommend.",1541386032,1541386127,False,5,7,0.540627658367156982,0,True,False,False,False,,,
41301922,"{'steamid': '76561198173131854', 'num_games_owned': 0, 'num_reviews': 19, 'playtime_forever': 936, 'playtime_last_two_weeks': 0, 'playtime_at_review': 936, 'last_played': 1522945379}",english,"Wow! worth the money.  I hate to admit that I needed to check a walk throught guide three times.  After each check I said, ""Duh! of course that's how you do it.""  It was frustrating at times, but the clues are all there if you look. Creepy background noises and voices.",1522945609,1522945609,True,0,0,0,0,True,False,False,False,,,
40780299,"{'steamid': '76561198027424772', 'num_games_owned': 0, 'num_reviews': 213, 'playtime_forever': 342, 'playtime_last_two_weeks': 0, 'playtime_at_review': 342, 'last_played': 1479065127}",english,"[b][u]Game Information[/u][/b]

""Mystery Case Files: Escape from Ravenhearst"" is a Hidden Object Puzzle Adventure game. The game was developed and published by Big Fish Games Studio.

""Escape from Ravenhearst"" is the eighth episode of ""Mystery Case Files."" Previous episodes: ""Huntsville;"" ""Prime Suspects;"" ""Ravenhearst;"" ""Madame Fate;"" ""Return to Ravenhearst;"" ""Dire Grove"" and ""13th Skull.""

Even though the game is not labelled as a collector's edition, it has some extra features that are not available in its' counterpart; the standard edition.

Please do note that some of the ""Mystery Case Files"" games are not available on Steam as of yet.

[b][u]The Game Review[/u][/b]

Game Visuals

I want to mention that the visuals in the game are well done. The visuals can be adjusted in the game's option menu.

Game Audio

I want to mention that audio for the game is well done. Even though the audio is somewhat simplistic and repetitive. The audio can be adjusted in the game's option menu as well.

Gameplay

There are two different difficulty game modes to choose from: Casual and Master Detective.

The notebook keeps track of progression in the game. Such as story events and clues.

There is no map available in the game. Plenty of backtracking from location to location.

There is no padlock feature that is available to lock the inventory panel in place. The inventory panel does slide up when it is being moused over.

The hidden object scenes consist of the following: Morphing objects (beyond items.)

The puzzles are fairly easy to solve without having the need to skip any of them.

Miscellaneous

There are seven different trading cards to collect. Only four of those trading cards are given out by the game. There are several ways to get the rest of the trading cards: Purchased from the Steam's Community Market; Trade with friends; Booster Packs and its Booster Pack Creator.

Final thoughts: I have found the game enjoyable to a certain extent. The replay value for the game is low. I would recommend this game, but not at the game's full price value.",1520918282,1605076695,True,8,0,0.605656981468200684,4,True,False,False,False,,,
38974288,"{'steamid': '76561198176301233', 'num_games_owned': 0, 'num_reviews': 76, 'playtime_forever': 369, 'playtime_last_two_weeks': 0, 'playtime_at_review': 369, 'last_played': 1514901005}",english,I picked this up during the winter sale and was pleasantly surprised by it. I've never tried the Mystery Case Files games before and really liked playing this one. The live actors were good and well integrated with the graphics in the game. The morphing objects instead of hidden objects was a nice change. Even the credits were amusing with morphing job titles. I have windows 10 with wide screen monitor and had no issues with gameplay. So thumbs up!,1514901883,1514901883,True,2,0,0.530773937702178955,0,True,False,False,False,,,
33301167,"{'steamid': '76561198305852519', 'num_games_owned': 0, 'num_reviews': 7, 'playtime_forever': 614, 'playtime_last_two_weeks': 0, 'playtime_at_review': 310, 'last_played': 1553227622}",english,"Great game once again from MCF. It did take a few puzzles to really get into the flow of the new game style but it was incredibly enjoyable. Also kudos to Big Fish for all the nostalgia in this game it was a great trip down memory lane (extra kudos for the peg leg!!). Only complaint is how short the game was, then again I just never want these games to end!

Absolutely loved the story line and ending for the game!",1499318660,1499318764,True,0,0,0,0,True,False,False,False,,,
31123823,"{'steamid': '76561198354477400', 'num_games_owned': 0, 'num_reviews': 1, 'playtime_forever': 390, 'playtime_last_two_weeks': 0, 'playtime_at_review': 390, 'last_played': 1489786952}",english,i've played all of the ravenhearst games and each is as good as the last. this one is challenging and entertaining with a gripping storyline to it that will keep players on the game for hours on end to continue the mystery to its finale.,1492116626,1492116626,True,3,0,0.566929101943969727,0,True,False,False,False,,,
28970150,"{'steamid': '76561198160133527', 'num_games_owned': 0, 'num_reviews': 7, 'playtime_forever': 446, 'playtime_last_two_weeks': 0, 'playtime_at_review': 108, 'last_played': 1611959263}",english,"In the first and second games the mechanism was a standard search-and-find, where you look for the named object and that's that. A lot of people were displeased that it changes to a game where you have to search for objects that shift in shape instead of objects on a list. I suppose some don't like change, but this did not bother me. I will admit it does get slightly easier than it was before, but they do attempt to raise the difficulty by replacing still, picture environments to search in, with moving backgrounds. Twitching leaves, running water; things that catch your eye more than the shifting objects. If you're really bothered about that I would stay away from the game, because the search and finds are less prominent in this game. As before mentioned, it made no difference to me, because in the Ravenhearst story, it's not really the gameplay, but the storyline, that's the main feature of the game.

If you've ever played the original MCF: Ravenhearst, you will know this to be true. The entire point of the first game is finding out the story behind Charles and Emma's relationship, and their affiliation with Rose and her two daughters. The second game is mostly the story of Charles' crimes; the story of how you find the mansion, find out what Charles has really been doing with the place, and attempt to stop him and save what's left of the poor Rose and her daughters.
This game is Charles' story. As with any criminal, the backstory has a lot to do with their actions, and this game gives you a nice walk through Charles' memory lane (against your own wishes). I won't lie. It's messed up. But if you know what his crimes are, you'll probably expect that. If you don't know, then good luck. The game lives up to its name by the fact that you have to escape from Charles' meticulous trap and save Emma, Rose, and her two daughters. Again.

The art is fantastic, and I must give credit to Charles' actor. He really catches the sadistic and tormented side of Charles, and seeing as he appears to torment you quite often, you always have that cruel voice waiting for you wherever you go. I can't even fault any of the other actors, though Victor's dancing is the best comedy aspect of the game. That is just... wonderful. The story is a good level of creepy and shocking, and amongst all the puzzles and problems to solve, you get to do fun things like blow up Charles' mom with a pie.

All in all I don't think this game deserves the hate it's got, but maybe I'm biased because I'm not too bothered by the search mechanism. Sure it's a short game, but most search-and-find's are. The art is great, the actors are good, the storyline is really interesting, and the puzzles are challenging in a good way.

My rating: 7 mannequin heads in a bathtub/10",1483434075,1483434075,True,12,0,0.692717373371124268,0,True,False,False,False,,,
22954025,"{'steamid': '76561198041598079', 'num_games_owned': 0, 'num_reviews': 1, 'playtime_forever': 499, 'playtime_last_two_weeks': 0, 'playtime_at_review': 227, 'last_played': 1498931413}",english,"It was a great, creeepy followup story, but the gameplay for the puzzles was really lacking.  Every single find object puzzle was a morphing one, which were super easy.  Hardly any objects to click on in most of them, so you could breeze through in 20-30 seconds just by clicking on everything.  Your journal doesn't write down the clues you see anymore, so make sure you have some paper handy.  If you're a completionist like I am, I'd say buy for the story, but if the hidden object was the funnest part for you, pass.  You're not looking, you're just staring at the screen waiting for something to move.",1463144563,1463144563,True,11,0,0.670742809772491455,1,True,False,False,False,,,
21008932,"{'steamid': '76561198000129549', 'num_games_owned': 0, 'num_reviews': 1, 'playtime_forever': 45, 'playtime_last_two_weeks': 0, 'playtime_at_review': 45, 'last_played': 1454794096}",english,"I was slightly excited there was a new Mystery Case Files game, Escape From Ravenhearst, released until I played it.  I have played the other Mystery Case Files games and enjoyed them.  This one I played for about an hour and could not take any more because the game play changed.  Up to the point I quit playing, instead of finding hidden objects you now find objects which change appearance or morph.  There was a previous game which had these morphing objects but they were specials.  Puzzles where you must use inventory items found in one location to open other locations is still present.  If the game play gets better or has brain teasers as the previous games did I cannot say because that first hour bored me sooooo much.",1454796739,1454796943,False,16,1,0.429508298635482788,11,True,False,False,False,,,
