recommendationid,author,language,review,timestamp_created,timestamp_updated,voted_up,votes_up,votes_funny,weighted_vote_score,comment_count,steam_purchase,received_for_free,written_during_early_access,hidden_in_steam_china,steam_china_location,timestamp_dev_responded,developer_response
159110551,"{'steamid': '76561198995387103', 'num_games_owned': 6510, 'num_reviews': 3379, 'playtime_forever': 236, 'playtime_last_two_weeks': 0, 'playtime_at_review': 141, 'last_played': 1708747517}",schinese,"就喜欢这种智商-100.00 爽快+10000的游戏

极简站桩射击，如果设计成自动射击，自动换枪或右键换枪，那真是极简打开了房门--极简到家了。宝藏小游戏，无中可玩，1内墙裂推荐入库；但是steam更改了价格策略，本平台1内是不可能了。

画面：*
音乐：***
剧情：*
演出：*
玩法：**
创意：**
手感：***
难度：***
丰富：**
耐玩：*
优化：**
更新：*
热情：*
细节：*
打磨：**
诚意：*

不足，bug，建议等：we need chinese, cloud save, new update. 我们需要中文，云存档，继续更新深挖玩法。

202309，fanatical，steam，steam掉卡抵扣，indie gala，daily indie game，t a o宝，支付宝红包，hxxxx，杉果，它处自定义包入的本体约9元。爱人如己，目前就这，看以后追评。有中文的游戏请耐心自研体验乐趣，攻略指南尽量不用。不建议使用外挂，插件，作弊之类的，游戏都要这样搞，那现实里那更是如此了。兄弟萌，强烈建议不要第三方平台的小店买y u额，通过饰品等挂steam市场转的，高概率red信乃至封号，且行且珍惜。",1708742390,1708742523,True,1,0,0.24046739935874939,0,True,False,False,True,,,
158325315,"{'steamid': '76561198394726644', 'num_games_owned': 0, 'num_reviews': 571, 'playtime_forever': 5, 'playtime_last_two_weeks': 0, 'playtime_at_review': 5, 'last_played': 1707939086}",koreana,일단 쏴,1707939113,1707939113,True,0,0,0,0,True,False,False,True,,,
144824362,"{'steamid': '76561199229971158', 'num_games_owned': 0, 'num_reviews': 34, 'playtime_forever': 340, 'playtime_last_two_weeks': 0, 'playtime_at_review': 125, 'last_played': 1693746348}",schinese,"最早是在手机上玩的，一下就被其吸引了：
简洁而又炫酷的战斗画面；
恰到好处能打起来并逐渐上手的难度；
特别好听各关不同的战斗bgm（真是边摇边打）；
各色不同风格的环境和那致命且不掩饰要葬你于死地的特化几何敌人们。

关卡上也是一关比一关致命，你能感觉到它们是来真的，而我们也不是服软的，用上不断分裂增加出的不同武器和强力技能们将它们砍断！切开！剁碎！靠自己战胜如潮水般的围剿，闯出一片天地！体验很酷很爽，虽千万人，吾往矣。

但每当我游玩时总会多想那真正强大，变异，恐怖，致命的存在究竟是什么，答案我想就是我们了，这个白色小方块，一个真正的存在，真正的异类。",1692751685,1692752094,True,1,1,0.489283263683319092,0,True,False,False,True,,,
137746191,"{'steamid': '76561198377358771', 'num_games_owned': 229, 'num_reviews': 20, 'playtime_forever': 70, 'playtime_last_two_weeks': 0, 'playtime_at_review': 23, 'last_played': 1683479564}",schinese,很爽，但明显感觉到自己年纪大了。。（失落,1683142514,1683142514,True,0,0,0,0,True,False,False,True,,,
133472573,"{'steamid': '76561198147151166', 'num_games_owned': 237, 'num_reviews': 31, 'playtime_forever': 66, 'playtime_last_two_weeks': 0, 'playtime_at_review': 21, 'last_played': 1696652620}",english,"This is like touhou if marisa gradually went from 1 ak47 to 2 ak47's to 3 ak47's to 4 miniguns and onward 


only difference is you're a square, you can't move, and the wacky pictures from the school geometry ""textbook"" (nice try, school, i know a picture book when i see one) are coming for you.

It's fun, i can see myself getting sucked into this. If you liked Super Hexagon, I'd recommend this for the same vibe. And vice versa.",1677221144,1677221144,True,0,0,0,0,True,False,False,True,,,
124199424,"{'steamid': '76561198177343555', 'num_games_owned': 0, 'num_reviews': 15, 'playtime_forever': 1503, 'playtime_last_two_weeks': 0, 'playtime_at_review': 1385, 'last_played': 1687027273}",english,,1666418464,1666418464,True,0,0,0,0,True,False,False,True,,,
121771165,"{'steamid': '76561199068986756', 'num_games_owned': 0, 'num_reviews': 6, 'playtime_forever': 600, 'playtime_last_two_weeks': 0, 'playtime_at_review': 546, 'last_played': 1709466946}",schinese,优秀的单机作品,1662354519,1662354519,True,0,0,0,0,True,False,False,True,,,
121709768,"{'steamid': '76561198334521990', 'num_games_owned': 717, 'num_reviews': 85, 'playtime_forever': 42, 'playtime_last_two_weeks': 0, 'playtime_at_review': 19, 'last_played': 1679134721}",schinese,"好玩 挺爽
除了瞎眼之外就是真的非常难 顶多打到boss 然后被boss一下带走  boss弹速真的太快了",1662257143,1662257143,True,1,0,0.523809552192687988,0,True,False,False,True,,,
119724548,"{'steamid': '76561198287848773', 'num_games_owned': 296, 'num_reviews': 83, 'playtime_forever': 160, 'playtime_last_two_weeks': 0, 'playtime_at_review': 160, 'last_played': 1659129941}",english,"Split bullet is a twin stick shooter, with motifs from arcade styled games such as super hexagon and 64.0, but adds a unique twist: you can't move.

The gameplay is very basic, you're given the ability to aim and fire, and you have to defeat oncoming enemies before they touch you and you die, simple enough but as stages progress, enemies have more complexities to them and the later the stage, the more gimmicky things begin to get, at the end of each stage there is a boss to defeat, which all have very interesting and varied patterns to shoot at, and they have some interesting strategy to them, despite not being able to dodge anything. However, the game might as well have just given you 1 weapon: the minigun, it just shreds most of everything in the game and feels a tad over powered, although im not even sure if the game is possible without it, despite this, the game still posed several threats and forced me to think on my toes, it genuinely is a thrilling experience which i truly loved. You also have a skill move at your disposal, and again only 1 of them is really of any use, but there's some timing element with it as knowing when to use it is extremely important, all of the elements used in the game come together well to make a reactionary and twitch reflex action game, which is highly enjoyable.

The graphics are basic as can be, the screen shake i found obnoxious so i turned it off, but generally each enemy is different enough to be distinguished and the ones to look out for are noticeable so it works fine, there is a weird laser effect when enemies get defeated sometimes which can blend in a lil but other than that, the graphics are fine.

The sound surprised me a lil, although a lot of the tracks sound very similar, they're slightly different and it helps set the tones apart for each level, its not much but it gave a nice polish touch to the game, also the sound effects of shooting and enemies exploding helps give extra signal to the player aswell.

Overall for the low price this game was i enjoyed it a lot more than i thought i would, there's some luck element to the game, some weird oddities to figure out with bosses and level gimmicks, some imbalance, but i couldn't care less, the game offered an enticing experience which got me thrilled the entire time, so its a thumbs up from me!",1659130702,1659132215,True,3,0,0.551282048225402832,0,True,False,False,False,,,
116868989,"{'steamid': '76561198172925593', 'num_games_owned': 14023, 'num_reviews': 4533, 'playtime_forever': 88, 'playtime_last_two_weeks': 0, 'playtime_at_review': 88, 'last_played': 1655040900}",schinese,"一款极简风格的弹幕射击游戏
操作很简单，数字键切换武器，左键攻击，右键直接切换自动攻击，鼠标移动调整攻击方向
敌人基本上都是纯色的图形，你只需要阻止它们攻击到屏幕中间的自己就行
每关根据击杀数量会增加进度，当达到90%时激活BOSS模式
难度不算太低，但你并不需要像其他清版射击游戏那样控制主角不同移动躲避敌人的子弹
而且就算BOSS战失败了，后续关卡也会解锁，避免了卡关
不过游戏画面还是挺晃眼的，尤其击杀敌人的抖动效果，玩久了有些晕",1655041594,1655041594,True,8,1,0.404337942600250244,0,True,False,False,False,,,
99594518,"{'steamid': '76561198446029769', 'num_games_owned': 667, 'num_reviews': 114, 'playtime_forever': 152, 'playtime_last_two_weeks': 0, 'playtime_at_review': 152, 'last_played': 1678299127}",english,"Are you a speedruner?
You can get a world record for fastest ragequit in entire history
 - The game is okay, but you need strong patience:))",1632016735,1632016735,True,0,0,0,0,True,False,False,False,,,
99470305,"{'steamid': '76561199075763675', 'num_games_owned': 193, 'num_reviews': 26, 'playtime_forever': 299, 'playtime_last_two_weeks': 0, 'playtime_at_review': 20, 'last_played': 1679195384}",english,Very good game only playerd it for 20 mins and feel like it is great even after you beat the challenges you can still have fun with endless mode definitely worth the $4 you pay for it and even worth it for $10,1631831310,1631831310,True,0,0,0,0,True,False,False,False,,,
97954769,"{'steamid': '76561198030691885', 'num_games_owned': 2038, 'num_reviews': 652, 'playtime_forever': 142, 'playtime_last_two_weeks': 0, 'playtime_at_review': 142, 'last_played': 1629517189}",english,Feels weird playing a shmup where you can't move only rotate. seems okay but very hard at times still,1629517251,1629517251,True,0,0,0,0,True,False,False,False,,,
97589048,"{'steamid': '76561198313121203', 'num_games_owned': 512, 'num_reviews': 33, 'playtime_forever': 354, 'playtime_last_two_weeks': 0, 'playtime_at_review': 10, 'last_played': 1652531571}",english,"amazing!!!!!!!!!!!!!!!!!!!!!!!!!!!!!!!!!!!!!!!!!!!!!!!!!!!!!!!!!!!!!!
really love this game",1628999610,1629002848,True,0,0,0,0,True,False,False,False,,,
95836012,"{'steamid': '76561198142786065', 'num_games_owned': 74, 'num_reviews': 5, 'playtime_forever': 57, 'playtime_last_two_weeks': 0, 'playtime_at_review': 39, 'last_played': 1626637476}",english,"this game? you mean the one that i cant even beat the first challenge and its strenuously boring? oh yea this game, you can't even tell what hits you and that 90% doesn't mean anything, the boss fight have many phases and you only gets 90%
the player area gets cover by meaningless things and you can't see anything (in the bad way)
barely playable",1626432849,1626432849,False,0,0,0,0,True,False,False,False,,,
89360097,"{'steamid': '76561198878088711', 'num_games_owned': 1039, 'num_reviews': 400, 'playtime_forever': 7, 'playtime_last_two_weeks': 0, 'playtime_at_review': 7, 'last_played': 1617094599}",koreana,"한 없이 간단한 게임방식
한 없이 깊은 게임 난이도

원가 줘도 안 아까움",1617095059,1617095059,True,1,0,0.469530969858169556,0,True,False,False,False,,,
87975431,"{'steamid': '76561197994395238', 'num_games_owned': 0, 'num_reviews': 72, 'playtime_forever': 165, 'playtime_last_two_weeks': 0, 'playtime_at_review': 101, 'last_played': 1703600287}",english,One of my favorite games. Pure action cleverly designed to make you feel like an absolute GOD of videogames! ADD resistant and good for those times your mind is racing.,1615060890,1615060890,True,0,0,0,0,True,False,False,False,,,
78214963,"{'steamid': '76561199084794488', 'num_games_owned': 11, 'num_reviews': 3, 'playtime_forever': 295, 'playtime_last_two_weeks': 0, 'playtime_at_review': 182, 'last_played': 1682847221}",schinese,"太好玩了
",1603765523,1603765523,True,0,0,0,0,True,False,False,False,,,
73085955,"{'steamid': '76561198023749367', 'num_games_owned': 1000, 'num_reviews': 214, 'playtime_forever': 293, 'playtime_last_two_weeks': 0, 'playtime_at_review': 293, 'last_played': 1595376321}",schinese,"难度曲线非常陡峭，容错率是一击必杀的程度
我太菜了，只过了第一关的boss
BGM电音到的确带劲
屏幕抖动抖的眼花，不过好在可以关掉
分辨率有点低1280p，全屏会有点糊，但不全屏吧，敌人太多你又看不清
总体来说比较单调，不是很推荐",1595376372,1595376427,False,3,0,0.548971951007843018,0,True,False,False,False,,,
70517387,"{'steamid': '76561198148827319', 'num_games_owned': 87, 'num_reviews': 14, 'playtime_forever': 103, 'playtime_last_two_weeks': 0, 'playtime_at_review': 103, 'last_played': 1513472789}",koreana,쏴! 그리고 부숴!,1591671900,1591671900,True,0,0,0,0,True,False,False,False,,,
70424746,"{'steamid': '76561198866524411', 'num_games_owned': 0, 'num_reviews': 12, 'playtime_forever': 606, 'playtime_last_two_weeks': 0, 'playtime_at_review': 407, 'last_played': 1628641613}",koreana,"빵빵 터지는 액션! 다양한 무기!

허나 내가 죽으면 멘탈이 빵빵 터집니다!",1591509614,1591509614,True,0,0,0,0,True,False,False,False,,,
69664567,"{'steamid': '76561198213794601', 'num_games_owned': 0, 'num_reviews': 6, 'playtime_forever': 287, 'playtime_last_two_weeks': 0, 'playtime_at_review': 112, 'last_played': 1649688234}",schinese,3年前在手机上1块钱玩到这个游戏，打击感很强！留下很深的印象。后来想玩玩不到了。在steam上看到毫不犹豫的买了。你问为什么不再在手机上玩？因为我是IOS啊,1590239418,1590239418,True,1,0,0,0,True,False,False,False,,,
66331768,"{'steamid': '76561198064701779', 'num_games_owned': 282, 'num_reviews': 40, 'playtime_forever': 693, 'playtime_last_two_weeks': 0, 'playtime_at_review': 693, 'last_played': 1585737868}",english,"Great music.Quite challenge and can pissed you off I spent 11 hours to beat the game all stages,really worth it
I'm like 2%(at this moment) of all players who clear every stages",1585738210,1585738210,True,0,0,0,0,True,False,False,False,,,
62023407,"{'steamid': '76561198257988868', 'num_games_owned': 3573, 'num_reviews': 76, 'playtime_forever': 356, 'playtime_last_two_weeks': 0, 'playtime_at_review': 356, 'last_played': 1549195091}",schinese,"[h1] 简单的乐趣[/h1]

[h1] 首先感谢indienova提供的测试机会。[/h1]
================================
完整体验请购买游戏正版许可。

[h1] SPLIT BULLET 分裂子弹[/h1]
[h1] SPLIT BULLET评测[/h1]

大家好我是少年粥。很久不见！我又开始写评测啦~！
这个游戏是2017年秋季申请的评测key，
作为射击类游戏，如同djmax选碟界面一样的关卡菜单，
简单不做作的游戏风格，
动次打次还是很带感的。

唯一的问题就是：
如果不小心在关卡最后的boss环节阵亡，一切都得重头开始……
所以我好几关都是90+%，完全打不完。
*（可能是太vegetable或者玩得时间不够）

前期卡牌非常值钱，背景也很值钱，最近不知道咋地突然就降价了。
打折的话可以试试看，还是蛮有趣的。
而且玩不下去的话也不会拖到超过退款时间&……很好。

[h1] 粥粥评分[/h1]
画面：★★★☆☆
音效：★★★★☆
情怀：★★★☆☆
游戏性：★★★★☆
性价比：★★★★☆",1579344988,1579345287,True,2,0,0.533437013626098633,0,False,True,False,False,,,
61206785,"{'steamid': '76561198325995000', 'num_games_owned': 295, 'num_reviews': 9, 'playtime_forever': 26, 'playtime_last_two_weeks': 0, 'playtime_at_review': 17, 'last_played': 1578145318}",japanese,"固定砲台の全方位シューティング。
セール時に買うのならアリ。
全く同じゲームがGooglePlayでも存在することや画面レイアウトなどから、もともとはスマホゲームとして開発したものをPCに移植したものだと考えられるが、だったらもっとPCで遊びやすいように調整を入れて欲しかった。
しかし、ゲームとしては全然面白いので特に問題はない。
画面の揺れが激しいので、遊ぶ前にオプションをいじることを推奨。


改良して欲しい点
・使用可能な武器の表示レイアウトをPC向けに調整してほしい
・武器を数字キーだけでなく、マウスホイールでも変更できるようにしてほしい
・武器やポーズボタンをクリックで反応しないようにしてほしい",1578052262,1578052430,True,0,0,0.476190477609634399,0,True,False,False,False,,,
60334219,"{'steamid': '76561198850198019', 'num_games_owned': 28, 'num_reviews': 11, 'playtime_forever': 105, 'playtime_last_two_weeks': 0, 'playtime_at_review': 27, 'last_played': 1605630041}",english,Nice...,1577038094,1577038094,True,0,0,0,0,True,False,False,False,,,
57113317,"{'steamid': '76561198119190276', 'num_games_owned': 733, 'num_reviews': 81, 'playtime_forever': 156, 'playtime_last_two_weeks': 0, 'playtime_at_review': 30, 'last_played': 1573830817}",english,very addicting and want to beat all achievement but it's too hard to get at the top with it. and not so sure if it's a bug or it is a gimmick but the score wouldn't go higher than 1000 even not finish the level yet and sure we all did a higher score than what it said on the board,1573671333,1573671333,True,1,0,0,0,True,False,False,False,,,
51652797,"{'steamid': '76561198068468308', 'num_games_owned': 327, 'num_reviews': 38, 'playtime_forever': 35, 'playtime_last_two_weeks': 0, 'playtime_at_review': 23, 'last_played': 1660074869}",schinese,总之就是很爽，射爆就完事了。,1561783327,1561783327,True,0,0,0,0,True,False,False,False,,,
43086121,"{'steamid': '76561198024905505', 'num_games_owned': 0, 'num_reviews': 29, 'playtime_forever': 15, 'playtime_last_two_weeks': 0, 'playtime_at_review': 15, 'last_played': 1530063777}",english,"I would not recommend this game. I like mindless shooters, but this one takes it a bit too far. The tutorial is nice and simple, sure, but it's nothing like the rest of the game. Even on the first level, I found myself wondering what the heck killed me, leaving me unable to form any kind of strategy as to how to better manage my time with each target. 

A lot of the targets have fancy visuals with them, and sometimes it means something and seems to kill you, and sometimes it doesn't. It seems very inconsistent and dependent on the target. Another complaint I would have is that the time you need to spend to get a power up seems very arbitrary, with only the score counter and the level's progress bar to tell you how long it's been since you started the level. However, since there's so much stuff on screen at any given time (and said stuff requires quite a bit of fire to take down) that you really can't take your eyes off the playing field for a moment.

Lastly there's the UI and controls. The inclusion of a big clickable pause button makes me think of a mobile game, but the game seems more suited to being played with a controller, so the button taking up unnecessary screen real estate seems completely unneccessary. The controls themselves could use some tweaking. Most people are probably playing with an Xbox or PS3/4 controller, and the need to keep the left/right bunper squeezed to fire and then the triggers being used to toggle weapons is really weird. It would be much better if there was an option in the menus to turn on an ""always fire"" option (or inverse fire a la bullet hell games) but no such luck.

Overall, this game could be much better, but as it is? Avoid.",1530064309,1530064309,False,3,0,0.526179254055023193,0,True,False,False,False,,,
42327799,"{'steamid': '76561198387612338', 'num_games_owned': 81, 'num_reviews': 18, 'playtime_forever': 320, 'playtime_last_two_weeks': 0, 'playtime_at_review': 267, 'last_played': 1679307297}",schinese,消磨时间好游戏，原价购买都值,1527476392,1527476392,True,0,0,0,0,False,False,False,False,,,
41551064,"{'steamid': '76561198265065128', 'num_games_owned': 3751, 'num_reviews': 22, 'playtime_forever': 295, 'playtime_last_two_weeks': 0, 'playtime_at_review': 243, 'last_played': 1524094302}",schinese,"分裂子弹是一款十分优秀的精品射击游戏。可以说得上是近期玩到的最精彩的游戏了。
+画面超级精彩！简单却不简陋，简单的几何图形与线条、曲线组成了这款游戏的主要部分。精致的画面，加上每个关卡后期疯狂抖动让人欲罢不能。
+音乐音效简直让人中毒。电子音效刺激着你的神经，让你血脉奔张。
+玩法有趣。游戏的玩法很简单，按住鼠标左键不停射爆就对了。移动鼠标来调整方向。而且有许多种武器可以更换，还有技能可以使用。每一个关卡的敌人类型，进攻方式都有所不同。10个挑战关卡+无尽模式足够killing time的。
+难度适当。每一关难度大致层层递进，每关能达到100%完成都十分困难，一般都是90%甚至不到就GAMEOVER了。
游戏也有一些可以改进的地方
-hud。武器和技能的hud稍微有些过大，不过半透明的形式还算可以。
-各种武器与技能介绍不足，到后期完全不知道该用哪种武器好，甚至有后期武器不如前期的情况。
-玩时间长之后有些感觉游戏模式稍微略显无聊，没太多重玩价值。
总评：9/10，一款值得购买的精品游戏，很适合无聊时killing time。射爆爱好者强烈推荐。",1524036012,1524036012,True,5,0,0.585730254650115967,0,False,True,False,False,,,
40787622,"{'steamid': '76561198313285913', 'num_games_owned': 0, 'num_reviews': 4, 'playtime_forever': 111, 'playtime_last_two_weeks': 0, 'playtime_at_review': 111, 'last_played': 1520948104}",english,"The difficulty comes from flooding the screen with unnecessary effects.
A single enemy type is responsible for 90% of your deaths.
I found use in only one other weapon besides the first one.
The enemy death sound seems like a badly recorded baloon popping and sometimes plays delayed, detached from the visual efffect. Cannot turn sound effects off because audio cues are important imo.",1520949097,1520949097,False,6,0,0.544687509536743164,0,True,False,False,False,,,
40737549,"{'steamid': '76561198381124682', 'num_games_owned': 167, 'num_reviews': 96, 'playtime_forever': 45, 'playtime_last_two_weeks': 0, 'playtime_at_review': 45, 'last_played': 1520758326}",english,This is way too stupid.,1520765102,1520765102,False,2,0,0.413604527711868286,0,True,False,False,False,,,
39225986,"{'steamid': '76561198289253732', 'num_games_owned': 45, 'num_reviews': 3, 'playtime_forever': 54, 'playtime_last_two_weeks': 0, 'playtime_at_review': 39, 'last_played': 1669097996}",koreana,모든 맵에서 레이저로 하다보면 다똑같이 무조건 90퍼에서 죽는건 뭐죠? 분명히 안닿았을텐데,1515570886,1515570886,True,0,0,0,0,True,False,False,False,,,
36582967,"{'steamid': '76561197975715389', 'num_games_owned': 0, 'num_reviews': 7, 'playtime_forever': 498, 'playtime_last_two_weeks': 0, 'playtime_at_review': 498, 'last_played': 1510960310}",english,"I will leave this review, only because there is something wrong with this game right now.

I have beaten first 2 challenges with 100% when i bought this game and now i tried this game again, i noticed something, all challenges are somehow broken and you can't beat them, you fail everytime even though you don't get hit and it always end with 90.00%. You can play 1 minute or 2 minutes, always 90.00% and score get stuck at 1000 points, you can see it when it flashes over 1000 but right away goes back to 1000.

Pls fix this, i like this game and i would like to be able to play it.",1510960631,1510960631,True,4,0,0.554612934589385986,0,True,False,False,False,,,
36281220,"{'steamid': '76561197967605706', 'num_games_owned': 0, 'num_reviews': 16, 'playtime_forever': 52, 'playtime_last_two_weeks': 0, 'playtime_at_review': 52, 'last_played': 1509284725}",english,hard but you keep playing - just 1 more...,1509830799,1509830799,True,0,1,0.454661726951599121,0,True,False,False,False,,,
36000239,"{'steamid': '76561198351173631', 'num_games_owned': 488, 'num_reviews': 6, 'playtime_forever': 304, 'playtime_last_two_weeks': 0, 'playtime_at_review': 302, 'last_played': 1509964656}",schinese,"1.游戏界面没有中文
2.游戏音乐动感十足！（游戏过程中耳机体验满分！）
3.教学关卡设计巧妙可以让玩家体验到不同的射击方式
4.设计元素简约，由方块组成，但形态各异，玩家能很好的分辨敌人
5.打击感十足，屏幕抖动好评（并且可以在设置调节抖动幅度，这无形间增加了受众人群）
6.关卡难易度适中，循序渐进，难度增加不突兀，
7.射击方式多样，通过小图标很好的表现了每种方式的特性
8.随着关卡难度上升攻击方式会自动升级（单发-双发-三发散射）
9.配色方案色彩对比很好，柔和不刺眼并且对比鲜明，
10.有特殊的按压射击设计，能让玩家更真实的融入其中，感觉很棒，增加可玩性
11.有无尽关卡，并且可以直接挑战，能直接挑战自己极限。
  这款游戏无疑是休闲类游戏的佳作，音效与画面以及色彩都可谓一级棒，并且受众面广，是一款很值得用闲暇时间一玩的游戏。特别推荐
（希望有全球玩家得分数据排行榜）（希望支持中文并且支持更多语言）",1508978213,1508978213,True,2,0,0,0,False,True,False,False,,,
