recommendationid,author,language,review,timestamp_created,timestamp_updated,voted_up,votes_up,votes_funny,weighted_vote_score,comment_count,steam_purchase,received_for_free,written_during_early_access,hidden_in_steam_china,steam_china_location,timestamp_dev_responded,developer_response
38942330,"{'steamid': '76561197964863427', 'num_games_owned': 1547, 'num_reviews': 192, 'playtime_forever': 1723, 'playtime_last_two_weeks': 0, 'playtime_at_review': 1300, 'last_played': 1527538611}",english,"This review was written after finishing the first four out of five planned episodes. 

The strongest point of the game is undoubtedly the visual art. Both London exteriors and interiors, as well as protagoinsts of the game are painted very competently, and the overall exceptional quality of the graphics certainly contributes greatly to the atmosphere. What few animations are in the game (rooftop chase, the beheading, etc) look like something from a comedy animated movie, however, and clashes stylistically with the rest of the game - which is no big deal since there is only a handful of animations in the whole game. 

The main topic of the game, Demonology, is rather interesting and well researched by the authors, and able to carry the whole narration sufficiently. The quality of the writing, however, is not without flaws. First of all, the pacing is inconsistent - the beginning is rather fast, which is IMO a lost opportunity, don't expect any Lovecraftesque moody litanies and rich descriptions, nor Eco's extensive trips to the rich and often confusing labyrinth of the 19th century occultism. Instead, the opening is rather quick and business like, establishing the playground and the rules of the game in a few, broad strokes, only to lose momentum altogether in the muddled ramblings of in the beginning of the third act - the endless bickering between Harry, Charless and Jeremy does not really develop the characters themselves, nor helps the story in any way.

The somewhat clumsy narrative style is futher hampered by the game's weakest point, and that is rather poor translation to English. ""He"" and ""she"" are aparently interchangeable even when refering to a single character, an odd expression here and there sometimes makes the reader lose the thread completely before he realizes that the sentence does not make any sense only due to poor choice of synonyms (for example ""Spare me your society"", instead of ""Spare me your company"", etc.) The game could greatly benefit from the services of a native speaker hired to proof-read the whole text (a step Russian indie developers often omit to their own loss).

Nevertheless, the game was interesting enough from the beginning till the end, I did care for the characters, and will play the remaining episode as soon as it is released.

I recommend this game to any fan of occult literature, 19th century London setting, or to readers of Lovecraft, Eco, or Arthur Conan Doyle.",1514825203,1514825203,True,9,0,0.595731019973754883,0,True,False,False,False,,,
37132647,"{'steamid': '76561198088936515', 'num_games_owned': 0, 'num_reviews': 2, 'playtime_forever': 1062, 'playtime_last_two_weeks': 0, 'playtime_at_review': 855, 'last_played': 1511455432}",english,"One of the best visual novels I've ever played. Besides interesting characters and just gorgeous art it has this really neat mystic adventure vibe that makes the story all the more appealing and immersive and leaves you begging for more.
Can't wait for the next chapters.",1511456000,1511456000,True,4,0,0,0,True,False,False,False,,,
36824098,"{'steamid': '76561197982034378', 'num_games_owned': 698, 'num_reviews': 28, 'playtime_forever': 2715, 'playtime_last_two_weeks': 0, 'playtime_at_review': 449, 'last_played': 1606159426}",russian,"Демон или Ангел в Нас. Или всё же происки других людей, которые вами манипулируют, ради своей выгоды. Лживо ли то, что вы видите , или обманчиво по своей природе. Поиск себя и  обман, внутренняя часть зверя и демона, как повелевание вами или сопротивление до самой смерти, но дабы не раскрыть то , что в вас. Вечные вопросы, иногда без ответов, здесь вам представиться возможность задуматься и подумать, возможно вы проиграете и не найдёте ответа на ваш вопрос, ведь это всего лишь - игра.",1511387615,1511393301,True,4,0,0.520201981067657471,0,True,False,False,False,,,
36805643,"{'steamid': '76561198287709816', 'num_games_owned': 0, 'num_reviews': 25, 'playtime_forever': 458, 'playtime_last_two_weeks': 0, 'playtime_at_review': 458, 'last_played': 1487017136}",russian,Интересная игра,1511384806,1511384806,True,4,0,0.482837706804275513,0,False,False,False,False,,,
36133897,"{'steamid': '76561197998827138', 'num_games_owned': 1217, 'num_reviews': 426, 'playtime_forever': 764, 'playtime_last_two_weeks': 0, 'playtime_at_review': 764, 'last_played': 1510385873}",english,"Really enjoying this occult mystery Visual Novel. The art is beautiful, the theme is well executed, there are some interesting decisions to be made, the characters are interesting and each have their own secrets and mysteries to add to the atmosphere; and, most importantly, the plot and narrative really makes me want to know where things are going.

The english translation is not perfect, but it's far from being bad. Not really a big issue.",1509348021,1509348021,True,5,0,0.480609685182571411,0,True,False,False,False,,,
34906218,"{'steamid': '76561197999699678', 'num_games_owned': 0, 'num_reviews': 14, 'playtime_forever': 765, 'playtime_last_two_weeks': 0, 'playtime_at_review': 765, 'last_played': 1505239513}",russian,"Р - разочарование.

Некоторое время назад (бездельным летом) приобрела первые 2 части этой игры, начитавшись восторженых отзывов (250р - хорошая цена, да и кто б сказал что оставшиеся 3 главы придется покупать КАЖДУЮ отдельно, да по 150р. Итоговая цена: 700 руб. Думаю каждый из вас может заглянуть в свой список желаемого и увидеть что-то более достойное за эту цену). Как любительница подобных казуалок сманилась и даже дала шанс игре,даже не особо вдохновившись 1 главой...рисовка и правда приятная, была надежда на оригинальные повороты сюжета и надежда на интересные загадки.

Люди, пишущие дикие восторги о ней видимо просто ""ничего слаще горькой редьки"" не пробовали. Да, замечательно что наши разработчики пытаются сделать что-то достойное.....но только из-за этого я не готова простить такое разочарование. Наступило оно в момент, когда я наткнулась на баг, не позволивший мне доиграть даже до конца 2 главы. Впоследствии окажется, что данный баг исключительно на 32битных системах, и что разработчики ""работают над этим"". Спустя почти месяц ситуация не изменилась. Попытка вернуть деньги за игру провалилась ибо играла в нее я больше 2 часов...а как иначе,если этот ""неустранимый"" баг встретился только во 2 части? 

В итоге получается, что даже при условии что ваш ПК соответствует(!) указанным системным требованиям, вы не получите за свои деньги даже нормально работающие 2 эпизода. Спустя несколько месяцев этот баг кажется убрали (простите,но у меня уже нет смысла в отслеживании новостей разработчиков чтобы сказать об этом со 100% уверенностью). А где гарантия что этого не случится с новыми главами?...

Итог: если вы готовы выкинуть от 250 до 700р и уныло зависнуть на пару месяцев в ожидании когда купленный продукт наконец-то заработает, то рекомендую к покупке.",1505240891,1505501405,False,20,3,0.529163479804992676,7,True,False,False,False,,,
34248907,"{'steamid': '76561198161293654', 'num_games_owned': 0, 'num_reviews': 12, 'playtime_forever': 10402, 'playtime_last_two_weeks': 0, 'playtime_at_review': 819, 'last_played': 1638355977}",schinese,没有 中文测评的话我就来当第一个。首先，这个游戏的画风就非常吸引我，故事北京也是我这个文学狗偏爱的维多利亚时代，还是在伦敦！对比我之前玩过的一些视觉小说类游戏，这款游戏有了一些小游戏来与剧情进行互动，我觉得这比我不停各种按enter要好上不少。但是缺点就是，更新太慢了，等死我了。如果游戏有配音的话就完美了。真的很喜欢这款游戏，希望后面的剧情不让我失望。,1502771207,1502771207,True,9,0,0.603206634521484375,0,True,False,False,False,,,
34022104,"{'steamid': '76561198034286355', 'num_games_owned': 0, 'num_reviews': 58, 'playtime_forever': 398, 'playtime_last_two_weeks': 0, 'playtime_at_review': 220, 'last_played': 1567818598}",english,Amazing game. Can't wait for further chapters to be released. :),1501873689,1501873689,True,5,0,0.517744362354278564,0,True,False,False,False,,,
33350670,"{'steamid': '76561198052514327', 'num_games_owned': 0, 'num_reviews': 178, 'playtime_forever': 1106, 'playtime_last_two_weeks': 0, 'playtime_at_review': 712, 'last_played': 1527781056}",english,"This game is just brilliant, I can't wait for chapter 4 and 5 :)",1499452390,1499452390,True,17,0,0.635542929172515869,0,False,False,False,False,,,
32789272,"{'steamid': '76561198037324067', 'num_games_owned': 441, 'num_reviews': 96, 'playtime_forever': 415, 'playtime_last_two_weeks': 0, 'playtime_at_review': 112, 'last_played': 1500326091}",russian,"Игра продаётся частями, за 250р только две главы из пяти, при этом нигде не предупреждают об этом, а должно быть ЖИРНЫМ КАПСОМ.

Сама игра хороша, если не сольют концовку.",1498425825,1498425825,False,24,2,0.55215829610824585,1,True,False,False,False,,,
32601312,"{'steamid': '76561198167506835', 'num_games_owned': 0, 'num_reviews': 10, 'playtime_forever': 445, 'playtime_last_two_weeks': 0, 'playtime_at_review': 101, 'last_played': 1535823104}",russian,"Очень славная, легкая история, созданная с любовью и душой. Приятно, что это отечественный проект, что авторы прислушиваются ко мнению читателей и готовы давать обратную связь.
Самая сильная сторона ОДЛ - это арт, особенно персонажи хороши!
Музыка тоже чудесная. История нелинейная, выборы влияют на сюжет, играть интересно.

Расстраивает только одно - стиль, в котором написаны диалоги. Очень много концеляризмов, сухих и неуместных в 19-том веке, да и вообще в речи живых людей (и демонов, кстати, тоже, если только они не были призваны в офисе безумными сотрудниками ЖКХ). Очень, ОЧЕНЬ активно реквестирую хотя бы минимальную редакцию. Хороший редактор сделает вашу игру еще лучше. 
",1497988747,1497988747,True,16,0,0.644479036331176758,0,True,False,False,False,,,
32385048,"{'steamid': '76561198038215719', 'num_games_owned': 0, 'num_reviews': 1, 'playtime_forever': 915, 'playtime_last_two_weeks': 0, 'playtime_at_review': 746, 'last_played': 1536043403}",english,"Absolutely fantastic. This is the best non-Japanese visual novel that I've ever played. The atmosphere, setting, art, subject matter, it's as if the game was made just for me. The only downside is the frequent occurence of typos and awkward English. They are improving in this regard however. 

If you enjoy mystery, the occult, and victorian themes and don't mind reading then this game is for you.",1497348669,1497348669,True,8,0,0.555940568447113037,0,True,False,False,False,,,
32082097,"{'steamid': '76561198096780298', 'num_games_owned': 0, 'num_reviews': 53, 'playtime_forever': 2342, 'playtime_last_two_weeks': 0, 'playtime_at_review': 1961, 'last_played': 1558806555}",russian,"Я, в общем-то, раньше как-то не интересовалась визуальными новеллами, но группа в полосатых купальниках (С) с одного из скриншотов сильно меня заинтересовала, решила купить. Когда начала играть - не могла оторваться! 
Сюжет весьма интересный, и куча разветвлений в диалогах. Бывает, что они все равно приводят к одному результату, а бывает и так, что решение, принятое в самом начале, сильно влияет на возможности в будущем. Можно не услышать некоторых вещей, если выбрать не ту ветку. Какие-то решения позволяют досрочно закончить игру (правда, потом можно изменить свое решение). 
Кроме разговоров встречаются места, где можно почитать книги, иногда нужно решать несложные головоломки. Имеются битвы и если неправильно действовать во время них, то наш персонаж умирает (однако в одном месте битвы можно избежать, возможно, в дальнейшем такая возможность представится еще...)
Игра весьма длинная, а ведь доступно еще только три главы! Я пока прошла две главы по два раза ([spoiler]очень мне хотелось, чтобы Дженнифер осталась с нами - но увы, оба раза меня постигла неудача... Теперь буду доигрывать так - посмотрю, как будет без нее, а потом, когда игра выйдет целиком, снова попробую)[/spoiler]), но времени уже прилично затрачено. При этом события развиваются, по кругу мы не ходим. 
Ну и Ви, конечно, невозможно не полюбить)
UPD: Мамма миа, как тут оказывается сложно! Разветвление оказалось даже сильнее, чем это казалось сначала. Насчет Ви  - беру свои слова назад... [spoiler] Ну и скотина! [/spoiler]",1496225007,1544874841,True,8,1,0.594942927360534668,0,True,False,False,False,,,
31188137,"{'steamid': '76561198070950757', 'num_games_owned': 0, 'num_reviews': 5, 'playtime_forever': 1526, 'playtime_last_two_weeks': 0, 'playtime_at_review': 986, 'last_played': 1533764158}",russian,"Попытаюсь развеять сомнения для тех, кто сомневается, брать или не брать.

Итак, эта игра совершенно точно НЕ:

-Вариация ""Бесконечного лета"" или симулятора свиданий.
-Состоит на 80% из мини-игр, прикрываясь названием визуальной новеллы.
-Имеет ровно один путь прохождения, а вся её вариантность - пара отличающихся фраз.
-Показывает на скриншотах красивую обертку, пытаясь спрятать унылое содержимое.
-Закончится через два часа, включая дополнение.
-Сделана без капли любви, исключительно ради жажды наживы.
-Прикрывается громким званием ""надежды отечественного игропрома"", пытаясь вам понравиться.

Напротив, в этой игре ЕСТЬ:

+Интересная история с несколькими вариантами развития событий. Событий, а не только диалогов.
+Как типичные, так и необычные, но одинаково колоритные персонажи, которые прекрасно вписаны в сюжет.
+Мини-игры, создающие атмосферу и не пытающиеся забрать у вас лишнее время.
+Минимум три сюжетных поворота, которые заставят вас сидеть с открытым ртом и хлопать глазами.
+Потрясающая визуальная составляющая. Не верьте скриншотам. Всё ещё круче.
+Музыка. Она разная, она к месту и оназасела в моем плей-листе на ближайшие недели.
+Злодей в цилиндре, злодей в костюме шута, викторианская англия, демоны... вы понимаете, к чему я клоню?
+Любовь. Звучит банально, но здесь на каждом шагу чувствуется, что авторы искренне любят свое детище и вкладывают в него душу.

А в итоге, получаем чудесную игру, которая за небольшую, особенно по нынешним временам, цену, предлагает окунуться в приятную историю, с красивой музыкой и обалденной графикой. Поиграйте в это. Пожалуйста.",1492381831,1492382384,True,30,0,0.71976768970489502,0,False,False,False,False,,,
30745109,"{'steamid': '76561198021586666', 'num_games_owned': 0, 'num_reviews': 14, 'playtime_forever': 723, 'playtime_last_two_weeks': 0, 'playtime_at_review': 612, 'last_played': 1510755307}",russian,"Эта игра реально Чудесна...Нет!!Она просто прелестна!!!Нет!!Она замечательна!!Нет!!Она обворожительна!!!!Нет!!Она прекрасна!!!Нет!!!Она изумительна!!!Нет!!!!Она сногсшибательна!!!Нет!!!Она потрясающе захватывающая!!Нет!!!!Она бесподобна!!!Да нет,она просто ГЕНИАЛЬНА,и этим все сказано!!!Играя в это творение,у меня возникло сильнейшее чувство де жа вю,я вспомнил как сам был таким же студентом,практикующим вызовы различных гоэтических духов каждый месяц+главный герой даже внешне чем-то похож на меня))))Ностальгия,однако....Спасибо разработчикам огромное-преогромное за этот шедевр,не побоюсь этого слова!!!Проходится на одном дыхании,все время держит в напряжении,да так,что оторваться просто нереально!!!Рекомендую однозначно ВСЕМ-ВСЕМ-ВСЕМ!!!!!В этот шедевр имеет смысл поиграть КАЖДОМУ уважающему себя игроку!!!!!Браво!!!Браво!!!Браво!!!!Так держать,ребята!!!!Вы очень-очень большие молодцы,спасибо Вам ВСЕМ огромнейшее за этот праздник!!!",1490513499,1490513499,True,4,2,0.486207276582717896,0,True,False,False,False,,,
30664711,"{'steamid': '76561198203003720', 'num_games_owned': 0, 'num_reviews': 68, 'playtime_forever': 992, 'playtime_last_two_weeks': 0, 'playtime_at_review': 708, 'last_played': 1658110577}",english,An exsqwiset game. A true master piece,1490168630,1490168630,True,7,1,0.402741730213165283,0,True,False,False,False,,,
