recommendationid,author,language,review,timestamp_created,timestamp_updated,voted_up,votes_up,votes_funny,weighted_vote_score,comment_count,steam_purchase,received_for_free,written_during_early_access,hidden_in_steam_china,steam_china_location,timestamp_dev_responded,developer_response
26184108,"{'steamid': '76561198069030201', 'num_games_owned': 0, 'num_reviews': 41, 'playtime_forever': 602, 'playtime_last_two_weeks': 0, 'playtime_at_review': 602, 'last_played': 1477155892}",russian,"Конец XIX века - великолепная, утонченная эпоха, нашедшая свое отражение в ""One day in London"". Главный герой - типичный представитель скучающей аристократии того времени, в поисках развлечений увлекшийся оккультизмом. Бездумное баловство редко обходится без последствий, не обошлось и в этот раз. Разнузданный образ жизни резко сменился чередой событий разного рода содержания, свидетелями которых мы и становимся. 

Для начала стоит отметить не популяризированный сеттинг игры. Признаться, разного рода выживания, апокалипсисы, личные взаимоотношения уже приелись, и демонология стала странным, но интересным открытием в ""One day in London"", особенно учитывая жанр визуальной новеллы. К слову, разнообразия ради ее слегка разбавили мини-играми и загадками. 

Основной костяк игры прекрасно исполнен. Приятная цветовая гамма, тщательный подход к деталям, изображение персонажей с учетом их характеров и темпераментов являют собой великолепную работу художника. Не уступает в этом и подбор музыки - спокойной и убаюкивающей, сменяющейся в напряженных моментах. Осмысленный детектив может поставить в пример и мрачный антураж, соответствующий описываемым событиям. Но даже не это главное достоинство игры. 

Что действительно заслуживает похвалы, так по-настоящему интересный сюжет, непредсказуемый и захватывающий, скрашенный нотками английского юмора и щепоткой здорового цинизма. Витиеватые диалоги, украшенные словесными оборотами и литературными приемами. Именно речевое многообразие привлекает, в первую очередь, пресыщенного упрощенными текстами игрока. Радует и вариативность, зависящая от выбора в соответствующей ситуации. Как главный герой, так и второстепенные персонажи раскрываются по мере повествования. Решения игрока в той или иной степени отразятся на их мировоззрении, взаимоотношениях и даже на характерах. 

Что омрачает общую картину, так это несколько смазанное окончание, изливающее несбалансированное событиями полотно текста. Финал не столь открыт, сколь резко оборван. Остается ждать следующих эпизодов, которые, по всей вероятности, выйдут не раньше, чем вырастет так незаслуженно низкая популярность игры.",1477235716,1477235716,True,40,0,0.747997820377349854,0,False,False,False,False,,,
25992784,"{'steamid': '76561198263081099', 'num_games_owned': 195, 'num_reviews': 21, 'playtime_forever': 5318, 'playtime_last_two_weeks': 0, 'playtime_at_review': 335, 'last_played': 1595515649}",russian,"Наверное, плохая идея писать обзор на эмоциях сразу после прохождения, но я рискну.

Новелла шикарна. Серьёзно. Сюжет, персонажи, фоновая музыка, сеттинг, графика, всё на высшем уровне.  

Действие разворачивается в викторианской Англии, и наш герой – типичный представитель того времени, студент Джереми Майерс, увлекающийся оккультизмом. Ожидаемо, что время первого шуточного ритуала что-то идёт не так и Джереми оказывается одержимым демоном, с которым пытается ужиться и которому даёт имя Ви. Почти сразу на него выходит некая организация демонологов, попутно обрушивая на головы Джереми ряд проблем, которые решить без его помощи, естественно, не может. Надо сказать, тема синтеза человека и чуждого людскому миру существа, изучения ими друг друга, встречалась мне единожды – в аниме/манге [i]«Parasyte»,[/i] где была замечательно обыграна, завоевав мою любовь. И [i]“One Day in London”[/i] в этом плане тоже не отстаёт.

Графика очень приятная, не цветисто-анимешная, как я ожидала (после БЛ), без оголтелого фансервиса (всё то же БЛ); хотя, возможность замутить с красоткой всё же будет. Здесь буквально каждый момент достоин скриншота. 

Персонажи отлично проработаны, это не просто красивые спрайты, но личности, со своей индивидуальностью и  историей.  Фоновая музыка  ненавязчивая, подобрана грамотно, отлично  погружает в атмосферу. 

Помимо жанра визуальной новеллы, присутствуют элементы point-and-click  и мини-игры.

Минусов тут практически нет, но я перечислю, что не понравилось конкретно мне:

1)	те же мини-игры (начерти мышкой знак, расставь символы в нужном порядке и т.п.) – на редкость скучноваты, но, к счастью, их можно пропустить;

2)	сам главный герой. Если опять вспомнить БЛ, то вот вам тот же Семён, только из 19 века. Но Джереми всё же не такой статический персонаж, он развивается и к концу второго эпизода уже отличается от самого себя в начале новеллы.
Кстати, об эпизодах. Очень грустно, что на данный момент их всего два и история обрывается на самом интересном месте. Буду с нетерпением ожидать продолжения.

Очень и очень рекомендую.",1476248160,1479990914,True,14,0,0.609266281127929688,0,True,False,False,False,,,
25972627,"{'steamid': '76561198062304230', 'num_games_owned': 0, 'num_reviews': 41, 'playtime_forever': 644, 'playtime_last_two_weeks': 0, 'playtime_at_review': 638, 'last_played': 1498477431}",russian,"Чтобы не повторять мое мнение о игре, вот вам обзор )

https://www.youtube.com/watch?v=NsE3SapvkXs",1476132495,1476132495,True,5,0,0.507938623428344727,0,False,True,False,False,,,
25873008,"{'steamid': '76561198040440461', 'num_games_owned': 137, 'num_reviews': 3, 'playtime_forever': 1359, 'playtime_last_two_weeks': 0, 'playtime_at_review': 1150, 'last_played': 1505757671}",english,"Approved.
-----------
Одобрено.

P.S. Годнота лютая (я хейтер ВН).",1475690372,1475690372,True,6,2,0.321852147579193115,0,True,False,False,False,,,
25738233,"{'steamid': '76561198070917374', 'num_games_owned': 0, 'num_reviews': 4, 'playtime_forever': 2556, 'playtime_last_two_weeks': 0, 'playtime_at_review': 694, 'last_played': 1516725321}",russian,"Очень атмосферная и захватывающая ВН. Сценарий и рисовка на высшем уровне! Порадовала проработка персонажей, надеюсь в дальнейших эпизодах мы узнаем их и их мотивацию чуть лучше. Очень интригуют возможные сюжетные повороты, ведь ответы в этих эпизодах повлияют на развитии отношений в последующих? Хочется в это верить, ведь Дженнифер весьма интригующий персонаж. ^_^
Из минусов - при повторном прохождении, хотелось бы кнопочку быстрой промотки до момента предваряющего выбор. Про голоса уже писали, и это правда. Голос Джереми нам знаком, хотелось бы услышать и другие голоса. (:
Так же, в некоторых случаях забыли учесть разную последовательность ответов. Так, например, Джереми упоминает о револьвере Гарри, до выбора соответствующего пункта.
Кстати, порадовало, что действительно можно уйти и история для персонажа на этом реально закончится. Спасибо! Довольно жизненно!
Моя оценка 9 из 10! Рекомендую!",1475062659,1475062659,True,3,0,0.500907421112060547,0,False,False,False,False,,,
25677024,"{'steamid': '76561198080406238', 'num_games_owned': 263, 'num_reviews': 13, 'playtime_forever': 422, 'playtime_last_two_weeks': 0, 'playtime_at_review': 287, 'last_played': 1496235986}",russian,"Прекрасная визуальная новелла! 

В свое время меня поразили Ever17 и Everlasting Summer. Наконец-то вышла такая визуальная новелла, которая становится в один ряд с героями своего жанра. В One Day in London не отпускающий сюжет, совершенно умопомрачительный визуальный ряд и арт. Арт заслуживает вообще отдельной песни - самое интересное, что все выполнено в совершенно нетипичном стиле для визуальных новелл. Здесь нет классической аниме-стилистики - ей на смену пришел мрачный стиль викторианского Лондона конца XIX века, в котором, собственно, и разворачиваются основные события игры. Сюжет довольно закрученный, при том обладающий мрачной мистической атмосферой в лучших традициях Эдгара Аллана По. Убийства, оккультизм, темные улочки, тайные общества, одним словом - все как мы любим. 

Практически прошел игру, жду развязки и буду проходить снова, так как вариантов развития событий какое-то невменяемое количество. Уверен, что и концовок тоже.
",1474744673,1474744673,True,4,0,0.500907421112060547,0,False,False,False,False,,,
25551124,"{'steamid': '76561198129214277', 'num_games_owned': 157, 'num_reviews': 14, 'playtime_forever': 1083, 'playtime_last_two_weeks': 0, 'playtime_at_review': 384, 'last_played': 1531762217}",russian,"Брат подарил на др, спасибо ему и разработчикам за игру)
Очень заинтересовало, чем-то напоминает the last day on decade...
Игра хорошая, нравится такие, диалоговые, эти эмоции персонажей,-однозначно рекомендую любителям такого жанра.",1474130156,1479954974,True,2,1,0,0,False,True,False,False,,,
25451476,"{'steamid': '76561198182356186', 'num_games_owned': 284, 'num_reviews': 24, 'playtime_forever': 1811, 'playtime_last_two_weeks': 0, 'playtime_at_review': 518, 'last_played': 1528043957}",russian,"Это превосходная игра, для своего жанра!
  
Если Вы никогда не играли в игру жанра визуальная новелла, то советую начать знакомство именно с этой игры. Интересный сюжет, великолепная графика и музыка не дадут вам оторваться от игры, до её завершения. 

Пара недочётов: 1 – при записи имени нового сохранения какая-то клавиша пролистывает 1 блок текста из игры; 2 – в одной фразе Дженнифер (2 глава) «… и теперь держит на расстоянии от важной информации?» явно пропущено слово «их». В остальном вроде всё хорошо. 

Далее чисто мои впечатления от первых двух глав этого шедевра:  Играть я начал на планшете, но, к сожалению (на тот момент) там была только 1 глава, и я был счастлив узнав, что в Steam лежит версия с 2 главами.  Игра очень сильно затянула в первую очередь своей историей, повествование нигде не провисало, и всегда было наполнено событиями. Читать диалоги, книги было очень интересно, и в какой-то момент я ловил себя на мысли, что уже давно не смотрел на картинки.  Периодически возникали ситуации, когда нужно было чертить руны, варить зелья, зажигать свечи и т.п. – это вносило оживление в игровой процесс. Также нужно было выбирать один из вариантов для продолжения диалога и тут можно отметить, что порой описание выбираемого диалога не всегда ведёт к той реакции, на которую ты рассчитывал (не знаю хорошо это или плохо). Порой хотелось сказать своему персонажу: «Что ты несёшь??? Я бы так себя не повёл в этой ситуации!» , но в целом наверное именно это и заставляет глубже проникнутся происходящими событиями. Да, у игры очень сильная атмосфера, чего-то таинственного, не изведанного, страшного и интересного. Также присутствует хорошее музыкальное сопровождение (я не сильно разбираюсь в музыке, но мне понравилось). Кстати в конце 2 главы есть звук кашля, а вот других «специфичных» звуков в игре я не помню, и это звучало несколько неожиданно…  И да, всё оборвалось на самом интересном месте, с нетерпением жду продолжения и спасибо за замечательную игру! 
",1473544529,1473544529,True,5,0,0.514746665954589844,0,True,False,False,False,,,
25407131,"{'steamid': '76561198182636646', 'num_games_owned': 0, 'num_reviews': 3, 'playtime_forever': 1449, 'playtime_last_two_weeks': 0, 'playtime_at_review': 342, 'last_played': 1528026459}",russian,"Графика вызывает благоговение. Она позволяет полностью погрузится в атмосферу старой Англии. Наслаждалась фонами, персонажами. Такая корпотливая работа достойна восхищения. 
Конечно, главное что покорило меня, так это сердце визуальной новеллы - сюжет. 
Сюжет затягивает, заставляя пройти игру от и до не отрываясь ни на минуту. Характер персонажей прописан так что волей не волей влюбляешься в них, сопереживаешь. 
Вся информация преподносилась так, что не было скучно или непонятно. 
Были сцены жуткие, над которыми можно развести сырость, или посмеятся в голос. Это действительно на мой взгяд показатель отличной игры. 
С нетерпением жду продолжения!",1473317493,1473317493,True,4,0,0.514746665954589844,0,False,False,False,False,,,
25371214,"{'steamid': '76561198052199699', 'num_games_owned': 0, 'num_reviews': 9, 'playtime_forever': 1108, 'playtime_last_two_weeks': 0, 'playtime_at_review': 1108, 'last_played': 1532388924}",russian,"+Очень интересно. С первой минуты погружаешься в сюжет, который так и радует событиями и неожиданными поворотами. Авторы не обманули - все герои очень харизматичные, со своей изюминкой так сказать.
+Много интерактива. Действительно, выбора здесь гораздо больше, чем в других новеллах. Однако, мне неизвестно, каждый ли из них влияет на дальнейшие события. Показалось, что нет.
+Авторам очень круто удалось внедрить систему point-and-click в свою новеллу. Мини-игры действительно ""в тему"". Тому же, кто хочет Read Only предусмотрели возможность пропускать такие вещи.
+Красивые арты. Так и чувствуется атмосфера Лондона конца XIXв.  А периодически мы еще получаем и небольшие видеовставки 
+Неплохое музыкальное сопровождение
+/-Хотелось бы все же хоть какое-то меню при запуске игры. Возможно это я такой привередливый, но попадать сразу в игру не люблю. С простыми кнопками типа продолжить, откуда закончили; загрузить какой-то определенный момент; выйти - было бы удобнее имхо.
-Новелла не закончена. Самый большой минус для меня. Такие вещи хочется брать и зачитываться от начала до конца за один присест. На начало сентября всего 2 главы. При этом, я так и не нашел нигде информации о приблизительных сроках выхода следующих.
-Несмотря на то, что музыка в целом неплоха, периодически встречаются места, где она отсутствует. Довольно странно.

В целом новелла очень хороша. И я бы советовал к приобретению всем любителям этого жанра. От авторов жду скорейшего выхода следующих эпизодов, а до того хотя бы примерные сроки :)

А пока только 8 одержимых из 10.
-----------------------------
UPDATE:
Что ж спустя год пришло время пройти еще 2 главы. Немного неприятный, нигде заранее не озвученный факт о том, что за каждую следующую главу начиная с 3 придется платить отдельно, немного озадачил. Но если говорить о содержании:
+Все также интересно
+Как мне показалось выборы стали сильнее влиять на конечный результат
+Появилось меню, интерфейс стал лучше
+/- Если 3 глава мне показалась даже немного затянутой, то 4 уж слишком коротка(хотя насыщена событиями не меньше предыдущих)  
- Выход этих самых глав происходит крайне долго, начал было с сейва, но понял, что некоторые моменты, и даже не основные персонажи уже подушли из памяти, пришлось начать с начала
------------------------------
UPDATE 2.0
Чувствую долг что-то написать сюда, так как продукт наконец-таки закончен. Ничего нового про 5 главу не скажу(вроде в этот раз добавили скип прочитанного текста при перепрохождении, хотя может и раньше). Впечатление подпорчено тем, насколько долго все это выходило. Я честно начинал каждый раз заново, дабы освежить в памяти все детали истории. Посмотрел свою концовку. И почему-то желания посмотреть другие не возникло. Все же такие истории надо выпускать целиком имхо. Но это нисколько не уменьшает качество продукта, и если вы еще не знакомы с ним, то сейчас самое время. Разработчикам спасибо.",1473110327,1549408876,True,3,0,0.500907421112060547,0,True,False,False,False,,,
25332215,"{'steamid': '76561198027978604', 'num_games_owned': 0, 'num_reviews': 62, 'playtime_forever': 1441, 'playtime_last_two_weeks': 0, 'playtime_at_review': 364, 'last_played': 1530885887}",english,"As I started to play, I wasn't so sure about this game, but the more time I spent with it, the more it caught my interest. The art is great and the story got me hooked. I can't wait for the next episode and see how this ends. My only gripe are the puzzles - I wish there was an option to skip them.",1472932819,1472932819,True,8,1,0.555728733539581299,2,True,False,False,False,,,
25190861,"{'steamid': '76561198038791353', 'num_games_owned': 645, 'num_reviews': 60, 'playtime_forever': 1197, 'playtime_last_two_weeks': 0, 'playtime_at_review': 382, 'last_played': 1562504673}",russian,"Очень приятный пример отечественной визуальной новеллы, не следующей заветам жанра ""слово в слово"". Да ещё и по такой-то цене. Надеюсь увидеть от разработчиков в будущем новые ВН-проекты в sci-fi-сеттинге. Если, конечно, у них будут на то возможности и желание.",1472331997,1476053287,True,17,2,0.614689290523529053,0,True,False,False,False,,,
