recommendationid,author,language,review,timestamp_created,timestamp_updated,voted_up,votes_up,votes_funny,weighted_vote_score,comment_count,steam_purchase,received_for_free,written_during_early_access,hidden_in_steam_china,steam_china_location,timestamp_dev_responded,developer_response
154332360,"{'steamid': '76561198262626587', 'num_games_owned': 0, 'num_reviews': 373, 'playtime_forever': 137, 'playtime_last_two_weeks': 0, 'playtime_at_review': 137, 'last_played': 1703460371}",english,"What is Bulletstorm ?

Before I start this review, I'll say to ignore my playtime, I bought the original bulletstorm version here on steam, the one that had the crappy GFWL integration and played it a lot,  however it was taken out of steam years ago and because of that I was never able to play this game's multiplayer or give it a review it deserved, so I got the full clip edition recently as it looks like to be better without GFWL and seems to be more modernized and was discounted, so here we go.

I'm gonna be brief bulletstorm is definitely one of my go-to recommendation for people looking for a bombastic singleplayer campaign experience, not only they have a diverse selection of weapons the game just never stops, at every chapter it introduces something cool or a nice setpiece, either through a bossfight or simply pulling something crazy out of nowhere like controlling a remote monster to attack your targets or running away from a kaiju while a city is falling apart or simply trying to avoid getting hit by a giant spining wheel that keeps chasing you, the game never loses momentum, I also really like the art design here, the game takes place in some weird planet that has a very distinct architecture which makes every level look unique.

When talking about story, bulletstorm may have a stupid story with dumb characters and it knows it, it has this whole explosion-filled blockbuster movie aspect all around it but because of that its fun, with the diverse set of weapons you can use and the amazing shockwhip that the game gives you to pull enemies that you can kick or creatively kill it gives the game a similar gameplay feel of games like the new doom or shadow warrior 3 which I love, here in this remastered version you can also play the multiplayer which is decent, however Im not really sure if this remaster is overall a big visual upgrade over the original but without GFWL playing it is much easier and less headache-inducing. Considering how cheap this game is and how fun it is to play, I'd say for an campaign that you will take around 8 hours to finish and the game's other modes make it a worthy pick if  youre fan of this type of fps experiences, the ones that just want to go crazy and say f*ck realism which is something I wish every fps game would do.",1703461171,1703461171,True,4,0,0.570595026016235352,0,True,False,False,True,,,
154326986,"{'steamid': '76561198080838768', 'num_games_owned': 0, 'num_reviews': 35, 'playtime_forever': 618, 'playtime_last_two_weeks': 0, 'playtime_at_review': 618, 'last_played': 1703453480}",english,"I remember first seeing this game in the Official Xbox Magazine around 2010. The magazine featured a glowing review of Bulletstorm, and having finally played it many years later I can confirm that I found it rather enjoyable. 

The weapons are diverse and all fun to use (quad barrelled shotguns, drill launchers, steerable explosive bullets). The gore never fails to amuse; splatting an enemy against a giant cactus never gets old. As someone who usually gets quickly bored of gratuitous violence, I will say that with this game the magic doesn't fade and blowing people apart remains fun all the way through. The graphics have in my opinion aged very well too. I would rather there had been less quick time events, but what can you really expect from a game from that era? I would say that Bulletstorm was definitely overlooked at the time, seeing as people ignored the innovative skillshot system of this game in favour of the generic military first-person shooter at the time.

One thing I was less keen on and thought might ruin the game for me is the rudeness. There is a lot of explicit language; something I usually find to be overused, unnecessary and tiresome. But to be honest, here it was just so over the top and bombastic that in a way its almost charming so I'll can overlook this.

This edition of Bulletstorm is a re-release but apparently the graphics barely changed, and there's a Duke Nukem DLC (which should have been free). I would definitely not recommend this game for full price seeing as it often goes on sale for 90% off (which is a bargain). Overall, Bulletstorm is an action-packed experience that I would definitely recommend if you're looking for a high octane game which doesn't take itself seriously, and that can be completed in a few short play sessions.",1703454959,1704449730,True,0,0,0,0,True,False,False,True,,,
154313987,"{'steamid': '76561198878170520', 'num_games_owned': 498, 'num_reviews': 366, 'playtime_forever': 307, 'playtime_last_two_weeks': 0, 'playtime_at_review': 307, 'last_played': 1572151627}",english,lots of fun,1703441783,1703441783,True,0,0,0,0,True,False,False,True,,,
154294999,"{'steamid': '76561198831300080', 'num_games_owned': 0, 'num_reviews': 2, 'playtime_forever': 282, 'playtime_last_two_weeks': 0, 'playtime_at_review': 273, 'last_played': 1707256406}",english,"Overall it's a really neat remaster to play with keyboard and mouse, but it's barely playable with a gamepad. I don't think it's an issue on developer's end though, cause Steam tend to throw a banner ""full gamepad support"" left and right, and lots of games with such banner only provide partial support, and Bulletstorm is no exception.

So, lets see what does ""full gamepad support"" mean in Bulletstorm:

- You have four predetermined layouts (non of which I find particularily comfortable) to choose from and no ability to remap anything
- No options for sensitivity, deadzones or acceleration for sticks
- No options to calibrate sensitivity differences between standard shooting, aiming down sites, using heavy weapons and steering sniper rifle bullets either

So you are basically stuck with lots of predetermined parameters that cannot be changed. I recommend this game overall, but I strongly don't recommend it for anyone who seeks smooth and pleasant experience with a gamepad.",1703424365,1703424365,False,0,0,0,0,True,False,False,True,,,
154286757,"{'steamid': '76561199039975778', 'num_games_owned': 146, 'num_reviews': 9, 'playtime_forever': 557, 'playtime_last_two_weeks': 0, 'playtime_at_review': 557, 'last_played': 1703415489}",english,"A perfect example of a 8/10 game fully soaked in the sweet edginess of the early 2010s. It recognizes itself as a dumb fun gory FPS and never tries to be anything more than that. The facial animations suck cock, the story is full of holes, the ending is unsatisfying and is teasing a sequel that will probably never come. But I had lots of fun along the way and i couldn't ask any more for 2 dollars.",1703415963,1703415963,True,0,0,0,0,True,False,False,True,,,
154282625,"{'steamid': '76561198349613264', 'num_games_owned': 142, 'num_reviews': 7, 'playtime_forever': 1651, 'playtime_last_two_weeks': 0, 'playtime_at_review': 1300, 'last_played': 1707560122}",turkish,Bu oyun underrated bir cevher,1703411379,1703411379,True,1,0,0.523809552192687988,0,True,False,False,True,,,
154280518,"{'steamid': '76561198867316041', 'num_games_owned': 781, 'num_reviews': 73, 'playtime_forever': 557, 'playtime_last_two_weeks': 0, 'playtime_at_review': 557, 'last_played': 1703408709}",russian,Прикольная игра но конец как по мне сильно затянутый,1703408802,1703408802,True,0,0,0,0,True,False,False,True,,,
154273300,"{'steamid': '76561199152262395', 'num_games_owned': 0, 'num_reviews': 11, 'playtime_forever': 539, 'playtime_last_two_weeks': 0, 'playtime_at_review': 539, 'last_played': 1703399650}",brazilian,"só compra
",1703399685,1703399685,True,0,0,0,0,True,False,False,True,,,
154261656,"{'steamid': '76561199470979117', 'num_games_owned': 0, 'num_reviews': 1, 'playtime_forever': 702, 'playtime_last_two_weeks': 0, 'playtime_at_review': 533, 'last_played': 1703974483}",spanish,"Me lo he pasado muy bien con este juego por las siguientes razones:
- La duración no es mucha pero está muy bien concentrada ya que te sientes en frenesí constantemente.
- Los escenarios con los paisajes que ofrecen son de lo mejor que he visto para un juego tan antiguo.
- Las armas son bastante originales y divertidas de usar, tienen mucha esencia del Duke Nukem o del Doom.
-A diferencia de otros shoters en primera persona en que lo único que hacías era pasar del punto A al punto B disparando cual pollo sin cabeza, en este te recompensan por ser todo lo creativo que quieras con las muertes de los enemigos.
 Sí que es verdad que hay dos puntos negativos que me gustaría resaltar que aunque no me hayan sacado mucho de la experiencia, sí que es verdad que me molestaron un poco:
- Hay varios fallos o bugs en ciertas zonas del juego; una de ellos fue en una de las escenas finales donde el protagonista discute con uno de sus compañeros, en mi caso ni si quiera habló, solamente gesticuló movimientos mientras que los demás lo observaban fijamente, aunque fue bastante gracioso de ver.
- En un momento de la partida tomas el control de un robot, si bien las intenciones eran muy divertidas, el control del robot fue de lo más tedioso en todo el juego debido a que la interfaz con la que apuntas es casi imposible darle a los helicópteros que vienen, por no mencionar que al pasar al control de dicho robot, el juego impide que des patadas o te deslices, siendo esto una sentencia a muerte si te tomas con un enemigo de frente.
Por lo demás es casi perfecto y puedo decir confianza que se ha vuelto de mis juegos favoritos.",1703385700,1703385700,True,0,0,0,0,True,False,False,True,,,
154250384,"{'steamid': '76561199213889251', 'num_games_owned': 0, 'num_reviews': 7, 'playtime_forever': 566, 'playtime_last_two_weeks': 0, 'playtime_at_review': 566, 'last_played': 1703372681}",english,"great game , i personally loved the story but was in it for the gore and violence",1703372826,1703372826,True,0,0,0,0,True,False,False,True,,,
154242188,"{'steamid': '76561198077982284', 'num_games_owned': 0, 'num_reviews': 55, 'playtime_forever': 730, 'playtime_last_two_weeks': 0, 'playtime_at_review': 403, 'last_played': 1706572388}",english,"got it for below 4e , great fun.Perhaps too scripted, but good",1703364982,1703364982,True,0,0,0,0,True,False,False,True,,,
154241288,"{'steamid': '76561198965074854', 'num_games_owned': 0, 'num_reviews': 264, 'playtime_forever': 33, 'playtime_last_two_weeks': 0, 'playtime_at_review': 33, 'last_played': 1703364057}",brazilian,Great !,1703364180,1703364180,True,0,0,0,0,True,False,False,True,,,
154231816,"{'steamid': '76561199217456435', 'num_games_owned': 0, 'num_reviews': 10, 'playtime_forever': 462, 'playtime_last_two_weeks': 0, 'playtime_at_review': 399, 'last_played': 1703677203}",russian,Игра похожа на bioshock infinite. Советую,1703355747,1703355747,True,0,0,0,0,True,False,False,True,,,
154169090,"{'steamid': '76561198125259886', 'num_games_owned': 0, 'num_reviews': 9, 'playtime_forever': 539, 'playtime_last_two_weeks': 0, 'playtime_at_review': 539, 'last_played': 1690495473}",french,"C'est vieillot mais pour quelques euros,ça passe : )",1703288283,1703288283,True,0,0,0,0,True,False,False,True,,,
154151706,"{'steamid': '76561198256224995', 'num_games_owned': 0, 'num_reviews': 1, 'playtime_forever': 803, 'playtime_last_two_weeks': 0, 'playtime_at_review': 803, 'last_played': 1703271853}",polish,"My all time favourite. Replayed multiple times.
I want a sequel. BADLY.",1703272088,1703272088,True,0,0,0,0,True,False,False,True,,,
154110261,"{'steamid': '76561199148068675', 'num_games_owned': 0, 'num_reviews': 1, 'playtime_forever': 489, 'playtime_last_two_weeks': 0, 'playtime_at_review': 24, 'last_played': 1705385971}",spanish,"Regresen el coperativo de la campaña, no tiene chiste si no lo tiene :/",1703224225,1703224225,False,0,0,0.476190477609634399,0,False,False,False,True,,,
154093516,"{'steamid': '76561199365895514', 'num_games_owned': 59, 'num_reviews': 21, 'playtime_forever': 850, 'playtime_last_two_weeks': 0, 'playtime_at_review': 798, 'last_played': 1704639563}",ukrainian,"9/10 Моя оцінка
8 - за драйвовий геймплей
-1 за неможливість самовільно стрибати та стрейфитись під час спринту
2 - за відтворення моїх типових кооперативів з другом у вигляді пригод Ґрейсона Ханта та Іші",1703201803,1703201803,True,0,0,0,0,True,False,False,True,,,
154092327,"{'steamid': '76561198827482991', 'num_games_owned': 1060, 'num_reviews': 570, 'playtime_forever': 656, 'playtime_last_two_weeks': 0, 'playtime_at_review': 656, 'last_played': 1703200034}",english,8/10,1703200369,1703200369,True,0,0,0,0,False,False,False,True,,,
154088252,"{'steamid': '76561198139140188', 'num_games_owned': 50, 'num_reviews': 55, 'playtime_forever': 1132, 'playtime_last_two_weeks': 0, 'playtime_at_review': 457, 'last_played': 1703935890}",english,"You shoot gun, kick cannibals and do a scorpion move on them, thats pretty much about it
Angy/10",1703195756,1703335948,True,0,0,0,0,True,False,False,True,,,
154054288,"{'steamid': '76561198139464344', 'num_games_owned': 183, 'num_reviews': 69, 'playtime_forever': 558, 'playtime_last_two_weeks': 0, 'playtime_at_review': 558, 'last_played': 1703157820}",schinese,不愧是冷门佳作，富有创造力的机制，满满的诚意。美中不足的就是偶尔会遇到小bug需要回档，还有剧情收尾有点草率，希望有生之年能见到第二部吧。,1703158042,1703158042,True,3,0,0.545586943626403809,0,True,False,False,True,,,
154042500,"{'steamid': '76561198276855836', 'num_games_owned': 47, 'num_reviews': 3, 'playtime_forever': 431, 'playtime_last_two_weeks': 0, 'playtime_at_review': 431, 'last_played': 1702825872}",english,"campaign is short 8-9 hours, but it is good",1703136606,1703136606,True,0,0,0,0,True,False,False,True,,,
154008629,"{'steamid': '76561199567166688', 'num_games_owned': 0, 'num_reviews': 43, 'playtime_forever': 305, 'playtime_last_two_weeks': 0, 'playtime_at_review': 305, 'last_played': 1703091817}",russian,"Крутейший шутер. Прошел на нормальном уровне, все равно пришлось в некоторых местах попотеть. Крутая система навыков и разносторонних способов изничтожить противника. Очень подвижные, стремительные бои. Забавные диалоги, с которых можно проорать в голос, особенно относится это к Генералу (топ чувак хоть и антогонист). Довольно красивые локации с учетом даты выхода игры. Здесь даже можно взять под контроль динозавтра мать его.

Однозначно рекомендую данный шедевр, за 5 часов прошел игру на нормальном уровне сложности.",1703092866,1703092866,True,1,0,0.523809552192687988,0,True,False,False,True,,,
153968072,"{'steamid': '76561198318158850', 'num_games_owned': 0, 'num_reviews': 16, 'playtime_forever': 430, 'playtime_last_two_weeks': 0, 'playtime_at_review': 430, 'last_played': 1703039199}",schinese,不是叫子弹风暴吗？为啥玩了一会子弹不够用了……果断开修改器无限子弹无限生命一直杀到底，确实挺爽的，没有迷宫，不用管队友，就是纯粹的开无双杀，几把枪也有点意思，尤其喜欢那把狙，就是游戏比较老，现在看贴图细节都差点意思，另外一直杀，通关用了7小时也不短了，总体还不错，最后看来是想做续集，还是有点期待的,1703039552,1703039552,True,0,0,0,0,True,False,False,True,,,
153964040,"{'steamid': '76561198212157495', 'num_games_owned': 167, 'num_reviews': 31, 'playtime_forever': 885, 'playtime_last_two_weeks': 0, 'playtime_at_review': 518, 'last_played': 1705197463}",brazilian,"Ótimo jogo, diálogos engraçados e ridículos, gameplay fantástica, com sistema de pontuação conforme as suas formas de abata, cenário interativo com mortes, muito bom mesmo, mas recomendo esperar uma promoção!!!!",1703033825,1703033825,True,0,0,0,0,False,False,False,True,,,
153943506,"{'steamid': '76561199477443059', 'num_games_owned': 18, 'num_reviews': 6, 'playtime_forever': 349, 'playtime_last_two_weeks': 0, 'playtime_at_review': 228, 'last_played': 1703168535}",russian,+rep,1703019529,1703019529,True,0,0,0,0,True,False,False,True,,,
153929308,"{'steamid': '76561198028140112', 'num_games_owned': 720, 'num_reviews': 235, 'playtime_forever': 325, 'playtime_last_two_weeks': 0, 'playtime_at_review': 325, 'last_played': 1703003732}",russian,Очень крутая игра в стиле Duke Nukem но с экшн-сценами как в Call of Duty!,1703003819,1703003819,True,0,0,0,0,True,False,False,True,,,
153924194,"{'steamid': '76561198250340170', 'num_games_owned': 308, 'num_reviews': 29, 'playtime_forever': 461, 'playtime_last_two_weeks': 0, 'playtime_at_review': 461, 'last_played': 1681651277}",polish,"Przyjemnie się w nią gra i miło spędza się czas.
",1702998471,1702998471,True,0,0,0,0,False,False,False,True,,,
153919241,"{'steamid': '76561198139304781', 'num_games_owned': 121, 'num_reviews': 26, 'playtime_forever': 478, 'playtime_last_two_weeks': 0, 'playtime_at_review': 478, 'last_played': 1687339402}",ukrainian,"Тупа заруба з такими самими тупими жартами, але воно варте проходження. Саме те щоб відключити мозок і піти вбивати ворогів підкатами в слоумо. Багато видовищних ситуацій, всратих моментів і фану.",1702992979,1702992979,True,0,0,0,0,True,False,False,True,,,
153914924,"{'steamid': '76561198327316613', 'num_games_owned': 630, 'num_reviews': 113, 'playtime_forever': 708, 'playtime_last_two_weeks': 0, 'playtime_at_review': 708, 'last_played': 1702987290}",turkish,Oyuna güzel bir inceleme yazacaktım ama yapacağınız finali s*keyim.,1702987561,1702987561,True,0,0,0,0,True,False,False,True,,,
153865866,"{'steamid': '76561198117477487', 'num_games_owned': 0, 'num_reviews': 47, 'playtime_forever': 788, 'playtime_last_two_weeks': 0, 'playtime_at_review': 518, 'last_played': 1705682435}",english,"still waiting for Bulletstorm 2
(EDIT)
On second taught i hope they don't make one. After the forced profanity filter shit with bulletstorm vr. God knows what baby game sensitive bullshit they are gonna make out the sequel.",1702917058,1707156525,True,41,0,0.758960127830505371,2,False,False,False,True,,,
153839203,"{'steamid': '76561198085832705', 'num_games_owned': 0, 'num_reviews': 33, 'playtime_forever': 344, 'playtime_last_two_weeks': 0, 'playtime_at_review': 344, 'last_played': 1702877048}",spanish,"Fun run n' gun game, nothing else",1702877183,1702877183,True,0,0,0,0,True,False,False,True,,,
153790069,"{'steamid': '76561198878675341', 'num_games_owned': 0, 'num_reviews': 56, 'playtime_forever': 377, 'playtime_last_two_weeks': 0, 'playtime_at_review': 376, 'last_played': 1704500628}",czech,70%,1702820327,1702820327,True,0,0,0,0,True,False,False,True,,,
153779684,"{'steamid': '76561198044453630', 'num_games_owned': 0, 'num_reviews': 451, 'playtime_forever': 76, 'playtime_last_two_weeks': 0, 'playtime_at_review': 71, 'last_played': 1702914289}",english,"A good bad game. Very scripted & linear.

Worth on sale, definitely not worth full price.",1702808864,1702808954,True,0,0,0,0,True,False,False,True,,,
153770039,"{'steamid': '76561199511028447', 'num_games_owned': 0, 'num_reviews': 11, 'playtime_forever': 358, 'playtime_last_two_weeks': 0, 'playtime_at_review': 273, 'last_played': 1702800432}",english,"Best way to play is as The king him self. its a classic run and gun With gut spilling gore, bullets flying everywhere, kicking losers into sharp pointy objects and blowing everything up in your way with High end explosives. story is easy to follow while paying barely any attention. its got jokes, Booze, betrayal and tight pants.  worth every penny.",1702795705,1702795705,True,0,0,0,0,True,False,False,True,,,
153769182,"{'steamid': '76561198215702612', 'num_games_owned': 0, 'num_reviews': 1, 'playtime_forever': 542, 'playtime_last_two_weeks': 0, 'playtime_at_review': 542, 'last_played': 1702794379}",brazilian,"Já tinha jogado a versão mais antiga, essa foi melhorado bastante a qualidade gráfica, é um baita jogo, recomendo á todos.",1702794442,1702794442,True,0,0,0,0,True,False,False,True,,,
153742736,"{'steamid': '76561199178340496', 'num_games_owned': 0, 'num_reviews': 28, 'playtime_forever': 378, 'playtime_last_two_weeks': 0, 'playtime_at_review': 378, 'last_played': 1702453693}",brazilian,"O único ponto negativo desse jogo é que ele é realmente muito curto, se tivesse uma sequencia ao menos...Porém o jogo é excelente, jogabilidade viciante e dinâmica juntamente com uma historia com personagens cativantes e divertidos que vão te conquistando aos poucos. Excelente jogo nota 9,5/10.",1702760992,1702760992,True,0,0,0,0,True,False,False,True,,,
153738215,"{'steamid': '76561198063212609', 'num_games_owned': 0, 'num_reviews': 3, 'playtime_forever': 647, 'playtime_last_two_weeks': 0, 'playtime_at_review': 645, 'last_played': 1710215322}",english,"Criminally Underrated game that's begging for a sequel. Great voice acting, memorable characters, and a master class in level design. Set pieces were amazing. My only small gripe is I couldn't get surround sound working properly, tried Sonic, Atmos, and THX and sound over gaming headphones sounded a bit hollow. Now I'm off to play the bonus content. This is the real Duke Nukem Forever! LOL",1702756488,1702756488,True,0,0,0,0,False,False,False,True,,,
153690322,"{'steamid': '76561198978376299', 'num_games_owned': 0, 'num_reviews': 60, 'playtime_forever': 149, 'playtime_last_two_weeks': 0, 'playtime_at_review': 149, 'last_played': 1677525409}",spanish,Mas malo que comer sopa en verano.,1702703952,1702703952,False,0,0,0.419532328844070435,0,True,False,False,True,,,
153662365,"{'steamid': '76561198922800008', 'num_games_owned': 648, 'num_reviews': 1107, 'playtime_forever': 490, 'playtime_last_two_weeks': 0, 'playtime_at_review': 490, 'last_played': 1702668642}",turkish,"[b]Grafik[/b] ( 3 / 10 )
Oyun aslında 12 yıllık. Sonradan redux gibi bir sürümünü çıkartmışlar. Dolayısıyla grafikler eski. Çok göze batmıyor ama öyle işte.

[b]Hikaye[/b] ( 1 / 10 )
Beğenmedim. Çok dandik. 

[b]Oynanış[/b] ( 2 / 10 )
Vuruş hissi yok diyebiliriz. Düşmanlar bir türlü ölmüyorlar. Beğenmedim.

Sonuç : ( 2 / 10 ).",1702668984,1702668984,False,0,0,0,0,True,False,False,True,,,
153612431,"{'steamid': '76561198053252844', 'num_games_owned': 0, 'num_reviews': 67, 'playtime_forever': 2708, 'playtime_last_two_weeks': 0, 'playtime_at_review': 2595, 'last_played': 1702646895}",spanish,Bueno,1702605422,1702605422,True,0,0,0,0,True,False,False,True,,,
153598821,"{'steamid': '76561198126897107', 'num_games_owned': 418, 'num_reviews': 84, 'playtime_forever': 695, 'playtime_last_two_weeks': 0, 'playtime_at_review': 695, 'last_played': 1702587408}",russian,6/10,1702587462,1702587462,False,1,0,0.48571428656578064,0,True,False,False,True,,,
153488494,"{'steamid': '76561198224893772', 'num_games_owned': 178, 'num_reviews': 242, 'playtime_forever': 528, 'playtime_last_two_weeks': 0, 'playtime_at_review': 61, 'last_played': 1702856982}",english,"The trailers of this game do not do it justice, its humor is a rare breed. This game has perfect humor, and is truly the best example of ""they don't make games like this anymore"".

Ivan just doesn't miss, this game is a certified hidden gem, thank you brother for always sharing with me the most banger games I have ever played.

Andrew Tate vs Shlatt, who wins?",1702443866,1710998676,True,1,1,0.421092331409454346,1,False,False,False,True,,,
153482499,"{'steamid': '76561199050763976', 'num_games_owned': 0, 'num_reviews': 28, 'playtime_forever': 991, 'playtime_last_two_weeks': 0, 'playtime_at_review': 991, 'last_played': 1687310568}",english,disappointed,1702434616,1702434616,False,0,1,0.476190477609634399,0,False,False,False,True,,,
153464468,"{'steamid': '76561197974214527', 'num_games_owned': 509, 'num_reviews': 29, 'playtime_forever': 360, 'playtime_last_two_weeks': 0, 'playtime_at_review': 360, 'last_played': 1702410478}",polish,"W skrócie, spoko rozwałka za mniej niż 20 zł.
Styl wizualny jest ok, kampania krótka, łatwa w odbiorze - idealna gra na jeden - dwa wieczory gdy chorujesz :)",1702410655,1702410655,True,0,0,0,0,True,False,False,True,,,
153451471,"{'steamid': '76561198250142976', 'num_games_owned': 202, 'num_reviews': 14, 'playtime_forever': 338, 'playtime_last_two_weeks': 0, 'playtime_at_review': 337, 'last_played': 1706821271}",english,"Amazing game, Extremely funny campaign although it's rather short so I would recommend getting it on a sale I got it for 5 bucks so almost free and I will say the money was well spent it is rather dated but it's a lot better than any other modern ""goofy"" fps single player game that I have tried",1702396677,1708893086,True,0,0,0,0,True,False,False,True,,,
