recommendationid,author,language,review,timestamp_created,timestamp_updated,voted_up,votes_up,votes_funny,weighted_vote_score,comment_count,steam_purchase,received_for_free,written_during_early_access,hidden_in_steam_china,steam_china_location,timestamp_dev_responded,developer_response
36647822,"{'steamid': '76561198321111777', 'num_games_owned': 0, 'num_reviews': 8, 'playtime_forever': 233, 'playtime_last_two_weeks': 0, 'playtime_at_review': 233, 'last_played': 1511190633}",schinese,"[spoiler]我带着十分沮丧的心情撰写这份评测，因为我在二十分钟前还在努力突破我那最后剩下的三个SpeedRun成绩（2-6、6-2、1-7）但是我没能做到[/spoiler]
[h1]7/10 可以一试的游戏[/h1]
十分可口的小游戏，画风很可爱[strike]（明明是救世天父的主题XDDDD）[/strike]
小王子Christie收到了自己老爹的求救信，踏上拯救[spoiler]可怜的[/spoiler]教皇国的旅途。路上他将和一大群酸夜怪物、触手怪、邪眼、[strike]菊花怪[/strike]、[strike]名字叫Dragon的超大号螃蟹[/strike]、[strike]头上被打洞的老爹[/strike]、[spoiler]特别记仇还长触手的[/spoiler]大怪物心脏：还会遇见[spoiler]使用云朵（史莱姆？）墙和自带上升气流的[/spoiler]小巫女Belle和[spoiler]整天拖着舌头含着毒液挥舞着匕首的[/spoiler]小怪物Jackie，使用各种[spoiler]强无敌的[/spoiler]武器和这些克总的小弟战斗。
游戏很可爱，但是[b]优化一点都不可爱...[/b]不知道为什么我的爱妻1070却只能[b]三四十帧...[/b]不过习惯了手感之后倒也无所谓。
具有一定难度但也不是核心向，普通的玩家在合理使用武器的情况下也可以比较轻松的完成流程和达到一些成就...还可以挑战一下那个十分可怕的排行榜。
BGM风格很棒，吉他和笛子（？）的轻快搭配让小王子的旅途一点点呈现在我们的视野中（但是最后面的BGM真是精污啊。。）各种武器特点也鲜明[spoiler]（吐槽一下光线枪和mini gun好了...为什么会有这种武器啦喂？？）[/spoiler]
总体来说是个质量很不错的小品游戏！推荐各位打折的时候购入哦！[spoiler]喜加一[/spoiler]",1511191530,1511191658,True,3,0,0.566929101943969727,0,True,False,False,False,,,
36525493,"{'steamid': '76561198136950908', 'num_games_owned': 0, 'num_reviews': 42, 'playtime_forever': 200, 'playtime_last_two_weeks': 0, 'playtime_at_review': 200, 'last_played': 1510724214}",japanese,"面白いです。主人公の赤ずきんちゃんも可愛くてグット！
箱コンでプレイできました。直感的なプレイ、短時間で終わるゲームでステージ、ボス戦一つ一つが難易度高め。初見ではですが。リスタートも早くつい何度も挑んでしまう。苦労したあとのクリアの達成感は格別。
慣れてきたらアンロックされたキャラ、武器でタイムアタックしてみましょう！二度楽しめるね！",1510724626,1510724626,True,1,0,0.53125,0,False,False,False,False,,,
35094937,"{'steamid': '76561198216413492', 'num_games_owned': 4327, 'num_reviews': 302, 'playtime_forever': 231, 'playtime_last_two_weeks': 0, 'playtime_at_review': 231, 'last_played': 1502633610}",english,⠀,1505955978,1505955978,True,1,0,0.309828579425811768,0,False,False,False,False,,,
35093106,"{'steamid': '76561198129936651', 'num_games_owned': 0, 'num_reviews': 477, 'playtime_forever': 123, 'playtime_last_two_weeks': 0, 'playtime_at_review': 123, 'last_played': 1505939572}",english,"Eldritch Hunter is a unique game but that does not mean it’s good. Okay, now for the story.

You play as a young girl who’s town be taken by Lovecraft monsters and you must stop them.

Now what I liked about the game.

Liked the cute art. That’s about it.

Now what, I did not like about the game.

One: A lot of the times it felt unfair, like with enemies and bosses.

Two: the story, there is barely one I mean you can make a good parody of Lovecraft stories and his monsters. But this, it feels like it just wasted a lot of time, I mean I am not asking for an epic story but what I am asking for is a little story.

So I say don’t get this game there are a lot better games, that do a good parody of Lovecraft out there.
",1505946392,1505946392,False,7,0,0.563709855079650879,0,True,False,False,False,,,
34840650,"{'steamid': '76561198019030910', 'num_games_owned': 455, 'num_reviews': 94, 'playtime_forever': 173, 'playtime_last_two_weeks': 0, 'playtime_at_review': 164, 'last_played': 1507370390}",tchinese,"6/10   

整體來說還算不錯的遊戲，單純通關難度普通(尾王難了一點)

對非手殘黨及不拿A評價、成就來說。

挑戰成就的話，先把人物&武器全刷出來吧

你會了解難易度的落差有多大...

這遊戲缺點:

東西(敵人&子彈過多)會很頓，不過我倒覺得還好

畢竟相當於送你的子彈時間，算是給反應較差的多點反應時間

關卡難的主要是部分討人厭的死亡殘留攻擊，與追蹤、穿牆的敵人(子彈)

當然也有些小BUG，部分武器在關卡中切換會無法攻擊

換完武器圖像沒變，但是攻擊卻換了等等

必須是進場前就先換好，或是換武器後RE才會正常。

優點:

你都買了還問我優點?

什麼!?沒買?那優點對你來說跟沒有是一樣的。",1504972785,1504972785,True,1,0,0.530386745929718018,0,False,False,False,False,,,
34750556,"{'steamid': '76561198171033130', 'num_games_owned': 456, 'num_reviews': 375, 'playtime_forever': 122, 'playtime_last_two_weeks': 0, 'playtime_at_review': 122, 'last_played': 1504589665}",english,"That was probably the worst two hours of my life. I'm not even remotely joking, the amount of genuine frustration at trying to just play this piece of utter swill is unbelievable.

Explaining how unfair, obnoxious, arbitrary, unenjoyable and stupid the difficulty of this game is in depth, it's beneath contempt. Play it, you will find out. It is not worth justifying a fact. But here's a metaphor. Playing this game, is like going out to the shore with a piece of paper, standing out in the water while holding it up infront of you; and challenging yourself to hold back the morning tide using only that piece of paper. That's what it feels like to play this game, it feels like a meaningless trial that is in every way bent against you and is not actually possible theoretically. And the only reason why you're doing it, is because you paid to be here, and the only reason you succeed, is due to a fluke.

This could have been a nice, solid little indie game if the developer didn't make it painful to play. The game beside being completely based on trial and error mixed with random chance; it demands more dexterity and environmental awareness then a human can functionally give. You have two eyes, pay attention to five completely different projectile sources, get hit by one, restart.


There used to be a rant here about how toxic the developer is and how he does not deserve to be able to release creations to the public because of how straight up poisonous they are. But it's not here anymore to reduce the risk of moderation.

This is hands down, the most unenjoyable game I have ever played. It should not exist, the buffoon who made this should not be a game developer.",1504591303,1504635701,False,6,0,0.426362663507461548,0,False,False,False,False,,,
34497582,"{'steamid': '76561198211285584', 'num_games_owned': 0, 'num_reviews': 4, 'playtime_forever': 208, 'playtime_last_two_weeks': 0, 'playtime_at_review': 208, 'last_played': 1503727366}",english,"
Great game but really hard. This game uses the keyboard to move and mouse to use your weapon. Because of this, you'll end up with a cramp as this game is difficult.  It starts off easy enough but it doesn't take long before it gets hard. I was nearly screaming from the difficulty of some of the puzzles as the enemies swarm you relentlessly. I swear, the puzzles were designed to give you a disadvantage as you have to get the timing of everything right. From the exact position of the enemy to the exact spot where you must fire your weapon, some puzzles require you to be in rhythm at the exact second to have a chance. It's that hard.

Yet, regardless of all that, I beat the game in 3 and a half hours. My left hand hurts like heck but I beat the game nonetheless so it's not all that bad.

I'd say it's a great game. Good graphics, nice soundtrack, decent story, easy to understand controls, you can even use a controller but I didn't had one that was compatible. If you do have a controller, I suggest you use it because your hand will hurt after dying over and over again.",1503727913,1503727913,True,1,0,0,0,True,False,False,False,,,
31224807,"{'steamid': '76561198135143088', 'num_games_owned': 630, 'num_reviews': 447, 'playtime_forever': 77, 'playtime_last_two_weeks': 0, 'playtime_at_review': 77, 'last_played': 1492544128}",english,Frustrating and unrewarding.,1492544001,1492544001,False,14,1,0.37947314977645874,0,True,False,False,False,,,
29660068,"{'steamid': '76561198009322999', 'num_games_owned': 630, 'num_reviews': 45, 'playtime_forever': 547, 'playtime_last_two_weeks': 0, 'playtime_at_review': 527, 'last_played': 1527334898}",russian,"
[h1] Eldritch Hunter — это хардкорный 2D платформер. [/h1]
Ваш герой в алом плаще инквизитора должен пройти 5 зон, наполненных ужасающими тварями, будто сошедшими с иллюстраций к рассказам Говарда Филлипса Лавкрафта. А после откроется и шестая, последняя.

В каждой зоне 7 уровней, а в конце вас ждет главарь. Игра далеко не простая. Некоторые уровни проходятся за несколько секунд, другие тоже можно пройти за считанные десятки секунд, но они займут гораздо больше времени. Так как вас будут убивать. И не раз.
В конце каждого уровня инквизитора ждет тварь в желтом наряде. Наверное, это местные аватары самого главного босса. Он просто стоит и ждет, но чтобы подобраться к нему и убить, подчас инквизитору нужно исполнить несколько акробатических этюдов с большим риском для своей жизни и ваших несчастных пальцев.

При этом игра Eldritch Hunter заточена под спидраны, т.е. чем быстрее прошел уровень, тем лучше. После пробегания локации вам показывают результат. Если совсем медленно прошли, вам не начислят опыта. А если быстро, то вам покажут ранг — C, B или A, что будет совсем неплохо. И, в зависимости от ранга, вам будет начислен опыт, который отображается в виде шкалы. По заполнении шкалы полностью вам откроется новое оружие, которое, как правило, существенно облегчит дальнейшее прохождение и позволит поставить новые рекорды скорости на уже пройденных этапах.

Полный обзор здесь: http://gamin.me/posts/18321

Прохождение игры: https://www.youtube.com/watch?v=MtLYUyCBRaE

",1486084399,1486084399,True,12,0,0.655932486057281494,0,True,False,False,False,,,
29606744,"{'steamid': '76561198010662114', 'num_games_owned': 0, 'num_reviews': 6, 'playtime_forever': 472, 'playtime_last_two_weeks': 0, 'playtime_at_review': 230, 'last_played': 1489783507}",english,"As far as $5 games go, Eldritch Hunter is everything I could ask for; a game that takes some very fundamental mechanics and executes them excellently, steadily introducing more and more challenging maps in the process that steadily test your approach to the game. It's not a game that I'd ever consider ""difficult"" in the way that games that you have to work at for hours to master are difficult, but its level design is constantly requiring new approaches and exploration of the tools you have. It's a few hours of solid action platforming delivered in bite-sized tactical chunks that play out perfectly for what they're meant to be. At its price point, Eldritch Hunter one of the more engaging and slickly put together games I've played in a while.",1485873449,1485873449,True,18,11,0.727473616600036621,0,True,False,False,False,,,
29580822,"{'steamid': '76561198215928547', 'num_games_owned': 0, 'num_reviews': 37, 'playtime_forever': 1002, 'playtime_last_two_weeks': 0, 'playtime_at_review': 790, 'last_played': 1492182344}",schinese,"一周目还是先通关，不要去挑战A评价，辛辛苦苦极限操作通关要10秒，换把武器直接1秒过关，所以等集齐所有武器和人物后再挑战A评价或时间，每个关卡或许都有最合适的人物和武器，而且过关中切换武器也是必不可少的，可能这是这个游戏的玩点吧
游戏的操作感我并不喜欢，轻飘飘的
还有每次打开游戏都要重新设置键位，最终boss还有bug？血条空了居然往左边负增长，后边把设置显血关了倒是顺利通关了",1485761786,1485761786,True,5,0,0.58100438117980957,0,True,False,False,False,,,
29578751,"{'steamid': '76561198314884344', 'num_games_owned': 50, 'num_reviews': 2, 'playtime_forever': 36, 'playtime_last_two_weeks': 0, 'playtime_at_review': 36, 'last_played': 1485833689}",schinese,手残党不要玩了....好难啊！,1485749811,1485749811,True,1,0,0.511568129062652588,0,True,False,False,False,,,
29560394,"{'steamid': '76561198038892067', 'num_games_owned': 3925, 'num_reviews': 66, 'playtime_forever': 23, 'playtime_last_two_weeks': 0, 'playtime_at_review': 23, 'last_played': 1485628225}",english,"Sometimes i write a review to praise a game i liked very much.
Sometimes i write a review to bash a game i hated very much.
With this in mind i come to the conclusion its quite rare i write a review to help fellow gamers make a decision....which should be the main reason someone writes a review.
Then im wondering whats the point of writing a review on Steam anymore? Everybody can buy the game, try it and refund if they dont like, so whats the point of a player review? None whatsoever...but i like doing things for no reason, especially when i wake up at 3am and cant sleep anymore :P

Eldritch Hunter is a hectic puzzle action/platformer based on pattern learning with a very unforgiving difficulty curve. 
Bought the game because i liked the art style and because i like platformers, but this is not a platformer at all.
Basically all levels i played were 1-2 screens large (so nowhere to roam and nothing to explore)  and required some platforming skills, coordination, reflexes and....drums rolling....thinking....because at the heart of this game is solving difficult situations, therefore solving puzzles of different kinds, timing puzzles, control puzzles, platforming puzzles, shooting puzzles, positional puzzles...you name it.

For people looking for an action-platformer with original graphics (like this game seems to be)....look elsewhere, this is not what you get here.

This game is for people looking for a challenge, solving reflex-based puzzles in a quest for the best time.
There is very good quality stuff on offer here, its one of the best puzzle/pattern-learning/difficulty-based games ive seen.
Personally i hate this kind of games, but despite this fact, i cant help but recommend this game because there is no denying it does exceptionally well what it sets out to do, and thats a quality very few games have.",1485683718,1485683718,True,34,4,0.629067599773406982,0,True,False,False,False,,,
29554339,"{'steamid': '76561198067713488', 'num_games_owned': 0, 'num_reviews': 38, 'playtime_forever': 289, 'playtime_last_two_weeks': 0, 'playtime_at_review': 289, 'last_played': 1489851985}",japanese,"6ボタンマウスとキーボードを使用。
ステージに映る死体や敵モンスターはグロテスクだが
イベントシーンのイラストはほのぼのとしてかわいらしい。
会話はほとんどなく英語を読まなくても楽しめた。

何度か死んでステージを覚えながら攻略ルートを探し、
できるだけ早いクリアを目指す2Dアクションゲーム。
1ステージのクリア時間は30秒もないことが多い。
武器はクリア時の評価によってアンロックされていく。
普通に攻略していけば終盤には全て使えるようになるだろう。


操作は現状マウスとキーボードのみ。
XBOXコントローラーは使えなかった。
設定の変更はマップの歯車を押せばできる。
ウィンドウモードとフルスクリーンの切り替えはF11。

武器切り替えはキーボード上部の数字キーとマウスホイール。
キー変更はできないので6ボタンマウスなどを設定しないと
武器を切り替えながらステージを攻略するのは若干厳しい。

初期キャラ以外のキャラが使えるようになるのは終盤になる。
最速を目指さなければステージに合った武器1種と
初期キャラのローリング回避スキルで十分攻略できるが、
少々もったいない部分に感じる。


設定の変更に不便さを感じる部分はあるが、
イベントシーンのかわいいイラストに
ちょうどよい難易度のステージ、
ボス戦も楽しめる出来だった。
価格も安く、短いながらもよく纏まっているので
十分満足できたゲーム。

*ボス戦でボスの体力バーがおかしくなり
その後ボスが消えて倒せない時があった。
バグかもしれないが、各ステージのクリア評価を上げてから
もう一度挑んだら普通に倒せたので
そういう仕様だったのかもしれない。",1485654511,1490335900,True,11,0,0.634837329387664795,0,True,False,False,False,,,
29548312,"{'steamid': '76561197991895839', 'num_games_owned': 0, 'num_reviews': 17, 'playtime_forever': 244, 'playtime_last_two_weeks': 0, 'playtime_at_review': 244, 'last_played': 1486173431}",english,"A clever little action-puzzle platformer about a little girl shooting at tenacles and slimy things with dungeon punk style guns. I've been really looking forward to this one, and I was thankfully not let down.

Add this one to my cute but devious category, This game has a cute, cupcakey hand-painted character look, but has some very tricky gameplay segments that test your tactical planning as much as your reflexes.

In this game, you go room by room, level by level, clearing out enemies and making your way to shoot the evil priest, which is the target of every stage. However, this game is not a Contra-esque action shooter, but more of an action puzzle. Many enemies are traps that leave behind obstacles or fire hard to avoid missiles when killed, and if you go in guns blazing you can end up boxing yourself in. The game also makes copious use of pest-spawning flesh creatures that make being accurate and choosing good footing to advance with important to not getting bowled over by an endless steam of worms.

This is one of the areas where the game does alright. The different weapons all have their uses, while still being adaptable enough to allow the player something of a favorite playstile. For example, the basic crossbow has enough damage and fire rate to swiftly mow down a swarm of pests, but it is a bit more deliberate against larger enemies or spawner nests. A shotgun blast can scatter groups of small creatures and punish big ones, but it's not the best for driving off an advancing swarm with its slow rate of fire. The fire bow can lock down a spawner or enemy bottleneck, wreathing anything that comes at you in flames, but it is less effective for attacking or hitting moving targets.

It's all pretty cleverly done, and the game never runs out of tricks. There are only about ten unique enemies or so, but it's paced out that even in the later stages you'll encounter new threats and still see previous enemies being used in sinister new ways, as well as getting new weapons and finding new ways to purge.

I don't entirely agree with the scoring system though; especially for a game as short as this. You are rated on time and time only, so the faster you stake the priest, the more medals and weapons you unlock, which can make getting better times on harder levels easier. I feel like the game shines most when you are playing to completion though, taking on each enemy as it's own obstacle and enjoying the challenge of clearing the board as opposed to rushing.

The game is short, but sweet. It can be cleared in under two hours if you are quick. Still, it's got pretty solid core design and I don't think I was cheated for only four dollars.

Overall: It's a nice little adventure with a cute protagonist and some fairly serious challenges. Recommended for classic hardcore arcade fans. If you find yourself longing for some challenging 2D action or are a fan of the old lovecraftian setting, this one is a nice little nut for you to crack.",1485631177,1485631360,True,9,0,0.599093616008758545,0,True,False,False,False,,,
29533496,"{'steamid': '76561198032539577', 'num_games_owned': 0, 'num_reviews': 15, 'playtime_forever': 96, 'playtime_last_two_weeks': 0, 'playtime_at_review': 78, 'last_played': 1508426408}",english,"Eldritch Hunter is a seakily addictive platformer.
It manages to be difficult, without being cheap.
Every time I died I felt like it was my fault and not not because of the game.
That being said, there are some pretty difficult spots that will take MULTIPLE attempts to get through.
Despite being difficult, it takes the Super Meat Boy approach of throwing you right back in the action. Which negates any frustration coming from dying over and over again.

Music is very engaging and fits the setting well.

Highly recommended for the price.",1485576565,1485621961,True,8,0,0.538511037826538086,0,True,False,False,False,,,
