recommendationid,author,language,review,timestamp_created,timestamp_updated,voted_up,votes_up,votes_funny,weighted_vote_score,comment_count,steam_purchase,received_for_free,written_during_early_access,hidden_in_steam_china,steam_china_location,timestamp_dev_responded,developer_response
161092161,"{'steamid': '76561199382636875', 'num_games_owned': 605, 'num_reviews': 87, 'playtime_forever': 1296, 'playtime_last_two_weeks': 0, 'playtime_at_review': 669, 'last_played': 1711209285}",japanese,"魔神少女は前作をSwitch版で購入済み、PCでのゲーム環境が出来た事でsteamで2を購入。
前作のレビューはSwitch購入の為書けませんが、2と同様に私の中では良好です。

前作の押しが何とプレイアブルになったのは嬉しい。
プレイアブルってだけで凄いテンション上がるんですよ、おかげ様でルナティックにも挑戦したくなるってものです。
さてアクション初心者層への配慮ですが、難易度選択があるのは◎。
一番下の難易度でもラスボス辺りはそこそこ強いかもしれませんが、ショップ利用の強化やその他の強化手段もありますので、アクション初心者層でも粘れば完走出来ると思います。
そのような意味でアクション初心者にもオススメしたいゲーム。
純粋なアクションではなくSTGアクションな感じなので、ロックマンやメタスラみたいな「撃って敵を倒せ！」なアクションが好きだと尚相性◎。
不慣れなうちはインストール（パワーアップ）も難しい事考えず、完全オートでベリーベリーイージーで脳死プレイでOKだと思います。
慣れてきたらセミオートなりマニュアルなり、難易度を上げたりと自由にやってみましょう。

ある程度アクションは慣れてますが、ルナティックを初めてプレイしましたらボスが撃破出来ずあまりに硬すぎて笑いました……。
ファミコンロックマンみたいなボスの体力を想定しますと、比べ物にならない程硬すぎます。
各ボスに弱点があると言えども、1ボスも撃破出来ないうちは通常攻撃で遣り合うしかありません。
どうしても駄目でしたらショップや「その他の手段」で色々と底上げするしかなさそうなので、現在底上げを試みてルナティック完走に頑張ってます。
このように完全無理ゲーではなく、底上げ手段による救済処置が設けられているのは好印象。

ミニゲームのルディミカルは実績やアイテム収集でお世話になると思うのですが、BEMANIみたいな音ゲー経験者からみますと正直これは「音ゲーではない」と思いました。
ただ曲が流れているだけの目押しゲー、むしろ曲が無い方が集中しやすいまである……率直な感想です。
ボタンタイミングが音ゲーとして考慮されているものではなく、更に私のやり方が悪いのか仕様なのかシビアなのか、短間隔での3～4連打辺りが来ると高確率で最後の1打が反応せずミスになります。
空打ちするときちんと連打でも入るっぽいですが、いざ実践となると何故か連打で斬れません……私のやり方が悪いのでしょうか。

アクションゲームとしては比較的自由度も高く、初心者から熟練者まで楽しめそうで、前作ファンにはキャラ的な意味で嬉しい要素もあり、アフタートークも楽しめ、値段を考えましても十分な程の作品です。
もっと早くこのシリーズを知りたかったです、その部分だけが若干の後悔。",1711052751,1711052751,True,0,0,0,0,True,False,False,True,,,
158542354,"{'steamid': '76561199074801448', 'num_games_owned': 0, 'num_reviews': 4, 'playtime_forever': 3315, 'playtime_last_two_weeks': 10, 'playtime_at_review': 3219, 'last_played': 1711547348}",japanese,価格に対してクオリティとやりごたえがあまりにも素晴らしい。幅広い難易度選択により初心者でも楽しむことができる。そしてブラッドさんがとてつもなくあまりにもとんでもなく可愛い。,1708187079,1708188364,True,0,0,0,0,True,False,False,True,,,
154883011,"{'steamid': '76561199092915139', 'num_games_owned': 0, 'num_reviews': 41, 'playtime_forever': 294, 'playtime_last_two_weeks': 0, 'playtime_at_review': 294, 'last_played': 1703825852}",english,"demo'ed on the 3ds. thankfully a port was made for pc and i wish i could say the same for other games that ive loved the demo for on that console. 

anyway truly a game, dark witch was present",1704016286,1704016286,True,0,0,0,0,True,False,False,True,,,
153887918,"{'steamid': '76561199147605347', 'num_games_owned': 0, 'num_reviews': 2, 'playtime_forever': 1755, 'playtime_last_two_weeks': 0, 'playtime_at_review': 1028, 'last_played': 1710783313}",english,"The updated mechanics like having two attacks slots is a neat change for anyone who struggles with quick swapping like me, the bosses were fun and it feels rewarding to figure out how to manoeuvre around the attacks. Plus the optional talking cut scenes after beating stages adds a lot to the story and characters.",1702944340,1702944340,True,0,0,0,0,True,False,False,True,,,
152817011,"{'steamid': '76561197998844959', 'num_games_owned': 0, 'num_reviews': 28, 'playtime_forever': 310, 'playtime_last_two_weeks': 0, 'playtime_at_review': 310, 'last_played': 1508132251}",english,good game,1701623967,1701623967,True,0,0,0,0,True,False,False,True,,,
146063485,"{'steamid': '76561198272910691', 'num_games_owned': 0, 'num_reviews': 16, 'playtime_forever': 4619, 'playtime_last_two_weeks': 0, 'playtime_at_review': 4619, 'last_played': 1694353598}",german,"Es war eine wunderbare und fantastische Reise in die Welt von Zizou Olympia abgetaucht zu sein.

Das Charakterdesign ist großartig und wunderbar. 
Das Spielsystem ist super Hammer.
Der Soundtrack ist unglaublich göttlich.
Die Levels sind fantastisch.

Zizou & Sola lassen sich großartig spielen.^^

Ein mega starkes und niedliches 2D Abenteuer.",1694361009,1694361009,True,0,0,0,0,True,False,False,True,,,
142195659,"{'steamid': '76561199526700885', 'num_games_owned': 0, 'num_reviews': 5, 'playtime_forever': 536, 'playtime_last_two_weeks': 0, 'playtime_at_review': 536, 'last_played': 1689383659}",japanese,cute and good,1689509737,1689509737,True,0,0,0,0,True,False,False,True,,,
141850232,"{'steamid': '76561198064758614', 'num_games_owned': 537, 'num_reviews': 28, 'playtime_forever': 186, 'playtime_last_two_weeks': 0, 'playtime_at_review': 186, 'last_played': 1486231057}",english,gradius and mega man had a  very cute child,1689099711,1689099711,True,0,0,0,0,True,False,False,True,,,
138012032,"{'steamid': '76561199501608135', 'num_games_owned': 0, 'num_reviews': 2, 'playtime_forever': 435, 'playtime_last_two_weeks': 0, 'playtime_at_review': 435, 'last_played': 1683526641}",japanese,間違いなくシリーズ最高傑作！！！,1683571594,1683571594,True,0,0,0,0,True,False,False,True,,,
135736630,"{'steamid': '76561198313385846', 'num_games_owned': 0, 'num_reviews': 23, 'playtime_forever': 240, 'playtime_last_two_weeks': 0, 'playtime_at_review': 240, 'last_played': 1680179365}",japanese,色んな要素を考えなく入れたゲーム,1680180502,1680180502,False,0,0,0.434782594442367554,0,True,False,False,True,,,
130406493,"{'steamid': '76561198986349756', 'num_games_owned': 117, 'num_reviews': 10, 'playtime_forever': 1027, 'playtime_last_two_weeks': 0, 'playtime_at_review': 921, 'last_played': 1704058431}",english,Really fun and unique take on the megamun gameplay style. I missed my chance to play it on 3ds this was a nice game to play through. Short too! May have died a couple times to rockmun boss but had a really fun time with Zizou. (PS: The parry mechanic is cool),1673156373,1673156373,True,1,0,0,0,True,False,False,True,,,
127622637,"{'steamid': '76561198822373483', 'num_games_owned': 0, 'num_reviews': 4, 'playtime_forever': 107, 'playtime_last_two_weeks': 0, 'playtime_at_review': 107, 'last_played': 1669804949}",japanese,"攻撃手段が弾である故「敵の行動が判明する前に倒してしまう or 初見殺し」みたいなのばかりでかなりつまらない。
画面が狭いかったり敵の体力が極端に少ないが影響していると思う。ボスもゴリ押しでよくわからないまま倒せてしまって攻略という感じではない。

後半は理不尽な敵や配置が多くすごく不快。いや、元来アクションゲームとはそういう物なんだけど、他の多くのゲームと違い爽快感や攻略した達成感を感じない。物足りなさと理不尽さが同時に介在してる。

2D横スクロールアクションを探してる方にはTOMOMIというゲームのバランスが良くすごく面白かったのでそちらをおすすめする。",1669806049,1669806049,False,1,1,0.464891046285629272,0,True,False,False,True,,,
118427102,"{'steamid': '76561198043728918', 'num_games_owned': 0, 'num_reviews': 291, 'playtime_forever': 748, 'playtime_last_two_weeks': 0, 'playtime_at_review': 748, 'last_played': 1657235181}",english,"What an improvement.

	Like its predecessor, Dark Witch is a mix of Megaman and Gradius. You platform and shoot, whilst also gaining temporary upgrades that last the length of the stage for as long as you stay alive. Movement speed boost, increased damage output, expanded projectile trajectories, etc. 

	My issues with the first game were that the boss weapons used the same resource as your upgrades. So you had to decide whether to upgrade your character or use boss weaponry. That, and the upgrades were requirements rather than optional. So if you died at certain points you just made life that much harder. 

	Dark Witch 2 includes some simple changes that imrpove a lot. Weapons, including your basic buster, have their own separate ammo pool. This ammo pool constantly refills. Different weapons use different amounts of the pool, and all have a set requirement to shoot at least 1 bullet. So the beam uses the entire pool whilst your buster uses such a small amount it allows you to spam. It's ingenious and something all Megaman-like games should take note of.

	There's some trade-offs in the stage design. The upgrades are no longer requirements to pass the stages, but that's because the stages are much simpler in design. There's barely any variety between them, with many being straight paths with the ocassional bottomless pit. It's a definite downgrade, even if it alleviates the upgrade issue. The bosses are like-wise much easier than before, even if they finally move (previously they stayed perfectly in place throughout the fight). 

	Outside of stages you can upgrade your abilities permanently. Just as before, you can upgrade for more health, increased base damage on your buster, and more lives. It makes the game much easier without altering the difficulty level. Dark Witch 2 expands the system, by allowing boss weapon upgrades and unlocking new abilities to upgrade in-stage. So instead of your temporary upgrade being a hover, you can replace it with a dash. Instead of the damage boost, you can replace it with a guard. So next time you're in-stage, the potential temp upgrade is now that.

	The game is roughly twice as long as the first game. You can still speed through it, but it carries almost double the stages of the first one. My only problem is the grinding required for the permanent upgrades. The first few levels are easy enough, but later ones require grinding out either the boss rush or individual levels. It feels like artificial padding, but you can also argue that the upper tiers are harder to attain because they're optional and make the game easier. In other words, it shouldn't be too easy to make the game easy. 
	The first game had some issues in its game design that really dampened the entire package. Dark Witch 2 makes some simple changes that lift the entire package out of that pit. But the outcome is a game balanced more on the easier side. Whilst it may be a longer game, its easy enough that your playtime isn't drastically extended. Unless you grind out the permanent upgrades. Despite some of the trade-offs in difficulty its definitely a game that has improved over the first. So much so that I'd be willing to recommend it, unlike the first game.
	
	Inside System (the developer) would go on to remake the first game with game mechanic alterations. Primarily, the ammo pool change introduced in Dark Witch 2. This obviously isn't a review of that, but it goes to show how crucial the change is. From my understanding, the third game has difficulties in making its way onto Steam due to it being developed in tandem with another company. Hopefully it can get out of limbo, because I'm definitely looking forward to it. I wouldn't call Dark Witch 2 a monumental game in platforming history, but its certainly working its way into a solid franchise.",1657249863,1657249863,True,2,0,0.4212188720703125,0,True,False,False,False,,,
118246068,"{'steamid': '76561198208182288', 'num_games_owned': 560, 'num_reviews': 156, 'playtime_forever': 383, 'playtime_last_two_weeks': 0, 'playtime_at_review': 233, 'last_played': 1657518650}",schinese,感觉比一代容易了些，操控能力有了大幅提升，关卡数量增加了，前作的索拉在这一作里作为玩家角色，画风也和前作一样一如既往地可爱，非常推荐,1657009485,1657009485,True,1,0,0.52173912525177002,0,True,False,False,False,,,
110236511,"{'steamid': '76561198995693294', 'num_games_owned': 86, 'num_reviews': 43, 'playtime_forever': 644, 'playtime_last_two_weeks': 0, 'playtime_at_review': 191, 'last_played': 1690767924}",english,"NOTE: There may be spoilers of the game if you're about to read this. If you haven't completed the Main Story, Then you might get spoiled...

One hell of an awesome Shooter+Platformer game, There's 3 characters you can play as: ZIZOU OLYMPIA, SOLA, and RIVA. There are many new things that I really, REALLY, like about this game.
1. The Music
The Music is honestly one of my most favorite parts of a game, I'm a dude who loves listening to video game music when I am bored. and TLoDW2 has some good music for the game. 
2. The Extras, Designs, etc.
Once you beat the game for the first time as Zizou without cheats from Al's Shop, You can unlock things such as PLAYING LEVEL, SYEGA SHOP to where you can unlock new things to change up the game on a new save file! Things in the Syega Shop are Costumes for Zizou and Sola, Stat Bonuses, and more!
3. The Voices
The voices are honestly one of my favorite parts, Hearing the voices just sounds so good to me. I really liked how well the VAs did in this game.

Conclusion: A great game to buy if you're into Shooter Platformers. I love this game and I have been playing this game on my 3DS too! I'd say that this game is just... magnificent. And I really love the story and how cool the character designs are. And with the Syega Shop, you can perform awesome new things and make up some challenges to make the game harder!

Note: This is my first time writing an actual review btw lol

Psst, If ya made it to the end of this review... I am gonna give you a little secret code for somethin'...

If you press the L, R, L, R, L, L, R, R, and then the X keys... Something will happen, But I won't tell ya much! :)",1644858341,1644858341,True,1,0,0,0,True,False,False,False,,,
109779127,"{'steamid': '76561199013127958', 'num_games_owned': 0, 'num_reviews': 32, 'playtime_forever': 261, 'playtime_last_two_weeks': 0, 'playtime_at_review': 209, 'last_played': 1653039386}",koreana,다양한 미녀대장들과 전투를 이기고 기술습득하면서 진행하고  상점에서 여러가지를 사는게 최고였고 오래 운영해줬으면 좋겠다.,1644319853,1644319853,True,0,0,0,0,True,False,False,False,,,
104307881,"{'steamid': '76561199098156058', 'num_games_owned': 226, 'num_reviews': 97, 'playtime_forever': 1622, 'playtime_last_two_weeks': 0, 'playtime_at_review': 194, 'last_played': 1701576569}",schinese,太好玩了，如果可以移植到ns上就好了,1638006884,1638006884,True,0,0,0,0,True,False,False,False,,,
92816884,"{'steamid': '76561199030535959', 'num_games_owned': 233, 'num_reviews': 66, 'playtime_forever': 1143, 'playtime_last_two_weeks': 0, 'playtime_at_review': 86, 'last_played': 1680552689}",english,"After playing for about an hour and a half, I can safely say that NAN-A did a better job porting the game this time instead of saying “fuck it, lets just put a 3ds game on pc because why the hell not”
They added Extra content too. Sure the play coins are gone, but at least we have Riva! The game is still fun, extra content or not. The only issue is the sprites look a bit blurry blown up to 1080p, but the game looks nice.
As for the game itself, take what worked with Dark Witch 1 and turns that shit up to 1000. The game’s music is literally goddess tier, The platforming; while simple, is very fun. The shop is  expanded upon. This is BY FAR the best Dark Witch game. Totally recommend it, and it's overall my favorite game of all time. I even 100%ed it recently, and I had a blast.",1622314130,1659978127,True,1,0,0.487288117408752441,0,True,False,False,False,,,
92306134,"{'steamid': '76561198007792308', 'num_games_owned': 522, 'num_reviews': 89, 'playtime_forever': 393, 'playtime_last_two_weeks': 0, 'playtime_at_review': 49, 'last_played': 1705624740}",english,Zizou is too cute for this world. Legend of Dark Witch 3 PC when?,1621518565,1621518565,True,0,0,0.326064825057983398,2,True,False,False,False,,,
89877898,"{'steamid': '76561198839540681', 'num_games_owned': 33, 'num_reviews': 8, 'playtime_forever': 1430, 'playtime_last_two_weeks': 0, 'playtime_at_review': 583, 'last_played': 1672260343}",english,"I've felt like I haven't put enough information as to why this game is a great game, but after reviewing The Legend of Dark Witch on November 27th, 2022, I've felt like I should change this review too. I'm keeping The Legend of Dark Witch 2 as a Reccomend game because of:


The story. There's a nation on the west side of  The Old Islands named Germa. This Germa has been shown to have good research in Seyga, and they have a researching group feared upon many known as the Ich, consisting of the top researchers of the nation. Germa decided to cause some naughty actiivy by sending that said group to Liana, antoher nation although its in the west, to continue their research in private. This move immediately Alarms the protagonist of the prequel, Zizou Olympia, to go check up on this. She decides to defeat all members of the Ich and creates a plan to go inside of Germa and to stop whoever is behind all of the research. With the people she gotten help with (the 2nd tier of bosses Codino, Blad, Stoj, and Pelusa), shes manages to go to the castle and then she counters the one behind everything: Franzer V. 

As the first phase begins, Franzer starts off with a melee strat with her sword with some magic in between. However, when Zizou defeats her, she told her the reason behind everything and how nobody was able to cap a whole bunch of Seyga into a human body except for her. Then, she turnes into her awakened form and the second and final phase begins. Even after the power that she had, Zizou finishes her off, and then tells her to stop her meddling, calming and finishing Gerrma's research. 

This story perfects the prequel's story in every way possible. Instead of being a cliché plot about some girl stealing stuff, it expands on the world of Beatus (the universe takes place) and revolutionises it as a whole even more. This along with the game's soundtrack's names, perfectly evident the importance of the story (Reach for your Wish, the final boss is reaching Franzer's wishes for Germa to become the strongest nation in The Old Islands) giving this game props to the storytelling. 

How's the characters overall though? While the charactes have been shown to have a spike in personality, I still feel like the characters fit the classic anime style of characters. This is evidented with one's Like Icke, Pelusa, and Rudy. Their designs are fantastic though. But the charactes could be a bit worked on to make it a better experience. I can probably see why as most of the developers working on the game are males (NAN-A, the main Dev behind most of the games) and I feel like they don't know how females work really. This is just me, but the personalites of the characters in this series feel more generalised than anything. 

Now how about the gameplay. The gameplay completely takes what the first game had to offer on both the positive and the critical perspective and fix the mistakes right away. The bosses attacks you get from them have a special metre instead of using the Gradius slot bar, and you can choose between Comet and Line without once again, using the slot. The only thing you can use with the slot for the primary is attacks is by enhancing them (and I believe that comet and Punishment (the other shot unlocked in Papelne Trade) is broken as hell) and its a better addition than what the prequel had. The Level design has been nerfed to the ground though. The levels seem too easy, and you can probably finish the game in under thirty minutes. Not to mention Papelne trade; with that you can get Express, a better version of speed that makes you extremely fast. Makes the game too easy as a whole. I'd suggest playing the game on Expert to get a more casual experience (casual is Very x2 Easy without the extra things it has to offer). 

The charactes also got revenge attacks: last minute damaging moves that can be threatening (especially on Lunatic) But don't worry, you got one too. Hyper Dark Arm! (or Churros Scramble, or Princess Strike (only exclusive to this version though)) They're all convenient especially when finding a way to dodge the enemies' ones. My personal favorite is Icke's where she sends out a giant beam. 


The postgame is excellent too. Sola as a playable character has got to be the best choice INSIDE_SYSTEM has ever done. Not only she's broken as hell, but her story of her taking her Spring Break to find her parents takes dedication, and she's willing to go through the trouble to find them at the end of the game. I didn't really like how Zizou was once again the final boss and she almost works similar to what she's like against Riva in the first game, but I guess it sparks discussions whether or not Zizou is good or not. Riva as a playable character although she's a bit broken as well, she doesn't interact with the bosses nor even has an aftertalk with them. 

This game is how you perfect a prequel game and The Legend of Dark Witch 2 is a fantastic game. I'd recommend this game to anyone especially for casual gamers.",1617791539,1669578701,True,1,0,0,1,False,False,False,False,,,
86739099,"{'steamid': '76561198272714162', 'num_games_owned': 297, 'num_reviews': 29, 'playtime_forever': 2101, 'playtime_last_two_weeks': 0, 'playtime_at_review': 614, 'last_played': 1613918547}",schinese,角色很可爱，孩子很喜欢。难度不高，爱了爱了。,1613417213,1613417213,True,0,0,0,0,True,False,False,False,,,
84437936,"{'steamid': '76561199118802196', 'num_games_owned': 5, 'num_reviews': 2, 'playtime_forever': 1471, 'playtime_last_two_weeks': 0, 'playtime_at_review': 294, 'last_played': 1656749327}",english,this game is a sequel find out in the legend of dark witch 3! also... because of i found out secrets check it in community and find the guide,1610295218,1610378836,True,0,0,0,0,True,True,False,False,,,
80908065,"{'steamid': '76561198021278565', 'num_games_owned': 0, 'num_reviews': 143, 'playtime_forever': 1575, 'playtime_last_two_weeks': 0, 'playtime_at_review': 1411, 'last_played': 1606646253}",tchinese,"簡單評價：沒玩過前作的建議先去試試看上集，如果真的很喜歡再考慮買這隻。雖然這隻並沒有到爛遊戲的程度，但要說推不推薦實在是沒辦法推薦，畢竟Steam上要找好玩的Platformer特別是獨立小品有非常多選擇。

這Episode 2在量的方面名副其實是一代的強化版，無論是關卡數目、強化選項和收集要素都明顯比上集豐富。然而，在質的方面，個人認為上集的關卡和Boss設計都比這一集用心和好玩得多。本作作為Platform game關卡卻幾乎都是平地直路、敵人和機關的放置也顯得有點隨便、Boss的攻擊即使在最高難度也有很多是固定模式和可以定點安置的。種種要素雖然不是很大問題、也不會令遊戲沒法玩，但整體感覺就是不好玩，破關也沒有成功感，只有作業感。

另外不建議從Casual或以下難度開始遊戲，而是直接由Expert玩，真的有嚴重卡關才去調低難度。Casual以下難度的Boss HP簡直跟紙糊一樣，很多時候還沒摸清打法，就算所有招用臉硬接換血最後還是會贏，這種感覺在遊戲體驗上實在稱不上是有趣…",1606586132,1606586132,False,0,1,0,0,True,False,False,False,,,
78907452,"{'steamid': '76561198436418702', 'num_games_owned': 0, 'num_reviews': 10, 'playtime_forever': 514, 'playtime_last_two_weeks': 0, 'playtime_at_review': 420, 'last_played': 1620946226}",english,"good
",1604787398,1604787398,True,1,0,0,0,True,False,False,False,,,
