recommendationid,author,language,review,timestamp_created,timestamp_updated,voted_up,votes_up,votes_funny,weighted_vote_score,comment_count,steam_purchase,received_for_free,written_during_early_access,hidden_in_steam_china,steam_china_location,timestamp_dev_responded,developer_response
29378413,"{'steamid': '76561198054108630', 'num_games_owned': 0, 'num_reviews': 5, 'playtime_forever': 347, 'playtime_last_two_weeks': 0, 'playtime_at_review': 331, 'last_played': 1567260905}",english,"As with The Legend of Dark Witch 1, this plays like a mix between Gradius and classic Mega Man. Collect experience from defeating enemies and redeem them to power up your player character, to make them faster and stronger. This game was released on the Nintendo 3DS eshop and, like the first game, has been reworked for a PC release. I worked on the beta release of the game.

I enjoyed this game very much on the 3DS and I am very glad it made its way to Steam much like the first game. Dark Witch 2 is a huge improvement over the first game in many ways, feautring more customization, more stages, more bosses, and more playable characters, including the Steam-exclusive Riva. There are shops to buy items to help you in stages or increase your power. There is much, much more content than the first game.

Among the best changes to the gameplay are customizeable upgrade slots and a new ""ammunition"" bar for using your boss skills, so your experience is not depleted when you want to use boss weapons. This is a very welcomed change for those who became frustrated with the ammo system in the first game. Additionally, collecting 4 crystals per stage allows for the player to choose which attributes they want to upgrade, as opposed to getting very specific ones.

The sprite work is fluid and cute, and the music is fantastic.

I have put lots of time into this game on the 3DS version. If you enjoyed the first Legend of Dark Witch game, I very highly recommend this one.",1484929456,1484933421,True,7,1,0.387442052364349365,4,False,True,False,False,,,
29375294,"{'steamid': '76561198085333309', 'num_games_owned': 1463, 'num_reviews': 38, 'playtime_forever': 1388, 'playtime_last_two_weeks': 0, 'playtime_at_review': 622, 'last_played': 1485266147}",schinese,"游戏是个好游戏，但是不建议买，为啥比美元区价格还要高？
玩了一晚上来更新一下，相比一代完善不少，很多基本上是一代的升级版，洛克人的过关模式，沙罗曼蛇的升级系统，三目童子的商店模式，一些钻石在商店购买道具后也会很方便的找出，有一个地方需要升级boss技能才能撞破墙，另一个需要商店购买垫脚石，还有一个地方需要用穿墙的炮弹打出来，激光和自带的第三个招式都可以。
通关后，还是刷梭哈，另外加了个扭蛋解锁图鉴和类似osu节奏切西瓜的小游戏来刷纯晶石，打牌最效率。

虽然很好玩，但是卖这么贵就是不推荐。看看1代的价格再看看2代的价格。还不如省点钱去买其他游戏。",1484918520,1484932783,False,27,2,0.34130820631980896,10,True,False,False,False,,,
29373629,"{'steamid': '76561198002128919', 'num_games_owned': 373, 'num_reviews': 4, 'playtime_forever': 2951, 'playtime_last_two_weeks': 0, 'playtime_at_review': 2503, 'last_played': 1660297539}",english,"Edited due to popular demand.

The Legend of Dark Witch is a action series originally developed for the 3DS, but has been brought to Steam with HD artwork and redesigned UI to make everything fit into one window.
The gameplay is very similar to the clasic Megaman games. You jump, shoot, fight bosses and gain their powers.
There's another gimmick though. While fighting enemies they will release tiny butterflies called Tres, which builds up a meter at the bottom of the screen that you can consume for a temporary upgrade for that stage or until you die. It works just like the upgrades in the games Gradius.
There's also a shop where you can use your collected Tres to buy passive upgrades, to give yourself more life, attack power or extra lives.
Overall a very fun game. The music is great, the controls are very responsive and can be customized to your liking. 
My biggest issue with the game is that even though there's a lot more stages than the first game, they all have very similar design. Most of the stages are just a straight runway.",1484911891,1484944922,True,35,1,0.504279732704162598,11,False,True,False,False,,,
