recommendationid,author,language,review,timestamp_created,timestamp_updated,voted_up,votes_up,votes_funny,weighted_vote_score,comment_count,steam_purchase,received_for_free,written_during_early_access,hidden_in_steam_china,steam_china_location,timestamp_dev_responded,developer_response
74243104,"{'steamid': '76561198260605734', 'num_games_owned': 0, 'num_reviews': 183, 'playtime_forever': 302, 'playtime_last_two_weeks': 0, 'playtime_at_review': 145, 'last_played': 1607436345}",japanese,"敵キャラかわいい。
ゲームはロックマン（無印）
値段ふつう。
主人公地味。",1597329353,1605977024,True,0,1,0.476190477609634399,0,True,False,False,False,,,
72061141,"{'steamid': '76561198060622753', 'num_games_owned': 0, 'num_reviews': 24, 'playtime_forever': 1567, 'playtime_last_two_weeks': 0, 'playtime_at_review': 1501, 'last_played': 1641468258}",japanese,"魔神少女2は2Dの横スクロールアクションゲームです。

ステージ道中ではポイントを貯めて一時的なパワーアップを行います。
またステージ間では貯めたポイントで恒久的なパワーアップを行います。
ステージのボスを倒すと、その敵の技を覚えられます。
簡単に言うと「ロックマン」と「グラディウス」をミックスさせたようなシステムです。

キャラクターはとても可愛く、主人公も敵も非常に魅力的。
BGMも名曲ばかりで、私はサウンドトラックを購入して楽しんでいます。

難易度は前作に比べるとかなり楽になりました。
アクションゲームが苦手な方は少しずつパワーアップしてクリアを目指し、得意な方はタイムアタックを楽しまれるのが良いのだと思います。

希望する改善点としては、ノーマルショットが強力すぎて道中は他の武器に切り替える必要が無い点です。
ボスを倒すことで得られる武器が別のボスの弱点くらいしか使い道が無かったので、今後は道中でも色々な武器が生かせるステージ構成になっていれば、さらに面白くなるのではないでしょうか。",1593916429,1593916429,True,2,0,0.54356849193572998,0,True,False,False,False,,,
63888393,"{'steamid': '76561199015052301', 'num_games_owned': 0, 'num_reviews': 2, 'playtime_forever': 2386, 'playtime_last_two_weeks': 0, 'playtime_at_review': 1839, 'last_played': 1589318071}",english,Innovative platformer with likeable characters.,1582308184,1582308184,True,0,0,0,0,True,False,False,False,,,
58173421,"{'steamid': '76561198144842286', 'num_games_owned': 0, 'num_reviews': 25, 'playtime_forever': 2726, 'playtime_last_two_weeks': 0, 'playtime_at_review': 2480, 'last_played': 1600802319}",english,"A great sequel to a great game that changes everything that it needs to in order to make it even better. The OST is still the stuff of legends, and Dark Witch 2 is a really fun experience. 10/10",1574860188,1574860188,True,1,0,0,0,True,False,False,False,,,
54979234,"{'steamid': '76561198136938509', 'num_games_owned': 0, 'num_reviews': 219, 'playtime_forever': 441, 'playtime_last_two_weeks': 0, 'playtime_at_review': 237, 'last_played': 1604036134}",spanish,"un plataformero muy divertido, obviamente inspirado en la saga Megaman, pero ya en ésta segunda entrega comenzó a tomar más personalidad propia. Muy superior al primer título, más niveles, más personajes jugables, mini juegos, lo vale! El apartado gráfico es muy bello, un excelente pixel art en los escenarios y personajes. Y si quieres un reto tiene diferentes grados de dificultad.",1567715492,1567715492,True,0,0,0,0,True,False,False,False,,,
53946701,"{'steamid': '76561198079028361', 'num_games_owned': 0, 'num_reviews': 163, 'playtime_forever': 1049, 'playtime_last_two_weeks': 0, 'playtime_at_review': 609, 'last_played': 1659595647}",koreana,"전작의 시스템을 충실히 계승한데다 거기에 부가적인 요소가 추가되었다
추가요소가 좋은 방향으로 작용해 훨씬 즐길 수 있게 되었다
특히 루나틱모드에서 데미지를 입어도 강화게이지가 초기화되지 않는건 큰 변화
플레이는 록맨계열이지만 이 작품만의 개성이 더 두드러져서 독자적인 작품으로 인식하게 만들었다고 본다
전작에선 숨겨진 셰가를 찾아서 그걸로 스킬을 강화하는 방식이었다면 
이번엔 숨겨진 셰가를 찾아내면 그걸 비용의 하나로서 지불해 스킬을 추가로 얻거나 
강화하는 방식
덕분에 스킬강화의 자유도가 올라갔다
전작과 비교해 좀 복잡해졌으므로 익숙해지기까지는 시간이 걸릴지도 모르겠지만 익숙해지면 전작보다 더 즐길 수 있다
전작에서 후속작까지 불과 1년밖에 걸리지 않았다는게 믿어지지 않을 정도
캐릭터들의 복장도 전작에 비해 이뻐지고 귀여워졌다

마신소녀시리즈가 2편에서 작품만의 개성을 확립한 느낌
3편도 3DS 로는 이미 발매됐는데 스팀으로도 내줬으면 한다",1562533339,1562534085,True,1,0,0.523809552192687988,0,True,False,False,False,,,
53641583,"{'steamid': '76561198038776903', 'num_games_owned': 7260, 'num_reviews': 3814, 'playtime_forever': 429, 'playtime_last_two_weeks': 0, 'playtime_at_review': 429, 'last_played': 1553069746}",schinese,风格可爱，手感流畅，元素丰富，价格公道。,1562322260,1562322260,True,10,0,0.206602230668067932,0,False,False,False,False,,,
52642585,"{'steamid': '76561198409094000', 'num_games_owned': 0, 'num_reviews': 28, 'playtime_forever': 1155, 'playtime_last_two_weeks': 0, 'playtime_at_review': 1134, 'last_played': 1564273302}",spanish,AAAA ESTA RE WENO,1561934091,1561934091,True,3,0,0.498330563306808472,0,True,False,False,False,,,
50510538,"{'steamid': '76561198843260183', 'num_games_owned': 0, 'num_reviews': 39, 'playtime_forever': 1122, 'playtime_last_two_weeks': 0, 'playtime_at_review': 1122, 'last_played': 1557128024}",japanese,"難易度は前作より簡単に作られている(敵のモーションなど)。ショップ機能を使えば誰でもクリアできる作りになっている。だがショップ機能を使わないなど縛りを入れれば一気に鬼畜難易度に変わるのでヌルゲー嫌いな人でも満足のいく作りになっていて楽しめると思います。やりこみ要素もあり、これで1000円しないとか安すぎる。

次回作が3dsで出ているので早くすSteaｍに出してほしいです。発売日にすぐ買います。",1557143927,1557143927,True,0,0,0.431836962699890137,0,True,False,False,False,,,
48831474,"{'steamid': '76561198119723948', 'num_games_owned': 208, 'num_reviews': 27, 'playtime_forever': 1934, 'playtime_last_two_weeks': 0, 'playtime_at_review': 807, 'last_played': 1653993571}",english,"i love playing all 3 dark witch games on 3ds, its fun to get all achievements and 100% the games on 3ds 
i might 100% the game again but on pc",1549570883,1549570883,True,0,0,0,0,True,False,False,False,,,
48456601,"{'steamid': '76561198149437416', 'num_games_owned': 1182, 'num_reviews': 589, 'playtime_forever': 2476, 'playtime_last_two_weeks': 0, 'playtime_at_review': 241, 'last_played': 1649324082}",english,"THE LEGEND OF DARK WITCH 2 is a steam videogame featuring hypoallergenic
washable graphics that cutaway the megaman chaining preference!

Just like the first additional one that is a overall really good game with a few issues!
But this one actually has requested leveling up system that makes this game
fun and easily accessible to a fine opportunity degree!!!

Firstly the soundtrack kicks battery-powered skinned butt with a claptrap
of booming sensational dancing beats that is both hothead and energetic
forever in my tangling soul!!!

The gameplay is a generic gradius twisted nonelectric pedal that is paved with
great enertaining flapsided dashing parts that are cranky and engaging!!!

The graphics are well velvet bunny noises of stash keys that snuggle a beautiful partial game
that never gets the wrapping justice!!!

The sound effects are typical just like a standard agave spiritual attempt
that makes the girl characters alive and present!!!

Its just like megaman clone but a closure to be better in some regards!!!

The bosses are hidden compartments of great difficult chamber challenges that
throw you off to think more clearly!

For what i played in this game since im just going to speed the tempo on this review up!
It is way better then the first one by a bag schelepping boner charming my mind
into creative galaxies of this so called witch service!

I give this game a top high roller score a 10/10 pick it up and if its on sale!
Just go to the shop and upgrade to not be frustrated so everybody can enjoy this
finemanship masterpiece love the burrito master!!!
",1548056516,1548056516,True,0,0,0.438218414783477783,0,True,False,False,False,,,
47832756,"{'steamid': '76561198817597644', 'num_games_owned': 0, 'num_reviews': 683, 'playtime_forever': 335, 'playtime_last_two_weeks': 0, 'playtime_at_review': 335, 'last_played': 1544700048}",english,"""A great sequel to The Legend Of Dark Witch Series."" (by [url=store.steampowered.com/curator/33855818/]Nyanco Curator[/url])

[h1]Review[/h1] 

The Legend of Dark Witch 2. Everything is improved compared to the previous series. Best of all, this game is designed for beginners to easily adapt to the game and enjoy the gameplay itself. Of course, the game is still challenging and exciting. More stages and stories are complemented. This game properly blended the advantages of Gradius and MegaMan. Basically, the gameplay time per level can be rather short, but the replay value is high. Sometimes a grinding process may be required to practice advanced skills, but in some cases such a play would be its own pleasure. It has a lot of content to enjoy. If you find this game, try it without any hesitation. This developer has great potential and talent. We really look forward to its another sequel project. Highly Recommended! 

[table]
[td][b]Pros[/b][list]
[*] Platformer + RPG System + Overall Improved
[*] Great pixel art and adorable characters
[*] Interesting mini-games(Rhythm/Poker/Etc)
[/list][/td]
[td][b]Cons[/b][list]
[*] The English font is not neat.
[*] Gameplay per level is rather short.
[*] Camera work seems to be a little slow.
[/list][/td]
[/table]

[u]Score: 8.5/10[/u]

* Nyanco Channel (Steam Curator) ヽ(=^･ω･^=)丿
https://store.steampowered.com/curator/33855818/",1545824920,1545825198,True,11,0,0.235158517956733704,0,False,False,False,False,,,
45694959,"{'steamid': '76561198052880366', 'num_games_owned': 372, 'num_reviews': 97, 'playtime_forever': 1999, 'playtime_last_two_weeks': 0, 'playtime_at_review': 1978, 'last_played': 1541644311}",english,"Overall The Legend of Dark Witch 2 has improved in many points

- more stages (total 13)
- better response in controls
- easier to gain synga
- more option to modified the game
- character stats can be improved more and items can be bought in a shop with Tres, what you gain by killing eniemies
- more minigames (Poker, ""Dots"" Gatcha, Rudy Rythm"")

In general you can say you have more option to make the game easier for you in all difficulty levels because of this his game is much easier to finish as part 1 but it`s still challenging.

The graphics remain in a lovely pixel animation style like in part 1. All enemies and background are fully animeted an uniq.

Music and Sound effects are lovely like in part 1.

If you like part 1 or find it to diffuicult, you maybe can take a look into this one. If you new the the series it is a good starting point to get a taste for it.",1541645165,1541645165,True,0,0,0,0,True,False,False,False,,,
40547741,"{'steamid': '76561198057219226', 'num_games_owned': 1390, 'num_reviews': 143, 'playtime_forever': 3805, 'playtime_last_two_weeks': 0, 'playtime_at_review': 3102, 'last_played': 1529536250}",english,"Improves all of the aspects from the First game and is therefore pretty much (one of) the best platformers on Steam. 

The first game suffered quite much from its Nintendo 3DS origins. Luckily this time the game doesn't feel like all characters were crammed into a very small screen which results much more smooth gameplay. 

If I were to nitpick about something it would be the difficulty that is considerable easier than it was in the first part of the series. I don't miss all those pits or suddenly appearing enemies but cute bosses have somewhat lost their charm because of the easier difficulty. In the first game bosses either required multiple lives to find out barely survivable strategy or upgraded technical skill that was their weakness. This time I accidentally beat most of the bosses in (so-called) expert mode with normal shot on first or second try. In the first game utilizing weaknesses felt like strangely satisfying cheating after failing multiple times with normal shot but now just beating bosses makes me have guilty conscience.

Later Thoughts: Replay-value of the game is huge thanks versatility of gameplay. There are two (and half) characters to play that differ considerably but what really adds that replay-value is the shop system. There are the normal shops that sell stuff for current playthrough and ""cheat-shop"" that can be used to alter characters initial parameters. Beating the game even on the hardest difficulty isn't exactly very hard because you can farm currency and quite buy ease. The real difficulty of the game is to understand all those (stupid) things you can do with shop-system and how to tailor your playthrough. For example: like in most of the megamanesque games, all the sub-weapons/technical skills are used extremely little. However with cheat shop its possible to get enough initial currency to fully upgrade your (least) favourite technical skill which gives incentive to put it into main weapon slot. Sliding through the game and enemies (and into pits) is very different  experience compared to just shooting things with standard shot.",1520118257,1520606924,True,1,0,0,1,True,False,False,False,,,
39510018,"{'steamid': '76561198034306697', 'num_games_owned': 1401, 'num_reviews': 617, 'playtime_forever': 2036, 'playtime_last_two_weeks': 0, 'playtime_at_review': 2036, 'last_played': 1516536580}",english,"[b]A sequel to a short 2D platformer about a goddess.[/b]
The gameplay is almost exactly the same as the [url=http://steamcommunity.com/id/Anitude/recommended/420770]previous title[/url], only a little bigger and more polished. This means that the parrying, on-site upgrade system, and the Megaman-esque gameplay aspects are all still here unchanged.

While playable on it, keyboard controls are only slightly better supported. Instead of being able to rebind keys to actions, you can only bind the actions to the keys on the screen. For example, you can't assign space bar or another key to ""Jump"", you have to assign the ""Jump"" action to one of the 9 keys that you can only assign to. The same deal is with controllers as well, you can only assign actions to buttons. 
DualShock 4 controllers are natively supported, but if you're using DS4Windows or maybe something else similar, the controls in-game get weird.

Just like the first game, it's simplistic with its run-n-shoot mechanics. You can shoot almost as fast as you press the button and there's a recharging ""Capacity"" bar that drains each time you attack with anything so you're discouraged from spamming attacks. This was here before, only now this applies to your default attacks as well to prevent the endless, unnecessary spamming.

The screen is still a bit small and constantly running forward without a bit of caution can still be consequential, though less so than the first game, and the camera still moves pretty slowly when turning around. You can still change the camera speed and positions, but it's all as slow as before when it moves.
Because of the lighter punishment in running forward without caution, the game overall can be pretty easy; it's possible to run to the end of most levels without stopping if you know when to jump, shoot, and upgrade, or if you just react fast enough.

There are more stages than in the previous game and they can be cleared pretty fast. They've got their own unique set of enemies as well as some recycled ones and level designs for each one are as simplistic as before as they're mostly flat with a few basic platforming sections here & there.
The bosses in the game are unique & simple, and a few from the previous game make a return. Unlike the previous game though, almost all of the bosses actually move around instead of remain in the same X-axis for the entirety of their fights. They also have no collision unless it's from certain attacks, meaning you can walk through them without harm, making many fights way easier than they ought to be. For a few bosses, using that advantage may be one of the only tactics against a particular attack of theirs to prevent you from taking damage.
There are 3 sets of stages/bosses in the game; 8 are available from the start, 4 more become available after the first 8 are cleared, and the last appears when those 4 are done. The last stage is a boss rush of the first 8 followed by the final boss after they're all done.
You acquire a boss' ""Technical Skill"" when you beat them, but this only applies to the first 8. They can be useful against specific bosses Mega Man style and in the stages themselves, but I rarely found myself using them there. One Skill in particular is an offensive dash with i-frames that activate as soon as the Skill itself activates. It makes for a great defensive option if upgraded and/or if other methods like basic dodging & parrying aren't going pretty well.

Parrying, or ""Blocking"", is still difficult to pull off, but is just as rewarding if you do it right intentionally; speed & precision is still required to negate the damage coming towards you. You press left or right just as an attack of some kind is about to hit you, however it can sometimes be pretty tough to determine when & where exactly the hitboxes collide.

""Tres"" is still both the currency and fuel for filling up the Enhancement Slot bar, your Gradius-style on-site upgrade system at the bottom of the screen.
There aren't many new upgrades compared to the previous game and only very few are any practical. The same goes for upgrading the same ""upgrade"" more than necessary; for example, upgrading ""Speed"" too much may make your movement speed harder to control, and too many upgrades to the slot that makes your attacks cover a broader range is highly unnecessary because almost all of the enemies in the game are in front of you or are just slightly above your default line of sight.
Like before, there's an upgrade shop of sorts in the stage select screen, only it's much bigger than before. You can buy various items and upgrades for a variety of selections such as the upgrades themselves in-game, your stats, and ""Technical Skills"". Because of how short the game is, there's a good chance you won't purchase everything in the shop before the game's actually beaten unless you decide to grind for them, which won't reward you with anything in the end.

Within each stage—save for the very last—there are 4 hidden collectibles, ""Pure Syega"". They're invisible, but they give off a subtle sparkle which you can either shoot or touch to reveal them. Their primary use is to be special currency for upgrades in the shop, but there's a good chance not all of them will be used at all as many upgrades aren't necessary.

Like the first game, you unlock Lunatic difficulty once you beat the game for the first time. It's a huge difficulty increase compared to what was already available as attacks for almost every enemy with an actual attack changes in some way and enemies—especially bosses—take more shots to beat regardless of your upgrades.

Replayability is relied on the in-game achievements that are tied to the Steam achievements, and two new characters that become available to you after the game's done; they're both from the first game and only one of them is of any real relevance to the rest of the game. The irrelevant one was pretty much just included in the game for appearance's sake as she doesn't have her own storyline or voice even. The one with the voice and storyline though plays pretty differently and she can be overpowered thanks to an in-game upgrade you can purchase that maximizes the rest of her upgrades in-game automatically.

The game's plot is pretty simplistic and doesn't really tie-in to the first game all that hard, so outside of familiarity's and numerical continuity's sake, you don't really have to play the first one.
Playthroughs are very short so replayability and the achievements in-game are relied on for extensive play times. It's double the price of the first game, though it is bigger and a bit more refined than that of the first game.",1516539754,1516551052,True,1,0,0.523470818996429443,0,True,False,False,False,,,
38684403,"{'steamid': '76561198798343757', 'num_games_owned': 166, 'num_reviews': 8, 'playtime_forever': 937, 'playtime_last_two_weeks': 0, 'playtime_at_review': 85, 'last_played': 1661591728}",latam,"Este juego es increible! desde mi 3ds y ahora jugarlo en pc a 1080 es epico
lo recomiendo mucho",1514264800,1514264800,True,2,0,0.545454561710357666,0,True,False,False,False,,,
38251082,"{'steamid': '76561198075335802', 'num_games_owned': 0, 'num_reviews': 56, 'playtime_forever': 166, 'playtime_last_two_weeks': 0, 'playtime_at_review': 138, 'last_played': 1513061877}",english,"Bought it on the 3ds, buying it again for steam.

Absoluely loved it, while it is the closest game to good megaman gameplay you can find in this day and age, its also doing its own take on that genre and some older bullet hells.  

confused?  dont be, its decently classic megaman gameplay brought into the modern day along with power ups for destroying enemies and not taking hits: speed up, gliding, patterns to help get more enemies down in tougher spots, all the way to straight double, quadra, and even more power!!!

at first i hated the game, i really did jsut want megaman gameplay, i was hating it, but when i gave it a fair shot i started to not only get better but love the unique gameplay thats been put into this game.  enemies are hard to deal with but easy once their patterns and behaviors are studied and thought out, and bosses are good test of your own dodging.

enemies arent a push over unlike in other megamanesc games and you cna only take so many hits but you will learn their patterns and with each boss ability unlocked, the abilites behavior will be perfect for countering the enemies, even the bosses (think about what ability's behavior, hit box, effect or more will counter the boss and you'll likely guess what their weakness it, giving you a massive advantage in both damage and making their best bullet patterns much easier to deal with).

each of the 12 stages, (YES BACK TO MEGAMAN 3 WITH THE ADDED ON LATER CONTENT :P ) also has 2 syega crystals that midly reveal themselves, if you pay attention to that or their shine when you hit them you can collect them for further upgrades to your slot upgrades.  collecting these will allow you to further push the limits of your characters powering up at your own choosing now unlike the first game, your special gauge to the side is used for any attacks but mostly boss abilites will drain it and is very easy to keep track of.  not only that but with each character played the hidding spots are changed respectively per character, based on what they can do and jsut generally relocating the syega again makes the hunt more fun per playthrough, i cant even memeorise where they all are because this will stump you half the time when youre jsut checking from memeory.  really enjoy the fresh feel you can get per cmapaign played.

i know ive only a few hours put into this pc version but ive 6 files of the varying difficulties, mixing between the characters and their unique playstyles, story and more, on my 3ds completed.  normal, hard, insane and even more random difficulty modifiers you can get from the menu section once you beat the game.  Inside System really know how to make the game last longer by it allowing itself to open up to you bit by bit offering more options and such to be played through giving you a different experience per playthrough.  

i highly recommend this game on either version.  though i will say a certain character youd wanna play from the first gmae if you beat it is playable only on the steam version.",1513060560,1513060583,True,5,0,0.547019064426422119,0,True,False,False,False,,,
37954420,"{'steamid': '76561198081905698', 'num_games_owned': 0, 'num_reviews': 77, 'playtime_forever': 695, 'playtime_last_two_weeks': 0, 'playtime_at_review': 217, 'last_played': 1529421812}",english,"First i thought it was Goemon.

turn out to be megaman.

well that find too.",1512054469,1512054469,True,1,0,0,0,True,False,False,False,,,
