recommendationid,author,language,review,timestamp_created,timestamp_updated,voted_up,votes_up,votes_funny,weighted_vote_score,comment_count,steam_purchase,received_for_free,written_during_early_access,hidden_in_steam_china,steam_china_location,timestamp_dev_responded,developer_response
70117127,"{'steamid': '76561198128239804', 'num_games_owned': 552, 'num_reviews': 184, 'playtime_forever': 3083, 'playtime_last_two_weeks': 0, 'playtime_at_review': 3083, 'last_played': 1590960771}",spanish,"Xenon Valkyrie es un juego de plataformas complicado, cuyo nivel de calidad es bueno en todos los aspectos, pero sin llegar a sobresalir en ninguno de ellos. Un buen trabajo sin llegar a la excelencia.
Gráficamente pixelado, pero cuidado, se hace agradable a la vista con su estilo anime. Los escenarios están bien trabajados, son variados, y están repletos de una gran variedad de enemigos.
La música que nos acompaña en cada partida sienta muy bien al ritmo de juego, y si bien no es una melodía pegadiza, no molestará en ningún momento.
La jugabilidad es muy buena, si bien necesitarás de unas cuantas horas de práctica antes de que empieces a dominar los saltos. La gran cantidad de armas cuerpo a cuerpo y a distancia no serán un problema por la simplicidad del uso de las teclas. La precisión de movimientos es buena, aunque no se acerca a lo mejor que se puede ver en el género. La dificultad, muy alta, solo al alcance de aquellos que gustan de este tipo de retos.
Además, si quieres descubrir todos los secretos que esconde el título, ver todos sus finales y conseguir todos los logros, tendrás que invertir una gran cantidad de horas. Sin duda, horas de diversión, por lo que bien vale la pena.

NOTA: 7,5/10",1590961615,1590961615,True,3,0,0.563492059707641602,0,True,False,False,False,,,
66602533,"{'steamid': '76561198081905698', 'num_games_owned': 0, 'num_reviews': 77, 'playtime_forever': 25, 'playtime_last_two_weeks': 0, 'playtime_at_review': 25, 'last_played': 1586016333}",english,"well this game make me stress 

may be it not my type",1586016412,1586016441,False,1,0,0.281520873308181763,0,True,False,False,False,,,
63423533,"{'steamid': '76561198005616069', 'num_games_owned': 854, 'num_reviews': 45, 'playtime_forever': 182, 'playtime_last_two_weeks': 0, 'playtime_at_review': 182, 'last_played': 1581580595}",english,"Tiny sprites, difficult gameplay for the sake of being difficult, and a lot of mechanics that are just not fun. The game is fine in its execution and everything works right, but other than that it's just OK at best.",1581580657,1581580657,False,2,1,0.460035860538482666,0,True,False,False,False,,,
60851346,"{'steamid': '76561198118191786', 'num_games_owned': 459, 'num_reviews': 44, 'playtime_forever': 496, 'playtime_last_two_weeks': 0, 'playtime_at_review': 493, 'last_played': 1708185422}",english,"For starters: This game is *not* a metroidvania, but a rogue-like. This has no impact on my rating, I just think it's important to mention.

I'll give it that, the game looks very cool. The enviroments and characters are teeming with pixelated, detailed goodness.

I also think it has a lot of problems. Levels are generated randomly and (depending on what character you choose) might lock you out of upgrades or even further progression. Items you get out of chests are also randomised and, depending on your luck, you can keep rolling weapons with the same or [i]worse[/i] stats than the ones you have.  The game forces you to kill bosses with melee because reasons (but probably because they'd be too easy otherwise), making ranged weapons borderline obsolete since ammo and healing are scarce as fuck. Also, I just think the game's plain boring.

Anyway, can't recommend.",1577641314,1686571753,False,0,0,0,0,True,False,False,True,,,
60689466,"{'steamid': '76561198106058063', 'num_games_owned': 0, 'num_reviews': 113, 'playtime_forever': 50, 'playtime_last_two_weeks': 0, 'playtime_at_review': 46, 'last_played': 1578067379}",russian,"lovely game
with a bit retarded control",1577470349,1577470349,True,1,1,0.360040724277496338,0,True,False,False,False,,,
60537794,"{'steamid': '76561198450365030', 'num_games_owned': 198, 'num_reviews': 47, 'playtime_forever': 377, 'playtime_last_two_weeks': 0, 'playtime_at_review': 72, 'last_played': 1577537176}",russian,"Игра интересная:
+ геймплей, ну впрочем всё простенько;
+ графон, прикольно;
+сложность игры конечно это вам не дарк соус но всё же мне понравилось:)
-+ управление ну такое, хоть даже его и можно менять, все ровно надо привыкнуть;
-+ сюжет ну такое себе;
- нету коопа, только одиночная игра;
Если и покупать, то только по скидке:D",1577296554,1577296554,True,0,0,0,0,True,False,False,False,,,
60175562,"{'steamid': '76561198443365414', 'num_games_owned': 0, 'num_reviews': 79, 'playtime_forever': 11, 'playtime_last_two_weeks': 0, 'playtime_at_review': 11, 'last_played': 1576852503}",schinese,这是一款仿古类的完全Rogue游戏，死了就全没了的那种，一点积累都没有，不推荐购买。,1576852656,1576852656,False,4,0,0.465082436800003052,0,True,False,False,False,,,
57923705,"{'steamid': '76561198011423755', 'num_games_owned': 0, 'num_reviews': 18, 'playtime_forever': 114, 'playtime_last_two_weeks': 0, 'playtime_at_review': 114, 'last_played': 1558825414}",english,"Takes a while for your eyes to adjust and some of the mechanics are unclear the first few runs, but it's still fun.",1574796248,1574796248,True,0,0,0,0,True,False,False,False,,,
57429646,"{'steamid': '76561197978901098', 'num_games_owned': 0, 'num_reviews': 16, 'playtime_forever': 253, 'playtime_last_two_weeks': 0, 'playtime_at_review': 112, 'last_played': 1575662495}",english,Miku Hatsune becomes a Space Merc.,1574096165,1574096165,True,0,5,0.356550335884094238,0,True,False,False,False,,,
55125592,"{'steamid': '76561197989560282', 'num_games_owned': 0, 'num_reviews': 7, 'playtime_forever': 17, 'playtime_last_two_weeks': 0, 'playtime_at_review': 17, 'last_played': 1568558047}",english,"Got to the first boss. Took a ton of damage before I figured out any way to do damage to it, took another hit, died, start over at the beginning. I've played roguelikes, but I don't need to be assaulted by them. Music  / sound is VERY loud, with no in game volume sliders, just on/off.",1568558241,1568558241,False,3,3,0.377585411071777344,0,True,False,False,False,,,
54762308,"{'steamid': '76561198021078112', 'num_games_owned': 922, 'num_reviews': 184, 'playtime_forever': 349, 'playtime_last_two_weeks': 0, 'playtime_at_review': 349, 'last_played': 1566553708}",russian,"Говноплатформер с двумя пикселями на весь экран, теми самыми, которые в картинке ""как инди разрабы считают выглядело ретро"". Случайной генерацией бестолковых блоков один на другом, в которых нужно буриться бомбами, как в Террарии, и всё это с типично террариевским маханием случайным пиксельным спрайтиком и кривым прыганием по кирпичикам. Смена спрайтика в руке олицетворяет новый контент и плюс к урону.

Эдакий Спелюнки без всего, причем именно тот, первый Спелюнки на гамаке. Физика террарии/рогуелегаси - куль с дерьмом вместо персонажа, непонятно как болтающийся во все стороны.

У героя кроме меча есть пистолет, гранаты для бурения и спецприём. Но на боссах ничем этим пользоваться не разрешают. Изволь пытаться ударить кривой хитбокс босса мечом и при этом не огрести сам, а видя босса в первый раз, ты 100% огребёшь и пойдёшь нахрен проходить всё с самого начала. Снова бурить килотонны корявых блоков.
Некоторые враги почему-то ""мажут"" по герою и не могут нанести урон практически никак. Другие наоборот. Может, это защита от случайного падения на врага с учётом кривой физики игры, но работает она странно.
А вот за то, что шипы наносят урон, только если на них упасть, то есть по ним можно ходить - зачёт.",1566554198,1566554198,False,4,4,0.570613503456115723,0,True,False,False,False,,,
54629987,"{'steamid': '76561197975171602', 'num_games_owned': 0, 'num_reviews': 486, 'playtime_forever': 123, 'playtime_last_two_weeks': 0, 'playtime_at_review': 123, 'last_played': 1493376572}",english,No,1565875372,1565875372,False,2,6,0.146045342087745667,0,True,False,False,False,,,
52418068,"{'steamid': '76561197999387093', 'num_games_owned': 0, 'num_reviews': 4, 'playtime_forever': 1886, 'playtime_last_two_weeks': 0, 'playtime_at_review': 1140, 'last_played': 1661613369}",russian," + Хорошая пиксельная графика
 + Хорошая 8битная музыка, несколько треков в игре очень стоящие
 + Easy to learn hard to master
 + 95% недочетов которые были при релизе исправлены
 + Геймплей прост, но интересен

 - На некоторых локациях задний фон и передний сливаются
 - Выпадающие из боссов предметы никак не описываются, сам догадайся что за эффект он тебе дает и как пригодится  [spoiler] спустя 19 часов игры я вдруг осознал что рентген очки ничего не рентгенируют - это очки ночного виденья, очень б$#%ть логично [/spoiler]

 Прекрасная игра ностальгирующим по sega. Полностью можно пройти катку за час. В игре доступно три персонажа на выбор  [spoiler] четвертый секретный [/spoiler]. Из вооружения доступен меч (единственное оружие для битвы с боссами), огнестрел, уникальный предмет для каждого персонажа и гранаты  [spoiler] которые в 90% случаев бесполезны, урона не наносят, но взрывают почву, а на 3 гранаты особо не покопаешь [/spoiler]. По мере прохождения мы находим ключи выпадающие из мини боссов и сундуки в которым можно найти новый меч или огнестрел. В самом начале игры в магазинчике можно за тиммерит купить новые образцы вооружения которые после покупки начнут рандомно падать из вскрываемых сундуков, обратите внимание что ассортимент обновится только после покупки всех трех предоставленных. Кроме того можно открыть точки телепорта и продавца дронов если немного постараться. После успешного прохождения и получения одной из концовок игра намекнет что в ней можно сделать еще для того чтобы  продвинуться дальше. В игре помимо истинной концовки можно открыть и секретный уровень  [spoiler] сложность попадания на него в том что надо набирать код стоя в упор к камню[/spoiler].

 Отлично играется с геймпада, рекомендую.",1561898227,1561898227,True,3,0,0.558531582355499268,0,True,False,False,False,,,
51813572,"{'steamid': '76561198028435808', 'num_games_owned': 0, 'num_reviews': 32, 'playtime_forever': 153, 'playtime_last_two_weeks': 0, 'playtime_at_review': 83, 'last_played': 1567239490}",english,"Well... Its platformer. What else do you want from it? Aslo well made, nice style (even if basic resolution is too low), nice to play. I think it is all what you need to know. 

The only minus: lack of separate keys for quick grenade and special ability.",1561801844,1561801844,True,0,0,0.477653622627258301,0,True,False,False,False,,,
51549482,"{'steamid': '76561198441643166', 'num_games_owned': 0, 'num_reviews': 10, 'playtime_forever': 155, 'playtime_last_two_weeks': 0, 'playtime_at_review': 19, 'last_played': 1619797289}",english,"random maps, destructable terrain, cute characters, and a slight of action rpg games.
the only downside is that you need to use the main weapon to fight bosses, which increases the dificulty.
just add damage or strenght and you be fine.

the ui and controls are good enough, could be better, but is far better than just wondering how to use the controls",1561772135,1561772135,True,0,0,0,0,True,False,False,False,,,
49261775,"{'steamid': '76561198210352673', 'num_games_owned': 0, 'num_reviews': 6, 'playtime_forever': 716, 'playtime_last_two_weeks': 0, 'playtime_at_review': 687, 'last_played': 1623678947}",koreana,어렵다 재밌다,1551271076,1605895855,True,1,0,0.523809552192687988,0,True,False,False,False,,,
48223902,"{'steamid': '76561198040421250', 'num_games_owned': 19550, 'num_reviews': 743, 'playtime_forever': 22, 'playtime_last_two_weeks': 0, 'playtime_at_review': 22, 'last_played': 1547102550}",english,"Xenon Valkyrie is a rogue-like platform shooter with RPG elements and it's as fun as it is hard.

It's a high quality game that has been made with really great pixel art and chiptune music. The game play is quite difficult due to the rogue-like nature of it (perma death) but it is really fun. Guns, melee, and grenades in a randomly generated platform world makes for a great time. You can jump up walls and the grenades can be used to blast holes in the platforms giving another way to get around.

Check it out, it's fantastic and it's available on Playstation, vita, XBox, PC and has just released on the Nintendo Switch.
Just remember, it's hard!
So take a look at my video to see what it's like... 
https://youtu.be/y9320qFcB2A
Thanks for watching, please like, subscribe and comment.",1547127474,1547127474,True,1,0,0.486505031585693359,0,False,True,False,False,,,
47267500,"{'steamid': '76561198066076521', 'num_games_owned': 0, 'num_reviews': 34, 'playtime_forever': 250, 'playtime_last_two_weeks': 0, 'playtime_at_review': 250, 'last_played': 1543795090}",english,"Took a long break from the game because of how hard it was, but its fun regardless",1543795185,1543795185,True,0,0,0.422427088022232056,0,True,False,False,False,,,
45332463,"{'steamid': '76561198048405525', 'num_games_owned': 462, 'num_reviews': 52, 'playtime_forever': 3074, 'playtime_last_two_weeks': 0, 'playtime_at_review': 3074, 'last_played': 1540500625}",english,"honestly don't see why people say this game is grindy or frustratingly difficult, if you just take the time to experiment with stat builds you can cheese all the way to late game quite consistently even on completely unfunded runs - for example if you max def early on you will be almost invincible against most enemies at least until the final biome. the boss patterns are few and simple, you should be able to learn em in under 5 hours. if it was any easier it wouldnt even be rewarding to finish a run. honeslty I had a harder time progressing in the binding of isaac than this.

UPDATE: just 100%'d the game, it had even more replay value than I thought, every route feels very different and surviving your first run is barely scratching the surface of all the hidden content in this game. take your time and discover all the secrets, remember to be generous and also 1 is up and 0 is down.

my favorite area was the ivory tundra, i loved the color and background contrast when you get out of the cave, and it's also my favorite bgm.

the true ending boss is a big gimmick but I liked it, very badass

now for the flaws:
- the delayed swing is pretty frustrating, I'd much rather have a swing that hits almost instantly as I press my key, it would feel much better and be less gimmicky to control
- swing hitbox is frustrating, if you're standing right on an enemy it might not hit. it should span a bit behind the center of the character
- cannot take back items once you exchange them, sometimes you can accidentally exchange a good weapon for a worse one
- some bosses can have unavoidable combos if you're unlucky enough, but rarely
- getting hit blocks your jump which feels very weird",1539914168,1540501971,True,6,0,0.6031951904296875,0,True,False,False,False,,,
44862037,"{'steamid': '76561198135589460', 'num_games_owned': 587, 'num_reviews': 23, 'playtime_forever': 847, 'playtime_last_two_weeks': 0, 'playtime_at_review': 407, 'last_played': 1538635927}",brazilian,"o jogo é muito bom e desafiante, mais difícil que dark souls, recomendo 'u'
as análises negativas que fazem pra esse jogo é a mal adaptação do joystick, como fiquei com preguiça de plugar o meu, só fiquei jogando no teclado, não muda muita coisa, mas vc precisa ser bem esperto de não ficar perdendo vida, ou seja, precisa de habilidade :I
mais uma vez digo que é muito bom e recomendo, pena que vc se sacrifica pra encontrar itens bons pra equipar pra morrer e perder tudo junto com o level tbm...",1537574377,1537574377,True,8,0,0.626401007175445557,0,False,True,False,False,,,
44718496,"{'steamid': '76561198128009111', 'num_games_owned': 0, 'num_reviews': 4, 'playtime_forever': 44, 'playtime_last_two_weeks': 0, 'playtime_at_review': 44, 'last_played': 1536873850}",english,"Controls are a little hard to customize as it wants you to use a xbox controller.. the keyboard controls work pretty alright but i never know what button to press when it tells me ""press A"" to continue and ""press B"" to cancle.. it is not refering tot he A and B keys, its refering to the xbox controller buttons.

there is an option to set your keyboard controls, but the save doesn't appear to work right. and even when it does, midway through a game its like the game forgot you set your controls and reverts back to default.

Music is a bit repetative.

aside from that, this game could have potential..",1536874139,1536874139,False,4,0,0.527184545993804932,0,True,False,False,False,,,
44696352,"{'steamid': '76561198044412430', 'num_games_owned': 1370, 'num_reviews': 7, 'playtime_forever': 45, 'playtime_last_two_weeks': 0, 'playtime_at_review': 45, 'last_played': 1536796441}",german,"Tolles Spiel.
Schade allerdings dass die PC Version nicht auf den Stand der Konsolen gebracht wurde.
Auf der PS4 hab ich es total gesuchtet und bin nur am seltsamen letzten Boss gescheitert.

Das umständliche Switchen zwischen dem Equipment, hätte in der PC Version auch ruhig verbessert werden können.

Ansonsten eine klare Empfehlung von mir.",1536750578,1536750578,True,0,0,0,0,True,False,False,False,,,
43498246,"{'steamid': '76561198092871583', 'num_games_owned': 183, 'num_reviews': 13, 'playtime_forever': 10, 'playtime_last_two_weeks': 0, 'playtime_at_review': 10, 'last_played': 1531464966}",english,"It is year 2018, we have a game with 0 tutorial and explanation
Spend 5 mins to figure out the controls, but have 0 ideas on the game mechanic
How can you love a game when you don't even know how to play a game, plus the weird control and hitbox just makes things wrose",1531466040,1531466040,False,3,6,0.207098901271820068,0,True,False,False,False,,,
43493402,"{'steamid': '76561198002596848', 'num_games_owned': 434, 'num_reviews': 34, 'playtime_forever': 252, 'playtime_last_two_weeks': 0, 'playtime_at_review': 252, 'last_played': 1531439809}",english,The controls are too clunky and the enemy knockback is rediculous. Everytime you hit an enemy they fly backwards quite a distance preventing you from killing them if they land in an awkward place. Also there are invisible blocks and the background is easily confused with the forground. Topping it all off with having your sword as the only weapon for a boss fight making all other items meaningless.,1531439941,1531439941,False,3,0,0.483606338500976563,0,True,False,False,False,,,
43200202,"{'steamid': '76561198012309675', 'num_games_owned': 0, 'num_reviews': 11, 'playtime_forever': 10, 'playtime_last_two_weeks': 0, 'playtime_at_review': 5, 'last_played': 1530397572}",spanish,"Tiene unos cuantos glitches de imagen,parpadeos en la pantalla de seleccion.Algunos controles a veces no responden.El juego en si ,graficamente y los sonidos estan muy bien.pero no se,sigue faltandole algo y sumado a estas cosas que he nombrado no puedo recomendarlo en el estado en que se encuentra.",1530399984,1530399984,False,1,0,0.476510077714920044,0,True,False,False,False,,1530570851.0,"Hola,soy el desarrollador del juego ¿podrías comentarme los problemas que tuviste con el juego? háblame por favor de esos errores o bugs para mejorarlo en un futuro.
Entiende que este juego lo a hecho una sola persona,que vive de esto y es muy difícil hacerlo todo perfecto. intento siempre hacer lo mejor que puedo.
gracias igualmente por el análisis.
un saludo amigo"
43008002,"{'steamid': '76561198186511371', 'num_games_owned': 98, 'num_reviews': 29, 'playtime_forever': 106, 'playtime_last_two_weeks': 0, 'playtime_at_review': 99, 'last_played': 1577116814}",japanese,むずかしい」,1529854698,1529854698,True,2,0,0.424151211977005005,0,True,False,False,False,,,
42888271,"{'steamid': '76561198116411231', 'num_games_owned': 0, 'num_reviews': 36, 'playtime_forever': 317, 'playtime_last_two_weeks': 0, 'playtime_at_review': 308, 'last_played': 1491607284}",english,This game is funish.,1529540447,1529540447,True,1,0,0.382693767547607422,0,True,False,False,False,,,
41593485,"{'steamid': '76561198154743253', 'num_games_owned': 649, 'num_reviews': 53, 'playtime_forever': 60, 'playtime_last_two_weeks': 0, 'playtime_at_review': 42, 'last_played': 1524530620}",spanish,"Es un título que bebe directamente de la época dorada de los juegos de 16 bits, por lo que da una sensación que ya conocemos junto a una que estaremos a punto de descubrir. 

Los diseños de los niveles son estilo metroidvania y están tan bien elaborados que provoca quedarse paseando por un largo rato antes de pasar al siguiente. 

La jugabilidad es otro de sus puntos fuertes, ya que es una mezcla de roguelite, plataformas y RPG.

Hice una completa review en mi blog que pueden visitar acá: http://retroorama.blogspot.com/2018/04/xenon-valkyrie-un-roguelite-que-combina.html

Completamente recomendado.",1524258456,1524258456,True,1,0,0,0,False,False,False,False,,,
41505755,"{'steamid': '76561198023056964', 'num_games_owned': 316, 'num_reviews': 14, 'playtime_forever': 38, 'playtime_last_two_weeks': 0, 'playtime_at_review': 38, 'last_played': 1523801700}",english,"Very fun platformer, good music, and fun gameplay overall. For someone who doesn't play a lot of platformers, this game is quite enjoyable, and I can see myself sinking many hours into this. Wish there was a bit more explanation as to what was going on, but that's probably part of the appeal of games like these.",1523806834,1523806834,True,0,0,0.476190477609634399,0,False,True,False,False,,,
40641472,"{'steamid': '76561198179342283', 'num_games_owned': 0, 'num_reviews': 254, 'playtime_forever': 141, 'playtime_last_two_weeks': 0, 'playtime_at_review': 74, 'last_played': 1588975092}",english,"I gave it a second try and changed my rating to a recommendation. There are no more laggs. Collision detection is ok, now.

It's still a grind fest, but Riddled Corpses wasn't much different. If you liked it and can take a roguelike platformer, this is for you.

+ environment is destructible
+ getting to know enemies makes game easier/faster to proceed
+ controls are responsive
+ some story

- no more unique design of level, only different tile graphics
- no intro",1520465196,1595706575,True,0,0,0.416781604290008545,2,True,True,False,False,,,
40381785,"{'steamid': '76561198292203053', 'num_games_owned': 108, 'num_reviews': 9, 'playtime_forever': 67, 'playtime_last_two_weeks': 0, 'playtime_at_review': 67, 'last_played': 1519548402}",schinese,"咦，这里是哪，怎么回去呀,迷路ing。

我只能说不能主动存档，

对于路痴和手残党来讲，

根本！玩！！不！！!下！！！！去丫 orz

不过个人感觉跑图战斗挺带感的说。。
希望改进。",1519548850,1519548940,True,4,0,0.579698622226715088,0,True,False,False,False,,,
