recommendationid,author,language,review,timestamp_created,timestamp_updated,voted_up,votes_up,votes_funny,weighted_vote_score,comment_count,steam_purchase,received_for_free,written_during_early_access,hidden_in_steam_china,steam_china_location,timestamp_dev_responded,developer_response
30067777,"{'steamid': '76561198002518295', 'num_games_owned': 0, 'num_reviews': 41, 'playtime_forever': 291, 'playtime_last_two_weeks': 0, 'playtime_at_review': 240, 'last_played': 1508823140}",english,"I've enjoyed Xenon Valkyrie. It provides some arcadey fun and pulls off that loop of playing, dying,  and saying ""one more time"". i.e. keeping you engaged for a half hour, 45 min, an hour, etc. when you have a good run going.

It reminds me of Cave Story a bit, but with a *tad* less finesse than that game's character feel. Initially, it was much more rigid, but thanks to an update in March, its been made MUCH more fluid. Everyone controls a lot better now - its a major improvement to the core character controller, and even things like switching weapons has been tightened up, becoming faster and more responsive. Overall the action feels good, but is a little more methodical than you might expect - which may not be coming through from the trailers or screenshots. Its got its own flow and tempo, but what its going for definitely works well.

>>>>March update: I should also mention that this March update (ver. 1.1.0) has also just improved a bunch of things, including the front end. It feels a whole bunch more ""finished"" now in general - it features a proper opening, there's more ""proper"" presentation all around now with better title cards upon entering stages and stuff like that. Most importantly, there's now options to fiddle with including fundamental things like fullscreen or windowed :D This game is feeling much better and super polished now!<<<< 
 
There's obviously some issues. Some graphic tiles used may double as backgrounds and collision. Some traps (gas spewers) only trigger when you're onscreen, throwing off their pattern. The reach on some of your melee weapons are total garbage, and some enemies seem practically untouchable as a result. The algorithm used to generate levels certainly isn't perfect, as expected, but it puts out good stuff more often than not.
 
I wish it looked better, at least its characters. Its got a good STYLE, and the backgrounds are actually pretty nice, resembling a chunkier, lower-res Super Metroid or Metroid Fusion. The characters stand out A TON though, because they're only like 10 large, chunky pixels arranged together, unfortunately. They successfully capture ZERO PERCENT of the cool designs from the key art you're seeing on the store page, which is a total shame. If the backgrounds were higher-res, and the character sprites shot for a style at least more like a Drill Dozer, Shockman or MetaGal instead, this would all be so much improved (it would probably be able to hang with something like TimeSpinner then). 

It is what it is, and while I personally think it all comes off looking a bit too much like ""Super Metroid for Atari"", the execution on the visual presentation is fine overall. Some nice chiptunes here as well.
 
I actually can't speak as to how this compares with Rogue Legacy, 20XX, Spelunky or the other big Roguelikes (I gotta start playing more of these), but I know that I've enjoyed playing this so far. Its got a few quibbles, but generally comes together well, and its a game I'm coming back to when I want to just zone out, listen to a podcast, and play something for a little bit of time. So it gets a recommendation from me.",1487630689,1490724120,True,5,0,0.550678431987762451,0,True,False,False,False,,,
30065723,"{'steamid': '76561198063051238', 'num_games_owned': 867, 'num_reviews': 20, 'playtime_forever': 492, 'playtime_last_two_weeks': 0, 'playtime_at_review': 361, 'last_played': 1582856489}",german,"Was für ein grossartiges Spiel, das richtig süchtig macht! Richtig gut finde ich auch der permanenten Support und soweit ich lesen konnte, kommt noch viel mehr Content dazu.
Die Grafik ist klar Geschmackssache, doch ich liebe diesen Stil einfach und jeder dem es genau sogeht kann hier wirklich nichts falsch machen. Schwierigkeitsgrad geht absolut in Ordnung, für Abwechslung ist gesorgt. 

Von mir eine absolute Kaufempfehlung!",1487622878,1487622878,True,2,0,0.54356849193572998,0,True,False,False,False,,,
30047742,"{'steamid': '76561198058558860', 'num_games_owned': 0, 'num_reviews': 69, 'playtime_forever': 94, 'playtime_last_two_weeks': 0, 'playtime_at_review': 94, 'last_played': 1487625892}",russian,"Стоит уважения как минимум потому, что разраб очень серьезно отнесся к первоначальным ошибкам. Посмотрите лог новостей, там одни патчи, с частотой 2+ в неделю. 
Ну и сама игра хороша, как и ее арт.",1487551578,1488182867,True,12,2,0.575219631195068359,0,True,False,False,False,,,
29942828,"{'steamid': '76561198173505969', 'num_games_owned': 0, 'num_reviews': 60, 'playtime_forever': 1974, 'playtime_last_two_weeks': 0, 'playtime_at_review': 1193, 'last_played': 1695888267}",japanese,"ランダムマップで生成されるアクションゲームです。
かなり人と選ぶゲームになりますが私にとってはとても好みなゲームでした。
要点をまとめると以下の通りになります。

・1度やられたら始めからやり直し
　┗ゲームオーバーになればスタート地点からやり直しになります。
　　手に入れた武器やスペシャルアイテムもなくなります。
　　ただし、一部の消耗品アイテムは引きお継がれます。

・短時間で気軽に
　┗スタートから画面上部にタイマーが設置されています。
　　あまり深くまでは言えませんがおおよそ30分~40分でクリアできます。
　　息抜きに1度やるかという感じでプレイできます。
　　RTAをするのにも良いと思います。

・割と上級者向け
　┗なるべくダメージを受けないように進んでいくゲームです。
　　回復アイテムの入手が難しいためプレイヤースキルが問われます。

・BGMがとても良い
　┗8bitが好きならなおのこと好きになると思います。
　　サウンドトラック出てほしいですね…

【懸念点】
・日本語に対応していない(そこまで気にすることでもないかもですが)
　┗こればかりはどうしようもないです
　　話している内容はどんなアイテムが必要だとか英語で表記されていますが
　　攻略に影響が出るほど難しい会話はしていませんので大丈夫だと思います。

・キャラクターによっては進行不可能な状態になってしまう
　┗時たまにあります。
　　マップがランダムで生成されているのも原因ではありますが…
　　一応手榴弾で壁を破壊するアイテムがありますが無理な時は諦めます。

以上になります。

余談ですが、リリースされてから多くのユーザーからの要望にこたえるべく
随時アップデートされ、だんだんと良くなってきているゲームです。
もし、いまはダメでもしばらくたった後良くなっていく可能性はあるでしょう。",1487169854,1487505358,True,9,0,0.619076013565063477,0,True,False,False,False,,,
29913532,"{'steamid': '76561197996715488', 'num_games_owned': 0, 'num_reviews': 309, 'playtime_forever': 275, 'playtime_last_two_weeks': 0, 'playtime_at_review': 275, 'last_played': 1487042390}",english,"Cute little game. Originally it was buggy and near impossible, but the dev has worked with the community to make the better game. If you're detered by reviews about bugs, they were resolved by the time I played.",1487043171,1487043171,True,0,0,0,0,True,False,False,False,,,
29898674,"{'steamid': '76561198046162452', 'num_games_owned': 792, 'num_reviews': 10, 'playtime_forever': 154, 'playtime_last_two_weeks': 0, 'playtime_at_review': 77, 'last_played': 1498314890}",english,THIS GAME RULE!  i love it =D,1486990104,1486990104,True,5,0,0.46236264705657959,0,True,False,False,False,,,
29840197,"{'steamid': '76561198113534698', 'num_games_owned': 0, 'num_reviews': 9, 'playtime_forever': 121, 'playtime_last_two_weeks': 0, 'playtime_at_review': 48, 'last_played': 1699461720}",koreana," 높은 난이도와 줫같은 조작감. 하지만 그럼에도 할 수 밖에 없게 하는 이쁜 그래픽, 잦은 업데이트 (많은 피드백).

많은 업데이트 바랍니다. 제발 ㅠㅠ
",1486793706,1486793706,True,7,0,0.580069482326507568,0,True,False,False,False,,,
29820477,"{'steamid': '76561198273011256', 'num_games_owned': 3040, 'num_reviews': 715, 'playtime_forever': 505, 'playtime_last_two_weeks': 0, 'playtime_at_review': 399, 'last_played': 1496996847}",latam,"[h1] Castellano: [/h1]
Jolines tios que el juego esta majo, aunque algo cuadrado; sin embargo, el desarrollador es chachi y da buena respuesta al feedback  mejora con cada parche, es un roguelike dificil pero justo que da cierta nostalgia por el aspecto retro; el objetivo es ir cagando leches hacia abajo mientras limpias y looteas(son 2 stages y luego boss)  subes de nivel y das hostiazos con ciertos perks que te permiten mejorar; sea fuerza mas carga de municion o mas defensa por lo que no hay que ser gil y pensar de acuerdo a tu estilo de juego, la musica es buena y el apartado grafico igual.

[h1] Español Latino:[/h1]
Es un jueguito dificil, manejas a unas monas kawaii o bien un alieno que es para pros tu arma principal es una espada, y la secundaria una pistola cada personaje tiene su estilo de juego y habilidades; el chiste es bajar y bajar despues de 2 stages viene un boss que simula un poco a los Contra (hay que aprender la secuencia) esta bonito y me gusto; pero si eres de los que se tiltea/frusta por morir mucho no lo vas a disfrutar; tiene poquitos fallos tecnicos pero el desarrollador es comprometido y siempre lo anda mejorando.

[h1] English:[/h1]
I fell in love with the developer♥~ for the game riddled corpses (awesome game btw) so I was expecting this game. The main objetive of this roguelike is survive trough levels going down (after 2 stages comes a boss and a shop: you can loot money from chests)  you can level your character by killing mobs making you more tanky or more lethal with your sword even can upgrade the capacity of ammo you can charge.
The developer is a nice guy and keeps improving the game every patch.",1486722043,1486722437,True,4,9,0.460997045040130615,0,True,False,False,False,,,
29807566,"{'steamid': '76561197983353237', 'num_games_owned': 0, 'num_reviews': 46, 'playtime_forever': 2522, 'playtime_last_two_weeks': 0, 'playtime_at_review': 872, 'last_played': 1539895116}",english,"This game is alot of fun, while it is very difficult it's also addicting. I wasn't going to write a review because I'm not good at coming up catchy and informative reviews, however after seeing that XenonValkyrie currently has a ""Mixed"" review average, I felt compelled to do what I can to recktify that. It really is a good game and is getting better with each update which are released often. My only request for the game is MORE STEAM ACHIEVEMENTS!!..",1486665932,1486665932,True,8,0,0.499214798212051392,2,True,False,False,False,,,
29786061,"{'steamid': '76561198024253337', 'num_games_owned': 0, 'num_reviews': 3, 'playtime_forever': 337, 'playtime_last_two_weeks': 0, 'playtime_at_review': 331, 'last_played': 1487438389}",japanese,"Version 1.0.4 で近接武器の判定が広がっただけで神ゲーになった。
クソゲーだと思って投げた方もう一度プレイしてみては？

- 追記
アップデートを重ねステージ途中での回復手段まで追加されてしまった。
最早ぬるげーだ。
辛辣なレビューの数々にどれほど理不尽なゲームなのか期待したのが懐かしい。

実際リリース直後はあまりにも理不尽さの度が過ぎて私も投げてしまった。
今となってはその面影もなく普通にクリアできる難易度になっている。
しかし調整前にクリアしている方もいることを考えるとあの難易度は絶妙なシビアさだったのかもしれない。",1486575709,1486654625,True,16,1,0.60668480396270752,0,True,False,False,False,,,
29759356,"{'steamid': '76561198037753187', 'num_games_owned': 174, 'num_reviews': 15, 'playtime_forever': 19, 'playtime_last_two_weeks': 0, 'playtime_at_review': 19, 'last_played': 1486465158}",schinese,"比自己预期中的感觉还要差一点，更新后能修改键位了是挺好，但操作手感确实太糟糕了
已申请退款",1486465811,1486465811,False,1,0,0.459905058145523071,0,True,False,False,False,,,
29747749,"{'steamid': '76561198043276254', 'num_games_owned': 310, 'num_reviews': 4, 'playtime_forever': 1786, 'playtime_last_two_weeks': 0, 'playtime_at_review': 750, 'last_played': 1492967923}",english,"I like it, it's hard but my wrists are getting sore - She said
Play with it a little more - I said


It is really difficult but that adds to it's charm. As you progress through worlds the difficulty is ramped up a lot! I wouldn't say it's to hard, remember the games on snes and megadrive!

Luckily you can unlock world checkpoint permanently which are good for practice, but not much else as you won't be gaining your levels from the previous worlds.

It takes patience not to get hit thus enabling you to get further into the game.

I've been playing it now and again and my skills have improved, but so many rage moments! 



Overall 8/10 from me.
(Incresed from 7 to 8 as lots of updates!)",1486409714,1488581433,True,4,0,0.523391187191009521,0,True,False,False,False,,,
29744166,"{'steamid': '76561198027130533', 'num_games_owned': 0, 'num_reviews': 8, 'playtime_forever': 186, 'playtime_last_two_weeks': 0, 'playtime_at_review': 116, 'last_played': 1526932176}",english,"At first, I wanted to like this game... The graphisms are amazing, the music too, there's a nice little cutscene at the beginning... But the gameplay was somewhat broken (and there was even a few crashes)... I even asked for a refund...

But a few days later, I decided to give it a second chance... And it was worth it.

The game is still difficult and ""broken"" is some parts, but the dev is still working on it to improve the game. 

So, even if it's not perfect yet, I can recommand this game, especially with the active work of the dev ^^",1486397892,1486397892,True,6,0,0.523383259773254395,0,True,False,False,False,,,
29741836,"{'steamid': '76561198011496847', 'num_games_owned': 670, 'num_reviews': 39, 'playtime_forever': 1133, 'playtime_last_two_weeks': 0, 'playtime_at_review': 852, 'last_played': 1651633077}",japanese,"Xenon Valkyrieを知ってるかい？
こいつはシビアなアクションゲーム！
というわけでドット絵がちまちま動くあたりから16ビット機辺りの香りが漂うローグライクアクションゲーム、Xenon Valkyrieの紹介です。
最初にそれ言うのはどうよって気もしますが、[url=http://steamcommunity.com/id/eisone-san/recommended/369890/]メーカーの前作[/url]同様初期リリース版はバグの嵐だったものの、アップデートが掛かって大体直っている模様です。
さて、じゃあこのゲームの内容を紹介するよー。長文読みたくない人は見出しだけ見たらいいと思うな！

あ、あとガイド書きました。
http://steamcommunity.com/sharedfiles/filedetails/?id=860694495

[h1]見た目も中身も16ビット風[/h1]
まず見た目のドット具合からしてファミコンとかスーパーファミコンとかを思わせますが、ゲームの内容も結構そんな感じ。

例えばゲーム開始時に選べる3人のプレイヤーキャラはそれぞれ万能型、攻撃重視、防御重視となっているのですが、この中で防御重視のキャラを選ぶと、ゲーム開始直後の敵の攻撃の大半が効かなかったりします。これはどうやら防御力以下のダメージを大体無効化するという仕様らしく、現代的なゲームに慣れている身からするとなんだその雑なパラメータはと思わんでもないのですが、見た目が8ビットゲームなのでこんなもんかなあ、というかこんなもんだったよね、という感じ。

昔のゲームっぽく、洗練されていない操作感とインターフェイスのお蔭で非常に死にやすいのも特徴で、特にステージ構成からどんどん下に落下しなくてはいけないのに、視点が自機中心の固定型なので落下先のダメージ地形が見えずミニマップにも表示されない、という不細工さはなかなか古臭い感じ（ちなみに敵はミニマップに表示される）。

他にも各キャラ剣、銃、特殊武装を切り替えて戦うのですが、剣を上段から振り下ろしているのに攻撃判定は自機正面と斜め上に少ししかないという不器用さのせいで、ジャンプしながらの空中戦や上から襲ってくる敵の処理は結構シビアです[b][u]（※結構判定が大きくなりました）。[/u][/b]
また回復アイテムの入手に運が絡む（確実に回復できるのはボス撃破後のみ）のも死にやすさに拍車をかけています[b][u]（※低確率ながら、道中回復アイテムが出るようになりました）[/u][/b]。
ただまあ、そういうところも含めて非常に昔のアクションゲームを思い出させる感じです。


[h1]ローグライクなゲーム性[/h1]
まず、マップや敵の配置は全てランダムです。そして死んだらお金も装備品も強化したパラメータも大体全部なくなります…というあたりは勿論ローグ的なのですが、他にもローグ的だなあ、と思わせる部分があります。

例えば敵の特殊能力。敵は撃破後に短時間死体が残るのですが、一部死体に攻撃を加えると爆発する敵がおり、知らないで殴るといきなり凄いダメージを受けます。
それはただの理不尽じゃん！と思うかもしれません。
しかし有名な国産ローグライクゲームにだって、条件を満たすと自爆して殺しにかかってくる敵は登場します。そしてそれらは対処法を誤らなければ大体どうにかできるものであり、それはこのゲームでも同様です。
要するにインターフェイスがアクションゲームであり、その腕前は当然生存能力に大きく影響しますが、基本はローグライクゲームと同様死んで覚えてプレイヤーが対処を学んでいくゲームという構造なのです。

また、ローグ的且つ地味に便利なのが壁の破壊。
プレイヤーキャラ3人のうちふたりは特殊武装が爆発物になっています。これを使って地面や壁を吹き飛ばすことでダメージ地形を除去したり、自分で安全な移動経路を作ってしまうなど、トラップ除去やつるはしで壁を壊す感覚で全く合法且つ有用。アップデートで爆発物のリチャージが結構早くなったので、遠慮なく我が道を行きましょう。


という感じで、ちょっと古臭いアクションゲームとローグライクゲームが好きな方なら買い、そうでない方は無理しない方が、という内容だと思います。プレイヤーによって大きく評価が別れそう。
ちなみに積み立てる要素は一応あり、ボスを倒した後の宝箱やお店から手に入る鉱石を集めることで、スタート地点右側にある強力な武器を解放したり（解放後宝箱から出るようになる）、先のエリアへの直通ポータルを使用可能になります。

[h1]あのトゲに向かって走れ！[/h1]
えー、恐らく大半のプレイヤーがやると思うんですが、なんと[b]ダメージ地形の棘は横から歩いて触れた場合、ダメージを受けません[/b]。あくまで上から踏んだ時のみダメージを受けます。
見た目がこんなんだから大半のプレイヤーは無理矢理回避を試みて余計なダメージを受けると思うので、ここでお知らせしておくよ！",1486390425,1487314187,True,79,6,0.785370051860809326,0,True,False,False,False,,,
29736142,"{'steamid': '76561198023726783', 'num_games_owned': 0, 'num_reviews': 5, 'playtime_forever': 163, 'playtime_last_two_weeks': 0, 'playtime_at_review': 105, 'last_played': 1499576188}",english,"[h1]Anime Spelunky[/h1]

It's hard, so I haven't gotten far yet.

It's cute.

I recommend trying very hard to keep your shield in the first level.

You might think ""I should save my ammo for the boss"", but it seems that you can't use guns on the boss.

It plays well with a keyboard. My only complaint is that there isn't a ragequit button--you have to die, and then go through menus to get out of the game (if you alt-tab and kill the game, you can lose teamerite!).

[h1]Differences from Spelunky:[/h1]

Items seem like much less of a big deal. Mostly I've seen stronger or weaker weapons, but the weapons act the same. A run in Spelunky was defined by your item pickups. I haven't seen what defines a run yet in this game, apart from ""how much am I sucking?""

It has more bosses. The first one only two levels, on the first world. I've seen two different bosses for the first world's boss, too.

You can collect 'teamerite' by beating bosses and by spending 500 at the shop prior to a boss. Your 'teamerite' persists through runs and can be spent on to benefit a run.

There doesn't seem to be a level time-limit (like Spelunky's ghost).

You have a melee weapon, a ranged weapon with depleting ammo, and bombs (or grenades, or jump boot uses) that recharge.

You have a mini-map of the complete level and near enemy indicators, but you can't look around.

Like the original Spelunky, but unlike the high-rez version, only the map near to you is 'alive'. You can set a bomb, run away, and then it won't actually blow up until you come back to it. Monsters will often spawn in situations that result in them killing themselves, but this won't happen until you're nearby.

There are no shopkeepers. Instead, between levels, you can talk to NPCs, level up your abilities, and buy some items.

When you reach the exit of a level, you can teleport to the top to get another try at looting the place, rather than immediately continuing on.

There don't seem to be any instaneous deaths. The spikes were nerfed.

[h1]Similarities to Spelunky:[/h1]

You go on 'runs' through 'worlds' of 'levels' that consist of randomly-generated side-view cave-like dungeons. You start at the top and will find the exit near the bottom. In between there are a variety of monsters and traps and treasures. More monsters than traps. Treasure is in breakable containers and openable chests rather than laying as gold on the ground.

After a while you can skip the earlier 'worlds' of a run, in this game via teleporters.

It's hard. Especially the bosses. In both games you can avoid everything and sprint to the exit, at the cost of being less capable of handling later levels.",1486364043,1486364267,True,7,0,0.522707998752593994,0,True,False,False,False,,,
29730688,"{'steamid': '76561197972511962', 'num_games_owned': 0, 'num_reviews': 18, 'playtime_forever': 49, 'playtime_last_two_weeks': 0, 'playtime_at_review': 49, 'last_played': 1486324228}",english,"Definitely has some shortcomings at the moment, but the dev is actively listening and improving things. Just don't go into it expecting something as polished as Spelunky.",1486334574,1486334574,True,3,0,0.52491605281829834,0,True,False,False,False,,,
29726380,"{'steamid': '76561197977250850', 'num_games_owned': 0, 'num_reviews': 3, 'playtime_forever': 25, 'playtime_last_two_weeks': 0, 'playtime_at_review': 25, 'last_played': 1486321037}",english,"The truth is that he had been waiting for a game of this quality. When I started to play it I shut a tear from the eye remembering the times in which I played with my brother to the snes. I have tried other rogue's and this is the best without a doubt. The music is also spectacular. The gameplay with an xbox controller 360º is very good, I expect hours of fun with this. My most sincere congratulations to the author of this game. Community I do not know what you expect to enjoy it, I'm about to throw my ps4 in the trash. Retro games forever .......",1486321047,1486321047,True,3,2,0.468966007232666016,0,False,False,False,False,,,
29720971,"{'steamid': '76561198318673842', 'num_games_owned': 0, 'num_reviews': 1, 'playtime_forever': 1009, 'playtime_last_two_weeks': 0, 'playtime_at_review': 1008, 'last_played': 1486827962}",spanish,"
This game is beautiful and fortunately has the feedback of its creator to keep improving. Version 1.0.2 is much better and I think it will continue along this path, I recommend it for those who want to give a chance to this great adventure.

Este juego es hermoso y por fortuna cuenta con el feedback de su creador para seguir mejorando. La version 1.0.2 esta mucho mejor y creo que seguira por ese camino, lo recomiendo para quienes quieran dar una oportunidad a esta gran aventura.
",1486307068,1486307068,True,1,0,0.47413790225982666,0,False,False,False,False,,,
