recommendationid,author,language,review,timestamp_created,timestamp_updated,voted_up,votes_up,votes_funny,weighted_vote_score,comment_count,steam_purchase,received_for_free,written_during_early_access,hidden_in_steam_china,steam_china_location,timestamp_dev_responded,developer_response
39479922,"{'steamid': '76561198073364755', 'num_games_owned': 957, 'num_reviews': 112, 'playtime_forever': 316, 'playtime_last_two_weeks': 0, 'playtime_at_review': 41, 'last_played': 1533974814}",japanese,"[h1]完成度に難あり。えっこれ早期アクセスゲームじゃないよね・・・？[/h1]
これがいかにサムズダウンされる作品なのかは他の人が既に書いてありますが自分も書きたいと思ったのでなるだけ短めにレビューしようと思います。（ver1.2.4時点）
このゲームの良いところ
・ドット絵のクオリティ※ただし巨大なヤツ・・・つまりボスオンリー
ジャケット絵というかバナー？の女の子の絵はかなりクオリティが高い方でしょう
でもそれがゲームの中では一切出てこないのでいろんな意味でお察しください。
プレイキャラの女の子や魚人はゲーム内だと他のザコ敵よろしくかなり小さく絵に惹かれた人のモチベをへし折ります。

悪いところは他の人が十二分に書いてくださってますのであえて３つだけ
[b] ・完成度？なにそれおいしいの？[/b]
他の人のレビューを見たり実際にやってみればわかりますがこの出来栄えでアーリーアクセスでもなく９８０円は高い、断言してもいいくらいに高いです
[b] ・仮に最後のボスを倒したとしてもクリア時のステータス画面ではＤＩＥＤつまり死亡扱いにされる[/b]
[b] ・クリア時の記録は一つも残らない。エンディングを見てキャンプに戻ったらまたレベル１装備もデフォルトからやり直し[/b]
・・・まあローグライクってのはクリアしたら持ち物は無くなったりするのは別にそう珍しいことじゃないですが、クリア記録すら残らない上に
[b] アイテムは何も残らないけどプレイヤーの腕前だけは上達して残るし次からはもっとさくさくやれるよ！！がコンセプトのゲームなら、別にこのゲームやらずともジャンル問わず腐るほど他にこれより面白い名作があるからこのゲーム別にやる必要ねぇなとプレイヤーに虚しさを思わせる[/b]っていうのが一番の不満ですね。
超が付く程いろんな部分が大幅にアップデート（改善）されてからでないと
[spoiler] [h1] 現時点じゃ口が裂けても他の人にはお勧めできないです。[/h1]",1516445275,1516445679,False,28,1,0.659017324447631836,0,True,False,False,False,,,
39407701,"{'steamid': '76561198046193538', 'num_games_owned': 701, 'num_reviews': 248, 'playtime_forever': 138, 'playtime_last_two_weeks': 0, 'playtime_at_review': 138, 'last_played': 1516237913}",english,"This game feels like it's trying to be [url=http://store.steampowered.com/app/239350/]Spelunky[/url] reimagined as a retro RPG, and it does that well for what it's worth. There main issue I have is that, unlike Spelunky, it's not fun to play. Xenon Valkyrie is riddled with flaws, and there's many things this game could improve upon that make the game much more enjoyable; In this review I'll try to cover each issue I came across when playing, and compare it to a similar scenario that did it right. You may get the impression that I'm biased towards Spelunky, and this is true; Spelunky did many things right that this game didn't, so I think it's fair to use it as a baseline to show why I didn't enjoy Xenon Valkyrie very much.

My first issue is that the game tells you [b]absolutley nothing[/b] in how to play it. You're given a selection between 3 characters with different weapons and stats, and a new player has absolutely no clue how each character plays until after wasting some time repeatedly dying trial-and-error style just to see what things do and what things mean. Talking to the NPCs doesn't help at all, as they don't really tell you anything useful. Spelunky had a clear and informative tutorial that showcased everything the player needed to know before heading in. Even the inclusion of an NPC at the start that you can ask gameplay questions to would be much better than nothing.

Another big issue is level design, and there's good ways to do procedurally generated random levels (i.e. Spelunky), and there's a bad ways (i.e. Nuclear Throne). Xenon Valkyrie's level design favors luck more than player skill; in almost every playthrough, when I try to look down before jumping down a pit, I usually am unable to see the bottom, meaning I need to take a leap of faith that more often than not causes me to land on an enemy or some spikes that I had absolutely no way of knowing were there. In Spelunky, this [i]rarely[/i] happened, and if it did happen, I had the option of using a rope to descend safely. The minimap on the top right of the screen isn't very accurate either; if the map shows there's a gap or hole, often it's actually just solid ground that's 1 block deep that I either need to blast open with a grenade, or find another way around. 

Another issue with the game is the inventory system; when playing, I'm [b]constantly[/b] changing between my melee weapon, my ranged weapon, and whatever gimmicky item the character has. This would be fine if it weren't for the fact that [b]inventory swapping is not instant, but time consuming.[/b] In Spelunky, your inventory (i.e. rope and bombs) were keybinded and usable whenever you needed them. Heck, even in Cave Story you could quickly swap between guns as needed. It shouldn't take that long just to scroll through your usable inventory items.

One of the biggest issues I have with this game is how it handles explosives. There is a [b]huge[/b] cooldown between when you can throw a grenade and when you can throw the next one. I fail to see why this is in-place. It's completely pointless and wastes time, especially if I find myself in a hole I can't get out of and have to wait forever just to throw another grenade to open a hole where I can progress through the level. The explosives don't even do much damage against enemies either. In Spelunky, your explosive bombs were very powerful and bombs could be thrown in rapid succession, just like [b]every other videogame ever[/b]. There really is absolutely reason why I need to wait at least 10 whole seconds before throwing another grenade.

Last, but not least, is how the game handles Boss Battles. You spend lots of time traversing levels and using all your equipment, occasionally even unlocking a better melee or ranged weapon. When you get to the boss, however, the [b]only[/b] item you're allowed to use is your melee weapon. Got an amazing gun but are stuck with your starting sword due to the weapon-upgrade system being random? Sucks to be you! The boss's hitbox and hurtbox don't even match the bosses sprites! It doesn't help that there's almost no audiovisual indication that you're taking damage if you take collision damage from a boss, making it easy to die quickly because you don't even realize you're taking damage since you have no choice but to attack the boss with your melee weapon. The bosses would be much more manageable with your ranged weapon; even nerfing your guns to half damage would be better than [b]completely restricting all of your inventory for a boss battle.[/b] There's not even an in-game justification for the game locking your inventory during boss battles either, and the game doesn't even tell you your inventory is locked, so as you switch through your ineventory (which takes time, like I said earlier) realizing none of your weapons or items can even be used, you'll already be half dead from the boss by the time you can re-equip your melee weapon thanks to aformentioned janky inaccurate hitboxes.

I don't see myself coming back to this game very much because of these irritating gameplay mechanics. I put over 60 hours in Spelunky, a very difficult yet similar game to this, because I enjoyed the challenge it provided as it felt fair and very player-skill based, and it felt enjoyable to progress and finally beat that game's difficult true ending. Xenon Valkyrie feels sluggish, boorish, irritating and unpolished in comparison, and it's needlessly frustrating in that it punishes the player for things beyond the player's control.",1516173712,1516225509,False,12,1,0.53935164213180542,0,True,False,False,False,,,
37994756,"{'steamid': '76561198022656191', 'num_games_owned': 375, 'num_reviews': 8, 'playtime_forever': 1691, 'playtime_last_two_weeks': 0, 'playtime_at_review': 1691, 'last_played': 1512719312}",english,"The game is not very good on the looks and enemy variation, but dang the challenge to defeat it keeps me playing. Starting over everytime is kinda cringy, especially for the later challenges. Still it is easy to just pick up if you do not have anything better to do. Controls seem to glitch sometimes, but that could be my controller emulator/plugin goofing off.",1512194907,1512194907,True,1,1,0.523809552192687988,0,True,False,False,False,,,
37233209,"{'steamid': '76561198357558513', 'num_games_owned': 61, 'num_reviews': 5, 'playtime_forever': 1044, 'playtime_last_two_weeks': 0, 'playtime_at_review': 545, 'last_played': 1554576130}",spanish,A really interesting rogue like,1511482040,1511482040,True,0,0,0,0,True,False,False,False,,,
36055483,"{'steamid': '76561197994673271', 'num_games_owned': 0, 'num_reviews': 17, 'playtime_forever': 18, 'playtime_last_two_weeks': 0, 'playtime_at_review': 18, 'last_played': 1507411043}",english,"Awesome, don't miss it!",1509135208,1509135208,True,0,0,0.418230593204498291,0,False,False,False,False,,,
35882994,"{'steamid': '76561198310476317', 'num_games_owned': 360, 'num_reviews': 35, 'playtime_forever': 2942, 'playtime_last_two_weeks': 0, 'playtime_at_review': 2476, 'last_played': 1607758884}",english,"LOVE THIS GAME!!!!!!!!!!!!!!!!!!!!!!!!!!!!!!!

",1508568663,1508568663,True,0,0,0.418230593204498291,0,True,False,False,False,,,
35797365,"{'steamid': '76561198424023743', 'num_games_owned': 0, 'num_reviews': 3, 'playtime_forever': 261, 'playtime_last_two_weeks': 0, 'playtime_at_review': 128, 'last_played': 1536098697}",spanish,Un juego plataformero que te obliga a explorar todo el mapeado algo asi como un the binding of isaac lo e jugado poco pero e quedado conforme con el juego 8/10,1508252956,1508252956,True,0,0,0,0,True,False,False,False,,,
35751385,"{'steamid': '76561198067653526', 'num_games_owned': 737, 'num_reviews': 322, 'playtime_forever': 290, 'playtime_last_two_weeks': 0, 'playtime_at_review': 201, 'last_played': 1533922009}",english,"Risk of Rain on acid.

Difficult to enjoy, quite literally, due to high difficulty level.",1508082904,1508082904,True,3,0,0.499855935573577881,0,True,False,False,False,,,
35750609,"{'steamid': '76561198101670484', 'num_games_owned': 241, 'num_reviews': 20, 'playtime_forever': 288, 'playtime_last_two_weeks': 0, 'playtime_at_review': 124, 'last_played': 1509556514}",english,"So far so good! overall pretty good. All I see wrong is a lack of explanation of gameplay and lack of customization aside from that its a really fun, but hard, rogue-like platformer. Solid 7.5/10",1508081082,1508081082,True,0,0,0.442020654678344727,0,True,False,False,False,,,
35653145,"{'steamid': '76561198028828176', 'num_games_owned': 1228, 'num_reviews': 3, 'playtime_forever': 878, 'playtime_last_two_weeks': 0, 'playtime_at_review': 544, 'last_played': 1507786996}",english,"Game gets updated on a regular basis, at this point in time I would definately recommend it to anyone who likes platformers.",1507787316,1507787316,True,4,0,0.517985641956329346,1,True,False,False,False,,,
35623235,"{'steamid': '76561197970273692', 'num_games_owned': 0, 'num_reviews': 203, 'playtime_forever': 333, 'playtime_last_two_weeks': 0, 'playtime_at_review': 223, 'last_played': 1511462767}",koreana,"겁나 어려움

칼은 캐릭터만큼 짧은데 보스전에서 총을 못씀

방어력은 6업이 한계

노히트 클리어가 더 좋은 보상이라는데 좀 극한 아닌가",1507659443,1508154279,True,1,0,0.502074718475341797,0,True,False,False,False,,,
34826697,"{'steamid': '76561198119918493', 'num_games_owned': 0, 'num_reviews': 68, 'playtime_forever': 68, 'playtime_last_two_weeks': 0, 'playtime_at_review': 42, 'last_played': 1508071467}",tchinese,"本來以為這是慢慢養成角色看著角色慢慢變強的遊戲，
結果是一款永久死亡類型的遊戲，
先不評論這遊戲如何，每次死亡都要重來的感覺可不是很好；

在來就是攻擊與判定，拿著近戰武器你只會看見揮了短短的距離，
但是實際攻擊距離卻又更長，包括對上方的判定，
還有被怪卡牆，你不只不好跳出來，被怪撞牆的話，
你只會看見人物一直對著牆讓怪物艹你的菊，
近戰攻擊也打不到背後，轉過去馬上被頂到面壁失神；
在來就是受傷的判定，似乎是有無敵時間，但那無敵時間下，
你是可以""被攻擊""的，儘管血量條不會減少，
但是會讓你因為受到傷害造成彈跳，讓你一飛沖天，

綜合以上因素的話，遊玩體驗偏差，
而且跟綠光時期比起來，介面少了很多東西，
也跟當初綠光宣傳片出的遊戲內容有所差距",1504920647,1504973031,False,6,0,0.491945505142211914,0,True,False,False,False,,,
34694949,"{'steamid': '76561198040649499', 'num_games_owned': 740, 'num_reviews': 86, 'playtime_forever': 2110, 'playtime_last_two_weeks': 0, 'playtime_at_review': 2110, 'last_played': 1504475504}",english,"Xenon Valkyrie wants to be Spelunky with RPG elements. It comes just close enough to see what it was going for, but ultimately it falls short. 

The main issue is its lack of depth. There are no meaningful strategic decisions to be made either in resource management or in putting a loadout together. The advancement you have control over is only simple numeric improvements in stats you already have; weapons you get to choose between differ only in simple numeric damage and appearance. As a result, the game is just an exercise in learning how to engage each enemy-type and hazard safely, and then advancing through the levels to the end.

The most disappointing thing about this game is that it's almost there. The implemented mechanics all work. The spritework and music and physics are all of surprisingly good quality by comparison. However, the team just seems to have neglected to include mechanics that would give the game anything really unique to set it apart. Any given floor of the dungeon has some combination of normal enemies, simple traps, containers with possible money in them, and possibly big monsters with keys / a chest to use a key on (which contains only a weapon with a different damage value than your current weapon of that type), but nothing else. They don't have special interactions or challenges or meaningful opportunities to try a high-risk high-reward play. 

There are various other things that make the game clumsy (having four usable abilities, but having to cycle between them rather than mapping them to separate buttons? Really?), but one can learn to work with them and they feel sort of forgivable, but really the simple boringness of this game's main gameplay makes it impossible to recommend.",1504384961,1504384961,False,11,1,0.549447298049926758,0,True,False,False,False,,,
34484899,"{'steamid': '76561198287226413', 'num_games_owned': 363, 'num_reviews': 74, 'playtime_forever': 307, 'playtime_last_two_weeks': 0, 'playtime_at_review': 235, 'last_played': 1524404154}",schinese,传送门底下藏钉子是最气的,1503678227,1503678788,True,1,6,0.535519123077392578,0,True,False,False,False,,,
34095355,"{'steamid': '76561198027223922', 'num_games_owned': 643, 'num_reviews': 14, 'playtime_forever': 1019, 'playtime_last_two_weeks': 0, 'playtime_at_review': 1019, 'last_played': 1502166850}",english,"Quite simply, dispite some flaws, this game is really fun.

Now keep in mind first and foremost that this game has been updated frequently, and old reviews sometimes have complaints that have already been addressed.

Like most roguelikes, this one has a fair bit of challenge, and getting use to enemies and mechanics can take a little while. The investment is worth it however. One of the big standouts for this game is the music. The theme for the first area is absolutly fantastic.

Honestly, this game is a solid 8/10 espesially for only 10 dollars.

Also worth noting that I have only had a single crash and that was before starting gameplay via switching from fullscreen to windowed. No issues futher.

Also Elone is bae.",1502166049,1502166126,True,4,0,0.566269814968109131,0,True,False,False,False,,,
33989958,"{'steamid': '76561198032654008', 'num_games_owned': 219, 'num_reviews': 25, 'playtime_forever': 17, 'playtime_last_two_weeks': 0, 'playtime_at_review': 17, 'last_played': 1501757181}",english,"A B O M I N A T I O N.

One word to say about this game. Screenshots and description is great. Risk of rain + Ninja Gaiden classics, should've been a fine game...

But you thrown into less then 320x240 resolution game without any explanation or guides, controls unresponsive af, you always forced to jump down without knowing if enemy is there (and it's probably there).
",1501757787,1501757787,False,7,1,0.347722798585891724,1,True,False,False,False,,,
33888802,"{'steamid': '76561198011794200', 'num_games_owned': 1463, 'num_reviews': 32, 'playtime_forever': 2301, 'playtime_last_two_weeks': 0, 'playtime_at_review': 2056, 'last_played': 1518380520}",english,"Hey, I have been playing this game 36 hours and got all achievements, and I love this game.

Before When I buy this game there lot bug and don't have pause, sometimes you die when you spawn by enemies or bomb of enemies, but the Developer listen to all these reports, and almost everything fix and now this game has pause 

I know this game is very difficult, that is a roguelike, I know there save (only save when you buys weapon, location, and dyminatry)), the checkpoint of location, etc... but is still roguelike because this game doesn't have save game or continue.
Just like other games of a roguelike.

Gameplay: Is very nice, is just classic style retro
Control: The control is difficult, sometimes you need practice like jump, etc... but control move is good just need practice because of a jump, etc...
Soundtrack: I love it, song is awesome there no mistake
Boss: Bosses is hard, but will be very easy if you read their pattern (I did no-hit damage all boss).

Do I recomend this game ? 

Well yes, is good, I know you guys don't like this game because is very hard or frustrating but remenber this is roguelike, whatever you guys are a fan of roguelike or non-roguelike this game is fun and I recomend buy this game.

8/10
",1501358127,1501358127,True,3,0,0.481231153011322021,0,True,False,False,False,,,
33860307,"{'steamid': '76561198268632303', 'num_games_owned': 90, 'num_reviews': 8, 'playtime_forever': 10, 'playtime_last_two_weeks': 0, 'playtime_at_review': 6, 'last_played': 1507424268}",schinese,有汉化补丁吗？买了几个月了没找到补丁碰都不想碰,1501261184,1501261184,False,0,0,0.351871579885482788,0,True,False,False,False,,,
33766940,"{'steamid': '76561198012870416', 'num_games_owned': 272, 'num_reviews': 24, 'playtime_forever': 1033, 'playtime_last_two_weeks': 0, 'playtime_at_review': 612, 'last_played': 1647622136}",english,"The game is just plain good.

This is a very typical rouge-like game. Nothing much to talk about, since this is just so typical.

Personally, I like the visual design. Fantasy, cyber punk, and a little bit of anime, all mixed in one bowl, which makes the game unique. Not dizzy, not  disgusting, not nerdy/geeky.

But the game is slightly unkind. As I make my ways through, I feel more like there is a certain intended way of playing this, not just grinding to the teeth. Also, random boxes rarely give weapons with ATK > 8. Even though ATK is not everything, boss fights are simply time consuming w/o those strong weapons.",1500906223,1500906223,True,3,0,0.503016889095306396,0,True,False,False,False,,,
33613221,"{'steamid': '76561198058989782', 'num_games_owned': 0, 'num_reviews': 5, 'playtime_forever': 1337, 'playtime_last_two_weeks': 0, 'playtime_at_review': 119, 'last_played': 1509868562}",english,"The simple fact that there are shiny particles in front of the screen that i can't disable in the options menu makes this game instantly unplayable for me. Do they add any value other than aesthetics? No. So why are there in front of my vision distracting me from the actual game and causing visual clutter? Our eyes are instantly drawn to shiny things, so when you have shiny things everywhere in front of the screen it becomes a chore to try to figure out your surroundings.

That being said if the problem of the visual clutter and slow/buggy weapon switch gets dealt with i can see myself enjoying this game. It is a fun game, it just needs some tweaks that make the gameplay less annoying.

Edit: The developer dealth with the issues i mentioned and updated the game, i enjoy it now. Id suggest the game just for the fact that there is an active developer listening to their players and making their game better. (unlike many other developers)",1500315047,1507660180,True,24,2,0.713323354721069336,3,True,False,False,False,,,
33327486,"{'steamid': '76561198142911508', 'num_games_owned': 0, 'num_reviews': 14, 'playtime_forever': 9, 'playtime_last_two_weeks': 0, 'playtime_at_review': 9, 'last_played': 1499383390}",english,"The controls are not told to the player, and  I have no idea how to really work anything, or what to do, all i know is that the keys that work are: a,d m, n, and l practically everyother key doesnt work for me",1499383519,1499383519,False,2,1,0.319805800914764404,0,True,False,False,False,,,
33288800,"{'steamid': '76561198066421328', 'num_games_owned': 0, 'num_reviews': 30, 'playtime_forever': 70, 'playtime_last_two_weeks': 0, 'playtime_at_review': 70, 'last_played': 1499219232}",english,"Edit: The game has been updated, so some of my complaints are no longer present

Let me just state that I only played 1.4 hours on Xenon Valkyrie before refunding it, so I could be wrong on some things I say, but for me, 1.4 hours was enough to know I wouldn't enjoy the entire game. 

Pros:
- Good variety of swords and guns
- Great presentation 
- Awesome music (the best part of the game imo)
- Controls are pretty good (except for the gun)
- Different characters make for good variety 

Neutral:
- Story is vague, so I can't comment on it
- There aren't any tutorials, or messages to tell you what the objective is, but it's still neat to figure out things on your own
- Combat is alright, but could of had more depth like light, heavy attacks, or at the least a charge attack
- Translation is a bit wonky, but it's hilarious to see, for me at least

Cons:
- The randomly generated levels can be cheap at times, areas with loot you can't get to, unavoidable spikes in your way, you get hit by explosions when you spawn into the level, and having to use bombs just to progress
- You can't heal or restore ammunition in the stages, the most you get are small health pickups
- Gun has a delay, which helps with not wasting ammo, but feels awkward 
- Sword range is too short, causing you to accidentally get hit a lot, and there's no way to increase the range
- You can only switch weapons in one direction, for example if you want to switch to your sword when you have a gun, you have to go through your grenades and special first

Overall, while the cons may not seem like that much, they make the game too frustrating. During my short experience, I didn't have that much fun.",1499284322,1507317646,False,6,0,0.493633925914764404,2,True,False,False,False,,,
33141263,"{'steamid': '76561198322498233', 'num_games_owned': 34, 'num_reviews': 6, 'playtime_forever': 24, 'playtime_last_two_weeks': 0, 'playtime_at_review': 24, 'last_played': 1499015096}",english,Good game! but quite difficult to enjoy,1499015773,1499015773,True,7,0,0.3884543776512146,0,True,False,False,False,,,
32744788,"{'steamid': '76561198398492463', 'num_games_owned': 0, 'num_reviews': 1, 'playtime_forever': 548, 'playtime_last_two_weeks': 0, 'playtime_at_review': 76, 'last_played': 1527735959}",english,"Pretty decent game but has some obvious bugs. Sometimes the keyboard controls stop working usually after you throw a grenade and they wont start working again until you somehow die. Also, you are unable to use guns and grenades at boss fights.",1498340808,1498340808,True,39,0,0.767227709293365479,0,True,False,False,False,,,
