recommendationid,author,language,review,timestamp_created,timestamp_updated,voted_up,votes_up,votes_funny,weighted_vote_score,comment_count,steam_purchase,received_for_free,written_during_early_access,hidden_in_steam_china,steam_china_location,timestamp_dev_responded,developer_response
157967318,"{'steamid': '76561197969025704', 'num_games_owned': 0, 'num_reviews': 139, 'playtime_forever': 57, 'playtime_last_two_weeks': 0, 'playtime_at_review': 57, 'last_played': 1699220523}",english,"I'm amazed at how under the radar this game is. Null Vector is very short, but it's quite well done for a room-based twin-stick shooter roguelite. There's some interesting decisions to be made along the way for upgrades, the room objectives are varied and interesting, and the overall aesthetic is quite cool. I think if you're a fan of Geometry Wars and Enter the Gungeon you'll be a fan of Null Vector as well.

Oh and it is basically perfect to play on the steam deck while you're waiting for your bus stop to arrive!",1707534237,1707534237,True,0,0,0,0,True,False,False,True,,,
148777210,"{'steamid': '76561198089823592', 'num_games_owned': 289, 'num_reviews': 5, 'playtime_forever': 807, 'playtime_last_two_weeks': 0, 'playtime_at_review': 807, 'last_played': 1694981679}",russian,"Несмотря на простоту дизайна, этот рогалик создаёт интересный челлендж

Вы управляете ""кораблём"" и должны зачищать комнаты, чтобы получить награды
Помимо здоровья, есть различные модификации - повышают скорость стрельбы, дают атакам возможности рикошета или пронзания, дают кораблю щиты, меняют вид атак на лазер, либо позволяют стрелять 2+ снарядами одновременно, а то и вовсе дают снарядам самонаведение, есть же и модификации, которые создают дополнительных помощников
И комбинировать модификации можно любым удобным образом
Ограничивает игрока только возможность носить лишь 3 модификации, а если хочется больше, то найдя специальную панель можно освободить 1 слот, сделав модификацию постоянной

С каждым уровнем будет появляться всё больше комнат и врагов, и в конце игрока ожидает финальный босс...
Вот только прохождение игры не является концом, ведь это только откроет первый игровой модификатор
Модификаторы делают игру более случайной и сложной (один просто повышает скорость игры, другой снижает максимальное здоровье корабля, другой снижает вероятность появления лечилок, а какой-то даёт шанс, что в зачищенной комнате вновь появится волна противников...)
Опять же все модификаторы можно активировать одновременно, и это повысит как сложность, так и очки, получаемые во время прохождения (увы, сейчас не эпоха ""highscore"", но для некоторых игроков это может стать вызовом или же просто забавным весельем в компании)

И если кажется, что вы прошли игру, и знаете уже всё, она всё равно заставит удивиться, когда игрок в первый раз отправится в ""Hell Mode"", после которого всё, что было в ""нормальном режиме"", покажется детской забавой",1698141503,1698141503,True,0,0,0,0,True,False,False,True,,,
146988030,"{'steamid': '76561198212138647', 'num_games_owned': 0, 'num_reviews': 4, 'playtime_forever': 542, 'playtime_last_two_weeks': 0, 'playtime_at_review': 542, 'last_played': 1538202029}",english,is hard but very fun,1695626826,1695626826,True,0,0,0,0,False,False,False,True,,,
135711246,"{'steamid': '76561198441788400', 'num_games_owned': 0, 'num_reviews': 1, 'playtime_forever': 10072, 'playtime_last_two_weeks': 0, 'playtime_at_review': 8467, 'last_played': 1707707818}",spanish,juegaso,1680136595,1680136595,True,0,0,0,0,False,False,False,True,,,
132912015,"{'steamid': '76561198149096614', 'num_games_owned': 0, 'num_reviews': 3, 'playtime_forever': 807, 'playtime_last_two_weeks': 0, 'playtime_at_review': 750, 'last_played': 1676641172}",spanish,Es adictivo y genial para pasar los ratos muertos.,1676485533,1676485533,True,0,0,0,0,False,False,False,True,,,
131065159,"{'steamid': '76561198078588463', 'num_games_owned': 0, 'num_reviews': 47, 'playtime_forever': 221, 'playtime_last_two_weeks': 0, 'playtime_at_review': 221, 'last_played': 1642278139}",latam,"Este juego gratuito en steam combina de forma bastante divertida los niveles generados aleatoriamente cada vez (rogue-like) y juegos de naves, no estoy muy acostumbrado a juegos que se manejen con 2 palancas al mismo tiempo (movimiento y disparos) pero al menos este se me hace bastante manejable y fluido, se pone algo confuso cuando toda la pantalla se llena de cosas moviéndose al mismo tiempo. 

Otra cosa que me gustaría recalcar es que como las maquinas y mejoras aparecen al azar por lo que eso obliga a improvisar un poco y fuerza a probar diferentes combinaciones dependiendo de lo que le juego te arroje y tratar de obtener y mejorar las piezas que combinen mejor.

Me gustaría que se pudiera seleccionar que los enemigos estuvieran marcados de otro color para facilitar no chocar con ellos, pero en general me gusto bastante para un rato, aunque dudo probar dificultades mayores.

https://www.youtube.com/watch?v=rKoKwiowLVw",1674011532,1674028266,True,0,0,0,0,False,False,False,True,,,
125342770,"{'steamid': '76561197996295141', 'num_games_owned': 0, 'num_reviews': 2, 'playtime_forever': 12, 'playtime_last_two_weeks': 0, 'playtime_at_review': 12, 'last_played': 1506710154}",english,Retrowave,1668247965,1668247965,True,0,0,0,0,False,False,False,True,,,
122007069,"{'steamid': '76561198077868071', 'num_games_owned': 0, 'num_reviews': 1, 'playtime_forever': 5019, 'playtime_last_two_weeks': 0, 'playtime_at_review': 3823, 'last_played': 1704679705}",english,"My current favorite game when I have a half hour to kill. This is a really well balanced twin-stick shooter that balances power-ups well and offers many different options for replay. I'm a bit bummed the creator seems to have vanished, would love to see what other games he would have made. 

Each game tends to be pretty short. Maybe 20 minutes to get through the whole thing. For me the fun is seeing what upgrade paths I can take and what the different weapons do maxed out and what combinations of weapons do what. 

Rockets provide explosive damage areas, lasers give instant attacks while rockets + lasers combine both. Nanobots create swarms of little dots randomly when you kill things that then go on to attack other enemies. 

Other upgrades include multi-shot, homing shot, shields, damage, piercing (allows bullets to travel through enemies and damage all enemies in path). Upgrading to multi-shot, homing, and damage will slow your weapon's fire rate but thankfully there are fire rate upgrades to be found and upgraded to balance this out. 

Definite must buy if you like twin-stick shooters or ever played robotron 2049. Starts out slow, but it offers plenty of action and replay value.",1662775157,1662775157,True,0,0,0,0,True,False,False,True,,,
121691329,"{'steamid': '76561198055733071', 'num_games_owned': 0, 'num_reviews': 4, 'playtime_forever': 628, 'playtime_last_two_weeks': 0, 'playtime_at_review': 604, 'last_played': 1662402028}",german,nice little game for little breaks,1662229223,1662229223,True,0,0,0,0,False,False,False,True,,,
120827449,"{'steamid': '76561198213555644', 'num_games_owned': 0, 'num_reviews': 1, 'playtime_forever': 523, 'playtime_last_two_weeks': 0, 'playtime_at_review': 522, 'last_played': 1660819847}",english,Semplice ma intrattiene. Non mancano le sfide,1660818796,1660818796,True,0,0,0,0,False,False,False,False,,,
120088255,"{'steamid': '76561198873804375', 'num_games_owned': 253, 'num_reviews': 118, 'playtime_forever': 2517, 'playtime_last_two_weeks': 0, 'playtime_at_review': 133, 'last_played': 1663019369}",english,"Super fun and really polished, but has incredibly aggravating bug of randomly not moving in a certain axis from shooting at an angle",1659674161,1659674161,False,0,0,0,0,True,False,False,False,,1660245419.0,"Hi MarioPlaysCoD!

Thank you for the kind review, glad you're having fun and like the game! 

As for the bug, are you by chance playing on a keyboard? If so, you are experiencing a hardware phenomena known as ""ghosting"", in which multiple key presses will cancel each other out and not register on your machine. This can be remedied by purchasing an ""anti-ghosting"" keyboard or by using a controller such as an Xbox or Playstation controller if you have one. 

If you aren't on a keyboard, then after tens of thousands of collective player hours you are the first to experience this bug! The odds seem likely the issue is with your setup somewhere. Again, likely the keyboard/controller or perhaps some additional software on your system. I hope this helps fix your issue!

- Alex (Optical Override)"
115940709,"{'steamid': '76561197998300195', 'num_games_owned': 0, 'num_reviews': 103, 'playtime_forever': 63, 'playtime_last_two_weeks': 0, 'playtime_at_review': 63, 'last_played': 1653396847}",english,"Very solid and fun game. Similar to Binding of Isaac, but much less poop.

The final boss comes quickly, but it invites you to keep going again with unlocked modifiers that make the game harder.",1653397479,1653397479,True,0,0,0,0,True,False,False,False,,,
107883857,"{'steamid': '76561198031313794', 'num_games_owned': 8531, 'num_reviews': 3393, 'playtime_forever': 2305, 'playtime_last_two_weeks': 0, 'playtime_at_review': 2305, 'last_played': 1642025559}",russian,"[h1]Описание:[/h1]
""Айзек"" в неоне. Несколько комнат, несколько этажей, в конце босс. Чтобы пройти в следующую комнату нужно убить всех врагов в текущей. Есть разные бонусы... Вообщем механика знакомая любому игравшему в айзека. Первое прохождение занимает всего 20-30 минут, но вот когда включаешь модификаторы сложности начинается самое интересное... Я так и не смог пройти все модификаторы на первой странице... И часы наигранные реальны, хотя обычно я сплю на клаве. Тут нечего описывать особо, в такое нужно играть самому. Точно недооцененная игра, которая заслуживает большего.

[h1]Оценка: 10/10[/h1]

[h1]Послесловие:[/h1]
[quote] Если вам понравился этот обзор добро пожаловать в кураторку
[url=https://store.steampowered.com/curator/8114152] К и Ко [/url], там много других, хороших обзоров.
[/quote]",1642025981,1642025981,True,8,1,0.604361653327941895,0,False,False,False,False,,,
106998624,"{'steamid': '76561198036712918', 'num_games_owned': 0, 'num_reviews': 24, 'playtime_forever': 221, 'playtime_last_two_weeks': 0, 'playtime_at_review': 221, 'last_played': 1640972938}",english,"The first 5-6 unlocks are pretty easy, but getting the last few unlocks becomes insanity difficulty level bullet hell.",1640973062,1640973062,True,0,0,0,0,False,False,False,False,,,
105538499,"{'steamid': '76561198355197087', 'num_games_owned': 78, 'num_reviews': 11, 'playtime_forever': 2215, 'playtime_last_two_weeks': 0, 'playtime_at_review': 1856, 'last_played': 1678548658}",french,"Amazing game, addictive awesome
Hell Mode has an amazing OST
Love this game",1639083513,1639083513,True,0,0,0,0,False,False,False,False,,,
100362166,"{'steamid': '76561197990256215', 'num_games_owned': 0, 'num_reviews': 7, 'playtime_forever': 942, 'playtime_last_two_weeks': 0, 'playtime_at_review': 202, 'last_played': 1634409217}",french,"Binding of Isaac + Hacking in Nier Automata + Synthwave + Good OST = Masterpiece Null vector

En stream le jeu rend bien, il est beau, intuitif, simple, minimaliste, prenant, on découvre et devine les rôles de chaque élément du jeu assez facilement (sauf pour le Nanobot j'ai mis du temps à comprendre que c'est du poison)

Il est rapide, une ou deux run suffisent à se familiariser et passer un bon moment et plusieurs run seront nécessaire pour venir à bout de ce jeu qui pour les plus vétérans demandera beaucoup d'adresse au vu de tout les malus que l'on peut se rajouter pour évoluer dans la difficulté.

Le mapping est bien fait, l'interface compréhensible, facile de prise en mains pour tout niveau de joueurs, le débutant pourra évoluer tranquillement quand le tryhardeur débloquera rapidement plein de malus pour se mettre au défi, l'objetif final pour platine le jeu serait alors de finir une run avec les malus des 3 pages.

Franchement une belle surprise et un plaisir d'y avoir joué",1633173800,1633173800,True,0,0,0,0,True,False,False,False,,,
99005844,"{'steamid': '76561198335166460', 'num_games_owned': 0, 'num_reviews': 3, 'playtime_forever': 222, 'playtime_last_two_weeks': 0, 'playtime_at_review': 200, 'last_played': 1631131775}",english,Fun gam,1631130459,1631130459,True,1,0,0.523809552192687988,0,False,False,False,False,,,
95010298,"{'steamid': '76561198168371483', 'num_games_owned': 184, 'num_reviews': 7, 'playtime_forever': 539, 'playtime_last_two_weeks': 0, 'playtime_at_review': 507, 'last_played': 1645666075}",english,very nice arcade style game,1625377773,1625377773,True,0,0,0,0,False,False,False,False,,,
90443885,"{'steamid': '76561198239221802', 'num_games_owned': 478, 'num_reviews': 33, 'playtime_forever': 643, 'playtime_last_two_weeks': 0, 'playtime_at_review': 177, 'last_played': 1623970068}",english,"A bite sized twin-stick that keeps things simple, straightforward, and quick. Eight way movement and firing if you're on keyboard (game doesn't read mouse) akin to a true original arcade twin-stick, which happens to be my preferred way to play. Honestly, I could see this doing reasonably well in a cabinet.
There's exactly one thing that isn't particularly clear in the game (Nanobots). [b]One.[/b] Everything else you'll just about figure out within 4 seconds of having it or getting shot at by it. The classic ""one enemy does one thing"" holds here, and there aren't any ""go run around shooting every wall"" type of obscure hidden things.

It's pretty short and gets repetitive, but it's definitely worth the asking price. Tight controls, escalating gameplay, and just enough variety of gear to make you think a little about what you take and when - but only a little. Soundtrack is pretty solid, worth a buy imo... if it was here.
EDIT: It's on Bandcamp, 7 bucks but the tracks are trimmed to perfectly loop out of the gate. Looping them yourself isn't exactly super hard normally, but one less step is one less step.


TL:DR (Really?) - A quick-play twin stick that doesn't overstay its welcome. Use KB for nostalgia. If the game ignoring mouse bothers you that much, wait for a sale or buy a controller.

If what you see in the trailers looks like something you would enjoy, buy it. If it doesn't, don't (or wait for a sale). There aren't any big secrets.",1618637613,1618771523,True,2,0,0.546827793121337891,0,True,False,False,False,,,
89673197,"{'steamid': '76561198403109414', 'num_games_owned': 0, 'num_reviews': 26, 'playtime_forever': 2981, 'playtime_last_two_weeks': 0, 'playtime_at_review': 1807, 'last_played': 1677523142}",english,good game,1617500917,1617500917,True,0,0,0.472102999687194824,0,False,False,False,False,,,
89467681,"{'steamid': '76561198160257433', 'num_games_owned': 0, 'num_reviews': 106, 'playtime_forever': 81, 'playtime_last_two_weeks': 0, 'playtime_at_review': 81, 'last_played': 1617236960}",english,Great game! Lots of upgrades and really nice soundtrack! Could really benefit from an endless mode though (or looping).,1617237424,1617237532,True,0,0,0,0,True,False,False,False,,,
87120881,"{'steamid': '76561198370535442', 'num_games_owned': 0, 'num_reviews': 808, 'playtime_forever': 2456, 'playtime_last_two_weeks': 0, 'playtime_at_review': 2456, 'last_played': 1520477309}",english,10 / 10,1613855872,1613855872,True,0,0,0.472102999687194824,0,False,False,False,False,,,
87061166,"{'steamid': '76561198150265334', 'num_games_owned': 0, 'num_reviews': 16, 'playtime_forever': 2175, 'playtime_last_two_weeks': 0, 'playtime_at_review': 2007, 'last_played': 1616720873}",english,"This is genuinely a game I've enjoyed for quite a while, it's a game I can't recommend enough. It's one of the best rouge-likes I have played, not many are this enjoyable taking on an arcade theme makes it very re-playable.",1613782220,1613782220,True,0,0,0,0,False,True,False,False,,,
79697956,"{'steamid': '76561198029026240', 'num_games_owned': 0, 'num_reviews': 27, 'playtime_forever': 515, 'playtime_last_two_weeks': 0, 'playtime_at_review': 515, 'last_played': 1571552260}",english,solid arcade roguelike,1606118019,1606118019,True,0,0,0,0,True,False,False,False,,,
77048816,"{'steamid': '76561198058133251', 'num_games_owned': 0, 'num_reviews': 27, 'playtime_forever': 2221, 'playtime_last_two_weeks': 27, 'playtime_at_review': 1337, 'last_played': 1711306168}",english,"I have really enjoyed this game. I stumbled on it when it was still free, and have enjoyed most of the iterations since then. The soundtrack is phenomenal. The game is fun to play. Runs are about the right length, and there are a lot of things to unlock. My favorite part is easily hell mode. It makes it much harder, but also makes ship parts drop more frequently. Which for me also increased the fun.",1601849236,1601849236,True,0,0,0,0,False,True,False,False,,,
74284260,"{'steamid': '76561198394355411', 'num_games_owned': 79, 'num_reviews': 1, 'playtime_forever': 331, 'playtime_last_two_weeks': 0, 'playtime_at_review': 331, 'last_played': 1569149670}",schinese,没有中文，文盲的我不配。,1597398986,1597398986,True,0,0,0,0,False,False,False,False,,,
72947736,"{'steamid': '76561198113014119', 'num_games_owned': 0, 'num_reviews': 1451, 'playtime_forever': 26, 'playtime_last_two_weeks': 0, 'playtime_at_review': 26, 'last_played': 1595162935}",english,"Null Vector
fast game with modern day graphics with easy controls that moves from location A to B to C and so on,
good amount of action and special effects,

good game.

Personal Suggested Purchase Price: $0.49 Or Less During Sale
",1595163127,1595163127,True,1,0,0.525862038135528564,0,False,False,False,False,,,
70699662,"{'steamid': '76561198253765992', 'num_games_owned': 0, 'num_reviews': 6, 'playtime_forever': 1571, 'playtime_last_two_weeks': 0, 'playtime_at_review': 522, 'last_played': 1709864882}",english,"Honestly quite fun, i am terrible at it but each highscore i make feels like an advancment.
it's a bit hard, but through skill it can be beaten.",1592009617,1592009617,True,0,0,0,0,False,False,False,False,,,
66596773,"{'steamid': '76561198230651248', 'num_games_owned': 0, 'num_reviews': 2, 'playtime_forever': 2652, 'playtime_last_two_weeks': 0, 'playtime_at_review': 866, 'last_played': 1708692194}",polish,Very addictive game with great gameplay and good graphics. Ideal for boring days.,1586012213,1586012213,True,0,0,0,0,False,False,False,False,,,
65186090,"{'steamid': '76561198077898593', 'num_games_owned': 0, 'num_reviews': 4, 'playtime_forever': 2437, 'playtime_last_two_weeks': 0, 'playtime_at_review': 550, 'last_played': 1705136137}",english,Made my vertices and vectors tingle.  10/10,1584418707,1584418707,True,0,0,0,0,True,False,False,False,,,
64054721,"{'steamid': '76561198371988173', 'num_games_owned': 0, 'num_reviews': 15, 'playtime_forever': 617, 'playtime_last_two_weeks': 0, 'playtime_at_review': 617, 'last_played': 1582545989}",english,"This game really fun, just buy it you will not regret it.",1582560012,1582560012,True,1,0,0.523809552192687988,0,False,False,False,False,,,
60314949,"{'steamid': '76561198018917475', 'num_games_owned': 464, 'num_reviews': 24, 'playtime_forever': 19, 'playtime_last_two_weeks': 0, 'playtime_at_review': 9, 'last_played': 1577020893}",english,A pretty solid gameplay loop. It's definitely gonna inspire the game design for my future games. It's simple and straight to the point. The game juice and feel could benefit from a bit of extra punch but otherwise I love the pick up and play nature of this game and I like getting cute robot allies to follow for me lol.,1577020108,1577020108,True,0,0,0,0,False,False,False,False,,,
59786839,"{'steamid': '76561198261038549', 'num_games_owned': 151, 'num_reviews': 65, 'playtime_forever': 677, 'playtime_last_two_weeks': 0, 'playtime_at_review': 505, 'last_played': 1630284997}",english,It's crazy to me that this is free. Very solid RogueLite,1576267762,1576267762,True,0,0,0,0,False,False,False,False,,,
59586113,"{'steamid': '76561198164445414', 'num_games_owned': 192, 'num_reviews': 64, 'playtime_forever': 265, 'playtime_last_two_weeks': 0, 'playtime_at_review': 208, 'last_played': 1630607074}",english,this is one of those games where you play it and its good,1575943382,1575943382,True,0,0,0,0,False,False,False,False,,,
58521029,"{'steamid': '76561198405481008', 'num_games_owned': 28, 'num_reviews': 4, 'playtime_forever': 217, 'playtime_last_two_weeks': 0, 'playtime_at_review': 186, 'last_played': 1600113499}",english,10/10 IS GOOD GAME,1575003629,1575003629,True,0,0,0,0,False,False,False,False,,,
56704550,"{'steamid': '76561198864195369', 'num_games_owned': 15, 'num_reviews': 2, 'playtime_forever': 623, 'playtime_last_two_weeks': 0, 'playtime_at_review': 256, 'last_played': 1698775253}",russian,"nice game anyway
",1573146284,1573146284,True,0,0,0,0,True,False,False,False,,,
56532683,"{'steamid': '76561198173731869', 'num_games_owned': 451, 'num_reviews': 18, 'playtime_forever': 49, 'playtime_last_two_weeks': 0, 'playtime_at_review': 21, 'last_played': 1631498561}",english,"Love this game, its like 80's arcade version of Binding of Issac",1572926005,1572926005,True,0,0,0,0,False,False,False,False,,,
56257900,"{'steamid': '76561198167226370', 'num_games_owned': 173, 'num_reviews': 10, 'playtime_forever': 1803, 'playtime_last_two_weeks': 0, 'playtime_at_review': 187, 'last_played': 1694521753}",english,its sick,1572689411,1572689411,True,1,0,0,0,False,False,False,False,,,
55545261,"{'steamid': '76561198271854463', 'num_games_owned': 36, 'num_reviews': 20, 'playtime_forever': 246, 'playtime_last_two_weeks': 0, 'playtime_at_review': 34, 'last_played': 1577262292}",japanese,"装備を間違えると瞬殺されます。
地味に弾幕ゲームですが弾幕薄いので何度かプレイするとエンディングまでたどり着けます。",1570754879,1570852815,True,1,0,0.523809552192687988,0,True,False,False,False,,,
53170347,"{'steamid': '76561198170154550', 'num_games_owned': 793, 'num_reviews': 16, 'playtime_forever': 335, 'playtime_last_two_weeks': 0, 'playtime_at_review': 195, 'last_played': 1655931619}",english,Good Dual-Stick Shooter with a catchy soundtrack.,1562080050,1569010969,True,1,0,0,0,False,True,False,False,,,
52014868,"{'steamid': '76561198384767994', 'num_games_owned': 296, 'num_reviews': 19, 'playtime_forever': 98, 'playtime_last_two_weeks': 0, 'playtime_at_review': 72, 'last_played': 1590194292}",spanish,juegazo 10 de 10 para lo poco que lo he usado,1561821081,1561821081,True,0,0,0,0,False,False,False,False,,,
51446176,"{'steamid': '76561198025571064', 'num_games_owned': 2180, 'num_reviews': 1520, 'playtime_forever': 7, 'playtime_last_two_weeks': 0, 'playtime_at_review': 7, 'last_played': 1561028208}",russian,"[i] Null Vector[/i] – рогалик в неоновой стилистике. Играете за треугольник с 4 хп, переходите от уровня к уровню, на каждом из которых есть задание, например, убить всех врагов или продержаться несколько волн, покупаете перки и ботов. На этом геймплейное развитие заканчивается и наступает монотонное безумие.

Ничего примечательного кроме стилистики здесь нет, а неоновый стиль в свою очередь тоже не является новаторством.",1561479353,1561479353,False,19,0,0.713662087917327881,0,False,True,False,False,,,
50992564,"{'steamid': '76561198162039034', 'num_games_owned': 0, 'num_reviews': 4, 'playtime_forever': 1375, 'playtime_last_two_weeks': 0, 'playtime_at_review': 1064, 'last_played': 1675692834}",french,that's nice,1559394414,1559394414,True,0,0,0,0,False,True,False,False,,,
